"Name","NCBI Genome","NCBI Taxonomy","PATRIC","KEGG","BioCYC","RAST Annotation","VFDB","RefSeq FTP","GenBank FTP","BioSample","BioProject","Assembly","Size (Mb)","GC%","Replicons","WGS","Scaffolds","Genes","Proteins","Release Date","Modify Date","Level","Completion Date","Sequencing Centers","Sequencing Platform","Sequencing Depth","Assembly Method","Chromosomes","Plasmids","Contigs","Genome Length","Isolation Country","Host Name"
"Helicobacter pylori 13-A-EK8","582937","210","210.5925","","","582937","","ftp://ftp.ncbi.nlm.nih.gov/genomes/all/GCF/006/338/545/GCF_006338545.1_ASM633854v1","ftp://ftp.ncbi.nlm.nih.gov/genomes/all/GCA/006/338/545/GCA_006338545.1_ASM633854v1","SAMN10053419","PRJNA490474","GCA_006338545.1","1.6193","39.1","chromosome:NZ_CP032912.1/CP032912.1","-","1","1604","1435/582937","6/13/2019","10/19/2019","Complete Genome","2019-06-13T00:00:00Z","Max von Pettenkofer-Institut","PacBio RSII","300x","HGAP v. 3","1","","1","1619300","Germany","Homo sapiens"
"Helicobacter pylori 169-A-EK5","582930","210","210.5918","","","582930","","ftp://ftp.ncbi.nlm.nih.gov/genomes/all/GCF/006/337/625/GCF_006337625.1_ASM633762v1","ftp://ftp.ncbi.nlm.nih.gov/genomes/all/GCA/006/337/625/GCA_006337625.1_ASM633762v1","SAMN10053703","PRJNA490474","GCA_006337625.1","1.61019","39","chromosome:NZ_CP032904.1/CP032904.1","-","1","1582","1426/582930","6/13/2019","10/31/2019","Complete Genome","2019-06-13T00:00:00Z","Max von Pettenkofer-Institut","PacBio RSII","300x","HGAP v. 3","1","","1","1610187","Germany","Homo sapiens"
"Helicobacter pylori 169-C-EK8","582922","210","210.5910","","","582922","","ftp://ftp.ncbi.nlm.nih.gov/genomes/all/GCF/006/337/345/GCF_006337345.1_ASM633734v1","ftp://ftp.ncbi.nlm.nih.gov/genomes/all/GCA/006/337/345/GCA_006337345.1_ASM633734v1","SAMN10053716","PRJNA490474","GCA_006337345.1","1.61163","39","chromosome:NZ_CP032477.1/CP032477.1","-","1","1584","1425/582922","6/13/2019","10/19/2019","Complete Genome","2019-06-13T00:00:00Z","Max von Pettenkofer-Institut","PacBio RSII","300x","HGAP v. 3","1","","1","1611628","Germany","Homo sapiens"
"Helicobacter pylori 173-A-EK1","582929","210","210.5917","","","582929","","ftp://ftp.ncbi.nlm.nih.gov/genomes/all/GCF/006/337/485/GCF_006337485.1_ASM633748v1","ftp://ftp.ncbi.nlm.nih.gov/genomes/all/GCA/006/337/485/GCA_006337485.1_ASM633748v1","SAMN10053719","PRJNA490474","GCA_006337485.1","1.69072","38.8","chromosome:NZ_CP032903.1/CP032903.1","-","1","1652","1490/582929","6/13/2019","10/19/2019","Complete Genome","2019-06-13T00:00:00Z","Max von Pettenkofer-Institut","PacBio RSII","300x","HGAP v. 3","1","","1","1690720","Germany","Homo sapiens"
"Helicobacter pylori 19-A-EK3","582936","210","210.5924","","","582936","","ftp://ftp.ncbi.nlm.nih.gov/genomes/all/GCF/006/338/415/GCF_006338415.1_ASM633841v1","ftp://ftp.ncbi.nlm.nih.gov/genomes/all/GCA/006/338/415/GCA_006338415.1_ASM633841v1","SAMN10053444","PRJNA490474","GCA_006338415.1","1.70638","38.7","chromosome:NZ_CP032911.1/CP032911.1","-","1","1663","1520/582936","6/13/2019","10/19/2019","Complete Genome","2019-06-13T00:00:00Z","Max von Pettenkofer-Institut","PacBio RSII","300x","HGAP v. 3","1","","1","1706376","Germany","Homo sapiens"
"Helicobacter pylori 19-C-EK1","582925","210","210.5913","","","582925","","ftp://ftp.ncbi.nlm.nih.gov/genomes/all/GCF/006/337/405/GCF_006337405.1_ASM633740v1","ftp://ftp.ncbi.nlm.nih.gov/genomes/all/GCA/006/337/405/GCA_006337405.1_ASM633740v1","SAMN10053452","PRJNA490474","GCA_006337405.1","1.70936","38.7","chromosome:NZ_CP032480.1/CP032480.1","-","1","1667","1523/582925","6/13/2019","10/19/2019","Complete Genome","2019-06-13T00:00:00Z","Max von Pettenkofer-Institut","PacBio RSII","300x","HGAP v. 3","1","","1","1709363","Germany","Homo sapiens"
"Helicobacter pylori 2017","163545","985081","985081.3","T01913","GCF_000192315","163545","","ftp://ftp.ncbi.nlm.nih.gov/genomes/all/GCF/000/192/315/GCF_000192315.1_ASM19231v1","ftp://ftp.ncbi.nlm.nih.gov/genomes/all/GCA/000/192/315/GCA_000192315.1_ASM19231v1","SAMN02603712","PRJNA62769","GCA_000192315.1","1.54824","39.3","chromosome:NC_017374.1/CP002571.1","-","1","1548","1367/163545","3/15/2011","8/26/2019","Complete Genome","2011-03-15T00:00:00Z","Pathogen Biology Laboratory, University of Hyderabad","","","","1","","1","1548238","",""
"Helicobacter pylori 2018","163546","985080","985080.3","T01914","HPYL985080","163546","","ftp://ftp.ncbi.nlm.nih.gov/genomes/all/GCF/000/192/335/GCF_000192335.1_ASM19233v1","ftp://ftp.ncbi.nlm.nih.gov/genomes/all/GCA/000/192/335/GCA_000192335.1_ASM19233v1","SAMN02603713","PRJNA62771","GCA_000192335.1","1.56283","39.3","chromosome:NC_017381.1/CP002572.1","-","1","1553","1375/163546","3/15/2011","8/26/2019","Complete Genome","2011-03-15T00:00:00Z","Pathogen Biology Laboratory, University of Hyderabad","","","","1","","1","1562832","",""
"Helicobacter pylori 20-A-EK1","582935","210","210.5923","","","582935","","ftp://ftp.ncbi.nlm.nih.gov/genomes/all/GCF/006/338/285/GCF_006338285.1_ASM633828v1","ftp://ftp.ncbi.nlm.nih.gov/genomes/all/GCA/006/338/285/GCA_006338285.1_ASM633828v1","SAMN10053472","PRJNA490474","GCA_006338285.1","1.59966","39.1","chromosome:NZ_CP032910.1/CP032910.1","-","1","1584","1417/582935","6/13/2019","10/31/2019","Complete Genome","2019-06-13T00:00:00Z","Max von Pettenkofer-Institut","PacBio RSII","300x","HGAP v. 3","1","","1","1599658","Germany","Homo sapiens"
"Helicobacter pylori 21-A-EK1","582934","210","210.5922","","","582934","","ftp://ftp.ncbi.nlm.nih.gov/genomes/all/GCF/006/338/145/GCF_006338145.1_ASM633814v1","ftp://ftp.ncbi.nlm.nih.gov/genomes/all/GCA/006/338/145/GCA_006338145.1_ASM633814v1","SAMN10053502","PRJNA490474","GCA_006338145.1","1.58213","39","chromosome:NZ_CP032909.1/CP032909.1","-","1","1558","1426/582934","6/13/2019","10/19/2019","Complete Genome","2019-06-13T00:00:00Z","Max von Pettenkofer-Institut","PacBio RSII","300x","HGAP v. 3","1","","1","1582133","Germany","Homo sapiens"
"Helicobacter pylori 21-F-EK1","582924","210","210.5912","","","582924","","ftp://ftp.ncbi.nlm.nih.gov/genomes/all/GCF/006/337/385/GCF_006337385.1_ASM633738v1","ftp://ftp.ncbi.nlm.nih.gov/genomes/all/GCA/006/337/385/GCA_006337385.1_ASM633738v1","SAMN10053522","PRJNA490474","GCA_006337385.1","1.58334","39","chromosome:NZ_CP032479.1/CP032479.1","-","1","1558","1424/582924","6/13/2019","10/19/2019","Complete Genome","2019-06-13T00:00:00Z","Max von Pettenkofer-Institut","PacBio RSII","300x","HGAP v. 3","1","","1","1583343","Germany","Homo sapiens"
"Helicobacter pylori 23-A-EK1","582933","210","210.5921","","","582933","","ftp://ftp.ncbi.nlm.nih.gov/genomes/all/GCF/006/338/045/GCF_006338045.1_ASM633804v1","ftp://ftp.ncbi.nlm.nih.gov/genomes/all/GCA/006/338/045/GCA_006338045.1_ASM633804v1","SAMN10053532","PRJNA490474","GCA_006338045.1","1.67916","38.8","chromosome:NZ_CP032908.1/CP032908.1","-","1","1644","1505/582933","6/13/2019","10/19/2019","Complete Genome","2019-06-13T00:00:00Z","Max von Pettenkofer-Institut","PacBio RSII","300x","HGAP v. 3","1","","1","1679162","Germany","Homo sapiens"
"Helicobacter pylori 24-A-EK1","590132","210","210.5920","","","590132","","ftp://ftp.ncbi.nlm.nih.gov/genomes/all/GCF/006/337/875/GCF_006337875.1_ASM633787v1","ftp://ftp.ncbi.nlm.nih.gov/genomes/all/GCA/006/337/875/GCA_006337875.1_ASM633787v1","SAMN10053562","PRJNA490474","GCA_006337875.1","1.6595","38.9","chromosome:NZ_CP032907.1/CP032907.1","-","1","1615","1477/590132","6/13/2019","10/31/2019","Complete Genome","2019-06-13T00:00:00Z","Max von Pettenkofer-Institut","PacBio RSII","300x","HGAP v. 3","1","","1","1659500","Germany","Homo sapiens"
"Helicobacter pylori 25-A-EK1","582942","210","210.5930","","","582942","","ftp://ftp.ncbi.nlm.nih.gov/genomes/all/GCF/006/339/235/GCF_006339235.1_ASM633923v1","ftp://ftp.ncbi.nlm.nih.gov/genomes/all/GCA/006/339/235/GCA_006339235.1_ASM633923v1","SAMN10053592","PRJNA490474","GCA_006339235.1","1.54021","39.1","chromosome:NZ_CP032906.1/CP032906.1","-","1","1520","1392/582942","6/13/2019","10/19/2019","Complete Genome","2019-06-13T00:00:00Z","Max von Pettenkofer-Institut","PacBio RSII","300x","HGAP v. 3","1","","1","1540214","Germany","Homo sapiens"
"Helicobacter pylori 25-A-EK9","582923","210","210.5911","","","582923","","ftp://ftp.ncbi.nlm.nih.gov/genomes/all/GCF/006/337/365/GCF_006337365.1_ASM633736v1","ftp://ftp.ncbi.nlm.nih.gov/genomes/all/GCA/006/337/365/GCA_006337365.1_ASM633736v1","SAMN10053600","PRJNA490474","GCA_006337365.1","1.54014","39.2","chromosome:NZ_CP032478.1/CP032478.1","-","1","1516","1390/582923","6/13/2019","10/19/2019","Complete Genome","2019-06-13T00:00:00Z","Max von Pettenkofer-Institut","PacBio RSII","300x","HGAP v. 3","1","","1","1540135","Germany","Homo sapiens"
"Helicobacter pylori 26695","299772","85962","85962.8","T00008/T02282","HPY","299772","yes","ftp://ftp.ncbi.nlm.nih.gov/genomes/all/GCF/000/008/525/GCF_000008525.1_ASM852v1","ftp://ftp.ncbi.nlm.nih.gov/genomes/all/GCA/000/008/525/GCA_000008525.1_ASM852v1","SAMN02603995","PRJNA233","GCA_000008525.1","1.66787","38.9","chromosome:NC_000915.1/AE000511.1","-","1","1555","1445/299772","8/6/1997","8/2/2016","Complete Genome","1997-08-07T00:00:00Z","TIGR","","","","1","","1","1667867","United Kingdom","Human, Homo sapiens"
"Helicobacter pylori 26695-1","217713","1391726","1391726.3","","","N/A","","ftp://ftp.ncbi.nlm.nih.gov/genomes/all/GCF/000/826/985/GCF_000826985.1_ASM82698v1","ftp://ftp.ncbi.nlm.nih.gov/genomes/all/GCA/000/826/985/GCA_000826985.1_ASM82698v1","SAMN03268385","PRJNA270700","GCA_000826985.1","1.66764","38.9","chromosome:NZ_CP010435.1/CP010435.1","-","1","1642","1505/217713","1/21/2015","8/27/2019","Complete Genome","2015-01-21T00:00:00Z","Oita University","Illumina HiSeq","680.0x","CLC NGS Cell v. April-2011","1","","1","1667638","United States","Human, Homo sapiens"
"Helicobacter pylori 26695-1","218284","1391726","1391726.4","","","N/A","","ftp://ftp.ncbi.nlm.nih.gov/genomes/all/GCF/000/829/095/GCF_000829095.1_ASM82909v1","ftp://ftp.ncbi.nlm.nih.gov/genomes/all/GCA/000/829/095/GCA_000829095.1_ASM82909v1","SAMD00061015","PRJDB1447","GCA_000829095.1","1.66764","38.9","chromosome:NZ_AP013354.1/AP013354.1","-","1","1642","1505/218284","10/1/2013","8/27/2019","Complete Genome","2013-10-02T00:00:00Z","Oita university","HiSeq2000","747X","CLC Reference assembly v. 6.0.3","1","","1","1667638","",""
"Helicobacter pylori 26695-1CH","218286","1391728","1391728.3","","","N/A","","ftp://ftp.ncbi.nlm.nih.gov/genomes/all/GCF/000/829/135/GCF_000829135.1_ASM82913v1","ftp://ftp.ncbi.nlm.nih.gov/genomes/all/GCA/000/829/135/GCA_000829135.1_ASM82913v1","SAMD00061017","PRJDB1449","GCA_000829135.1","1.6673","38.9","chromosome:NZ_AP013355.1/AP013355.1","-","1","1642","1504/218286","10/1/2013","8/27/2019","Complete Genome","2013-10-02T00:00:00Z","Oita university","HiSeq2000","747X","CLC Reference assembly v. 6.0.3","1","","1","1667302","",""
"Helicobacter pylori 26695-1CL","218285","1391727","1391727.3","","","N/A","","ftp://ftp.ncbi.nlm.nih.gov/genomes/all/GCF/000/829/115/GCF_000829115.1_ASM82911v1","ftp://ftp.ncbi.nlm.nih.gov/genomes/all/GCA/000/829/115/GCA_000829115.1_ASM82911v1","SAMD00061016","PRJDB1448","GCA_000829115.1","1.66724","38.9","chromosome:NZ_AP013356.1/AP013356.1","-","1","1640","1502/218285","10/1/2013","8/27/2019","Complete Genome","2013-10-02T00:00:00Z","Oita university","HiSeq2000","747X","CLC Reference assembly v. 6.0.3","1","","1","1667239","",""
"Helicobacter pylori 26695-1MET","217714","210","210.1381","","","N/A","","ftp://ftp.ncbi.nlm.nih.gov/genomes/all/GCF/000/827/025/GCF_000827025.1_ASM82702v1","ftp://ftp.ncbi.nlm.nih.gov/genomes/all/GCA/000/827/025/GCA_000827025.1_ASM82702v1","SAMN03268365","PRJNA270699","GCA_000827025.1","1.6673","38.9","chromosome:NZ_CP010436.1/CP010436.1","-","1","1641","1503/217714","1/21/2015","8/27/2019","Complete Genome","2015-01-21T00:00:00Z","Oita University","Illumina HiSeq","680.0x","CLC NGS Cell v. MAY-2012","1","","1","1667303","United States","Human, Homo sapiens"
"Helicobacter pylori 26695-dR","361913","210","210.4123","","","N/A","","ftp://ftp.ncbi.nlm.nih.gov/genomes/all/GCF/002/906/535/GCF_002906535.1_ASM290653v1","ftp://ftp.ncbi.nlm.nih.gov/genomes/all/GCA/002/906/535/GCA_002906535.1_ASM290653v1","SAMN08388633","PRJNA431311","GCA_002906535.1","1.66647","38.9","chromosome:NZ_CP026326.1/CP026326.1","-","1","1645","1505/361913","1/30/2018","2/1/2018","Complete Genome","2018-01-30T00:00:00Z","New England Biolabs, Inc.","PacBio","411x","RS_HGAP_Assembly v. 3","1","","1","1666471","","Human, Homo sapiens"
"Helicobacter pylori 26695-dRdM1dM2","361912","210","210.4122","","","N/A","","ftp://ftp.ncbi.nlm.nih.gov/genomes/all/GCF/002/906/515/GCF_002906515.1_ASM290651v1","ftp://ftp.ncbi.nlm.nih.gov/genomes/all/GCA/002/906/515/GCA_002906515.1_ASM290651v1","SAMN08388636","PRJNA431311","GCA_002906515.1","1.66688","38.9","chromosome:NZ_CP026323.1/CP026323.1","-","1","1643","1472/361912","1/30/2018","2/1/2018","Complete Genome","2018-01-30T00:00:00Z","New England Biolabs, Inc.","PacBio","422x","RS_HGAP_Assembly v. 3","1","","1","1666879","","Human, Homo sapiens"
"Helicobacter pylori 26695-dRdM2","361914","210","210.4124","","","N/A","","ftp://ftp.ncbi.nlm.nih.gov/genomes/all/GCF/002/906/555/GCF_002906555.1_ASM290655v1","ftp://ftp.ncbi.nlm.nih.gov/genomes/all/GCA/002/906/555/GCA_002906555.1_ASM290655v1","SAMN08388635","PRJNA431311","GCA_002906555.1","1.66674","38.9","chromosome:NZ_CP026324.1/CP026324.1","-","1","1644","1506/361914","1/30/2018","2/1/2018","Complete Genome","2018-01-30T00:00:00Z","New England Biolabs, Inc.","PacBio","513x","RS_HGAP_Assembly v. 3","1","","1","1666735","","Human, Homo sapiens"
"Helicobacter pylori 26-A-EK1","582931","210","210.5919","","","582931","","ftp://ftp.ncbi.nlm.nih.gov/genomes/all/GCF/006/337/745/GCF_006337745.1_ASM633774v1","ftp://ftp.ncbi.nlm.nih.gov/genomes/all/GCA/006/337/745/GCA_006337745.1_ASM633774v1","SAMN10053622","PRJNA490474","GCA_006337745.1","1.64342","38.9","chromosome:NZ_CP032905.1/CP032905.1","-","1","1640","1467/582931","6/13/2019","10/19/2019","Complete Genome","2019-06-13T00:00:00Z","Max von Pettenkofer-Institut","PacBio RSII","300x","HGAP v. 3","1","","1","1643421","Germany","Homo sapiens"
"Helicobacter pylori 280-A-EK1","582928","210","210.5916","","","582928","","ftp://ftp.ncbi.nlm.nih.gov/genomes/all/GCF/006/337/465/GCF_006337465.1_ASM633746v1","ftp://ftp.ncbi.nlm.nih.gov/genomes/all/GCA/006/337/465/GCA_006337465.1_ASM633746v1","SAMN10053739","PRJNA490474","GCA_006337465.1","1.60944","39","chromosome:NZ_CP032902.1/CP032902.1","-","1","1598","1429/582928","6/13/2019","10/19/2019","Complete Genome","2019-06-13T00:00:00Z","Max von Pettenkofer-Institut","PacBio RSII","300x","HGAP v. 3","1","","1","1609437","Germany","Homo sapiens"
"Helicobacter pylori 29CaP","256367","210","210.1969","","","256367","","ftp://ftp.ncbi.nlm.nih.gov/genomes/all/GCF/001/433/495/GCF_001433495.1_ASM143349v1","ftp://ftp.ncbi.nlm.nih.gov/genomes/all/GCA/001/433/495/GCA_001433495.1_ASM143349v1","SAMN03144734","PRJNA264984","GCA_001433495.1","1.66716","38.8","chromosome:NZ_CP012907.1/CP012907.1","-","1","1657","1445/256367","11/5/2015","10/8/2019","Complete Genome","2015-11-05T00:00:00Z","Universidad Nacional Autonoma de Mexico","454; PcBioHQ; Solexa; Solid","135.74x","MIRA v. 3.4; SMRT v. 2.3","1","","1","1667159","Mexico","Human, Homo sapiens"
"Helicobacter pylori 35A","163540","585535","585535.5","T01892","GCF_000178935-HMP","163540","","ftp://ftp.ncbi.nlm.nih.gov/genomes/all/GCF/000/178/935/GCF_000178935.2_ASM17893v2","ftp://ftp.ncbi.nlm.nih.gov/genomes/all/GCA/000/178/935/GCA_000178935.2_ASM17893v2","SAMN02299423","PRJNA34603","GCA_000178935.2","1.56665","38.9","chromosome:NC_017360.1/CP002096.1","-","1","1566","1411/163540","12/29/2010","3/22/2017","Complete Genome","2010-06-15T00:00:00Z","Baylor College of Medicine","","","","1","","1","1566655","",""
"Helicobacter pylori 381-A-EK4","582927","210","210.5915","","","582927","","ftp://ftp.ncbi.nlm.nih.gov/genomes/all/GCF/006/337/445/GCF_006337445.1_ASM633744v1","ftp://ftp.ncbi.nlm.nih.gov/genomes/all/GCA/006/337/445/GCA_006337445.1_ASM633744v1","SAMN10053762","PRJNA490474","GCA_006337445.1","1.57943","39.1","chromosome:NZ_CP032901.1/CP032901.1","-","1","1571","1416/582927","6/13/2019","10/19/2019","Complete Genome","2019-06-13T00:00:00Z","Max von Pettenkofer-Institut","PacBio RSII","300x","HGAP v. 3","1","","1","1579431","Germany","Homo sapiens"
"Helicobacter pylori 381-C-EK1","582921","210","210.5909","","","582921","","ftp://ftp.ncbi.nlm.nih.gov/genomes/all/GCF/006/337/325/GCF_006337325.1_ASM633732v1","ftp://ftp.ncbi.nlm.nih.gov/genomes/all/GCA/006/337/325/GCA_006337325.1_ASM633732v1","SAMN10053769","PRJNA490474","GCA_006337325.1","1.58899","39.1","chromosome:NZ_CP032476.1/CP032476.1","-","1","1583","1419/582921","6/13/2019","10/19/2019","Complete Genome","2019-06-13T00:00:00Z","Max von Pettenkofer-Institut","PacBio RSII","300x","HGAP v. 3","1","","1","1588985","Germany","Homo sapiens"
"Helicobacter pylori 381-F-EK9","582920","210","210.5908","","","582920","","ftp://ftp.ncbi.nlm.nih.gov/genomes/all/GCF/006/337/305/GCF_006337305.1_ASM633730v1","ftp://ftp.ncbi.nlm.nih.gov/genomes/all/GCA/006/337/305/GCA_006337305.1_ASM633730v1","SAMN10053787","PRJNA490474","GCA_006337305.1","1.58096","39.1","chromosome:NZ_CP032475.1/CP032475.1","-","1","1570","1412/582920","6/13/2019","10/19/2019","Complete Genome","2019-06-13T00:00:00Z","Max von Pettenkofer-Institut","PacBio RSII","300x","HGAP v. 3","1","","1","1580965","Germany","Homo sapiens"
"Helicobacter pylori 476-A2-EK2","582919","210","210.5907","","","582919","","ftp://ftp.ncbi.nlm.nih.gov/genomes/all/GCF/006/337/285/GCF_006337285.1_ASM633728v1","ftp://ftp.ncbi.nlm.nih.gov/genomes/all/GCA/006/337/285/GCA_006337285.1_ASM633728v1","SAMN10053800","PRJNA490474","GCA_006337285.1","1.64954","38.9","chromosome:NZ_CP032473.1/CP032473.1","-","1","1630","1466/582919","6/13/2019","10/19/2019","Complete Genome","2019-06-13T00:00:00Z","Max von Pettenkofer-Institut","PacBio RSII","300x","HGAP v. 3","1","","1","1649543","Germany","Homo sapiens"
"Helicobacter pylori 476-A-EK5","582926","210","210.5914","","","582926","","ftp://ftp.ncbi.nlm.nih.gov/genomes/all/GCF/006/337/425/GCF_006337425.1_ASM633742v1","ftp://ftp.ncbi.nlm.nih.gov/genomes/all/GCA/006/337/425/GCA_006337425.1_ASM633742v1","SAMN10053793","PRJNA490474","GCA_006337425.1","1.6348","38.9","chromosome:NZ_CP032900.1/CP032900.1","-","1","1623","1456/582926","6/13/2019","10/19/2019","Complete Genome","2019-06-13T00:00:00Z","Max von Pettenkofer-Institut","PacBio RSII","300x","HGAP v. 3","1","","1","1634797","Germany","Homo sapiens"
"Helicobacter pylori 476-C-EK5","582939","210","210.5927","","","582939","","ftp://ftp.ncbi.nlm.nih.gov/genomes/all/GCF/006/338/815/GCF_006338815.1_ASM633881v1","ftp://ftp.ncbi.nlm.nih.gov/genomes/all/GCA/006/338/815/GCA_006338815.1_ASM633881v1","SAMN10053808","PRJNA490474","GCA_006338815.1","1.60138","39","chromosome:NZ_CP032474.1/CP032474.1","-","1","1597","1428/582939","6/13/2019","10/19/2019","Complete Genome","2019-06-13T00:00:00Z","Max von Pettenkofer-Institut","PacBio RSII","300x","HGAP v. 3","1","","1","1601381","Germany","Homo sapiens"
"Helicobacter pylori 478-A-EK1","582941","210","210.5929","","","582941","","ftp://ftp.ncbi.nlm.nih.gov/genomes/all/GCF/006/339/065/GCF_006339065.1_ASM633906v1","ftp://ftp.ncbi.nlm.nih.gov/genomes/all/GCA/006/339/065/GCA_006339065.1_ASM633906v1","SAMN10053819","PRJNA490474","GCA_006339065.1","1.62862","38.9","chromosome:NZ_CP032899.1/CP032899.1","-","1","1602","1439/582941","6/13/2019","6/22/2019","Complete Genome","2019-06-13T00:00:00Z","Max von Pettenkofer-Institut","PacBio RSII","300x","HGAP v. 3","1","","1","1628623","Germany","Homo sapiens"
"Helicobacter pylori 479-A2-EK4","582918","210","210.5906","","","582918","","ftp://ftp.ncbi.nlm.nih.gov/genomes/all/GCF/006/337/265/GCF_006337265.1_ASM633726v1","ftp://ftp.ncbi.nlm.nih.gov/genomes/all/GCA/006/337/265/GCA_006337265.1_ASM633726v1","SAMN10053852","PRJNA490474","GCA_006337265.1","1.63644","38.9","chromosome:NZ_CP032472.1/CP032472.1","-","1","1600","1455/582918","6/13/2019","10/19/2019","Complete Genome","2019-06-13T00:00:00Z","Max von Pettenkofer-Institut","PacBio RSII","300x","HGAP v. 3","1","","1","1636444","Germany","Homo sapiens"
"Helicobacter pylori 479-C2-EK2","582938","210","210.5926","","","582938","","ftp://ftp.ncbi.nlm.nih.gov/genomes/all/GCF/006/338/685/GCF_006338685.1_ASM633868v1","ftp://ftp.ncbi.nlm.nih.gov/genomes/all/GCA/006/338/685/GCA_006338685.1_ASM633868v1","SAMN10053865","PRJNA490474","GCA_006338685.1","1.63778","38.9","chromosome:NZ_CP032471.1/CP032471.1","-","1","1590","1447/582938","6/13/2019","10/19/2019","Complete Genome","2019-06-13T00:00:00Z","Max von Pettenkofer-Institut","PacBio RSII","300x","HGAP v. 3","1","","1","1637783","Germany","Homo sapiens"
"Helicobacter pylori 479-C-EK2","582940","210","210.5928","","","582940","","ftp://ftp.ncbi.nlm.nih.gov/genomes/all/GCF/006/338/945/GCF_006338945.1_ASM633894v1","ftp://ftp.ncbi.nlm.nih.gov/genomes/all/GCA/006/338/945/GCA_006338945.1_ASM633894v1","SAMN10053855","PRJNA490474","GCA_006338945.1","1.63802","38.9","chromosome:NZ_CP032898.1/CP032898.1","-","1","1600","1455/582940","6/13/2019","6/22/2019","Complete Genome","2019-06-13T00:00:00Z","Max von Pettenkofer-Institut","PacBio RSII","300x","HGAP v. 3","1","","1","1638022","Germany","Homo sapiens"
"Helicobacter pylori 51","163527","290847","290847.5","T02082","HPYL290847","163527","","ftp://ftp.ncbi.nlm.nih.gov/genomes/all/GCF/000/011/725/GCF_000011725.1_ASM1172v1","ftp://ftp.ncbi.nlm.nih.gov/genomes/all/GCA/000/011/725/GCA_000011725.1_ASM1172v1","SAMN02603300","PRJNA9627","GCA_000011725.1","1.58995","38.8","chromosome:NC_017382.1/CP000012.1","-","1","1575","1417/163527","10/21/2009","3/22/2017","Complete Genome","2009-10-21T00:00:00Z","Gyeongsang National University College of Medicine and 21c Frontier Human Functional Genome Research Project|Gyeongsang National University|KRIBB, Korea, Daejeon","","","","1","","1","1589954","South Korea","Human, Homo sapiens"
"Helicobacter pylori 52","163532","684950","684950.4","T01898","HPYL684950","163532","","ftp://ftp.ncbi.nlm.nih.gov/genomes/all/GCF/000/023/805/GCF_000023805.1_ASM2380v1","ftp://ftp.ncbi.nlm.nih.gov/genomes/all/GCA/000/023/805/GCA_000023805.1_ASM2380v1","SAMN02603357","PRJNA39507","GCA_000023805.1","1.56883","38.9","chromosome:NC_017354.1/CP001680.1","-","1","1549","1390/163532","10/21/2009","3/22/2017","Complete Genome","2009-10-21T00:00:00Z","Korea Research Institute of Bioscience and Biotechnology","","","","1","","1","1568826","",""
"Helicobacter pylori 5-A-EK1","582943","210","210.5931","","","582943","","ftp://ftp.ncbi.nlm.nih.gov/genomes/all/GCF/006/339/365/GCF_006339365.1_ASM633936v1","ftp://ftp.ncbi.nlm.nih.gov/genomes/all/GCA/006/339/365/GCA_006339365.1_ASM633936v1","SAMN10053382","PRJNA490474","GCA_006339365.1","1.59699","39","chromosome:NZ_CP032913.1/CP032913.1","-","1","1562","1421/582943","6/13/2019","10/19/2019","Complete Genome","2019-06-13T00:00:00Z","Max von Pettenkofer-Institut","PacBio RSII","300x","HGAP v. 3","1","","1","1596986","Germany","Homo sapiens"
"Helicobacter pylori 7.13","650022","210","210.6103","","","650022","","ftp://ftp.ncbi.nlm.nih.gov/genomes/all/GCF/007/836/855/GCF_007836855.1_ASM783685v1","ftp://ftp.ncbi.nlm.nih.gov/genomes/all/GCA/007/836/855/GCA_007836855.1_ASM783685v1","SAMN08055030","PRJNA419269","GCA_007836855.1","1.67674","38.8","chromosome:NZ_CP024953.1/CP024953.1","-","1","1640","1490/650022","8/5/2019","10/19/2019","Complete Genome","2019-08-05T00:00:00Z","Yonsei University","PacBio","579.05x","PacBio SMRT Analysis v. v2.3.0","1","","1","1676743","",""
"Helicobacter pylori 7.13_D1a","364213","210","210.4131","","","N/A","","ftp://ftp.ncbi.nlm.nih.gov/genomes/all/GCF/002/952/335/GCF_002952335.1_ASM295233v1","ftp://ftp.ncbi.nlm.nih.gov/genomes/all/GCA/002/952/335/GCA_002952335.1_ASM295233v1","SAMN06216079","PRJNA362878","GCA_002952335.1","1.67412","38.8","chromosome:NZ_CP024015.1/CP024015.1","-","1","1639","1430/364213","2/26/2018","8/29/2019","Complete Genome","2018-02-26T00:00:00Z","Vanderbilt University Medical Center","Illumina MiSeq","115x","VGAS v. 1","1","","1","1674120","United States","gerbil"
"Helicobacter pylori 7.13_D1b","364214","210","210.4132","","","N/A","","ftp://ftp.ncbi.nlm.nih.gov/genomes/all/GCF/002/952/355/GCF_002952355.1_ASM295235v1","ftp://ftp.ncbi.nlm.nih.gov/genomes/all/GCA/002/952/355/GCA_002952355.1_ASM295235v1","SAMN06216080","PRJNA362878","GCA_002952355.1","1.67408","38.8","chromosome:NZ_CP024016.1/CP024016.1","-","1","1636","1451/364214","2/26/2018","10/18/2019","Complete Genome","2018-02-26T00:00:00Z","Vanderbilt University Medical Center","Illumina MiSeq","108x","VGAS v. 1","1","","1","1674080","United States","gerbil"
"Helicobacter pylori 7.13_D1c","364215","210","210.4133","","","N/A","","ftp://ftp.ncbi.nlm.nih.gov/genomes/all/GCF/002/952/375/GCF_002952375.1_ASM295237v1","ftp://ftp.ncbi.nlm.nih.gov/genomes/all/GCA/002/952/375/GCA_002952375.1_ASM295237v1","SAMN06216081","PRJNA362878","GCA_002952375.1","1.67416","38.8","chromosome:NZ_CP024017.1/CP024017.1","-","1","1641","1436/364215","2/26/2018","8/29/2019","Complete Genome","2018-02-26T00:00:00Z","Vanderbilt University Medical Center","Illumina MiSeq","82x","VGAS v. 1","1","","1","1674163","United States","gerbil"
"Helicobacter pylori 7.13_D3a","364216","210","210.4137","","","N/A","","ftp://ftp.ncbi.nlm.nih.gov/genomes/all/GCF/002/952/455/GCF_002952455.1_ASM295245v1","ftp://ftp.ncbi.nlm.nih.gov/genomes/all/GCA/002/952/455/GCA_002952455.1_ASM295245v1","SAMN06216085","PRJNA362878","GCA_002952455.1","1.67402","38.8","chromosome:NZ_CP024021.1/CP024021.1","-","1","1635","1485/364216","2/26/2018","10/19/2019","Complete Genome","2018-02-26T00:00:00Z","Vanderbilt University Medical Center","Illumina MiSeq","145x","VGAS v. 1","1","","1","1674015","United States","gerbil"
"Helicobacter pylori 7.13_D3b","364217","210","210.4138","","","N/A","","ftp://ftp.ncbi.nlm.nih.gov/genomes/all/GCF/002/952/475/GCF_002952475.1_ASM295247v1","ftp://ftp.ncbi.nlm.nih.gov/genomes/all/GCA/002/952/475/GCA_002952475.1_ASM295247v1","SAMN06216086","PRJNA362878","GCA_002952475.1","1.67401","38.8","chromosome:NZ_CP024022.1/CP024022.1","-","1","1635","1485/364217","2/26/2018","10/19/2019","Complete Genome","2018-02-26T00:00:00Z","Vanderbilt University Medical Center","Illumina MiSeq","87x","VGAS v. 1","1","","1","1674013","United States","gerbil"
"Helicobacter pylori 7.13_D3c","364218","210","210.4139","","","N/A","","ftp://ftp.ncbi.nlm.nih.gov/genomes/all/GCF/002/952/495/GCF_002952495.1_ASM295249v1","ftp://ftp.ncbi.nlm.nih.gov/genomes/all/GCA/002/952/495/GCA_002952495.1_ASM295249v1","SAMN06216087","PRJNA362878","GCA_002952495.1","1.67401","38.8","chromosome:NZ_CP024023.1/CP024023.1","-","1","1635","1485/364218","2/26/2018","10/19/2019","Complete Genome","2018-02-26T00:00:00Z","Vanderbilt University Medical Center","Illumina MiSeq","116x","VGAS v. 1","1","","1","1674013","United States","gerbil"
"Helicobacter pylori 7.13_R1a","364778","210","210.4148","","","N/A","","ftp://ftp.ncbi.nlm.nih.gov/genomes/all/GCF/002/952/675/GCF_002952675.1_ASM295267v1","ftp://ftp.ncbi.nlm.nih.gov/genomes/all/GCA/002/952/675/GCA_002952675.1_ASM295267v1","SAMN06216070","PRJNA362878","GCA_002952675.1","1.67402","38.8","chromosome:NZ_CP024071.1/CP024071.1","-","1","1638","1487/364778","2/26/2018","10/19/2019","Complete Genome","2018-02-26T00:00:00Z","Vanderbilt University Medical Center","Illumina MiSeq","121x","VGAS v. 1","1","","1","1674018","United States","gerbil"
"Helicobacter pylori 7.13_R1b","364777","210","210.4147","","","N/A","","ftp://ftp.ncbi.nlm.nih.gov/genomes/all/GCF/002/952/655/GCF_002952655.1_ASM295265v1","ftp://ftp.ncbi.nlm.nih.gov/genomes/all/GCA/002/952/655/GCA_002952655.1_ASM295265v1","SAMN06216071","PRJNA362878","GCA_002952655.1","1.67401","38.8","chromosome:NZ_CP024072.1/CP024072.1","-","1","1636","1485/364777","2/26/2018","10/19/2019","Complete Genome","2018-02-26T00:00:00Z","Vanderbilt University Medical Center","Illumina MiSeq","104x","VGAS v. 1","1","","1","1674010","United States","gerbil"
"Helicobacter pylori 7.13_R1c","364774","210","210.4144","","","N/A","","ftp://ftp.ncbi.nlm.nih.gov/genomes/all/GCF/002/952/595/GCF_002952595.1_ASM295259v1","ftp://ftp.ncbi.nlm.nih.gov/genomes/all/GCA/002/952/595/GCA_002952595.1_ASM295259v1","SAMN06216072","PRJNA362878","GCA_002952595.1","1.67401","38.8","chromosome:NZ_CP024073.1/CP024073.1","-","1","1636","1485/364774","2/26/2018","10/19/2019","Complete Genome","2018-02-26T00:00:00Z","Vanderbilt University Medical Center","Illumina MiSeq","83x","VGAS v. 1","1","","1","1674009","United States","gerbil"
"Helicobacter pylori 7.13_R2a","364222","210","210.4143","","","N/A","","ftp://ftp.ncbi.nlm.nih.gov/genomes/all/GCF/002/952/575/GCF_002952575.1_ASM295257v1","ftp://ftp.ncbi.nlm.nih.gov/genomes/all/GCA/002/952/575/GCA_002952575.1_ASM295257v1","SAMN06216073","PRJNA362878","GCA_002952575.1","1.67395","38.8","chromosome:NZ_CP024074.1/CP024074.1","-","1","1637","1484/364222","2/26/2018","10/19/2019","Complete Genome","2018-02-26T00:00:00Z","Vanderbilt University Medical Center","Illumina MiSeq","132x","VGAS v. 1","1","","1","1673951","United States","gerbil"
"Helicobacter pylori 7.13_R2b","364776","210","210.4146","","","N/A","","ftp://ftp.ncbi.nlm.nih.gov/genomes/all/GCF/002/952/635/GCF_002952635.1_ASM295263v1","ftp://ftp.ncbi.nlm.nih.gov/genomes/all/GCA/002/952/635/GCA_002952635.1_ASM295263v1","SAMN06216074","PRJNA362878","GCA_002952635.1","1.67403","38.8","chromosome:NZ_CP024075.1/CP024075.1","-","1","1636","1486/364776","2/26/2018","10/19/2019","Complete Genome","2018-02-26T00:00:00Z","Vanderbilt University Medical Center","Illumina MiSeq","125x","VGAS v. 1","1","","1","1674026","United States","gerbil"
"Helicobacter pylori 7.13_R2c","364221","210","210.4142","","","N/A","","ftp://ftp.ncbi.nlm.nih.gov/genomes/all/GCF/002/952/555/GCF_002952555.1_ASM295255v1","ftp://ftp.ncbi.nlm.nih.gov/genomes/all/GCA/002/952/555/GCA_002952555.1_ASM295255v1","SAMN06216075","PRJNA362878","GCA_002952555.1","1.67401","38.8","chromosome:NZ_CP024076.1/CP024076.1","-","1","1635","1485/364221","2/26/2018","10/19/2019","Complete Genome","2018-02-26T00:00:00Z","Vanderbilt University Medical Center","Illumina MiSeq","100x","VGAS v. 1","1","","1","1674009","United States","gerbil"
"Helicobacter pylori 7.13_R3a","364775","210","210.4145","","","N/A","","ftp://ftp.ncbi.nlm.nih.gov/genomes/all/GCF/002/952/615/GCF_002952615.1_ASM295261v1","ftp://ftp.ncbi.nlm.nih.gov/genomes/all/GCA/002/952/615/GCA_002952615.1_ASM295261v1","SAMN06216076","PRJNA362878","GCA_002952615.1","1.67402","38.8","chromosome:NZ_CP024077.1/CP024077.1","-","1","1636","1486/364775","2/26/2018","10/19/2019","Complete Genome","2018-02-26T00:00:00Z","Vanderbilt University Medical Center","Illumina MiSeq","130x","VGAS v. 1","1","","1","1674020","United States","gerbil"
"Helicobacter pylori 7.13_R3b","364220","210","210.4141","","","N/A","","ftp://ftp.ncbi.nlm.nih.gov/genomes/all/GCF/002/952/535/GCF_002952535.1_ASM295253v1","ftp://ftp.ncbi.nlm.nih.gov/genomes/all/GCA/002/952/535/GCA_002952535.1_ASM295253v1","SAMN06216077","PRJNA362878","GCA_002952535.1","1.67402","38.8","chromosome:NZ_CP024078.1/CP024078.1","-","1","1637","1486/364220","2/26/2018","10/19/2019","Complete Genome","2018-02-26T00:00:00Z","Vanderbilt University Medical Center","Illumina MiSeq","77x","VGAS v. 1","1","","1","1674019","United States","gerbil"
"Helicobacter pylori 7.13_R3c","364219","210","210.4140","","","N/A","","ftp://ftp.ncbi.nlm.nih.gov/genomes/all/GCF/002/952/515/GCF_002952515.1_ASM295251v1","ftp://ftp.ncbi.nlm.nih.gov/genomes/all/GCA/002/952/515/GCA_002952515.1_ASM295251v1","SAMN06216078","PRJNA362878","GCA_002952515.1","1.67402","38.8","chromosome:NZ_CP024079.1/CP024079.1","-","1","1636","1486/364219","2/26/2018","10/19/2019","Complete Genome","2018-02-26T00:00:00Z","Vanderbilt University Medical Center","Illumina MiSeq","133x","VGAS v. 1","1","","1","1674018","United States","gerbil"
"Helicobacter pylori 7C","256368","210","210.1970","","","256368","","ftp://ftp.ncbi.nlm.nih.gov/genomes/all/GCF/001/433/515/GCF_001433515.1_ASM143351v1","ftp://ftp.ncbi.nlm.nih.gov/genomes/all/GCA/001/433/515/GCA_001433515.1_ASM143351v1","SAMN03144736","PRJNA264984","GCA_001433515.1","1.63128","38.9895","chromosome:NZ_CP012905.1/CP012905.1; plasmid unnamed:NZ_CP012906.1/CP012906.1","-","2","1582","1421/256368","11/5/2015","8/28/2019","Complete Genome","2015-11-05T00:00:00Z","Universidad Nacional Autonoma de Mexico","454; PcBioHQ; Solexa","121.29x","MIRA v. 3.4; SMRT v. 2.3","","1","2","1631276","Mexico","Human, Homo sapiens"
"Helicobacter pylori 7C","256368","210","210.3092","","","256368","","ftp://ftp.ncbi.nlm.nih.gov/genomes/all/GCF/001/433/515/GCF_001433515.1_ASM143351v1","ftp://ftp.ncbi.nlm.nih.gov/genomes/all/GCA/001/433/515/GCA_001433515.1_ASM143351v1","SAMN03144736","PRJNA264984","GCA_001433515.1","1.63128","38.9895","chromosome:NZ_CP012905.1/CP012905.1; plasmid unnamed:NZ_CP012906.1/CP012906.1","-","2","1582","1421/256368","11/5/2015","8/28/2019","Complete Genome","2016-03-22T00:00:00Z","Universidad Nacional Autonoma de Mexico","454; PcBioHQ; Solexa","121.29x","MIRA v. 3.4; SMRT v. 2.3","","1","1","6835","Mexico","Human, Homo sapiens"
"Helicobacter pylori 83","163548","585538","585538.3","T01915","GCF_000213135-HMP","163548","","ftp://ftp.ncbi.nlm.nih.gov/genomes/all/GCF/000/213/135/GCF_000213135.1_ASM21313v1","ftp://ftp.ncbi.nlm.nih.gov/genomes/all/GCA/000/213/135/GCA_000213135.1_ASM21313v1","SAMN00189522","PRJNA34609","GCA_000213135.1","1.61743","38.7","chromosome:NC_017375.1/CP002605.1","-","1","1599","1432/163548","5/11/2011","3/22/2017","Complete Genome","2011-05-11T00:00:00Z","Baylor College of Medicine","454","38.3x","Newbler v. 2.0.0-Eclipse","1","","1","1617426","","Human, Homo sapiens"
"Helicobacter pylori 908","163535","869727","869727.3","T01893","HPYL869727","163535","","ftp://ftp.ncbi.nlm.nih.gov/genomes/all/GCF/000/148/665/GCF_000148665.1_ASM14866v1","ftp://ftp.ncbi.nlm.nih.gov/genomes/all/GCA/000/148/665/GCA_000148665.1_ASM14866v1","SAMN02604189","PRJNA50869","GCA_000148665.1","1.54967","39.3","chromosome:NC_017357.1/CP002184.1","-","1","1545","1356/163535","9/24/2010","8/25/2019","Complete Genome","2010-09-24T00:00:00Z","University of Hyderabad, India","","","","1","","1","1549666","",""
"Helicobacter pylori Aklavik117","163566","1055531","1055531.3","T02352","HPYL1055531","163566","","ftp://ftp.ncbi.nlm.nih.gov/genomes/all/GCF/000/315/955/GCF_000315955.1_ASM31595v1","ftp://ftp.ncbi.nlm.nih.gov/genomes/all/GCA/000/315/955/GCA_000315955.1_ASM31595v1","SAMN02604323","PRJNA69923","GCA_000315955.1","1.63613","38.7292","chromosome:NC_019560.1/CP003483.1; plasmid p1HPAKL117:NC_019561.1/CP003484.1; plasmid p2HPAKL117:NC_019562.1/CP003485.1","-","3","1587","1454/163566","11/26/2012","8/26/2019","Complete Genome","2012-11-26T00:00:00Z","Washington University Medical School","","","1","1","2","3","1636125","Canada","Human, Homo sapiens"
"Helicobacter pylori Aklavik117","163566","1055531","1055531.5","T02352","HPYL1055531","163566","","ftp://ftp.ncbi.nlm.nih.gov/genomes/all/GCF/000/315/955/GCF_000315955.1_ASM31595v1","ftp://ftp.ncbi.nlm.nih.gov/genomes/all/GCA/000/315/955/GCA_000315955.1_ASM31595v1","SAMN02604323","PRJNA69923","GCA_000315955.1","1.63613","38.7292","chromosome:NC_019560.1/CP003483.1; plasmid p1HPAKL117:NC_019561.1/CP003484.1; plasmid p2HPAKL117:NC_019562.1/CP003485.1","-","3","1587","1454/163566","11/26/2012","8/26/2019","Complete Genome","2016-07-26T00:00:00Z","Washington University Medical School","","","","","1","1","18787","Canada","Human, Homo sapiens"
"Helicobacter pylori Aklavik117","163566","1055531","1055531.6","T02352","HPYL1055531","163566","","ftp://ftp.ncbi.nlm.nih.gov/genomes/all/GCF/000/315/955/GCF_000315955.1_ASM31595v1","ftp://ftp.ncbi.nlm.nih.gov/genomes/all/GCA/000/315/955/GCA_000315955.1_ASM31595v1","SAMN02604323","PRJNA69923","GCA_000315955.1","1.63613","38.7292","chromosome:NC_019560.1/CP003483.1; plasmid p1HPAKL117:NC_019561.1/CP003484.1; plasmid p2HPAKL117:NC_019562.1/CP003485.1","-","3","1587","1454/163566","11/26/2012","8/26/2019","Complete Genome","2016-07-26T00:00:00Z","Washington University Medical School","","","","","1","1","2891","Canada","Human, Homo sapiens"
"Helicobacter pylori Aklavik86","163567","1055532","1055532.3","T02353","HPYL1055532","163567","","ftp://ftp.ncbi.nlm.nih.gov/genomes/all/GCF/000/317/875/GCF_000317875.1_ASM31787v1","ftp://ftp.ncbi.nlm.nih.gov/genomes/all/GCA/000/317/875/GCA_000317875.1_ASM31787v1","SAMN02604324","PRJNA69925","GCA_000317875.1","1.50793","39.253","chromosome:NC_019563.1/CP003476.1; plasmid p1HPAKL86:NC_019564.1/CP003477.1; plasmid p2HPAKL86:NC_019565.1/CP003478.1","-","3","1468","1365/163567","11/26/2012","8/26/2019","Complete Genome","2012-11-26T00:00:00Z","Washington University Medical School","","","1","1","2","3","1507930","Canada","Human, Homo sapiens"
"Helicobacter pylori Aklavik86","163567","1055532","1055532.5","T02353","HPYL1055532","163567","","ftp://ftp.ncbi.nlm.nih.gov/genomes/all/GCF/000/317/875/GCF_000317875.1_ASM31787v1","ftp://ftp.ncbi.nlm.nih.gov/genomes/all/GCA/000/317/875/GCA_000317875.1_ASM31787v1","SAMN02604324","PRJNA69925","GCA_000317875.1","1.50793","39.253","chromosome:NC_019563.1/CP003476.1; plasmid p1HPAKL86:NC_019564.1/CP003477.1; plasmid p2HPAKL86:NC_019565.1/CP003478.1","-","3","1468","1365/163567","11/26/2012","8/26/2019","Complete Genome","2016-07-26T00:00:00Z","Washington University Medical School","","","","","1","1","12113","Canada","Human, Homo sapiens"
"Helicobacter pylori Aklavik86","163567","1055532","1055532.6","T02353","HPYL1055532","163567","","ftp://ftp.ncbi.nlm.nih.gov/genomes/all/GCF/000/317/875/GCF_000317875.1_ASM31787v1","ftp://ftp.ncbi.nlm.nih.gov/genomes/all/GCA/000/317/875/GCA_000317875.1_ASM31787v1","SAMN02604324","PRJNA69925","GCA_000317875.1","1.50793","39.253","chromosome:NC_019563.1/CP003476.1; plasmid p1HPAKL86:NC_019564.1/CP003477.1; plasmid p2HPAKL86:NC_019565.1/CP003478.1","-","3","1468","1365/163567","11/26/2012","8/26/2019","Complete Genome","2016-07-26T00:00:00Z","Washington University Medical School","","","","","1","1","1634","Canada","Human, Homo sapiens"
"Helicobacter pylori ATCC 43504","454106","210","210.5630","","","454106","","ftp://ftp.ncbi.nlm.nih.gov/genomes/all/GCF/004/295/525/GCF_004295525.1_HPATCC43504_01","ftp://ftp.ncbi.nlm.nih.gov/genomes/all/GCA/004/295/525/GCA_004295525.1_HPATCC43504_01","SAMD00051589","PRJDB4522","GCA_004295525.1","1.68083","38.8","chromosome:NZ_AP017632.1/AP017632.1","-","1","1677","1489/454106","1/17/2019","8/8/2019","Complete Genome","2019-01-17T00:00:00Z","Microbiology, Graduate School of Medical Sciences, Kyushu University","454 GS FLX; ABI 3730; illumina","30x","Newbler v. 2.6","1","","1","1680829","",""
"Helicobacter pylori B125A","650021","210","210.6102","","","650021","","ftp://ftp.ncbi.nlm.nih.gov/genomes/all/GCF/007/836/735/GCF_007836735.1_ASM783673v1","ftp://ftp.ncbi.nlm.nih.gov/genomes/all/GCA/007/836/735/GCA_007836735.1_ASM783673v1","SAMN08055031","PRJNA419269","GCA_007836735.1","1.64396","38.9","chromosome:NZ_CP024952.1/CP024952.1","-","1","1609","1460/650021","8/5/2019","10/19/2019","Complete Genome","2019-08-05T00:00:00Z","Yonsei University","PacBio","582.73x","PacBio SMRT Analysis v. v2.3.0","1","","1","1643956","",""
"Helicobacter pylori B128","650028","544406","544406.7","","","650028","","ftp://ftp.ncbi.nlm.nih.gov/genomes/all/GCF/007/844/075/GCF_007844075.1_ASM784407v1","ftp://ftp.ncbi.nlm.nih.gov/genomes/all/GCA/007/844/075/GCA_007844075.1_ASM784407v1","SAMN08055032","PRJNA419269","GCA_007844075.1","1.67536","38.8","chromosome:NZ_CP024951.1/CP024951.1","-","1","1642","1489/650028","8/5/2019","10/19/2019","Complete Genome","2019-08-05T00:00:00Z","Yonsei University","PacBio","531.59x","PacBio SMRT Analysis v. v2.3.0","1","","1","1675360","",""
"Helicobacter pylori B128 7.13","647425","210","210.6101","","","N/A","","ftp://ftp.ncbi.nlm.nih.gov/genomes/all/GCF/007/794/935/GCF_007794935.1_ASM779493v1","ftp://ftp.ncbi.nlm.nih.gov/genomes/all/GCA/007/794/935/GCA_007794935.1_ASM779493v1","SAMN10083778","PRJNA491697","GCA_007794935.1","1.68159","38.7901","chromosome:NZ_CP042211.1/CP042211.1; plasmid pB128:NZ_CP042212.1/CP042212.1","-","2","1646","1484/647425","8/1/2019","8/6/2019","Complete Genome","2019-08-01T00:00:00Z","University of Birmingham","PacBio","83x","Canu v. v1.7","1","1","2","1681590","","Homo sapiens"
"Helicobacter pylori B128_1","364212","210","210.4125","","","N/A","","ftp://ftp.ncbi.nlm.nih.gov/genomes/all/GCF/002/951/975/GCF_002951975.1_ASM295197v1","ftp://ftp.ncbi.nlm.nih.gov/genomes/all/GCA/002/951/975/GCA_002951975.1_ASM295197v1","SAMN06216064","PRJNA362878","GCA_002951975.1","1.674","38.8","chromosome:NZ_CP019700.1/CP019700.1","-","1","1636","1485/364212","2/26/2018","10/31/2019","Complete Genome","2018-02-26T00:00:00Z","Vanderbilt University Medical Center","Illumina MiSeq","18.0x","Visual Genomics Analysis Studio v.","1","","1","1674002","United States","Human, Homo sapiens"
"Helicobacter pylori B130A","650027","210","210.6108","","","650027","","ftp://ftp.ncbi.nlm.nih.gov/genomes/all/GCF/007/844/055/GCF_007844055.1_ASM784405v1","ftp://ftp.ncbi.nlm.nih.gov/genomes/all/GCA/007/844/055/GCA_007844055.1_ASM784405v1","SAMN08055033","PRJNA419269","GCA_007844055.1","1.64604","38.9","chromosome:NZ_CP024950.1/CP024950.1","-","1","1613","1440/650027","8/5/2019","10/19/2019","Complete Genome","2019-08-05T00:00:00Z","Yonsei University","PacBio","507.48x","PacBio SMRT Analysis v. v2.3.0","1","","1","1646042","",""
"Helicobacter pylori B136A","650026","210","210.6107","","","650026","","ftp://ftp.ncbi.nlm.nih.gov/genomes/all/GCF/007/844/035/GCF_007844035.1_ASM784403v1","ftp://ftp.ncbi.nlm.nih.gov/genomes/all/GCA/007/844/035/GCA_007844035.1_ASM784403v1","SAMN08055034","PRJNA419269","GCA_007844035.1","1.66352","38.9","chromosome:NZ_CP024949.1/CP024949.1","-","1","1647","1480/650026","8/5/2019","10/19/2019","Complete Genome","2019-08-05T00:00:00Z","Yonsei University","PacBio","511.21x","PacBio SMRT Analysis v. v2.3.0","1","","1","1663520","",""
"Helicobacter pylori B140","650025","210","210.6106","","","650025","","ftp://ftp.ncbi.nlm.nih.gov/genomes/all/GCF/007/843/915/GCF_007843915.1_ASM784391v1","ftp://ftp.ncbi.nlm.nih.gov/genomes/all/GCA/007/843/915/GCA_007843915.1_ASM784391v1","SAMN08055035","PRJNA419269","GCA_007843915.1","1.72684","38.7","chromosome:NZ_CP024948.1/CP024948.1","-","1","1694","1518/650025","8/5/2019","10/19/2019","Complete Genome","2019-08-05T00:00:00Z","Yonsei University","PacBio","539.85x","PacBio SMRT Analysis v. v2.3.0","1","","1","1726836","",""
"Helicobacter pylori B147","650023","210","210.6104","","","650023","","ftp://ftp.ncbi.nlm.nih.gov/genomes/all/GCF/007/843/535/GCF_007843535.1_ASM784353v1","ftp://ftp.ncbi.nlm.nih.gov/genomes/all/GCA/007/843/535/GCA_007843535.1_ASM784353v1","SAMN08055037","PRJNA419269","GCA_007843535.1","1.63109","38.9","chromosome:NZ_CP024946.1/CP024946.1","-","1","1596","1434/650023","8/5/2019","10/19/2019","Complete Genome","2019-08-05T00:00:00Z","Yonsei University","PacBio","553.46x","PacBio SMRT Analysis v. v2.3.0","1","","1","1631093","",""
"Helicobacter pylori B38","163533","592205","592205.3","T00950","HPYL592205","163533","","ftp://ftp.ncbi.nlm.nih.gov/genomes/all/GCF/000/091/345/GCF_000091345.1_ASM9134v1","ftp://ftp.ncbi.nlm.nih.gov/genomes/all/GCA/000/091/345/GCA_000091345.1_ASM9134v1","SAMEA3138296","PRJNA39685","GCA_000091345.1","1.57676","39.2","chromosome:NC_012973.1/FM991728.1","-","1","1570","1421/163533","7/15/2009","8/25/2019","Complete Genome","2009-07-15T00:00:00Z","Institut Pasteur","","","","1","","1","1576758","",""
"Helicobacter pylori B8","163547","693745","693745.11","T01262","GCF_000196755","163547","","ftp://ftp.ncbi.nlm.nih.gov/genomes/all/GCF/000/196/755/GCF_000196755.1_ASM19675v1","ftp://ftp.ncbi.nlm.nih.gov/genomes/all/GCA/000/196/755/GCA_000196755.1_ASM19675v1","SAMEA2272698","PRJEA41831","GCA_000196755.1","1.68003","38.7896","chromosome:NC_014256.1/FN598874.1; plasmid HPB8p:NC_014257.1/FN665651.1","-","2","1641","1490/163547","6/15/2010","8/26/2019","Complete Genome","2016-07-25T00:00:00Z","CeBitec, Bielefeld University","","","","","1","1","6032","",""
"Helicobacter pylori B8","163547","693745","693745.3","T01262","GCF_000196755","163547","","ftp://ftp.ncbi.nlm.nih.gov/genomes/all/GCF/000/196/755/GCF_000196755.1_ASM19675v1","ftp://ftp.ncbi.nlm.nih.gov/genomes/all/GCA/000/196/755/GCA_000196755.1_ASM19675v1","SAMEA2272698","PRJEA41831","GCA_000196755.1","1.68003","38.7896","chromosome:NC_014256.1/FN598874.1; plasmid HPB8p:NC_014257.1/FN665651.1","-","2","1641","1490/163547","6/15/2010","8/26/2019","Complete Genome","2010-06-15T00:00:00Z","Bielefeld Univ","","","","1","","1","1673997","",""
"Helicobacter pylori BM012A","163575","1407462","1407462.3","T02939","HPYL1407462","163575","","ftp://ftp.ncbi.nlm.nih.gov/genomes/all/GCF/000/498/315/GCF_000498315.1_ASM49831v1","ftp://ftp.ncbi.nlm.nih.gov/genomes/all/GCA/000/498/315/GCA_000498315.1_ASM49831v1","SAMN02376623","PRJNA224090","GCA_000498315.1","1.66043","38.9","chromosome:NC_022886.1/CP006888.1","-","1","1657","1492/163575","11/22/2013","8/27/2019","Complete Genome","2013-11-22T00:00:00Z","Pennsylvania State University","454 Roche FLX Titanium","83x","Newbler v. 2.6","1","","1","1660425","Australia","Human, Homo sapiens"
"Helicobacter pylori BM012S","163576","1407463","1407463.3","T02940","HPYL1407463","163576","","ftp://ftp.ncbi.nlm.nih.gov/genomes/all/GCF/000/498/335/GCF_000498335.1_ASM49833v1","ftp://ftp.ncbi.nlm.nih.gov/genomes/all/GCA/000/498/335/GCA_000498335.1_ASM49833v1","SAMN02376624","PRJNA229079","GCA_000498335.1","1.66047","38.9","chromosome:NC_022911.1/CP006889.1","-","1","1658","1490/163576","11/22/2013","8/27/2019","Complete Genome","2013-11-22T00:00:00Z","Pennsylvania State University","454 Roche FLX Titanium","136x","Newbler v. 2.8","1","","1","1660469","Australia","Human, Homo sapiens"
"Helicobacter pylori Cuz20","163538","765964","765964.3","T01894","HPYL765964","163538","","ftp://ftp.ncbi.nlm.nih.gov/genomes/all/GCF/000/148/895/GCF_000148895.1_ASM14889v1","ftp://ftp.ncbi.nlm.nih.gov/genomes/all/GCA/000/148/895/GCA_000148895.1_ASM14889v1","SAMN02603204","PRJNA49029","GCA_000148895.1","1.63545","38.9","chromosome:NC_017358.1/CP002076.1","-","1","1616","1475/163538","10/1/2010","3/22/2017","Complete Genome","2010-10-01T00:00:00Z","Genome Sequencing Center (GSC) at Washington University (WashU) School of Medicine","","","","1","","1","1635449","Peru",""
"Helicobacter pylori dRdM1","361911","210","210.4121","","","361911","","ftp://ftp.ncbi.nlm.nih.gov/genomes/all/GCF/002/906/495/GCF_002906495.1_ASM290649v1","ftp://ftp.ncbi.nlm.nih.gov/genomes/all/GCA/002/906/495/GCA_002906495.1_ASM290649v1","SAMN08388634","PRJNA431311","GCA_002906495.1","1.67078","38.9","chromosome:NZ_CP026325.1/CP026325.1","-","1","1647","1510/361911","1/30/2018","2/1/2018","Complete Genome","2018-01-30T00:00:00Z","New England Biolabs, Inc.","PacBio","485x","RS_HGAP_Assembly v. 3","1","","1","1670779","","Human, Homo sapiens"
"Helicobacter pylori dRdM2addM2","364779","210","210.4149","","","364779","","ftp://ftp.ncbi.nlm.nih.gov/genomes/all/GCF/002/953/555/GCF_002953555.1_ASM295355v1","ftp://ftp.ncbi.nlm.nih.gov/genomes/all/GCA/002/953/555/GCA_002953555.1_ASM295355v1","SAMN08388637","PRJNA431311","GCA_002953555.1","1.66874","38.9","chromosome:NZ_CP026515.1/CP026515.1","-","1","1647","1510/364779","2/6/2018","3/4/2018","Complete Genome","2018-02-06T00:00:00Z","New England Biolabs, Inc.","PacBio","414x","RS_HGAP_Assembly v. 3","1","","1","1668735","","Human, Homo sapiens"
"Helicobacter pylori ELS37","163552","1055527","1055527.11","T01798","HPYL1055527","163552","","ftp://ftp.ncbi.nlm.nih.gov/genomes/all/GCF/000/255/955/GCF_000255955.1_ASM25595v1","ftp://ftp.ncbi.nlm.nih.gov/genomes/all/GCA/000/255/955/GCA_000255955.1_ASM25595v1","SAMN02604318","PRJNA69915","GCA_000255955.1","1.66988","38.8905","chromosome:NC_017063.1/CP002953.1; plasmid pHPELS37:NC_017064.1/CP002954.1","-","2","1643","1485/163552","3/23/2012","3/22/2017","Complete Genome","2016-07-26T00:00:00Z","Washington University Med. School","","","","","1","1","5289","El Salvador","Human, Homo sapiens"
"Helicobacter pylori ELS37","163552","1055527","1055527.3","T01798","HPYL1055527","163552","","ftp://ftp.ncbi.nlm.nih.gov/genomes/all/GCF/000/255/955/GCF_000255955.1_ASM25595v1","ftp://ftp.ncbi.nlm.nih.gov/genomes/all/GCA/000/255/955/GCA_000255955.1_ASM25595v1","SAMN02604318","PRJNA69915","GCA_000255955.1","1.66988","38.8905","chromosome:NC_017063.1/CP002953.1; plasmid pHPELS37:NC_017064.1/CP002954.1","-","2","1643","1485/163552","3/23/2012","3/22/2017","Complete Genome","2012-03-23T00:00:00Z","Washington University Med. School","","","","1","1","2","1669876","","Human, Homo sapiens"
"Helicobacter pylori F16","163555","866344","866344.4","T01910","HPYL866344","163555","","ftp://ftp.ncbi.nlm.nih.gov/genomes/all/GCF/000/270/005/GCF_000270005.1_ASM27000v1","ftp://ftp.ncbi.nlm.nih.gov/genomes/all/GCA/000/270/005/GCA_000270005.1_ASM27000v1","SAMD00060971","PRJDA50589","GCA_000270005.1","1.5754","38.9","chromosome:NC_017368.1/AP011940.1","-","1","1564","1411/163555","1/7/2011","8/26/2019","Complete Genome","2011-01-07T00:00:00Z","The University of Tokyo|Center for Omics and Bioinformatics","","","","1","","1","1575399","",""
"Helicobacter pylori F30","163556","866345","866345.4","T01895","HPYL866345","163556","","ftp://ftp.ncbi.nlm.nih.gov/genomes/all/GCF/000/270/025/GCF_000270025.1_ASM27002v1","ftp://ftp.ncbi.nlm.nih.gov/genomes/all/GCA/000/270/025/GCA_000270025.1_ASM27002v1","SAMD00060972","PRJDA50591","GCA_000270025.1","1.57969","38.7728","chromosome:NC_017365.1/AP011941.1; plasmid pHPF30:NC_017369.1/AP011942.1","-","2","1571","1430/163556","1/7/2011","8/26/2019","Complete Genome","2011-01-07T00:00:00Z","The University of Tokyo|Center for Omics and Bioinformatics","","","","1","1","2","1579693","",""
"Helicobacter pylori F30","163556","866345","866345.7","T01895","HPYL866345","163556","","ftp://ftp.ncbi.nlm.nih.gov/genomes/all/GCF/000/270/025/GCF_000270025.1_ASM27002v1","ftp://ftp.ncbi.nlm.nih.gov/genomes/all/GCA/000/270/025/GCA_000270025.1_ASM27002v1","SAMD00060972","PRJDA50591","GCA_000270025.1","1.57969","38.7728","chromosome:NC_017365.1/AP011941.1; plasmid pHPF30:NC_017369.1/AP011942.1","-","2","1571","1430/163556","1/7/2011","8/26/2019","Complete Genome","2016-10-07T00:00:00Z","The University of Tokyo","","","","1","","1","9129","",""
"Helicobacter pylori F32","163557","102608","102608.4","T01911","HPYL102608","163557","","ftp://ftp.ncbi.nlm.nih.gov/genomes/all/GCF/000/270/045/GCF_000270045.1_ASM27004v1","ftp://ftp.ncbi.nlm.nih.gov/genomes/all/GCA/000/270/045/GCA_000270045.1_ASM27004v1","SAMD00060973","PRJDA50593","GCA_000270045.1","1.58146","38.8963","chromosome:NC_017366.1/AP011943.1; plasmid pHPF32:NC_017370.1/AP011944.1","-","2","1573","1434/163557","1/7/2011","8/26/2019","Complete Genome","2011-01-07T00:00:00Z","The University of Tokyo|Center for Omics and Bioinformatics","","","","1","1","2","1581461","",""
"Helicobacter pylori F32","163557","102608","102608.9","T01911","HPYL102608","163557","","ftp://ftp.ncbi.nlm.nih.gov/genomes/all/GCF/000/270/045/GCF_000270045.1_ASM27004v1","ftp://ftp.ncbi.nlm.nih.gov/genomes/all/GCA/000/270/045/GCA_000270045.1_ASM27004v1","SAMD00060973","PRJDA50593","GCA_000270045.1","1.58146","38.8963","chromosome:NC_017366.1/AP011943.1; plasmid pHPF32:NC_017370.1/AP011944.1","-","2","1573","1434/163557","1/7/2011","8/26/2019","Complete Genome","2016-10-07T00:00:00Z","The University of Tokyo","","","","1","","1","2637","",""
"Helicobacter pylori F57","163558","866346","866346.4","T01912","HPYL866346","163558","","ftp://ftp.ncbi.nlm.nih.gov/genomes/all/GCF/000/270/065/GCF_000270065.1_ASM27006v1","ftp://ftp.ncbi.nlm.nih.gov/genomes/all/GCA/000/270/065/GCA_000270065.1_ASM27006v1","SAMD00060974","PRJDA50595","GCA_000270065.1","1.60901","38.7","chromosome:NC_017367.1/AP011945.1","-","1","1584","1436/163558","1/7/2011","8/26/2019","Complete Genome","2011-01-07T00:00:00Z","The University of Tokyo|Center for Omics and Bioinformatics","","","","1","","1","1609006","",""
"Helicobacter pylori FDAARGOS_298","371939","210","210.4220","","","371939","","ftp://ftp.ncbi.nlm.nih.gov/genomes/all/GCF/003/050/665/GCF_003050665.1_ASM305066v1","ftp://ftp.ncbi.nlm.nih.gov/genomes/all/GCA/003/050/665/GCA_003050665.1_ASM305066v1","SAMN06173311","PRJNA231221","GCA_003050665.1","1.6809","38.8","chromosome:NZ_CP028325.1/CP028325.1","-","1","1678","1511/371939","4/13/2018","10/19/2019","Complete Genome","2018-04-13T00:00:00Z","US Food and Drug Administration","PacBio; Illumina","24.67x","CA v. 8.2","1","","1","1680898","United States","Human, Homo sapiens"
"Helicobacter pylori FDAARGOS_300","366545","210","210.4150","","","366545","","ftp://ftp.ncbi.nlm.nih.gov/genomes/all/GCF/002/983/705/GCF_002983705.1_ASM298370v1","ftp://ftp.ncbi.nlm.nih.gov/genomes/all/GCA/002/983/705/GCA_002983705.1_ASM298370v1","SAMN06173313","PRJNA231221","GCA_002983705.1","1.64574","39.2","chromosome:NZ_CP027404.1/CP027404.1","-","1","1602","1462/366545","3/9/2018","10/19/2019","Complete Genome","2018-03-09T00:00:00Z","US Food and Drug Administration","PacBio; Illumina","16.4410831120036x","SMRT v. 2.3.0, HGAP v. 3.0","1","","1","1645738","United States","Human, Homo sapiens"
"Helicobacter pylori G27","299776","563041","563041.16","T00777","HPYL563041","299776","yes","ftp://ftp.ncbi.nlm.nih.gov/genomes/all/GCF/000/021/165/GCF_000021165.1_ASM2116v1","ftp://ftp.ncbi.nlm.nih.gov/genomes/all/GCA/000/021/165/GCA_000021165.1_ASM2116v1","SAMN02604237","PRJNA31341","GCA_000021165.1","1.66301","38.8759","chromosome:NC_011333.1/CP001173.1; plasmid pHPG27:NC_011334.1/CP001174.1","-","2","1622","1475/299776","10/3/2008","8/25/2019","Complete Genome","2016-07-26T00:00:00Z","University of Oregon","","","","","1","1","10031","",""
"Helicobacter pylori G27","299776","563041","563041.6","T00777","HPYL563041","299776","yes","ftp://ftp.ncbi.nlm.nih.gov/genomes/all/GCF/000/021/165/GCF_000021165.1_ASM2116v1","ftp://ftp.ncbi.nlm.nih.gov/genomes/all/GCA/000/021/165/GCA_000021165.1_ASM2116v1","SAMN02604237","PRJNA31341","GCA_000021165.1","1.66301","38.8759","chromosome:NC_011333.1/CP001173.1; plasmid pHPG27:NC_011334.1/CP001174.1","-","2","1622","1475/299776","10/3/2008","8/25/2019","Complete Genome","2008-10-03T00:00:00Z","University of Oregon|Washington University in St. Louis","","","","1","1","2","1663013","",""
"Helicobacter pylori G272","324066","210","210.2712","","","324066","","ftp://ftp.ncbi.nlm.nih.gov/genomes/all/GCF/002/222/575/GCF_002222575.1_ASM222257v1","ftp://ftp.ncbi.nlm.nih.gov/genomes/all/GCA/002/222/575/GCA_002222575.1_ASM222257v1","SAMN07338981","PRJNA393647","GCA_002222575.1","1.58487","38.8746","chromosome:NZ_CP022409.1/CP022409.1; plasmid unnamed1:NZ_CP022410.1/CP022410.1","-","2","1568","1401/324066","7/20/2017","7/22/2017","Complete Genome","2017-07-20T00:00:00Z","Guizhou Medical University","Illumina Hiseq","300.0x","SMRT portal v. 3.2.0","1","1","2","1584869","China","Human, Homo sapiens"
"Helicobacter pylori G272","324066","210","210.3093","","","324066","","ftp://ftp.ncbi.nlm.nih.gov/genomes/all/GCF/002/222/575/GCF_002222575.1_ASM222257v1","ftp://ftp.ncbi.nlm.nih.gov/genomes/all/GCA/002/222/575/GCA_002222575.1_ASM222257v1","SAMN07338981","PRJNA393647","GCA_002222575.1","1.58487","38.8746","chromosome:NZ_CP022409.1/CP022409.1; plasmid unnamed1:NZ_CP022410.1/CP022410.1","-","2","1568","1401/324066","7/20/2017","7/22/2017","Complete Genome","2017-07-20T00:00:00Z","Guizhou Medical University","Illumina Hiseq","300.0x","SMRT portal v. 3.2.0","","1","1","8736","China","Human, Homo sapiens"
"Helicobacter pylori Gambia94/24","163542","907240","907240.3","T01917","GCF_000185205","163542","","ftp://ftp.ncbi.nlm.nih.gov/genomes/all/GCF/000/185/205/GCF_000185205.1_ASM18520v1","ftp://ftp.ncbi.nlm.nih.gov/genomes/all/GCA/000/185/205/GCA_000185205.1_ASM18520v1","SAMN02603024","PRJNA53317","GCA_000185205.1","1.71247","39.0975","chromosome:NC_017371.1/CP002332.1; plasmid unnamed:NC_017364.1/CP002333.1","-","2","1682","1528/163542","1/6/2011","3/22/2017","Complete Genome","2011-01-06T00:00:00Z","Genome Sequencing Center (GSC) at Washington University (WashU) School of Medicine","","","","1","1","2","1712468","",""
"Helicobacter pylori Gambia94/24","163542","907240","907240.5","T01917","GCF_000185205","163542","","ftp://ftp.ncbi.nlm.nih.gov/genomes/all/GCF/000/185/205/GCF_000185205.1_ASM18520v1","ftp://ftp.ncbi.nlm.nih.gov/genomes/all/GCA/000/185/205/GCA_000185205.1_ASM18520v1","SAMN02603024","PRJNA53317","GCA_000185205.1","1.71247","39.0975","chromosome:NC_017371.1/CP002332.1; plasmid unnamed:NC_017364.1/CP002333.1","-","2","1682","1528/163542","1/6/2011","3/22/2017","Complete Genome","2016-07-25T00:00:00Z","Berg lab, Washington University Medical Shool","","","","","1","1","2557","",""
"Helicobacter pylori GD63","410760","210","210.5180","","","410760","","ftp://ftp.ncbi.nlm.nih.gov/genomes/all/GCF/003/640/585/GCF_003640585.1_ASM364058v1","ftp://ftp.ncbi.nlm.nih.gov/genomes/all/GCA/003/640/585/GCA_003640585.1_ASM364058v1","SAMN09809602","PRJNA485550","GCA_003640585.1","1.59097","38.7695","chromosome:NZ_CP031558.1/CP031558.1; plasmid pHPGD63:NZ_CP031559.1/CP031559.1","-","2","1569","1391/410760","10/12/2018","10/18/2018","Complete Genome","2018-10-12T00:00:00Z","University of Science, VNU-HCM","Illumina MiSeq; Oxford Nanopore MiniION","180.0x","Unicycler v. v0.4.4","1","1","2","1590969","Viet Nam","Human, Homo sapiens"
"Helicobacter pylori H-137","431758","210","210.5258","","","431758","","ftp://ftp.ncbi.nlm.nih.gov/genomes/all/GCF/003/957/395/GCF_003957395.1_ASM395739v1","ftp://ftp.ncbi.nlm.nih.gov/genomes/all/GCA/003/957/395/GCA_003957395.1_ASM395739v1","SAMN08195713","PRJNA422738","GCA_003957395.1","1.63744","38.7","chromosome:NZ_CP025474.1/CP025474.1","-","1","1600","1440/431758","12/20/2018","12/26/2018","Complete Genome","2018-12-20T00:00:00Z","Korea Food Research Institute","PacBio","396.0x","HGAP v. 4.0","1","","1","1637442","South Korea","Human, Homo sapiens"
"Helicobacter pylori HE101/09","348358","210","210.3037","","","348358","","ftp://ftp.ncbi.nlm.nih.gov/genomes/all/GCF/900/120/255/GCF_900120255.1_HE101_09","ftp://ftp.ncbi.nlm.nih.gov/genomes/all/GCA/900/120/255/GCA_900120255.1_HE101_09","SAMEA4554831","PRJEB17945","GCA_900120255.1","1.66782","39.1","chromosome I:NZ_LT635456.1/LT635456.1","-","1","1643","1478/348358","7/7/2017","10/28/2017","Complete Genome","2017-07-07T00:00:00Z","Institute of Medical Microbiology and Hospital Epidemiology","","","","1","","1","1667821","",""
"Helicobacter pylori HE132/09","348354","210","210.3033","","","348354","","ftp://ftp.ncbi.nlm.nih.gov/genomes/all/GCF/900/120/135/GCF_900120135.1_HE132_09","ftp://ftp.ncbi.nlm.nih.gov/genomes/all/GCA/900/120/135/GCA_900120135.1_HE132_09","SAMEA4554832","PRJEB17945","GCA_900120135.1","1.66817","39.1","chromosome I:NZ_LT635459.1/LT635459.1","-","1","1643","1489/348354","7/7/2017","10/28/2017","Complete Genome","2017-07-07T00:00:00Z","Institute of Medical Microbiology and Hospital Epidemiology","","","","1","","1","1668174","",""
"Helicobacter pylori HE134/09","348355","210","210.3035","","","348355","","ftp://ftp.ncbi.nlm.nih.gov/genomes/all/GCF/900/120/185/GCF_900120185.1_HE134_09","ftp://ftp.ncbi.nlm.nih.gov/genomes/all/GCA/900/120/185/GCA_900120185.1_HE134_09","SAMEA4554833","PRJEB17945","GCA_900120185.1","1.66786","39.1","chromosome I:NZ_LT635476.1/LT635476.1","-","1","1643","1484/348355","7/7/2017","10/28/2017","Complete Genome","2017-07-07T00:00:00Z","Institute of Medical Microbiology and Hospital Epidemiology","","","","1","","1","1667858","",""
"Helicobacter pylori HE136/09","348357","210","210.3036","","","348357","","ftp://ftp.ncbi.nlm.nih.gov/genomes/all/GCF/900/120/225/GCF_900120225.1_HE136_09","ftp://ftp.ncbi.nlm.nih.gov/genomes/all/GCA/900/120/225/GCA_900120225.1_HE136_09","SAMEA4554834","PRJEB17945","GCA_900120225.1","1.66798","39.1","chromosome I:NZ_LT635473.1/LT635473.1","-","1","1642","1474/348357","7/7/2017","10/28/2017","Complete Genome","2017-07-07T00:00:00Z","Institute of Medical Microbiology and Hospital Epidemiology","","","","1","","1","1667978","",""
"Helicobacter pylori HE141/09","348356","210","210.3034","","","348356","","ftp://ftp.ncbi.nlm.nih.gov/genomes/all/GCF/900/120/205/GCF_900120205.1_HE141_09","ftp://ftp.ncbi.nlm.nih.gov/genomes/all/GCA/900/120/205/GCA_900120205.1_HE141_09","SAMEA4554835","PRJEB17945","GCA_900120205.1","1.67038","39.1","chromosome I:NZ_LT635471.1/LT635471.1","-","1","1647","1491/348356","7/7/2017","10/28/2017","Complete Genome","2017-07-07T00:00:00Z","Institute of Medical Microbiology and Hospital Epidemiology","","","","1","","1","1670384","",""
"Helicobacter pylori HE142/09","348359","210","210.3038","","","348359","","ftp://ftp.ncbi.nlm.nih.gov/genomes/all/GCF/900/120/275/GCF_900120275.1_HE142_09","ftp://ftp.ncbi.nlm.nih.gov/genomes/all/GCA/900/120/275/GCA_900120275.1_HE142_09","SAMEA4554836","PRJEB17945","GCA_900120275.1","1.66794","39.1","chromosome I:NZ_LT635478.1/LT635478.1","-","1","1644","1485/348359","7/7/2017","10/28/2017","Complete Genome","2017-07-07T00:00:00Z","Institute of Medical Microbiology and Hospital Epidemiology","","","","1","","1","1667936","",""
"Helicobacter pylori HE143/09","348352","210","210.3031","","","348352","","ftp://ftp.ncbi.nlm.nih.gov/genomes/all/GCF/900/119/995/GCF_900119995.1_HE143_09","ftp://ftp.ncbi.nlm.nih.gov/genomes/all/GCA/900/119/995/GCA_900119995.1_HE143_09","SAMEA4554837","PRJEB17945","GCA_900119995.1","1.6678","39.1","chromosome I:NZ_LT635458.1/LT635458.1","-","1","1639","1465/348352","7/7/2017","10/28/2017","Complete Genome","2017-07-07T00:00:00Z","Institute of Medical Microbiology and Hospital Epidemiology","","","","1","","1","1667804","",""
"Helicobacter pylori HE147/09","348361","210","210.3040","","","348361","","ftp://ftp.ncbi.nlm.nih.gov/genomes/all/GCF/900/120/335/GCF_900120335.1_HE147_09","ftp://ftp.ncbi.nlm.nih.gov/genomes/all/GCA/900/120/335/GCA_900120335.1_HE147_09","SAMEA4554838","PRJEB17945","GCA_900120335.1","1.66771","39.1","chromosome I:NZ_LT635477.1/LT635477.1","-","1","1644","1481/348361","7/7/2017","10/28/2017","Complete Genome","2017-07-07T00:00:00Z","Institute of Medical Microbiology and Hospital Epidemiology","","","","1","","1","1667712","",""
"Helicobacter pylori HE170/09","348360","210","210.3039","","","348360","","ftp://ftp.ncbi.nlm.nih.gov/genomes/all/GCF/900/120/315/GCF_900120315.1_HE170_09","ftp://ftp.ncbi.nlm.nih.gov/genomes/all/GCA/900/120/315/GCA_900120315.1_HE170_09","SAMEA4554839","PRJEB17945","GCA_900120315.1","1.67032","39.1","chromosome I:NZ_LT635472.1/LT635472.1","-","1","1646","1487/348360","7/7/2017","10/28/2017","Complete Genome","2017-07-07T00:00:00Z","Institute of Medical Microbiology and Hospital Epidemiology","","","","1","","1","1670321","",""
"Helicobacter pylori HE171/09","348351","210","210.3030","","","348351","","ftp://ftp.ncbi.nlm.nih.gov/genomes/all/GCF/900/119/955/GCF_900119955.1_HE171_09","ftp://ftp.ncbi.nlm.nih.gov/genomes/all/GCA/900/119/955/GCA_900119955.1_HE171_09","SAMEA4554840","PRJEB17945","GCA_900119955.1","1.66762","39.1","chromosome I:NZ_LT635474.1/LT635474.1","-","1","1641","1486/348351","7/7/2017","10/28/2017","Complete Genome","2017-07-07T00:00:00Z","Institute of Medical Microbiology and Hospital Epidemiology","","","","1","","1","1667625","",""
"Helicobacter pylori HE178/09","348353","210","210.3032","","","348353","","ftp://ftp.ncbi.nlm.nih.gov/genomes/all/GCF/900/120/055/GCF_900120055.1_HE178_09","ftp://ftp.ncbi.nlm.nih.gov/genomes/all/GCA/900/120/055/GCA_900120055.1_HE178_09","SAMEA4554841","PRJEB17945","GCA_900120055.1","1.66789","39.1","chromosome I:NZ_LT635460.1/LT635460.1","-","1","1645","1481/348353","7/7/2017","10/28/2017","Complete Genome","2017-07-07T00:00:00Z","Institute of Medical Microbiology and Hospital Epidemiology","","","","1","","1","1667894","",""
"Helicobacter pylori HE93/10_v1","348362","210","210.3041","","","348362","","ftp://ftp.ncbi.nlm.nih.gov/genomes/all/GCF/900/176/185/GCF_900176185.1_HE93_10","ftp://ftp.ncbi.nlm.nih.gov/genomes/all/GCA/900/176/185/GCA_900176185.1_HE93_10","SAMEA103957791","PRJEB17945","GCA_900176185.1","1.6828","39.1","chromosome I:NZ_LT838273.1/LT838273.1","-","1","1655","1490/348362","7/7/2017","10/28/2017","Complete Genome","2017-07-07T00:00:00Z","Institute of Medical Microbiology and Hospital Epidemiology","","","","1","","1","1682800","",""
"Helicobacter pylori Hp238","216679","210","210.1380","","","216679","","ftp://ftp.ncbi.nlm.nih.gov/genomes/all/GCF/000/817/025/GCF_000817025.1_ASM81702v1","ftp://ftp.ncbi.nlm.nih.gov/genomes/all/GCA/000/817/025/GCA_000817025.1_ASM81702v1","SAMN03154060","PRJNA265917","GCA_000817025.1","1.58647","38.7","chromosome:NZ_CP010013.1/CP010013.1","-","1","1570","1416/216679","1/9/2015","8/27/2019","Complete Genome","2015-01-09T00:00:00Z","National Cheng Kung University","454","33x","GS Assembler v. 2.6","1","","1","1586473","Taiwan","Human, Homo sapiens"
"Helicobacter pylori HP42K","430794","210","210.5255","","","430794","","ftp://ftp.ncbi.nlm.nih.gov/genomes/all/GCF/003/939/085/GCF_003939085.1_ASM393908v1","ftp://ftp.ncbi.nlm.nih.gov/genomes/all/GCA/003/939/085/GCA_003939085.1_ASM393908v1","SAMN10181238","PRJNA494842","GCA_003939085.1","1.65845","38.8796","chromosome:NZ_CP034314.1/CP034314.1; plasmid pHP42-1:NZ_CP034313.1/CP034313.1; plasmid pHP42-2:NZ_CP034312.1/CP034312.1","-","3","1605","1452/430794","12/12/2018","12/14/2018","Complete Genome","2018-12-12T00:00:00Z","Gomel state medical universitate","IonTorrent","40.0x","SPAdes v. 3.13","1","2","3","1658454","Belarus","Human, Homo sapiens"
"Helicobacter pylori HPAG1","299774","357544","357544.13","T00365","HPYL357544","299774","yes","ftp://ftp.ncbi.nlm.nih.gov/genomes/all/GCF/000/013/245/GCF_000013245.1_ASM1324v1","ftp://ftp.ncbi.nlm.nih.gov/genomes/all/GCA/000/013/245/GCA_000013245.1_ASM1324v1","SAMN02604311","PRJNA16183","GCA_000013245.1","1.60574","39.0842","chromosome:NC_008086.1/CP000241.1; plasmid pHPAG1:NC_008087.1/CP000242.1","-","2","1579","1438/299774","6/6/2006","8/25/2019","Complete Genome","2006-06-06T00:00:00Z","Genome Sequencing Center (GSC) at Washington University (WashU) School of Medicine","","","","1","1","2","1605736","","Human, Homo sapiens"
"Helicobacter pylori HPAG1","299774","357544","357544.23","T00365","HPYL357544","299774","yes","ftp://ftp.ncbi.nlm.nih.gov/genomes/all/GCF/000/013/245/GCF_000013245.1_ASM1324v1","ftp://ftp.ncbi.nlm.nih.gov/genomes/all/GCA/000/013/245/GCA_000013245.1_ASM1324v1","SAMN02604311","PRJNA16183","GCA_000013245.1","1.60574","39.0842","chromosome:NC_008086.1/CP000241.1; plasmid pHPAG1:NC_008087.1/CP000242.1","-","2","1579","1438/299774","6/6/2006","8/25/2019","Complete Genome","2016-07-14T00:00:00Z","Washington University (WashU)","","","","","1","1","9370","","Human, Homo sapiens"
"Helicobacter pylori Hpbs1","426476","210","210.5250","","","426476","","ftp://ftp.ncbi.nlm.nih.gov/genomes/all/GCF/003/855/475/GCF_003855475.1_ASM385547v1","ftp://ftp.ncbi.nlm.nih.gov/genomes/all/GCA/003/855/475/GCA_003855475.1_ASM385547v1","SAMN10461767","PRJNA506489","GCA_003855475.1","1.5637","38.9","chromosome:NZ_CP034071.1/CP034071.1","-","1","1534","1393/426476","12/2/2018","12/4/2018","Complete Genome","2018-12-02T00:00:00Z","BGI","Illumina","995.0x","Newbler v. NOV22-2018","1","","1","1563701","China","Human, Homo sapiens"
"Helicobacter pylori Hpbs2","440859","210","210.5627","","","440859","","ftp://ftp.ncbi.nlm.nih.gov/genomes/all/GCF/004/088/155/GCF_004088155.1_ASM408815v1","ftp://ftp.ncbi.nlm.nih.gov/genomes/all/GCA/004/088/155/GCA_004088155.1_ASM408815v1","SAMN10663081","PRJNA512253","GCA_004088155.1","1.53525","38.9","chromosome:NZ_CP035105.1/CP035105.1","-","1","1517","1389/440859","1/21/2019","1/23/2019","Complete Genome","2019-01-21T00:00:00Z","BGI","Illumina","998.0x","Newbler v. DEC31-2018","1","","1","1535248","China","Human, Homo sapiens"
"Helicobacter pylori Hpbs3","440858","210","210.5625","","","440858","","ftp://ftp.ncbi.nlm.nih.gov/genomes/all/GCF/004/088/075/GCF_004088075.1_ASM408807v1","ftp://ftp.ncbi.nlm.nih.gov/genomes/all/GCA/004/088/075/GCA_004088075.1_ASM408807v1","SAMN10663175","PRJNA512257","GCA_004088075.1","1.51467","39","chromosome:NZ_CP035106.1/CP035106.1","-","1","1502","1361/440858","1/21/2019","1/23/2019","Complete Genome","2019-01-21T00:00:00Z","BGI","Illumina","996.0x","Newbler v. DEC31-2018","1","","1","1514674","China","Human, Homo sapiens"
"Helicobacter pylori HPJP26","331690","210","210.2901","","","331690","","ftp://ftp.ncbi.nlm.nih.gov/genomes/all/GCF/002/356/595/GCF_002356595.1_ASM235659v1","ftp://ftp.ncbi.nlm.nih.gov/genomes/all/GCA/002/356/595/GCA_002356595.1_ASM235659v1","SAMN07661065","PRJNA384245","GCA_002356595.1","1.57835","38.9","chromosome:NZ_CP023448.1/CP023448.1","-","1","1571","1383/331690","9/25/2017","2/1/2019","Complete Genome","2017-09-25T00:00:00Z","Ichan School of Medicine at Mount Sinai","PacBio","166.6x","HGAP v. May-2016","1","","1","1578351","United States","Human, Homo sapiens"
"Helicobacter pylori HUP-B14","163553","1163743","1163743.3","T02035","HPYL1163743","163553","","ftp://ftp.ncbi.nlm.nih.gov/genomes/all/GCF/000/259/235/GCF_000259235.1_ASM25923v1","ftp://ftp.ncbi.nlm.nih.gov/genomes/all/GCA/000/259/235/GCA_000259235.1_ASM25923v1","SAMN02603197","PRJNA95277","GCA_000259235.1","1.60758","39.0866","chromosome:NC_017733.1/CP003486.1; plasmid pHPB14:NC_017734.1/CP003487.1","-","2","1574","1429/163553","4/19/2012","3/22/2017","Complete Genome","2012-04-19T00:00:00Z","Dept. Molec. Microbiology, Washington University Medical School in Saint Louis","","","","1","1","2","1607584","Spain","Human, Homo sapiens"
"Helicobacter pylori HUP-B14","163553","1163743","1163743.5","T02035","HPYL1163743","163553","","ftp://ftp.ncbi.nlm.nih.gov/genomes/all/GCF/000/259/235/GCF_000259235.1_ASM25923v1","ftp://ftp.ncbi.nlm.nih.gov/genomes/all/GCA/000/259/235/GCA_000259235.1_ASM25923v1","SAMN02603197","PRJNA95277","GCA_000259235.1","1.60758","39.0866","chromosome:NC_017733.1/CP003486.1; plasmid pHPB14:NC_017734.1/CP003487.1","-","2","1574","1429/163553","4/19/2012","3/22/2017","Complete Genome","2016-07-26T00:00:00Z","Dept. Molec. Microbiology, Washington University Medical School in Saint Louis","","","","","1","1","8304","Spain","Human, Homo sapiens"
"Helicobacter pylori India7","163541","907238","907238.3","T01918","HPYL907238","163541","","ftp://ftp.ncbi.nlm.nih.gov/genomes/all/GCF/000/185/185/GCF_000185185.1_ASM18518v1","ftp://ftp.ncbi.nlm.nih.gov/genomes/all/GCA/000/185/185/GCA_000185185.1_ASM18518v1","SAMN02603026","PRJNA53321","GCA_000185185.1","1.67592","38.9","chromosome:NC_017372.1/CP002331.1","-","1","1629","1470/163541","1/6/2011","3/22/2017","Complete Genome","2011-01-06T00:00:00Z","Genome Sequencing Center (GSC) at Washington University (WashU) School of Medicine","","","","1","","1","1675918","",""
"Helicobacter pylori J166","163586","102611","102611.3","","","163586","","ftp://ftp.ncbi.nlm.nih.gov/genomes/all/GCF/000/685/625/GCF_000685625.1_ASM68562v1","ftp://ftp.ncbi.nlm.nih.gov/genomes/all/GCA/000/685/625/GCA_000685625.1_ASM68562v1","SAMN02736817","PRJNA245313","GCA_000685625.1","1.65056","38.9","chromosome:NZ_CP007603.1/CP007603.1","-","1","1607","1466/163586","5/8/2014","8/27/2019","Complete Genome","2014-05-08T00:00:00Z","Penn State University","Sanger dideoxy sequencing; 454; Illumina","","Newbler v. May-2009","1","","1","1650561","","Human, Homo sapiens"
"Helicobacter pylori J182","650024","210","210.6105","","","650024","","ftp://ftp.ncbi.nlm.nih.gov/genomes/all/GCF/007/843/715/GCF_007843715.1_ASM784371v1","ftp://ftp.ncbi.nlm.nih.gov/genomes/all/GCA/007/843/715/GCA_007843715.1_ASM784371v1","SAMN08055036","PRJNA419269","GCA_007843715.1","1.64808","38.9","chromosome:NZ_CP024947.1/CP024947.1","-","1","1626","1498/650024","8/5/2019","10/19/2019","Complete Genome","2019-08-05T00:00:00Z","Yonsei University","PacBio","464.63x","PacBio SMRT Analysis v. v2.3.0","1","","1","1648077","",""
"Helicobacter pylori J99","299773","85963","85963.7","T00020","HPYL85963","299773","yes","ftp://ftp.ncbi.nlm.nih.gov/genomes/all/GCF/000/008/785/GCF_000008785.1_ASM878v1","ftp://ftp.ncbi.nlm.nih.gov/genomes/all/GCA/000/008/785/GCA_000008785.1_ASM878v1","SAMN02602990","PRJNA234","GCA_000008785.1","1.64383","39.2","chromosome:NC_000921.1/AE001439.1","-","1","1601","1463/299773","1/12/1999","8/25/2019","Complete Genome","1999-01-29T00:00:00Z","ASTRA","","","","1","","1","1643831","United States","Human, Homo sapiens"
"Helicobacter pylori Lithuania75","163543","907237","907237.3","T01896","HPYL907237","163543","","ftp://ftp.ncbi.nlm.nih.gov/genomes/all/GCF/000/185/225/GCF_000185225.1_ASM18522v1","ftp://ftp.ncbi.nlm.nih.gov/genomes/all/GCA/000/185/225/GCA_000185225.1_ASM18522v1","SAMN02603023","PRJNA53323","GCA_000185225.1","1.64067","38.8492","chromosome:NC_017362.1/CP002334.1; plasmid unnamed:NC_017363.1/CP002335.1","-","2","1619","1445/163543","1/6/2011","3/22/2017","Complete Genome","2011-01-06T00:00:00Z","Genome Sequencing Center (GSC) at Washington University (WashU) School of Medicine","","","","1","1","2","1640673","",""
"Helicobacter pylori Lithuania75","163543","907237","907237.6","T01896","HPYL907237","163543","","ftp://ftp.ncbi.nlm.nih.gov/genomes/all/GCF/000/185/225/GCF_000185225.1_ASM18522v1","ftp://ftp.ncbi.nlm.nih.gov/genomes/all/GCA/000/185/225/GCA_000185225.1_ASM18522v1","SAMN02603023","PRJNA53323","GCA_000185225.1","1.64067","38.8492","chromosome:NC_017362.1/CP002334.1; plasmid unnamed:NC_017363.1/CP002335.1","-","2","1619","1445/163543","1/6/2011","3/22/2017","Complete Genome","2016-07-25T00:00:00Z","Berg lab, Washington University Medical School","","","","","1","1","16029","",""
"Helicobacter pylori MGYG-HGUT-01357","656790","210","210.6154","","","656790","","ftp://ftp.ncbi.nlm.nih.gov/genomes/all/GCF/902/381/665/GCF_902381665.1_UHGG_MGYG-HGUT-01357","ftp://ftp.ncbi.nlm.nih.gov/genomes/all/GCA/902/381/665/GCA_902381665.1_UHGG_MGYG-HGUT-01357","SAMEA5850860","PRJEB33885","GCA_902381665.1","1.56665","38.9","chromosome 1:NZ_LR698956.1/LR698956.1","-","1","1560","1413/656790","8/9/2019","8/22/2019","Complete Genome","2019-08-09T00:00:00Z","EMG","","","","1","","1","1566655","",""
"Helicobacter pylori ML2","264196","210","210.2071","","","264196","","ftp://ftp.ncbi.nlm.nih.gov/genomes/all/GCF/001/549/855/GCF_001549855.1_ASM154985v1","ftp://ftp.ncbi.nlm.nih.gov/genomes/all/GCA/001/549/855/GCA_001549855.1_ASM154985v1","SAMD00024432","PRJDB3430","GCA_001549855.1","1.56212","38.9","chromosome Unknown:NZ_AP014711.1/AP014711.1","-","1","1545","1204/264196","3/7/2015","10/8/2019","Complete Genome","2015-06-04T00:00:00Z","National Health Research Institutes","454 GS junior","45x","GS Junior System Software Package v. 2.7","1","","1","1562125","Taiwan","Human, Homo sapiens"
"Helicobacter pylori ML3","264197","210","210.3079","","","264197","","ftp://ftp.ncbi.nlm.nih.gov/genomes/all/GCF/001/549/875/GCF_001549875.1_ASM154987v1","ftp://ftp.ncbi.nlm.nih.gov/genomes/all/GCA/001/549/875/GCA_001549875.1_ASM154987v1","SAMD00024433","PRJDB3430","GCA_001549875.1","1.63533","38.6787","chromosome Unknown:NZ_AP014712.1/AP014712.1; plasmid ML3-PL:NZ_AP014713.1/AP014713.1","-","2","1617","1363/264197","3/7/2015","8/28/2019","Complete Genome","2015-06-04T00:00:00Z","National Health Research Institutes","454 GS junior","60x","GS Junior System SoftwarePackage v. 2.7","1","","1","6220","Taiwan","Human, Homo sapiens"
"Helicobacter pylori NCTC 11637 = CCUG 17874 = ATCC 43504","383853","102618","102618.7","","","383853","","ftp://ftp.ncbi.nlm.nih.gov/genomes/all/GCF/900/478/295/GCF_900478295.1_35377_D02","ftp://ftp.ncbi.nlm.nih.gov/genomes/all/GCA/900/478/295/GCA_900478295.1_35377_D02","SAMEA3178013","PRJEB6403","GCA_900478295.1","1.68094","38.8","chromosome 1:NZ_LS483488.1/LS483488.1","-","1","1679","1500/383853","6/17/2018","6/25/2018","Complete Genome","2018-06-17T00:00:00Z","SC","","","","1","","1","1680937","Australia","Human, Homo sapiens"
"Helicobacter pylori NCTC12823","432187","210","210.5392","","","432187","","ftp://ftp.ncbi.nlm.nih.gov/genomes/all/GCF/900/638/505/GCF_900638505.1_57728_F01","ftp://ftp.ncbi.nlm.nih.gov/genomes/all/GCA/900/638/505/GCA_900638505.1_57728_F01","SAMEA104224786","PRJEB6403","GCA_900638505.1","1.63222","39","chromosome 1:NZ_LR134519.1/LR134519.1","-","1","1604","1424/432187","12/19/2018","12/28/2018","Complete Genome","2018-12-19T00:00:00Z","SC","","","","1","","1","1632224","","Human, Homo sapiens"
"Helicobacter pylori NCTC13345","432186","210","210.5391","","","432186","","ftp://ftp.ncbi.nlm.nih.gov/genomes/all/GCF/900/638/475/GCF_900638475.1_57685_G01","ftp://ftp.ncbi.nlm.nih.gov/genomes/all/GCA/900/638/475/GCA_900638475.1_57685_G01","SAMEA104224776","PRJEB6403","GCA_900638475.1","1.64431","39","chromosome 1:NZ_LR134517.1/LR134517.1","-","1","1608","1450/432186","12/19/2018","12/28/2018","Complete Genome","2018-12-19T00:00:00Z","SC","","","","1","","1","1644315","Nigeria",""
"Helicobacter pylori NY40","218283","1426844","1426844.3","","","218283","","ftp://ftp.ncbi.nlm.nih.gov/genomes/all/GCF/000/828/955/GCF_000828955.1_ASM82895v1","ftp://ftp.ncbi.nlm.nih.gov/genomes/all/GCA/000/828/955/GCA_000828955.1_ASM82895v1","SAMD00061026","PRJDB1537","GCA_000828955.1","1.69692","38.8","chromosome:NZ_AP014523.1/AP014523.1","-","1","1693","1479/218283","6/5/2014","3/25/2017","Complete Genome","2014-06-05T00:00:00Z","Kochi University","454 GS Jr.; illumina; ABI 3710","114x","GS De Novo Assembler v. 2.7","1","","1","1696917","",""
"Helicobacter pylori OK113","163568","1248725","1248725.3","T02510","HPYL1248725","163568","","ftp://ftp.ncbi.nlm.nih.gov/genomes/all/GCF/000/348/865/GCF_000348865.1_ASM34886v1","ftp://ftp.ncbi.nlm.nih.gov/genomes/all/GCA/000/348/865/GCA_000348865.1_ASM34886v1","SAMD00061056","PRJDB693","GCA_000348865.1","1.61662","38.7","chromosome:NC_020508.1/AP012600.1","-","1","1595","1420/163568","3/11/2013","8/26/2019","Complete Genome","2013-03-11T00:00:00Z","University of Tokyo","Sanger","7.9x","phrap v. 1.080730","1","","1","1616617","",""
"Helicobacter pylori OK310","163569","1248726","1248726.3","T02542","HPYL1248726","163569","","ftp://ftp.ncbi.nlm.nih.gov/genomes/all/GCF/000/348/885/GCF_000348885.1_ASM34888v1","ftp://ftp.ncbi.nlm.nih.gov/genomes/all/GCA/000/348/885/GCA_000348885.1_ASM34888v1","SAMD00061057","PRJDB694","GCA_000348885.1","1.59544","38.7937","chromosome:NC_020509.1/AP012601.1; plasmid pHPOK310:NC_020556.1/AP012602.1","-","2","1573","1434/163569","3/11/2013","8/26/2019","Complete Genome","2013-03-11T00:00:00Z","University of Tokyo","Sanger","7.7x","phrap v. 1.080730","1","1","2","1595436","",""
"Helicobacter pylori OK310","163569","1248726","1248726.5","T02542","HPYL1248726","163569","","ftp://ftp.ncbi.nlm.nih.gov/genomes/all/GCF/000/348/885/GCF_000348885.1_ASM34888v1","ftp://ftp.ncbi.nlm.nih.gov/genomes/all/GCA/000/348/885/GCA_000348885.1_ASM34888v1","SAMD00061057","PRJDB694","GCA_000348885.1","1.59544","38.7937","chromosome:NC_020509.1/AP012601.1; plasmid pHPOK310:NC_020556.1/AP012602.1","-","2","1573","1434/163569","3/11/2013","8/26/2019","Complete Genome","2016-10-07T00:00:00Z","University of Tokyo","Sanger","7.7x","phrap v. 1.080730","1","","1","4158","",""
"Helicobacter pylori oki102","163578","1382920","1382920.3","T03182","","163578","","ftp://ftp.ncbi.nlm.nih.gov/genomes/all/GCF/000/600/045/GCF_000600045.1_ASM60004v1","ftp://ftp.ncbi.nlm.nih.gov/genomes/all/GCA/000/600/045/GCA_000600045.1_ASM60004v1","SAMN03081488","PRJNA215147","GCA_000600045.1","1.63321","38.8","chromosome:NZ_CP006820.1/CP006820.1","-","1","1593","1462/163578","3/25/2014","8/27/2019","Complete Genome","2014-03-25T00:00:00Z","Okinawa Institute of Advanced Sciences","PacBio","489x","HGAP v. 2.0","1","","1","1633212","Japan","Human, Homo sapiens"
"Helicobacter pylori oki112","163579","1382921","1382921.3","T03723","","163579","","ftp://ftp.ncbi.nlm.nih.gov/genomes/all/GCF/000/600/085/GCF_000600085.1_ASM60008v1","ftp://ftp.ncbi.nlm.nih.gov/genomes/all/GCA/000/600/085/GCA_000600085.1_ASM60008v1","SAMN03081489","PRJNA215148","GCA_000600085.1","1.63793","38.8","chromosome:NZ_CP006821.1/CP006821.1","-","1","1606","1459/163579","3/25/2014","8/27/2019","Complete Genome","2014-03-25T00:00:00Z","Okinawa Institute of Advanced Sciences","PacBio","328x","HGAP v. 2.0","1","","1","1637925","Japan","Human, Homo sapiens"
"Helicobacter pylori oki128","163580","1382922","1382922.3","T03724","","163580","","ftp://ftp.ncbi.nlm.nih.gov/genomes/all/GCF/000/600/125/GCF_000600125.1_ASM60012v1","ftp://ftp.ncbi.nlm.nih.gov/genomes/all/GCA/000/600/125/GCA_000600125.1_ASM60012v1","SAMN03081490","PRJNA215150","GCA_000600125.1","1.55383","39","chromosome:NZ_CP006822.1/CP006822.1","-","1","1531","1363/163580","3/25/2014","8/27/2019","Complete Genome","2014-03-25T00:00:00Z","Okinawa Institute of Advanced Sciences","PacBio","261x","HGAP v. 2.0","1","","1","1553826","Japan","Human, Homo sapiens"
"Helicobacter pylori oki154","163581","1382923","1382923.3","T03725","","163581","","ftp://ftp.ncbi.nlm.nih.gov/genomes/all/GCF/000/600/145/GCF_000600145.1_ASM60014v1","ftp://ftp.ncbi.nlm.nih.gov/genomes/all/GCA/000/600/145/GCA_000600145.1_ASM60014v1","SAMN03081491","PRJNA215152","GCA_000600145.1","1.5997","38.8","chromosome:NZ_CP006823.1/CP006823.1","-","1","1575","1412/163581","3/25/2014","8/27/2019","Complete Genome","2014-03-25T00:00:00Z","Okinawa Institute of Advanced Sciences","PacBio","822x","HGAP v. 2.0","1","","1","1599700","Japan","Human, Homo sapiens"
"Helicobacter pylori oki422","163582","1382924","1382924.3","T03726","","163582","","ftp://ftp.ncbi.nlm.nih.gov/genomes/all/GCF/000/600/165/GCF_000600165.1_ASM60016v1","ftp://ftp.ncbi.nlm.nih.gov/genomes/all/GCA/000/600/165/GCA_000600165.1_ASM60016v1","SAMN03081492","PRJNA215149","GCA_000600165.1","1.63485","38.8","chromosome:NZ_CP006824.1/CP006824.1","-","1","1592","1435/163582","3/25/2014","8/27/2019","Complete Genome","2014-03-25T00:00:00Z","Okinawa Institute of Advanced Sciences","PacBio","432x","HGAP v. 2.0","1","","1","1634852","Japan","Human, Homo sapiens"
"Helicobacter pylori oki673","163583","1382925","1382925.3","T03727","","163583","","ftp://ftp.ncbi.nlm.nih.gov/genomes/all/GCF/000/600/185/GCF_000600185.1_ASM60018v1","ftp://ftp.ncbi.nlm.nih.gov/genomes/all/GCA/000/600/185/GCA_000600185.1_ASM60018v1","SAMN03081493","PRJNA215154","GCA_000600185.1","1.59506","38.8","chromosome:NZ_CP006825.1/CP006825.1","-","1","1566","1401/163583","3/25/2014","8/27/2019","Complete Genome","2014-03-25T00:00:00Z","Okinawa Institute of Advanced Sciences","PacBio","193x","HGAP v. 2.0","1","","1","1595058","Japan","Human, Homo sapiens"
"Helicobacter pylori oki828","163584","1382926","1382926.3","T03728","","163584","","ftp://ftp.ncbi.nlm.nih.gov/genomes/all/GCF/000/600/205/GCF_000600205.1_ASM60020v1","ftp://ftp.ncbi.nlm.nih.gov/genomes/all/GCA/000/600/205/GCA_000600205.1_ASM60020v1","SAMN03081494","PRJNA215153","GCA_000600205.1","1.60034","38.8","chromosome:NZ_CP006826.1/CP006826.1","-","1","1574","1407/163584","3/25/2014","8/27/2019","Complete Genome","2014-03-25T00:00:00Z","Okinawa Institute of Advanced Sciences","PacBio","434x","HGAP v. 2.0","1","","1","1600345","Japan","Human, Homo sapiens"
"Helicobacter pylori oki898","163585","1382927","1382927.3","T03729","","163585","","ftp://ftp.ncbi.nlm.nih.gov/genomes/all/GCF/000/600/225/GCF_000600225.1_ASM60022v1","ftp://ftp.ncbi.nlm.nih.gov/genomes/all/GCA/000/600/225/GCA_000600225.1_ASM60022v1","SAMN03081495","PRJNA215151","GCA_000600225.1","1.63488","38.8","chromosome:NZ_CP006827.1/CP006827.1","-","1","1598","1462/163585","3/25/2014","8/27/2019","Complete Genome","2014-03-25T00:00:00Z","Okinawa Institute of Advanced Sciences","PacBio","613x","HGAP v. 2.0","1","","1","1634875","Japan","Human, Homo sapiens"
"Helicobacter pylori P12","299777","570508","570508.26","T00786","HPYL570508","299777","yes","ftp://ftp.ncbi.nlm.nih.gov/genomes/all/GCF/000/021/465/GCF_000021465.1_ASM2146v1","ftp://ftp.ncbi.nlm.nih.gov/genomes/all/GCA/000/021/465/GCA_000021465.1_ASM2146v1","SAMN02603595","PRJNA32291","GCA_000021465.1","1.68404","38.7775","chromosome:NC_011498.1/CP001217.1; plasmid HPP12:NC_011499.1/CP001218.1","-","2","1650","1468/299777","10/30/2008","8/25/2019","Complete Genome","2016-07-26T00:00:00Z","Max von Pettenkofer-Institut fr Hygiene und Medizinische Mikrobiologie, Ludwig-Maximilians-Universitt Mnchen","","","","","1","1","10225","","Human, Homo sapiens"
"Helicobacter pylori P12","299777","570508","570508.6","T00786","HPYL570508","299777","yes","ftp://ftp.ncbi.nlm.nih.gov/genomes/all/GCF/000/021/465/GCF_000021465.1_ASM2146v1","ftp://ftp.ncbi.nlm.nih.gov/genomes/all/GCA/000/021/465/GCA_000021465.1_ASM2146v1","SAMN02603595","PRJNA32291","GCA_000021465.1","1.68404","38.7775","chromosome:NC_011498.1/CP001217.1; plasmid HPP12:NC_011499.1/CP001218.1","-","2","1650","1468/299777","10/30/2008","8/25/2019","Complete Genome","2008-10-30T00:00:00Z","Max von Pettenkofer-Institut f????r Hygiene und Medizinische Mikrobiologie, Ludwig-Maximilians-Universit????t M????nchen|Institut f????r Informatik, LFE Bioinformatik, Ludwig-Maximilians-Universit????t M????nchen","","","","1","1","2","1684038","","Human, Homo sapiens"
"Helicobacter pylori PeCan18","163562","1163742","1163742.3","T02036","HPYL1163742","163562","","ftp://ftp.ncbi.nlm.nih.gov/genomes/all/GCF/000/277/425/GCF_000277425.1_ASM27742v1","ftp://ftp.ncbi.nlm.nih.gov/genomes/all/GCA/000/277/425/GCA_000277425.1_ASM27742v1","SAMN02603196","PRJNA95275","GCA_000277425.1","1.66068","39","chromosome:NC_017742.1/CP003475.1","-","1","1622","1467/163562","4/19/2012","3/23/2017","Complete Genome","2012-04-19T00:00:00Z","Dept. Molec. Microbiology, Washington University Medical School in Saint Louis","","","","1","","1","1660685","Peru","Human, Homo sapiens"
"Helicobacter pylori PeCan4","163537","765963","765963.4","T01322","HPYL765963","163537","","ftp://ftp.ncbi.nlm.nih.gov/genomes/all/GCF/000/148/875/GCF_000148875.1_ASM14887v1","ftp://ftp.ncbi.nlm.nih.gov/genomes/all/GCA/000/148/875/GCA_000148875.1_ASM14887v1","SAMN02603203","PRJNA49027","GCA_000148875.1","1.63827","38.8681","chromosome:NC_014555.1/CP002074.1; plasmid pHPPC4:NC_014556.1/CP002075.1","-","2","1611","1462/163537","10/1/2010","3/22/2017","Complete Genome","2010-10-01T00:00:00Z","Genome Sequencing Center (GSC) at Washington University (WashU) School of Medicine","","","","1","1","2","1638269","","Human, Homo sapiens"
"Helicobacter pylori PeCan4","163537","765963","765963.8","T01322","HPYL765963","163537","","ftp://ftp.ncbi.nlm.nih.gov/genomes/all/GCF/000/148/875/GCF_000148875.1_ASM14887v1","ftp://ftp.ncbi.nlm.nih.gov/genomes/all/GCA/000/148/875/GCA_000148875.1_ASM14887v1","SAMN02603203","PRJNA49027","GCA_000148875.1","1.63827","38.8681","chromosome:NC_014555.1/CP002074.1; plasmid pHPPC4:NC_014556.1/CP002075.1","-","2","1611","1462/163537","10/1/2010","3/22/2017","Complete Genome","2016-07-25T00:00:00Z","Dept. of Molec. Microbiology, Washington University Medical School, Saint Louis","","","","","1","1","8712","Peru","Human, Homo sapiens"
"Helicobacter pylori PMSS1","305990","1431450","1431450.5","","GCF_001991095","305990","","ftp://ftp.ncbi.nlm.nih.gov/genomes/all/GCF/001/991/095/GCF_001991095.1_ASM199109v1","ftp://ftp.ncbi.nlm.nih.gov/genomes/all/GCA/001/991/095/GCA_001991095.1_ASM199109v1","SAMN04362855","PRJNA306775","GCA_001991095.1","1.62454","38.9929","chromosome:NZ_CP018823.1/CP018823.1; plasmid pHPYLPMSS1:NZ_CP018824.1/CP018824.1","-","2","1588","1438/305990","2/10/2017","3/29/2017","Complete Genome","2017-02-10T00:00:00Z","University of California, Davis","PacBio, HiSeq",">500x","SMRT Analysis pipeline (HGAP & QUIVER) v.","","1","1","6058","Australia","Human, Homo sapiens"
"Helicobacter pylori PMSS1","454107","210","210.5631","","","N/A","","ftp://ftp.ncbi.nlm.nih.gov/genomes/all/GCF/004/295/545/GCF_004295545.1_HP_PMSS1_01","ftp://ftp.ncbi.nlm.nih.gov/genomes/all/GCA/004/295/545/GCA_004295545.1_HP_PMSS1_01","SAMD00051588","PRJDB4521","GCA_004295545.1","1.60915","38.9928","chromosome:NZ_AP017633.1/AP017633.1; plasmid pPMSS1:NZ_AP017634.1/AP017634.1","-","2","1588","1433/454107","1/17/2019","8/8/2019","Complete Genome","2019-01-17T00:00:00Z","Microbial genome science, Genome of Life and Environmental Sciences Division, Frontier Science Research Center","454 GS FLX; ABI 3730; illumina","42x","Newbler v. 2.6","1","1","2","1609151","",""
"Helicobacter pylori Puno120","163549","1055528","1055528.4","T01919","GCF_000224535","163549","","ftp://ftp.ncbi.nlm.nih.gov/genomes/all/GCF/000/224/535/GCF_000224535.1_ASM22453v1","ftp://ftp.ncbi.nlm.nih.gov/genomes/all/GCA/000/224/535/GCA_000224535.1_ASM22453v1","SAMN02604320","PRJNA69917","GCA_000224535.1","1.63776","38.8758","chromosome:NC_017378.1/CP002980.1; plasmid pHPPN120:NC_017377.1/CP002981.1","-","2","1585","1444/163549","8/26/2011","3/22/2017","Complete Genome","2011-08-26T00:00:00Z","Genome Sequencing Center (GSC) at Washington University (WashU) School of Medicine","","","","1","1","2","1637762","",""
"Helicobacter pylori Puno120","163549","1055528","1055528.7","T01919","GCF_000224535","163549","","ftp://ftp.ncbi.nlm.nih.gov/genomes/all/GCF/000/224/535/GCF_000224535.1_ASM22453v1","ftp://ftp.ncbi.nlm.nih.gov/genomes/all/GCA/000/224/535/GCA_000224535.1_ASM22453v1","SAMN02604320","PRJNA69917","GCA_000224535.1","1.63776","38.8758","chromosome:NC_017378.1/CP002980.1; plasmid pHPPN120:NC_017377.1/CP002981.1","-","2","1585","1444/163549","8/26/2011","3/22/2017","Complete Genome","2016-07-25T00:00:00Z","Washington University Medical School","","","","","1","1","12783","Peru","Human, Homo sapiens"
"Helicobacter pylori Puno135","163550","1055529","1055529.4","T01920","HPYL1055529","163550","","ftp://ftp.ncbi.nlm.nih.gov/genomes/all/GCF/000/224/555/GCF_000224555.1_ASM22455v1","ftp://ftp.ncbi.nlm.nih.gov/genomes/all/GCA/000/224/555/GCA_000224555.1_ASM22455v1","SAMN02604321","PRJNA69919","GCA_000224555.1","1.64614","38.8","chromosome:NC_017379.1/CP002982.1","-","1","1606","1481/163550","8/26/2011","3/22/2017","Complete Genome","2011-08-26T00:00:00Z","Genome Sequencing Center (GSC) at Washington University (WashU) School of Medicine","","","","1","","1","1646139","",""
"Helicobacter pylori Rif1","163564","1234365","1234365.3","T02317","HPYL1234365","163564","","ftp://ftp.ncbi.nlm.nih.gov/genomes/all/GCF/000/307/815/GCF_000307815.1_ASM30781v1","ftp://ftp.ncbi.nlm.nih.gov/genomes/all/GCA/000/307/815/GCA_000307815.1_ASM30781v1","SAMN02603762","PRJNA175544","GCA_000307815.1","1.66788","38.9","chromosome:NC_018937.1/CP003905.1","-","1","1640","1493/163564","10/23/2012","8/26/2019","Complete Genome","2012-10-23T00:00:00Z","RIPCM","","","1","1","","1","1667883","",""
"Helicobacter pylori Rif2","163565","1234600","1234600.3","T02318","HPYL1234600","163565","","ftp://ftp.ncbi.nlm.nih.gov/genomes/all/GCF/000/307/835/GCF_000307835.1_ASM30783v1","ftp://ftp.ncbi.nlm.nih.gov/genomes/all/GCA/000/307/835/GCA_000307835.1_ASM30783v1","SAMN02603763","PRJNA175625","GCA_000307835.1","1.66789","38.9","chromosome:NC_018938.1/CP003906.1","-","1","1639","1495/163565","10/23/2012","8/26/2019","Complete Genome","2012-10-23T00:00:00Z","RIPCM","","","1","1","","1","1667890","",""
"Helicobacter pylori Sat464","163539","794851","794851.3","T01897","GCF_000148915","163539","","ftp://ftp.ncbi.nlm.nih.gov/genomes/all/GCF/000/148/915/GCF_000148915.1_ASM14891v1","ftp://ftp.ncbi.nlm.nih.gov/genomes/all/GCA/000/148/915/GCA_000148915.1_ASM14891v1","SAMN02603200","PRJNA49453","GCA_000148915.1","1.56757","39.0742","chromosome:NC_017359.1/CP002071.1; plasmid pHPSAT464:NC_017356.1/CP002072.1","-","2","1553","1419/163539","10/1/2010","3/22/2017","Complete Genome","2010-10-01T00:00:00Z","Dept. Molec. Microbiology, Washintgton University Medical School in Saint Louis","","","","1","1","2","1567570","Peru","Human, Homo sapiens"
"Helicobacter pylori Sat464","163539","794851","794851.6","T01897","GCF_000148915","163539","","ftp://ftp.ncbi.nlm.nih.gov/genomes/all/GCF/000/148/915/GCF_000148915.1_ASM14891v1","ftp://ftp.ncbi.nlm.nih.gov/genomes/all/GCA/000/148/915/GCA_000148915.1_ASM14891v1","SAMN02603200","PRJNA49453","GCA_000148915.1","1.56757","39.0742","chromosome:NC_017359.1/CP002071.1; plasmid pHPSAT464:NC_017356.1/CP002072.1","-","2","1553","1419/163539","10/1/2010","3/22/2017","Complete Genome","2016-07-25T00:00:00Z","Dept. Molec. Microbiology, Washintgton University Medical School in Saint Louis","","","","","1","1","7228","Peru","Human, Homo sapiens"
"Helicobacter pylori Shi112","163561","1163740","1163740.3","T02037","HPYL1163740","163561","","ftp://ftp.ncbi.nlm.nih.gov/genomes/all/GCF/000/277/405/GCF_000277405.1_ASM27740v1","ftp://ftp.ncbi.nlm.nih.gov/genomes/all/GCA/000/277/405/GCA_000277405.1_ASM27740v1","SAMN02603194","PRJNA94347","GCA_000277405.1","1.66346","38.8","chromosome:NC_017741.1/CP003474.1","-","1","1635","1493/163561","4/19/2012","3/23/2017","Complete Genome","2012-04-19T00:00:00Z","Dept. Molec. Microbiology, Washington University Medical School in Saint Louis","","","","1","","1","1663456","Peru","Human, Homo sapiens"
"Helicobacter pylori Shi169","163560","1163741","1163741.3","T02038","HPYL1163741","163560","","ftp://ftp.ncbi.nlm.nih.gov/genomes/all/GCF/000/277/385/GCF_000277385.1_ASM27738v1","ftp://ftp.ncbi.nlm.nih.gov/genomes/all/GCA/000/277/385/GCA_000277385.1_ASM27738v1","SAMN02603195","PRJNA94507","GCA_000277385.1","1.61691","38.9","chromosome:NC_017740.1/CP003473.1","-","1","1595","1456/163560","4/19/2012","3/23/2017","Complete Genome","2012-04-19T00:00:00Z","Dept. Molec. Microbiology, Washington University Medical School in Saint Louis","","","","1","","1","1616909","Peru","Human, Homo sapiens"
"Helicobacter pylori Shi417","163559","1163739","1163739.3","T02039","HPYL1163739","163559","","ftp://ftp.ncbi.nlm.nih.gov/genomes/all/GCF/000/277/365/GCF_000277365.1_ASM27736v1","ftp://ftp.ncbi.nlm.nih.gov/genomes/all/GCA/000/277/365/GCA_000277365.1_ASM27736v1","SAMN02603193","PRJNA94345","GCA_000277365.1","1.66572","38.8","chromosome:NC_017739.1/CP003472.1","-","1","1622","1490/163559","4/19/2012","3/23/2017","Complete Genome","2012-04-19T00:00:00Z","Dept. Molec. Microbiology, Washington University Medical School in Saint Louis","","","","1","","1","1665719","Peru","Human, Homo sapiens"
"Helicobacter pylori Shi470","299775","512562","512562.5","T00742","HPYL512562","299775","yes","ftp://ftp.ncbi.nlm.nih.gov/genomes/all/GCF/000/020/245/GCF_000020245.1_ASM2024v1","ftp://ftp.ncbi.nlm.nih.gov/genomes/all/GCA/000/020/245/GCA_000020245.1_ASM2024v1","SAMN02604319","PRJNA29045","GCA_000020245.1","1.60855","38.9","chromosome:NC_010698.2/CP001072.2","-","1","1584","1442/299775","5/14/2008","3/22/2017","Complete Genome","2008-05-14T00:00:00Z","Genome Sequencing Center (GSC) at Washington University (WashU) School of Medicine","","","","1","","1","1608548","Peru",""
"Helicobacter pylori SJM180","163536","765962","765962.4","T01323","HPYL765962","163536","","ftp://ftp.ncbi.nlm.nih.gov/genomes/all/GCF/000/148/855/GCF_000148855.1_ASM14885v1","ftp://ftp.ncbi.nlm.nih.gov/genomes/all/GCA/000/148/855/GCA_000148855.1_ASM14885v1","SAMN02603202","PRJNA49025","GCA_000148855.1","1.65805","38.9","chromosome:NC_014560.1/CP002073.1","-","1","1617","1478/163536","10/1/2010","3/22/2017","Complete Genome","2010-10-01T00:00:00Z","Genome Sequencing Center (GSC) at Washington University (WashU) School of Medicine","","","","1","","1","1658051","Peru",""
"Helicobacter pylori SNT49","163551","1055530","1055530.4","T01916","","163551","","ftp://ftp.ncbi.nlm.nih.gov/genomes/all/GCF/000/224/575/GCF_000224575.1_ASM22457v1","ftp://ftp.ncbi.nlm.nih.gov/genomes/all/GCA/000/224/575/GCA_000224575.1_ASM22457v1","SAMN02604322","PRJNA69921","GCA_000224575.1","1.61083","38.9968","chromosome:NC_017376.1/CP002983.1; plasmid pHPSNT:NC_017380.1/CP002984.1","-","2","1579","1427/163551","8/26/2011","3/22/2017","Complete Genome","2011-08-26T00:00:00Z","Genome Sequencing Center (GSC) at Washington University (WashU) School of Medicine","","","","1","1","2","1610830","",""
"Helicobacter pylori SNT49","163551","1055530","1055530.6","T01916","","163551","","ftp://ftp.ncbi.nlm.nih.gov/genomes/all/GCF/000/224/575/GCF_000224575.1_ASM22457v1","ftp://ftp.ncbi.nlm.nih.gov/genomes/all/GCA/000/224/575/GCA_000224575.1_ASM22457v1","SAMN02604322","PRJNA69921","GCA_000224575.1","1.61083","38.9968","chromosome:NC_017376.1/CP002983.1; plasmid pHPSNT:NC_017380.1/CP002984.1","-","2","1579","1427/163551","8/26/2011","3/22/2017","Complete Genome","2016-07-25T00:00:00Z","Washington University Medical School","","","","","1","1","3253","India","Human, Homo sapiens"
"Helicobacter pylori SouthAfrica20","163577","1352356","1352356.3","T02807","HPYL1352356","163577","","ftp://ftp.ncbi.nlm.nih.gov/genomes/all/GCF/000/590/775/GCF_000590775.1_ASM59077v1","ftp://ftp.ncbi.nlm.nih.gov/genomes/all/GCA/000/590/775/GCA_000590775.1_ASM59077v1","SAMN02604293","PRJNA209860","GCA_000590775.1","1.6229","38.6","chromosome:NC_022130.1/CP006691.1","-","1","1568","1342/163577","8/21/2013","8/27/2019","Complete Genome","2013-08-21T00:00:00Z","Vanderbilt University School of Medicine","454","25x","GS De Novo Assemble v. Jan 2011","1","","1","1622903","South Africa","Human, Homo sapiens"
"Helicobacter pylori SouthAfrica7","163544","907239","907239.3","T01921","HPYL907239","163544","","ftp://ftp.ncbi.nlm.nih.gov/genomes/all/GCF/000/185/245/GCF_000185245.1_ASM18524v1","ftp://ftp.ncbi.nlm.nih.gov/genomes/all/GCA/000/185/245/GCA_000185245.1_ASM18524v1","SAMN02603025","PRJNA53319","GCA_000185245.1","1.67983","38.4259","chromosome:NC_017361.1/CP002336.1; plasmid unnamed:NC_017373.1/CP002337.1","-","2","1610","1452/163544","1/6/2011","8/25/2019","Complete Genome","2011-01-06T00:00:00Z","Genome Sequencing Center (GSC) at Washington University (WashU) School of Medicine","","","","1","1","2","1679829","",""
"Helicobacter pylori SouthAfrica7","163544","907239","907239.6","T01921","HPYL907239","163544","","ftp://ftp.ncbi.nlm.nih.gov/genomes/all/GCF/000/185/245/GCF_000185245.1_ASM18524v1","ftp://ftp.ncbi.nlm.nih.gov/genomes/all/GCA/000/185/245/GCA_000185245.1_ASM18524v1","SAMN02603025","PRJNA53319","GCA_000185245.1","1.67983","38.4259","chromosome:NC_017361.1/CP002336.1; plasmid unnamed:NC_017373.1/CP002337.1","-","2","1610","1452/163544","1/6/2011","8/25/2019","Complete Genome","2016-07-25T00:00:00Z","Berg lab, Washington University Medical Shool","","","","","1","1","25916","",""
"Helicobacter pylori SS1","307918","102617","102617.13","","GCF_002005525","307918","","ftp://ftp.ncbi.nlm.nih.gov/genomes/all/GCF/002/005/525/GCF_002005525.1_ASM200552v1","ftp://ftp.ncbi.nlm.nih.gov/genomes/all/GCA/002/005/525/GCA_002005525.1_ASM200552v1","SAMN03331743","PRJNA256258","GCA_002005525.1","1.62494","38.9939","chromosome:NZ_CP009259.1/CP009259.1; plasmid pHPLYSS1:NZ_CP009260.1/CP009260.1","-","2","1592","1439/307918","2/22/2017","8/7/2019","Complete Genome","2017-02-22T00:00:00Z","University of California at Santa Cruz","454, SOLiD, targeted Sanger, targeted",">1000x","Roche GS Assembler & GS Mapper v. 2.0.01;","","1","1","5845","Australia","Helicobacter pylori"
"Helicobacter pylori TN2wt","676610","210","210.6129","","","676610","","ftp://ftp.ncbi.nlm.nih.gov/genomes/all/GCF/008/326/525/GCF_008326525.1_ASM832652v1","ftp://ftp.ncbi.nlm.nih.gov/genomes/all/GCA/008/326/525/GCA_008326525.1_ASM832652v1","SAMN02724990","PRJNA244276","GCA_008326525.1","1.60495","38.7","chromosome:NZ_AP019730.1/AP019730.1","-","1","1597","1428/676610","8/22/2019","9/14/2019","Complete Genome","2019-08-23T00:00:00Z","Oita University","PacBio","567x","HGAP v. 2.0","1","","1","1604952","Japan","Homo sapiens"
"Helicobacter pylori UM032","209379","1311573","1311573.5","T02658","HPYL1311573","209379","","ftp://ftp.ncbi.nlm.nih.gov/genomes/all/GCF/000/392/455/GCF_000392455.3_ASM39245v3","ftp://ftp.ncbi.nlm.nih.gov/genomes/all/GCA/000/392/455/GCA_000392455.3_ASM39245v3","SAMN02230257","PRJNA196982","GCA_000392455.3","1.59354","38.8","chromosome:NC_021215.3/CP005490.3","-","1","1559","1440/209379","5/14/2013","8/27/2019","Complete Genome","2013-05-14T00:00:00Z","University of Malaya","Pacific Biosciences","20X","SMRT de novo v. CLR","1","","1","1599933","Malaysia","Human, Homo sapiens"
"Helicobacter pylori UM037","210005","1321939","1321939.6","T02659","HPYL1321939","210005","","ftp://ftp.ncbi.nlm.nih.gov/genomes/all/GCF/000/392/515/GCF_000392515.3_ASM39251v3","ftp://ftp.ncbi.nlm.nih.gov/genomes/all/GCA/000/392/515/GCA_000392515.3_ASM39251v3","SAMN02604194","PRJNA196985","GCA_000392515.3","1.69279","38.9","chromosome:NC_021217.3/CP005492.3","-","1","1675","1507/210005","5/14/2013","3/24/2017","Complete Genome","2013-05-14T00:00:00Z","University of Malaya","Pacific Biosciences","20X","SMRT de novo v. CLR","1","","1","1694406","Malaysia","Human, Homo sapiens"
"Helicobacter pylori UM066","210006","1321940","1321940.5","T02660","HPYL1321940","210006","","ftp://ftp.ncbi.nlm.nih.gov/genomes/all/GCF/000/392/535/GCF_000392535.3_ASM39253v3","ftp://ftp.ncbi.nlm.nih.gov/genomes/all/GCA/000/392/535/GCA_000392535.3_ASM39253v3","SAMN02230271","PRJNA196986","GCA_000392535.3","1.65805","38.6","chromosome:NC_021218.3/CP005493.3","-","1","1614","1471/210006","5/14/2013","3/24/2017","Complete Genome","2013-05-14T00:00:00Z","University of Malaya","Pacific Biosciences","20X","SMRT de novo v. CLR","1","","1","1658730","Malaysia","Human, Homo sapiens"
"Helicobacter pylori UM298","209381","1321941","1321941.5","T02757","HPYL1321941","209381","","ftp://ftp.ncbi.nlm.nih.gov/genomes/all/GCF/000/439/295/GCF_000439295.2_ASM43929v2","ftp://ftp.ncbi.nlm.nih.gov/genomes/all/GCA/000/439/295/GCA_000439295.2_ASM43929v2","SAMN02641597","PRJNA196983","GCA_000439295.2","1.59454","38.8","chromosome:NC_021882.2/CP006610.2","-","1","1561","1440/209381","7/23/2013","8/27/2019","Complete Genome","2013-07-23T00:00:00Z","University of Malaya","PacBio","","HGAP v. 2013","1","","1","1604216","Singapore","Mouse, Mus musculus"
"Helicobacter pylori UM299","209380","1321938","1321938.4","T02661","GCF_000392475","209380","","ftp://ftp.ncbi.nlm.nih.gov/genomes/all/GCF/000/392/475/GCF_000392475.3_ASM39247v3","ftp://ftp.ncbi.nlm.nih.gov/genomes/all/GCA/000/392/475/GCA_000392475.3_ASM39247v3","SAMN02230259","PRJNA196984","GCA_000392475.3","1.59457","38.8","chromosome:NC_021216.3/CP005491.3","-","1","1560","1439/209380","5/14/2013","8/27/2019","Complete Genome","2013-05-14T00:00:00Z","University of Malaya","Pacific Biosciences","20X","SMRT de novo v. CLR","1","","1","1602007","Malaysia","Mouse, Mus musculus"
"Helicobacter pylori v225d","163534","637913","637913.3","T01899","HPYL637913","163534","","ftp://ftp.ncbi.nlm.nih.gov/genomes/all/GCF/000/093/185/GCF_000093185.1_ASM9318v1","ftp://ftp.ncbi.nlm.nih.gov/genomes/all/GCA/000/093/185/GCA_000093185.1_ASM9318v1","SAMN00003101","PRJNA36609","GCA_000093185.1","1.5956","38.972","chromosome:NC_017355.1/CP001582.1; plasmid pHPv225d:NC_017383.1/CP001583.1","-","2","1565","1416/163534","6/3/2010","8/25/2019","Complete Genome","2010-06-03T00:00:00Z","The Pathosystems Resource Integration Center (PATRIC)|Virginia Bioinformatics Institute|Virginia Polytechnic Institute and State University, Virginia Bioinformatics Institute, USA, Blacksburg","","","","1","1","2","1595604","",""
"Helicobacter pylori v225d","163534","637913","637913.5","T01899","HPYL637913","163534","","ftp://ftp.ncbi.nlm.nih.gov/genomes/all/GCF/000/093/185/GCF_000093185.1_ASM9318v1","ftp://ftp.ncbi.nlm.nih.gov/genomes/all/GCA/000/093/185/GCA_000093185.1_ASM9318v1","SAMN00003101","PRJNA36609","GCA_000093185.1","1.5956","38.972","chromosome:NC_017355.1/CP001582.1; plasmid pHPv225d:NC_017383.1/CP001583.1","-","2","1565","1416/163534","6/3/2010","8/25/2019","Complete Genome","2016-07-25T00:00:00Z","Virginia Bioinformatics Institute","","","","","1","1","7326","","Human, Homo sapiens"
"Helicobacter pylori XZ274","163554","1127122","1127122.3","T02130","GCF_000262655","163554","","ftp://ftp.ncbi.nlm.nih.gov/genomes/all/GCF/000/262/655/GCF_000262655.1_ASM26265v1","ftp://ftp.ncbi.nlm.nih.gov/genomes/all/GCA/000/262/655/GCA_000262655.1_ASM26265v1","SAMN02603962","PRJNA79003","GCA_000262655.1","1.65654","38.6067","chromosome:NC_017926.1/CP003419.1; plasmid pXZ274:NC_017919.1/CP003420.1","-","2","1647","1345/163554","5/14/2012","10/9/2019","Complete Genome","2012-05-14T00:00:00Z","Third Military Medical University","","","","1","1","2","1656544","China","Human, Homo sapiens"
"Helicobacter pylori XZ274","163554","1127122","1127122.5","T02130","GCF_000262655","163554","","ftp://ftp.ncbi.nlm.nih.gov/genomes/all/GCF/000/262/655/GCF_000262655.1_ASM26265v1","ftp://ftp.ncbi.nlm.nih.gov/genomes/all/GCA/000/262/655/GCA_000262655.1_ASM26265v1","SAMN02603962","PRJNA79003","GCA_000262655.1","1.65654","38.6067","chromosome:NC_017926.1/CP003419.1; plasmid pXZ274:NC_017919.1/CP003420.1","-","2","1647","1345/163554","5/14/2012","10/9/2019","Complete Genome","2016-07-26T00:00:00Z","Third Military Medical University","","","","","1","1","22406","China","Human, Homo sapiens"
"Helicobacter pylori 7.13_1","364227","210","210.4130","","","N/A","","ftp://ftp.ncbi.nlm.nih.gov/genomes/all/GCF/002/952/275/GCF_002952275.1_ASM295227v1","ftp://ftp.ncbi.nlm.nih.gov/genomes/all/GCA/002/952/275/GCA_002952275.1_ASM295227v1","SAMN06216067","PRJNA362878","GCA_002952275.1","1.67412","38.8","chromosome:NZ_CP023267.1/CP023267.1","-","1","1635","1483/364227","2/22/2018","10/18/2019","Chromosome","2018-02-22T00:00:00Z","Vanderbilt University Medical Center","Illumina MiSeq","20x","VGAS v. 1","","","1","1674115","United States","gerbil"
"Helicobacter pylori 7.13_2","364226","210","210.4129","","","N/A","","ftp://ftp.ncbi.nlm.nih.gov/genomes/all/GCF/002/952/255/GCF_002952255.1_ASM295225v1","ftp://ftp.ncbi.nlm.nih.gov/genomes/all/GCA/002/952/255/GCA_002952255.1_ASM295225v1","SAMN06216068","PRJNA362878","GCA_002952255.1","1.67421","38.8","chromosome:NZ_CP023266.1/CP023266.1","-","1","1635","1421/364226","2/22/2018","8/29/2019","Chromosome","2018-02-22T00:00:00Z","Vanderbilt University Medical Center","Illumina MiSeq","20x","VGAS v. 1","","","1","1674214","United States","gerbil"
"Helicobacter pylori 7.13_3","364225","210","210.4128","","","N/A","","ftp://ftp.ncbi.nlm.nih.gov/genomes/all/GCF/002/952/235/GCF_002952235.1_ASM295223v1","ftp://ftp.ncbi.nlm.nih.gov/genomes/all/GCA/002/952/235/GCA_002952235.1_ASM295223v1","SAMN06216069","PRJNA362878","GCA_002952235.1","1.67435","38.8","chromosome:NZ_CP023265.1/CP023265.1","-","1","1641","1371/364225","2/22/2018","8/29/2019","Chromosome","2018-02-22T00:00:00Z","Vanderbilt University Medical Center","Illumina MiSeq","20x","VGAS v. 1","","","1","1674350","United States","gerbil"
"Helicobacter pylori 7.13_D2a","364228","210","210.4134","","","N/A","","ftp://ftp.ncbi.nlm.nih.gov/genomes/all/GCF/002/952/395/GCF_002952395.1_ASM295239v1","ftp://ftp.ncbi.nlm.nih.gov/genomes/all/GCA/002/952/395/GCA_002952395.1_ASM295239v1","SAMN06216082","PRJNA362878","GCA_002952395.1","1.674","38.8","chromosome:NZ_CP024018.1/CP024018.1","-","1","1635","1481/364228","2/26/2018","10/18/2019","Chromosome","2018-02-26T00:00:00Z","Vanderbilt University Medical Center","Illumina MiSeq","118x","VGAS v. 1","1","","1","1674004","United States","gerbil"
"Helicobacter pylori 7.13_D2b","364229","210","210.4135","","","N/A","","ftp://ftp.ncbi.nlm.nih.gov/genomes/all/GCF/002/952/415/GCF_002952415.1_ASM295241v1","ftp://ftp.ncbi.nlm.nih.gov/genomes/all/GCA/002/952/415/GCA_002952415.1_ASM295241v1","SAMN06216083","PRJNA362878","GCA_002952415.1","1.674","38.8","chromosome:NZ_CP024019.1/CP024019.1","-","1","1637","1481/364229","2/26/2018","10/18/2019","Chromosome","2018-02-26T00:00:00Z","Vanderbilt University Medical Center","Illumina MiSeq","111x","VGAS v. 1","1","","1","1674005","United States","gerbil"
"Helicobacter pylori 7.13_D2c","364230","210","210.4136","","","N/A","","ftp://ftp.ncbi.nlm.nih.gov/genomes/all/GCF/002/952/435/GCF_002952435.1_ASM295243v1","ftp://ftp.ncbi.nlm.nih.gov/genomes/all/GCA/002/952/435/GCA_002952435.1_ASM295243v1","SAMN06216084","PRJNA362878","GCA_002952435.1","1.674","38.8","chromosome:NZ_CP024020.1/CP024020.1","-","1","1637","1480/364230","2/26/2018","10/19/2019","Chromosome","2018-02-26T00:00:00Z","Vanderbilt University Medical Center","Illumina MiSeq","91x","VGAS v. 1","1","","1","1673998","United States","gerbil"
"Helicobacter pylori B128_2","364223","210","210.4126","","","N/A","","ftp://ftp.ncbi.nlm.nih.gov/genomes/all/GCF/002/952/175/GCF_002952175.1_ASM295217v1","ftp://ftp.ncbi.nlm.nih.gov/genomes/all/GCA/002/952/175/GCA_002952175.1_ASM295217v1","SAMN06216065","PRJNA362878","GCA_002952175.1","1.67414","38.8","chromosome:NZ_CP027020.1/CP027020.1","-","1","1637","1472/364223","2/22/2018","10/18/2019","Chromosome","2018-02-22T00:00:00Z","Vanderbilt University Medical Center","Illumina MiSeq","20.0x","Visual Genomics Analysis Studio v.","1","","1","1674142","United States","Human, Homo sapiens"
"Helicobacter pylori B128_3","364224","210","210.4127","","","N/A","","ftp://ftp.ncbi.nlm.nih.gov/genomes/all/GCF/002/952/195/GCF_002952195.1_ASM295219v1","ftp://ftp.ncbi.nlm.nih.gov/genomes/all/GCA/002/952/195/GCA_002952195.1_ASM295219v1","SAMN06216066","PRJNA362878","GCA_002952195.1","1.67407","38.8","chromosome:NZ_CP027021.1/CP027021.1","-","1","1637","1484/364224","2/22/2018","10/18/2019","Chromosome","2018-02-22T00:00:00Z","Vanderbilt University Medical Center","Illumina MiSeq","20.0x","Visual Genomics Analysis Studio v.","1","","1","1674070","United States","Human, Homo sapiens"
"Helicobacter pylori C-Mx-2008-31","660304","210","210.6116","","","N/A","","ftp://ftp.ncbi.nlm.nih.gov/genomes/all/GCF/008/027/775/GCF_008027775.1_ASM802777v1","ftp://ftp.ncbi.nlm.nih.gov/genomes/all/GCA/008/027/775/GCA_008027775.1_ASM802777v1","SAMN09935058","PRJNA203445","GCA_008027775.1","1.64482","38.9877","chromosome:NZ_CP032031.1/CP032031.1; plasmid unnamed:NZ_CP032032.1/CP032032.1","-","2","1624","1458/660304","8/20/2019","8/22/2019","Chromosome","2019-08-20T00:00:00Z","University of California at Davis","PacBio RSII","360x","HGAP v. 15-May","1","1","2","1644819","Mexico","Homo sapiens"
"Helicobacter pylori C-Mx-2010-12","675775","210","210.6128","","","N/A","","ftp://ftp.ncbi.nlm.nih.gov/genomes/all/GCF/008/281/125/GCF_008281125.1_ASM828112v1","ftp://ftp.ncbi.nlm.nih.gov/genomes/all/GCA/008/281/125/GCA_008281125.1_ASM828112v1","SAMN09935061","PRJNA203445","GCA_008281125.1","1.65825","39","chromosome:NZ_CP032024.1/CP032024.1","-","1","1613","1455/675775","8/20/2019","9/14/2019","Chromosome","2019-08-20T00:00:00Z","University of California at Davis","PacBio RSII","81x","HGAP v. 15-Apr","1","","1","1658253","Mexico","Homo sapiens"
"Helicobacter pylori C-Mx-2010-3","660303","210","210.6115","","","N/A","","ftp://ftp.ncbi.nlm.nih.gov/genomes/all/GCF/008/027/395/GCF_008027395.1_ASM802739v1","ftp://ftp.ncbi.nlm.nih.gov/genomes/all/GCA/008/027/395/GCA_008027395.1_ASM802739v1","SAMN09935062","PRJNA203445","GCA_008027395.1","1.64234","39.1","chromosome:NZ_CP032023.1/CP032023.1","-","1","1625","1482/660303","8/20/2019","8/22/2019","Chromosome","2019-08-20T00:00:00Z","University of California at Davis","PacBio RSII","388x","HGAP v. 15-May","1","","1","1642343","Mexico","Homo sapiens"
"Helicobacter pylori C-Mx-2010-5","660302","210","210.6114","","","N/A","","ftp://ftp.ncbi.nlm.nih.gov/genomes/all/GCF/008/027/235/GCF_008027235.1_ASM802723v1","ftp://ftp.ncbi.nlm.nih.gov/genomes/all/GCA/008/027/235/GCA_008027235.1_ASM802723v1","SAMN09935063","PRJNA203445","GCA_008027235.1","1.64584","39.1","chromosome:NZ_CP032022.1/CP032022.1","-","1","1622","1477/660302","8/20/2019","8/22/2019","Chromosome","2019-08-20T00:00:00Z","University of California at Davis","PacBio RSII","398x","HGAP v. 15-May","1","","1","1645840","Mexico","Homo sapiens"
"Helicobacter pylori C-Mx-2010-8","660301","210","210.6113","","","N/A","","-","ftp://ftp.ncbi.nlm.nih.gov/genomes/all/GCA/008/026/995/GCA_008026995.1_ASM802699v1","SAMN09935059","PRJNA203445","GCA_008026995.1","1.70695","38.7827","chromosome:CP032027.1; plasmid unnamed1:CP032028.1; plasmid unnamed2:CP032029.1; plasmid unnamed3:CP032030.1","-","4","1663","1406/660301","8/20/2019","8/20/2019","Chromosome","2019-08-20T00:00:00Z","University of California at Davis","PacBio RSII","281x","HGAP v. 15-Jun","1","3","4","1706946","Mexico","Homo sapiens"
"Helicobacter pylori C-Mx-2010-97","660307","210","210.6119","","","N/A","","ftp://ftp.ncbi.nlm.nih.gov/genomes/all/GCF/008/032/735/GCF_008032735.1_ASM803273v1","ftp://ftp.ncbi.nlm.nih.gov/genomes/all/GCA/008/032/735/GCA_008032735.1_ASM803273v1","SAMN09935055","PRJNA203445","GCA_008032735.1","1.62446","39.2","chromosome:NZ_CP032036.1/CP032036.1","-","1","1590","1380/660307","8/20/2019","8/22/2019","Chromosome","2019-08-20T00:00:00Z","University of California at Davis","PacBio RSII","209x","HGAP v. 15-Apr","1","","1","1624459","Mexico","Homo sapiens"
"Helicobacter pylori C-Mx-2011-145","660300","210","210.6112","","","N/A","","ftp://ftp.ncbi.nlm.nih.gov/genomes/all/GCF/008/026/815/GCF_008026815.1_ASM802681v1","ftp://ftp.ncbi.nlm.nih.gov/genomes/all/GCA/008/026/815/GCA_008026815.1_ASM802681v1","SAMN09935056","PRJNA203445","GCA_008026815.1","1.69285","38.9625","chromosome:NZ_CP032034.1/CP032034.1; plasmid unnamed:NZ_CP032035.1/CP032035.1","-","2","1641","1471/660300","8/20/2019","8/22/2019","Chromosome","2019-08-20T00:00:00Z","University of California at Davis","PacBio RSII","422x","HGAP v. 15-May","1","1","2","1692846","Mexico","Homo sapiens"
"Helicobacter pylori C-Mx-2011-152","660298","210","210.6110","","","N/A","","ftp://ftp.ncbi.nlm.nih.gov/genomes/all/GCF/008/026/375/GCF_008026375.1_ASM802637v1","ftp://ftp.ncbi.nlm.nih.gov/genomes/all/GCA/008/026/375/GCA_008026375.1_ASM802637v1","SAMN09935060","PRJNA203445","GCA_008026375.1","1.63843","38.9943","chromosome:NZ_CP032025.1/CP032025.1; plasmid unnamed:NZ_CP032026.1/CP032026.1","-","2","1623","1444/660298","8/20/2019","8/22/2019","Chromosome","2019-08-20T00:00:00Z","University of California at Davis","PacBio RSII","438x","HGAP v. 15-May","1","1","2","1638427","Mexico","Homo sapiens"
"Helicobacter pylori C-Mx-2011-171","660299","210","210.6111","","","N/A","","ftp://ftp.ncbi.nlm.nih.gov/genomes/all/GCF/008/026/615/GCF_008026615.1_ASM802661v1","ftp://ftp.ncbi.nlm.nih.gov/genomes/all/GCA/008/026/615/GCA_008026615.1_ASM802661v1","SAMN09935057","PRJNA203445","GCA_008026615.1","1.6455","39.1","chromosome:NZ_CP032033.1/CP032033.1","-","1","1614","1434/660299","8/20/2019","8/22/2019","Chromosome","2019-08-20T00:00:00Z","University of California at Davis","PacBio RSII","474x","HGAP v. 15-May","1","","1","1645502","Mexico","Homo sapiens"
"Helicobacter pylori C-Mx-2011-69","660297","210","210.6109","","","N/A","","ftp://ftp.ncbi.nlm.nih.gov/genomes/all/GCF/008/026/175/GCF_008026175.1_ASM802617v1","ftp://ftp.ncbi.nlm.nih.gov/genomes/all/GCA/008/026/175/GCA_008026175.1_ASM802617v1","SAMN09935064","PRJNA203445","GCA_008026175.1","1.69368","38.7497","chromosome:NZ_CP032020.1/CP032020.1; plasmid unnamed:NZ_CP032021.1/CP032021.1","-","2","1669","1477/660297","8/20/2019","8/22/2019","Chromosome","2019-08-20T00:00:00Z","University of California at Davis","PacBio RSII","599x","HGAP v. 15-Jun","1","1","2","1693680","Mexico","Homo sapiens"
"Helicobacter pylori F13","331697","210","210.2908","","","N/A","","ftp://ftp.ncbi.nlm.nih.gov/genomes/all/GCF/002/357/435/GCF_002357435.1_ASM235743v1","ftp://ftp.ncbi.nlm.nih.gov/genomes/all/GCA/002/357/435/GCA_002357435.1_ASM235743v1","SAMD00042462","PRJDB4296","GCA_002357435.1","1.5919","39","chromosome:NZ_AP017329.1/AP017329.1","-","1","1580","1405/331697","1/17/2017","8/29/2019","Chromosome","2017-01-18T00:00:00Z","Department of Bioscience, Faculty of Applied Bioscience, Tokyo University of Agriculture","Illumina Hiseq 2000","125X","Abyss v. 1.3.4","1","","1","1591903","Japan","Human, Homo sapiens"
"Helicobacter pylori F17","331698","210","210.2909","","","N/A","","ftp://ftp.ncbi.nlm.nih.gov/genomes/all/GCF/002/357/455/GCF_002357455.1_ASM235745v1","ftp://ftp.ncbi.nlm.nih.gov/genomes/all/GCA/002/357/455/GCA_002357455.1_ASM235745v1","SAMD00042463","PRJDB4296","GCA_002357455.1","1.57144","38.9","chromosome:NZ_AP017330.1/AP017330.1","-","1","1564","1394/331698","1/17/2017","8/29/2019","Chromosome","2017-01-18T00:00:00Z","Department of Bioscience, Faculty of Applied Bioscience, Tokyo University of Agriculture","Illumina Hiseq 2000","870X","Abyss v. 1.3.4","1","","1","1571440","Japan","Human, Homo sapiens"
"Helicobacter pylori F18","331699","210","210.2910","","","N/A","","ftp://ftp.ncbi.nlm.nih.gov/genomes/all/GCF/002/357/475/GCF_002357475.1_ASM235747v1","ftp://ftp.ncbi.nlm.nih.gov/genomes/all/GCA/002/357/475/GCA_002357475.1_ASM235747v1","SAMD00042464","PRJDB4296","GCA_002357475.1","1.60791","39","chromosome:NZ_AP017331.1/AP017331.1","-","1","1577","1382/331699","1/17/2017","8/29/2019","Chromosome","2017-01-18T00:00:00Z","Department of Bioscience, Faculty of Applied Bioscience, Tokyo University of Agriculture","Illumina Hiseq 2000","713X","Abyss v. 1.3.4","1","","1","1607914","Japan","Human, Homo sapiens"
"Helicobacter pylori F20","331701","210","210.2912","","","N/A","","ftp://ftp.ncbi.nlm.nih.gov/genomes/all/GCF/002/357/515/GCF_002357515.1_ASM235751v1","ftp://ftp.ncbi.nlm.nih.gov/genomes/all/GCA/002/357/515/GCA_002357515.1_ASM235751v1","SAMD00042465","PRJDB4296","GCA_002357515.1","1.57874","38.9","chromosome:NZ_AP017333.1/AP017333.1","-","1","1574","1418/331701","1/17/2017","8/29/2019","Chromosome","2017-01-18T00:00:00Z","Department of Bioscience, Faculty of Applied Bioscience, Tokyo University of Agriculture","Illumina Hiseq 2000","1434X","Abyss v. 1.3.4","1","","1","1578736","Japan","Human, Homo sapiens"
"Helicobacter pylori F209","331700","210","210.2911","","","N/A","","ftp://ftp.ncbi.nlm.nih.gov/genomes/all/GCF/002/357/495/GCF_002357495.1_ASM235749v1","ftp://ftp.ncbi.nlm.nih.gov/genomes/all/GCA/002/357/495/GCA_002357495.1_ASM235749v1","SAMD00042466","PRJDB4296","GCA_002357495.1","1.5824","38.8","chromosome:NZ_AP017332.1/AP017332.1","-","1","1567","1415/331700","1/17/2017","8/29/2019","Chromosome","2017-01-18T00:00:00Z","Department of Bioscience, Faculty of Applied Bioscience, Tokyo University of Agriculture","Illumina Hiseq 2000","1125X","Abyss v. 1.3.4","1","","1","1582399","Japan","Human, Homo sapiens"
"Helicobacter pylori F21","331704","210","210.2915","","","N/A","","ftp://ftp.ncbi.nlm.nih.gov/genomes/all/GCF/002/357/575/GCF_002357575.1_ASM235757v1","ftp://ftp.ncbi.nlm.nih.gov/genomes/all/GCA/002/357/575/GCA_002357575.1_ASM235757v1","SAMD00042467","PRJDB4296","GCA_002357575.1","1.56683","38.9","chromosome:NZ_AP017336.1/AP017336.1","-","1","1559","1393/331704","1/17/2017","8/29/2019","Chromosome","2017-01-18T00:00:00Z","Department of Bioscience, Faculty of Applied Bioscience, Tokyo University of Agriculture","Illumina Hiseq 2000","1340X","Abyss v. 1.3.4","1","","1","1566831","Japan","Human, Homo sapiens"
"Helicobacter pylori F210","331702","210","210.2913","","","N/A","","ftp://ftp.ncbi.nlm.nih.gov/genomes/all/GCF/002/357/535/GCF_002357535.1_ASM235753v1","ftp://ftp.ncbi.nlm.nih.gov/genomes/all/GCA/002/357/535/GCA_002357535.1_ASM235753v1","SAMD00042468","PRJDB4296","GCA_002357535.1","1.63431","38.8","chromosome:NZ_AP017334.1/AP017334.1","-","1","1607","1452/331702","1/17/2017","8/29/2019","Chromosome","2017-01-18T00:00:00Z","Department of Bioscience, Faculty of Applied Bioscience, Tokyo University of Agriculture","Illumina Hiseq 2000","1126X","Abyss v. 1.3.4","1","","1","1634312","Japan","Human, Homo sapiens"
"Helicobacter pylori F211","331703","210","210.2914","","","N/A","","ftp://ftp.ncbi.nlm.nih.gov/genomes/all/GCF/002/357/555/GCF_002357555.1_ASM235755v1","ftp://ftp.ncbi.nlm.nih.gov/genomes/all/GCA/002/357/555/GCA_002357555.1_ASM235755v1","SAMD00042469","PRJDB4296","GCA_002357555.1","1.58564","38.9","chromosome:NZ_AP017335.1/AP017335.1","-","1","1574","1413/331703","1/17/2017","8/29/2019","Chromosome","2017-01-18T00:00:00Z","Department of Bioscience, Faculty of Applied Bioscience, Tokyo University of Agriculture","Illumina Hiseq 2000","1084X","Abyss v. 1.3.4","1","","1","1585641","Japan","Human, Homo sapiens"
"Helicobacter pylori F23","331705","210","210.2916","","","N/A","","ftp://ftp.ncbi.nlm.nih.gov/genomes/all/GCF/002/357/595/GCF_002357595.1_ASM235759v1","ftp://ftp.ncbi.nlm.nih.gov/genomes/all/GCA/002/357/595/GCA_002357595.1_ASM235759v1","SAMD00042470","PRJDB4296","GCA_002357595.1","1.5587","38.9","chromosome:NZ_AP017337.1/AP017337.1","-","1","1545","1392/331705","1/17/2017","8/29/2019","Chromosome","2017-01-18T00:00:00Z","Department of Bioscience, Faculty of Applied Bioscience, Tokyo University of Agriculture","Illumina Hiseq 2000","1408X","Abyss v. 1.3.4","1","","1","1558697","Japan","Human, Homo sapiens"
"Helicobacter pylori F24","331706","210","210.2917","","","N/A","","ftp://ftp.ncbi.nlm.nih.gov/genomes/all/GCF/002/357/615/GCF_002357615.1_ASM235761v1","ftp://ftp.ncbi.nlm.nih.gov/genomes/all/GCA/002/357/615/GCA_002357615.1_ASM235761v1","SAMD00042471","PRJDB4296","GCA_002357615.1","1.57027","38.9","chromosome:NZ_AP017338.1/AP017338.1","-","1","1563","1396/331706","1/17/2017","8/29/2019","Chromosome","2017-01-18T00:00:00Z","Department of Bioscience, Faculty of Applied Bioscience, Tokyo University of Agriculture","Illumina Hiseq 2000","1222X","Abyss v. 1.3.4","1","","1","1570268","Japan","Human, Homo sapiens"
"Helicobacter pylori F28","331692","210","210.2903","","","N/A","","ftp://ftp.ncbi.nlm.nih.gov/genomes/all/GCF/002/357/335/GCF_002357335.1_ASM235733v1","ftp://ftp.ncbi.nlm.nih.gov/genomes/all/GCA/002/357/335/GCA_002357335.1_ASM235733v1","SAMD00042472","PRJDB4296","GCA_002357335.1","1.62315","38.7881","chromosome:NZ_AP017339.1/AP017339.1; plasmid pHPF28:NZ_AP017340.1/AP017340.1","-","2","1588","1410/331692","1/17/2017","8/29/2019","Chromosome","2017-01-18T00:00:00Z","Department of Bioscience, Faculty of Applied Bioscience, Tokyo University of Agriculture","Illumina Hiseq 2000","872X","Abyss v. 1.3.4","2","","2","1623154","Japan","Human, Homo sapiens"
"Helicobacter pylori F28","331692","210","210.3084","","","N/A","","ftp://ftp.ncbi.nlm.nih.gov/genomes/all/GCF/002/357/335/GCF_002357335.1_ASM235733v1","ftp://ftp.ncbi.nlm.nih.gov/genomes/all/GCA/002/357/335/GCA_002357335.1_ASM235733v1","SAMD00042472","PRJDB4296","GCA_002357335.1","1.62315","38.7881","chromosome:NZ_AP017339.1/AP017339.1; plasmid pHPF28:NZ_AP017340.1/AP017340.1","-","2","1588","1410/331692","1/17/2017","8/29/2019","Chromosome","2017-01-18T00:00:00Z","Department of Bioscience, Faculty of Applied Bioscience, Tokyo University of Agriculture","Illumina Hiseq 2000","872X","Abyss v. 1.3.4","1","","1","6417","Japan","Human, Homo sapiens"
"Helicobacter pylori F38","331693","210","210.2904","","","N/A","","ftp://ftp.ncbi.nlm.nih.gov/genomes/all/GCF/002/357/355/GCF_002357355.1_ASM235735v1","ftp://ftp.ncbi.nlm.nih.gov/genomes/all/GCA/002/357/355/GCA_002357355.1_ASM235735v1","SAMD00042473","PRJDB4296","GCA_002357355.1","1.63295","38.7882","chromosome:NZ_AP017341.1/AP017341.1; plasmid pHPF38:NZ_AP017342.1/AP017342.1","-","2","1617","1437/331693","1/17/2017","8/29/2019","Chromosome","2017-01-18T00:00:00Z","Department of Bioscience, Faculty of Applied Bioscience, Tokyo University of Agriculture","Illumina Hiseq 2000","1164X","Abyss v. 1.3.4","2","","2","1632955","Japan","Human, Homo sapiens"
"Helicobacter pylori F38","331693","210","210.3080","","","N/A","","ftp://ftp.ncbi.nlm.nih.gov/genomes/all/GCF/002/357/355/GCF_002357355.1_ASM235735v1","ftp://ftp.ncbi.nlm.nih.gov/genomes/all/GCA/002/357/355/GCA_002357355.1_ASM235735v1","SAMD00042473","PRJDB4296","GCA_002357355.1","1.63295","38.7882","chromosome:NZ_AP017341.1/AP017341.1; plasmid pHPF38:NZ_AP017342.1/AP017342.1","-","2","1617","1437/331693","1/17/2017","8/29/2019","Chromosome","2017-01-18T00:00:00Z","Department of Bioscience, Faculty of Applied Bioscience, Tokyo University of Agriculture","Illumina Hiseq 2000","1164X","Abyss v. 1.3.4","1","","1","6417","Japan","Human, Homo sapiens"
"Helicobacter pylori F51","331695","210","210.2906","","","N/A","","ftp://ftp.ncbi.nlm.nih.gov/genomes/all/GCF/002/357/395/GCF_002357395.1_ASM235739v1","ftp://ftp.ncbi.nlm.nih.gov/genomes/all/GCA/002/357/395/GCA_002357395.1_ASM235739v1","SAMD00042474","PRJDB4296","GCA_002357395.1","1.58587","38.8653","chromosome:NZ_AP017343.1/AP017343.1; plasmid pHPF51:NZ_AP017344.1/AP017344.1","-","2","1554","1395/331695","1/17/2017","8/29/2019","Chromosome","2017-01-18T00:00:00Z","Department of Bioscience, Faculty of Applied Bioscience, Tokyo University of Agriculture","Illumina Hiseq 2000","1061X","Abyss v. 1.3.4","2","","2","1585868","Japan","Human, Homo sapiens"
"Helicobacter pylori F51","331695","210","210.3083","","","N/A","","ftp://ftp.ncbi.nlm.nih.gov/genomes/all/GCF/002/357/395/GCF_002357395.1_ASM235739v1","ftp://ftp.ncbi.nlm.nih.gov/genomes/all/GCA/002/357/395/GCA_002357395.1_ASM235739v1","SAMD00042474","PRJDB4296","GCA_002357395.1","1.58587","38.8653","chromosome:NZ_AP017343.1/AP017343.1; plasmid pHPF51:NZ_AP017344.1/AP017344.1","-","2","1554","1395/331695","1/17/2017","8/29/2019","Chromosome","2017-01-18T00:00:00Z","Department of Bioscience, Faculty of Applied Bioscience, Tokyo University of Agriculture","Illumina Hiseq 2000","1061X","Abyss v. 1.3.4","1","","1","10369","Japan","Human, Homo sapiens"
"Helicobacter pylori F55","331707","210","210.2918","","","N/A","","ftp://ftp.ncbi.nlm.nih.gov/genomes/all/GCF/002/357/635/GCF_002357635.1_ASM235763v1","ftp://ftp.ncbi.nlm.nih.gov/genomes/all/GCA/002/357/635/GCA_002357635.1_ASM235763v1","SAMD00042475","PRJDB4296","GCA_002357635.1","1.62315","38.8","chromosome:NZ_AP017345.1/AP017345.1","-","1","1623","1429/331707","1/17/2017","8/29/2019","Chromosome","2017-01-18T00:00:00Z","Department of Bioscience, Faculty of Applied Bioscience, Tokyo University of Agriculture","Illumina Hiseq 2000","1189X","Abyss v. 1.3.4","1","","1","1623153","Japan","Human, Homo sapiens"
"Helicobacter pylori F63","331694","210","210.2905","","","N/A","","ftp://ftp.ncbi.nlm.nih.gov/genomes/all/GCF/002/357/375/GCF_002357375.1_ASM235737v1","ftp://ftp.ncbi.nlm.nih.gov/genomes/all/GCA/002/357/375/GCA_002357375.1_ASM235737v1","SAMD00042476","PRJDB4296","GCA_002357375.1","1.59841","38.8785","chromosome:NZ_AP017346.1/AP017346.1; plasmid pHPF63:NZ_AP017347.1/AP017347.1","-","2","1579","1401/331694","1/17/2017","8/29/2019","Chromosome","2017-01-18T00:00:00Z","Department of Bioscience, Faculty of Applied Bioscience, Tokyo University of Agriculture","Illumina Hiseq 2000","871X","Abyss v. 1.3.4","2","","2","1598408","Japan","Human, Homo sapiens"
"Helicobacter pylori F63","331694","210","210.3081","","","N/A","","ftp://ftp.ncbi.nlm.nih.gov/genomes/all/GCF/002/357/375/GCF_002357375.1_ASM235737v1","ftp://ftp.ncbi.nlm.nih.gov/genomes/all/GCA/002/357/375/GCA_002357375.1_ASM235737v1","SAMD00042476","PRJDB4296","GCA_002357375.1","1.59841","38.8785","chromosome:NZ_AP017346.1/AP017346.1; plasmid pHPF63:NZ_AP017347.1/AP017347.1","-","2","1579","1401/331694","1/17/2017","8/29/2019","Chromosome","2017-01-18T00:00:00Z","Department of Bioscience, Faculty of Applied Bioscience, Tokyo University of Agriculture","Illumina Hiseq 2000","871X","Abyss v. 1.3.4","1","","1","9824","Japan","Human, Homo sapiens"
"Helicobacter pylori F67","331708","210","210.2919","","","N/A","","ftp://ftp.ncbi.nlm.nih.gov/genomes/all/GCF/002/357/655/GCF_002357655.1_ASM235765v1","ftp://ftp.ncbi.nlm.nih.gov/genomes/all/GCA/002/357/655/GCA_002357655.1_ASM235765v1","SAMD00042477","PRJDB4296","GCA_002357655.1","1.58758","38.9","chromosome:NZ_AP017348.1/AP017348.1","-","1","1575","1391/331708","1/17/2017","8/29/2019","Chromosome","2017-01-18T00:00:00Z","Department of Bioscience, Faculty of Applied Bioscience, Tokyo University of Agriculture","Illumina Hiseq 2000","587X","Abyss v. 1.3.4","1","","1","1587581","Japan","Human, Homo sapiens"
"Helicobacter pylori F70","331709","210","210.2920","","","N/A","","ftp://ftp.ncbi.nlm.nih.gov/genomes/all/GCF/002/357/675/GCF_002357675.1_ASM235767v1","ftp://ftp.ncbi.nlm.nih.gov/genomes/all/GCA/002/357/675/GCA_002357675.1_ASM235767v1","SAMD00042478","PRJDB4296","GCA_002357675.1","1.63163","38.9","chromosome:NZ_AP017349.1/AP017349.1","-","1","1623","1454/331709","1/17/2017","8/29/2019","Chromosome","2017-01-18T00:00:00Z","Department of Bioscience, Faculty of Applied Bioscience, Tokyo University of Agriculture","Illumina Hiseq 2000","1047X","Abyss v. 1.3.4","1","","1","1631634","Japan","Human, Homo sapiens"
"Helicobacter pylori F72","331710","210","210.2921","","","N/A","","ftp://ftp.ncbi.nlm.nih.gov/genomes/all/GCF/002/357/695/GCF_002357695.1_ASM235769v1","ftp://ftp.ncbi.nlm.nih.gov/genomes/all/GCA/002/357/695/GCA_002357695.1_ASM235769v1","SAMD00042479","PRJDB4296","GCA_002357695.1","1.62576","38.8","chromosome:NZ_AP017350.1/AP017350.1","-","1","1605","1437/331710","1/17/2017","8/29/2019","Chromosome","2017-01-18T00:00:00Z","Department of Bioscience, Faculty of Applied Bioscience, Tokyo University of Agriculture","Illumina Hiseq 2000","1058X","Abyss v. 1.3.4","1","","1","1625760","Japan","Human, Homo sapiens"
"Helicobacter pylori F75","331711","210","210.2922","","","N/A","","ftp://ftp.ncbi.nlm.nih.gov/genomes/all/GCF/002/357/715/GCF_002357715.1_ASM235771v1","ftp://ftp.ncbi.nlm.nih.gov/genomes/all/GCA/002/357/715/GCA_002357715.1_ASM235771v1","SAMD00042480","PRJDB4296","GCA_002357715.1","1.62713","38.8","chromosome:NZ_AP017351.1/AP017351.1","-","1","1606","1417/331711","1/17/2017","8/29/2019","Chromosome","2017-01-18T00:00:00Z","Department of Bioscience, Faculty of Applied Bioscience, Tokyo University of Agriculture","Illumina Hiseq 2000","918X","Abyss v. 1.3.4","1","","1","1627132","Japan","Human, Homo sapiens"
"Helicobacter pylori F78","331696","210","210.2907","","","N/A","","ftp://ftp.ncbi.nlm.nih.gov/genomes/all/GCF/002/357/415/GCF_002357415.1_ASM235741v1","ftp://ftp.ncbi.nlm.nih.gov/genomes/all/GCA/002/357/415/GCA_002357415.1_ASM235741v1","SAMD00042481","PRJDB4296","GCA_002357415.1","1.65696","38.6631","chromosome:NZ_AP017352.1/AP017352.1; plasmid pHPF78:NZ_AP017353.1/AP017353.1","-","2","1629","1430/331696","1/17/2017","8/29/2019","Chromosome","2017-01-18T00:00:00Z","Department of Bioscience, Faculty of Applied Bioscience, Tokyo University of Agriculture","Illumina Hiseq 2000","1185X","Abyss v. 1.3.4","2","","2","1656962","Japan","Human, Homo sapiens"
"Helicobacter pylori F78","331696","210","210.3085","","","N/A","","ftp://ftp.ncbi.nlm.nih.gov/genomes/all/GCF/002/357/415/GCF_002357415.1_ASM235741v1","ftp://ftp.ncbi.nlm.nih.gov/genomes/all/GCA/002/357/415/GCA_002357415.1_ASM235741v1","SAMD00042481","PRJDB4296","GCA_002357415.1","1.65696","38.6631","chromosome:NZ_AP017352.1/AP017352.1; plasmid pHPF78:NZ_AP017353.1/AP017353.1","-","2","1629","1430/331696","1/17/2017","8/29/2019","Chromosome","2017-01-18T00:00:00Z","Department of Bioscience, Faculty of Applied Bioscience, Tokyo University of Agriculture","Illumina Hiseq 2000","1185X","Abyss v. 1.3.4","1","","1","12002","Japan","Human, Homo sapiens"
"Helicobacter pylori F90","331712","210","210.2923","","","N/A","","ftp://ftp.ncbi.nlm.nih.gov/genomes/all/GCF/002/357/735/GCF_002357735.1_ASM235773v1","ftp://ftp.ncbi.nlm.nih.gov/genomes/all/GCA/002/357/735/GCA_002357735.1_ASM235773v1","SAMD00042482","PRJDB4296","GCA_002357735.1","1.58812","38.9","chromosome:NZ_AP017354.1/AP017354.1","-","1","1584","1404/331712","1/17/2017","8/29/2019","Chromosome","2017-01-18T00:00:00Z","Department of Bioscience, Faculty of Applied Bioscience, Tokyo University of Agriculture","Illumina Hiseq 2000","963X","Abyss v. 1.3.4","1","","1","1588119","Japan","Human, Homo sapiens"
"Helicobacter pylori F94","331713","210","210.2924","","","N/A","","ftp://ftp.ncbi.nlm.nih.gov/genomes/all/GCF/002/357/755/GCF_002357755.1_ASM235775v1","ftp://ftp.ncbi.nlm.nih.gov/genomes/all/GCA/002/357/755/GCA_002357755.1_ASM235775v1","SAMD00042483","PRJDB4296","GCA_002357755.1","1.56617","38.9","chromosome:NZ_AP017355.1/AP017355.1","-","1","1559","1384/331713","1/17/2017","8/29/2019","Chromosome","2017-01-18T00:00:00Z","Department of Bioscience, Faculty of Applied Bioscience, Tokyo University of Agriculture","Illumina Hiseq 2000","1118X","Abyss v. 1.3.4","1","","1","1566172","Japan","Human, Homo sapiens"
"Helicobacter pylori G-Mx-2003-108","660315","210","210.6127","","","N/A","","ftp://ftp.ncbi.nlm.nih.gov/genomes/all/GCF/008/033/075/GCF_008033075.1_ASM803307v1","ftp://ftp.ncbi.nlm.nih.gov/genomes/all/GCA/008/033/075/GCA_008033075.1_ASM803307v1","SAMN09935047","PRJNA203445","GCA_008033075.1","1.68617","38.8557","chromosome:NZ_CP032044.1/CP032044.1; plasmid unnamed:NZ_CP032045.1/CP032045.1","-","2","1647","1472/660315","8/20/2019","8/22/2019","Chromosome","2019-08-20T00:00:00Z","University of California at Davis","PacBio RSII","363x","HGAP v. 15-May","1","1","2","1686171","Mexico","Homo sapiens"
"Helicobacter pylori G-Mx-2003-250","660314","210","210.6126","","","N/A","","ftp://ftp.ncbi.nlm.nih.gov/genomes/all/GCF/008/033/055/GCF_008033055.1_ASM803305v1","ftp://ftp.ncbi.nlm.nih.gov/genomes/all/GCA/008/033/055/GCA_008033055.1_ASM803305v1","SAMN09935045","PRJNA203445","GCA_008033055.1","1.67228","38.9","chromosome:NZ_CP032048.1/CP032048.1","-","1","1614","1448/660314","8/20/2019","8/22/2019","Chromosome","2019-08-20T00:00:00Z","University of California at Davis","PacBio RSII","408x","HGAP v. 15-May","1","","1","1672280","Mexico","Homo sapiens"
"Helicobacter pylori G-Mx-2003-93","660313","210","210.6125","","","N/A","","ftp://ftp.ncbi.nlm.nih.gov/genomes/all/GCF/008/033/035/GCF_008033035.1_ASM803303v1","ftp://ftp.ncbi.nlm.nih.gov/genomes/all/GCA/008/033/035/GCA_008033035.1_ASM803303v1","SAMN09935048","PRJNA203445","GCA_008033035.1","1.63268","39.1","chromosome:NZ_CP032043.1/CP032043.1","-","1","1594","1245/660313","8/20/2019","10/8/2019","Chromosome","2019-08-20T00:00:00Z","University of California at Davis","PacBio RSII","52x","HGAP v. 15-Apr","1","","1","1632682","Mexico","Homo sapiens"
"Helicobacter pylori G-Mx-2005-108","660312","210","210.6124","","","N/A","","ftp://ftp.ncbi.nlm.nih.gov/genomes/all/GCF/008/033/015/GCF_008033015.1_ASM803301v1","ftp://ftp.ncbi.nlm.nih.gov/genomes/all/GCA/008/033/015/GCA_008033015.1_ASM803301v1","SAMN09935049","PRJNA203445","GCA_008033015.1","1.65485","39","chromosome:NZ_CP032042.1/CP032042.1","-","1","1616","1446/660312","8/20/2019","8/22/2019","Chromosome","2019-08-20T00:00:00Z","University of California at Davis","PacBio RSII","354x","HGAP v. 15-May","1","","1","1654849","Mexico","Homo sapiens"
"Helicobacter pylori G-Mx-2005-337","660311","210","210.6123","","","N/A","","ftp://ftp.ncbi.nlm.nih.gov/genomes/all/GCF/008/032/995/GCF_008032995.1_ASM803299v1","ftp://ftp.ncbi.nlm.nih.gov/genomes/all/GCA/008/032/995/GCA_008032995.1_ASM803299v1","SAMN09935050","PRJNA203445","GCA_008032995.1","1.69781","38.9","chromosome:NZ_CP032041.1/CP032041.1","-","1","1681","1450/660311","8/20/2019","8/22/2019","Chromosome","2019-08-20T00:00:00Z","University of California at Davis","PacBio RSII","354x","HGAP v. 15-Apr","1","","1","1697806","Mexico","Homo sapiens"
"Helicobacter pylori G-Mx-2006-152","660310","210","210.6122","","","N/A","","ftp://ftp.ncbi.nlm.nih.gov/genomes/all/GCF/008/032/975/GCF_008032975.1_ASM803297v1","ftp://ftp.ncbi.nlm.nih.gov/genomes/all/GCA/008/032/975/GCA_008032975.1_ASM803297v1","SAMN09935051","PRJNA203445","GCA_008032975.1","1.61331","39.1","chromosome:NZ_CP032040.1/CP032040.1","-","1","1577","1421/660310","8/20/2019","8/22/2019","Chromosome","2019-08-20T00:00:00Z","University of California at Davis","PacBio RSII","340x","HGAP v. 15-May","1","","1","1613306","Mexico","Homo sapiens"
"Helicobacter pylori G-Mx-2006-46","660309","210","210.6121","","","N/A","","ftp://ftp.ncbi.nlm.nih.gov/genomes/all/GCF/008/032/955/GCF_008032955.1_ASM803295v1","ftp://ftp.ncbi.nlm.nih.gov/genomes/all/GCA/008/032/955/GCA_008032955.1_ASM803295v1","SAMN09935046","PRJNA203445","GCA_008032955.1","1.63647","38.9958","chromosome:NZ_CP032046.1/CP032046.1; plasmid unnamed:NZ_CP032047.1/CP032047.1","-","2","1603","1325/660309","8/20/2019","8/22/2019","Chromosome","2019-08-20T00:00:00Z","University of California at Davis","PacBio RSII","355x","HGAP v. 15-May","1","1","2","1636468","Mexico","Homo sapiens"
"Helicobacter pylori G-Mx-2006-583","660308","210","210.6120","","","N/A","","ftp://ftp.ncbi.nlm.nih.gov/genomes/all/GCF/008/032/935/GCF_008032935.1_ASM803293v1","ftp://ftp.ncbi.nlm.nih.gov/genomes/all/GCA/008/032/935/GCA_008032935.1_ASM803293v1","SAMN09935052","PRJNA203445","GCA_008032935.1","1.64551","39.1","chromosome:NZ_CP032039.1/CP032039.1","-","1","1620","1314/660308","8/20/2019","10/8/2019","Chromosome","2019-08-20T00:00:00Z","University of California at Davis","PacBio RSII","306x","HGAP v. 15-May","1","","1","1645512","Mexico","Homo sapiens"
"Helicobacter pylori G-Mx-2011-124","660306","210","210.6118","","","N/A","","ftp://ftp.ncbi.nlm.nih.gov/genomes/all/GCF/008/032/615/GCF_008032615.1_ASM803261v1","ftp://ftp.ncbi.nlm.nih.gov/genomes/all/GCA/008/032/615/GCA_008032615.1_ASM803261v1","SAMN09935053","PRJNA203445","GCA_008032615.1","1.66127","39","chromosome:NZ_CP032038.1/CP032038.1","-","1","1632","1422/660306","8/20/2019","8/22/2019","Chromosome","2019-08-20T00:00:00Z","University of California at Davis","PacBio RSII","370x","HGAP v. 15-Jun","1","","1","1661266","Mexico","Homo sapiens"
"Helicobacter pylori G-Mx-2011-147","660305","210","210.6117","","","N/A","","ftp://ftp.ncbi.nlm.nih.gov/genomes/all/GCF/008/032/475/GCF_008032475.1_ASM803247v1","ftp://ftp.ncbi.nlm.nih.gov/genomes/all/GCA/008/032/475/GCA_008032475.1_ASM803247v1","SAMN09935054","PRJNA203445","GCA_008032475.1","1.66733","38.9","chromosome:NZ_CP032037.1/CP032037.1","-","1","1633","1453/660305","8/20/2019","8/22/2019","Chromosome","2019-08-20T00:00:00Z","University of California at Davis","PacBio RSII","274x","HGAP v. 15-May","1","","1","1667329","Mexico","Homo sapiens"
"Helicobacter pylori Hp_TH2099","417749","210","210.5181","","","N/A","","ftp://ftp.ncbi.nlm.nih.gov/genomes/all/GCF/003/711/165/GCF_003711165.1_ASM371116v1","ftp://ftp.ncbi.nlm.nih.gov/genomes/all/GCA/003/711/165/GCA_003711165.1_ASM371116v1","SAMN08328770","PRJNA429063","GCA_003711165.1","1.6674","40","chromosome:NZ_CP025748.1/CP025748.1","-","1","1588","1282/417749","11/5/2018","11/7/2018","Chromosome","2018-11-05T00:00:00Z","The University of Tokyo","Illumina MiSeq","200.0x","Resequencing v. FEB-2017","1","","1","1667396","Japan","Macaca fuscata"
"Helicobacter pylori MKF10","331714","210","210.2925","","","N/A","","ftp://ftp.ncbi.nlm.nih.gov/genomes/all/GCF/002/357/775/GCF_002357775.1_ASM235777v1","ftp://ftp.ncbi.nlm.nih.gov/genomes/all/GCA/002/357/775/GCA_002357775.1_ASM235777v1","SAMD00042484","PRJDB4296","GCA_002357775.1","1.61776","38.8","chromosome:NZ_AP017356.1/AP017356.1","-","1","1603","1432/331714","1/17/2017","8/29/2019","Chromosome","2017-01-18T00:00:00Z","Department of Bioscience, Faculty of Applied Bioscience, Tokyo University of Agriculture","Illumina Hiseq 2000","1066X","Abyss v. 1.3.4","1","","1","1617765","Japan","Human, Homo sapiens"
"Helicobacter pylori MKF3","331715","210","210.2926","","","N/A","","ftp://ftp.ncbi.nlm.nih.gov/genomes/all/GCF/002/357/795/GCF_002357795.1_ASM235779v1","ftp://ftp.ncbi.nlm.nih.gov/genomes/all/GCA/002/357/795/GCA_002357795.1_ASM235779v1","SAMD00042485","PRJDB4296","GCA_002357795.1","1.60278","38.8","chromosome:NZ_AP017357.1/AP017357.1","-","1","1593","1435/331715","1/17/2017","8/29/2019","Chromosome","2017-01-18T00:00:00Z","Department of Bioscience, Faculty of Applied Bioscience, Tokyo University of Agriculture","Illumina Hiseq 2000","949X","Abyss v. 1.3.4","1","","1","1602776","Japan","Human, Homo sapiens"
"Helicobacter pylori MKF8","331716","210","210.2927","","","N/A","","ftp://ftp.ncbi.nlm.nih.gov/genomes/all/GCF/002/357/815/GCF_002357815.1_ASM235781v1","ftp://ftp.ncbi.nlm.nih.gov/genomes/all/GCA/002/357/815/GCA_002357815.1_ASM235781v1","SAMD00042486","PRJDB4296","GCA_002357815.1","1.59299","39","chromosome:NZ_AP017358.1/AP017358.1","-","1","1580","1398/331716","1/17/2017","8/29/2019","Chromosome","2017-01-18T00:00:00Z","Department of Bioscience, Faculty of Applied Bioscience, Tokyo University of Agriculture","Illumina Hiseq 2000","885X","Abyss v. 1.3.4","1","","1","1592987","Japan","Human, Homo sapiens"
"Helicobacter pylori MKM1","331717","210","210.2928","","","N/A","","ftp://ftp.ncbi.nlm.nih.gov/genomes/all/GCF/002/357/835/GCF_002357835.1_ASM235783v1","ftp://ftp.ncbi.nlm.nih.gov/genomes/all/GCA/002/357/835/GCA_002357835.1_ASM235783v1","SAMD00042487","PRJDB4296","GCA_002357835.1","1.56787","38.9","chromosome:NZ_AP017359.1/AP017359.1","-","1","1561","1394/331717","1/17/2017","8/29/2019","Chromosome","2017-01-18T00:00:00Z","Department of Bioscience, Faculty of Applied Bioscience, Tokyo University of Agriculture","Illumina Hiseq 2000","868X","Abyss v. 1.3.4","1","","1","1567867","Japan","Human, Homo sapiens"
"Helicobacter pylori MKM5","331691","210","210.2902","","","N/A","","ftp://ftp.ncbi.nlm.nih.gov/genomes/all/GCF/002/357/315/GCF_002357315.1_ASM235731v1","ftp://ftp.ncbi.nlm.nih.gov/genomes/all/GCA/002/357/315/GCA_002357315.1_ASM235731v1","SAMD00042488","PRJDB4296","GCA_002357315.1","1.61556","38.8786","chromosome:NZ_AP017360.1/AP017360.1; plasmid pHPMKM5:NZ_AP017361.1/AP017361.1","-","2","1601","1425/331691","1/17/2017","8/29/2019","Chromosome","2017-01-18T00:00:00Z","Department of Bioscience, Faculty of Applied Bioscience, Tokyo University of Agriculture","Illumina Hiseq 2000","1555X","Abyss v. 1.3.4","2","","2","1615564","Japan","Human, Homo sapiens"
"Helicobacter pylori MKM5","331691","210","210.3082","","","N/A","","ftp://ftp.ncbi.nlm.nih.gov/genomes/all/GCF/002/357/315/GCF_002357315.1_ASM235731v1","ftp://ftp.ncbi.nlm.nih.gov/genomes/all/GCA/002/357/315/GCA_002357315.1_ASM235731v1","SAMD00042488","PRJDB4296","GCA_002357315.1","1.61556","38.8786","chromosome:NZ_AP017360.1/AP017360.1; plasmid pHPMKM5:NZ_AP017361.1/AP017361.1","-","2","1601","1425/331691","1/17/2017","8/29/2019","Chromosome","2017-01-18T00:00:00Z","Department of Bioscience, Faculty of Applied Bioscience, Tokyo University of Agriculture","Illumina Hiseq 2000","1555X","Abyss v. 1.3.4","1","","1","9104","Japan","Human, Homo sapiens"
"Helicobacter pylori MKM6","331718","210","210.2929","","","N/A","","ftp://ftp.ncbi.nlm.nih.gov/genomes/all/GCF/002/357/855/GCF_002357855.1_ASM235785v1","ftp://ftp.ncbi.nlm.nih.gov/genomes/all/GCA/002/357/855/GCA_002357855.1_ASM235785v1","SAMD00042489","PRJDB4296","GCA_002357855.1","1.57712","38.9","chromosome:NZ_AP017362.1/AP017362.1","-","1","1557","1390/331718","1/17/2017","8/29/2019","Chromosome","2017-01-18T00:00:00Z","Department of Bioscience, Faculty of Applied Bioscience, Tokyo University of Agriculture","Illumina Hiseq 2000","1270X","Abyss v. 1.3.4","1","","1","1577123","Japan","Human, Homo sapiens"
"Helicobacter pylori USU101","605750","210","210.6049","","","N/A","","ftp://ftp.ncbi.nlm.nih.gov/genomes/all/GCF/006/874/685/GCF_006874685.1_ASM687468v1","ftp://ftp.ncbi.nlm.nih.gov/genomes/all/GCA/006/874/685/GCA_006874685.1_ASM687468v1","SAMN10182326","PRJNA494865","GCA_006874685.1","1.69583","38.8","chromosome:NZ_CP032818.1/CP032818.1","-","1","1666","1508/605750","7/11/2019","7/17/2019","Chromosome","2019-07-11T00:00:00Z","Universitat Autonoma de Barcelona","Illumina MiSeq; Illumina HiSeq","117.0x","SPAdes v. 3.10.1; Velvet v. 1.2.10","1","","1","1695835","","Homo sapiens"
"Helicobacter pylori 1089/03","214306","210","210.1344","","","N/A","","ftp://ftp.ncbi.nlm.nih.gov/genomes/all/GCF/000/802/455/GCF_000802455.1_ASM80245v1","ftp://ftp.ncbi.nlm.nih.gov/genomes/all/GCA/000/802/455/GCA_000802455.1_ASM80245v1","SAMN03151583","PRJNA265204","GCA_000802455.1","1.58716","39.1","-","JSUY01","62","1588","1423/214306","12/16/2014","3/25/2017","Scaffold","2014-12-16T00:00:00Z","National Institute of Health, Portugal","Illumina MiSeq","134.0x","Velvet v. 1.2.10","","","62","1587159","","Human, Homo sapiens"
"Helicobacter pylori 1152/04","214305","210","210.1345","","","N/A","","ftp://ftp.ncbi.nlm.nih.gov/genomes/all/GCF/000/802/445/GCF_000802445.1_ASM80244v1","ftp://ftp.ncbi.nlm.nih.gov/genomes/all/GCA/000/802/445/GCA_000802445.1_ASM80244v1","SAMN03153300","PRJNA265819","GCA_000802445.1","1.58865","39.1","-","JSUZ01","59","1586","1413/214305","12/16/2014","3/25/2017","Scaffold","2014-12-16T00:00:00Z","National Institute of Health, Portugal","Illumina MiSeq","156.0x","Velvet v. 1.2.10","","","59","1588646","","Human, Homo sapiens"
"Helicobacter pylori 1198/04","214307","210","210.1347","","","N/A","","ftp://ftp.ncbi.nlm.nih.gov/genomes/all/GCF/000/802/465/GCF_000802465.1_ASM80246v1","ftp://ftp.ncbi.nlm.nih.gov/genomes/all/GCA/000/802/465/GCA_000802465.1_ASM80246v1","SAMN03153477","PRJNA265826","GCA_000802465.1","1.61834","39","-","JSXT01","57","1596","1446/214307","12/16/2014","3/25/2017","Scaffold","2014-12-16T00:00:00Z","National Institute of Health, Portugal","Illumina MiSeq","72x","Velvet v. 1.2.10","","1","57","1618345","","Human, Homo sapiens"
"Helicobacter pylori 173/00","219517","210","210.3089","","","N/A","","ftp://ftp.ncbi.nlm.nih.gov/genomes/all/GCF/000/802/625/GCF_000802625.1_ASM80262v1","ftp://ftp.ncbi.nlm.nih.gov/genomes/all/GCA/000/802/625/GCA_000802625.1_ASM80262v1","SAMN03145647","PRJNA265112","GCA_000802625.1","1.5733","39.0923","plasmid pHPY173:NZ_CM003128.1/CM003128.1","JSXX01","79","1583","1417/219517","12/16/2014","3/25/2017","Scaffold","2015-02-10T00:00:00Z","National Institute of Health, Portugal","Illumina MiSeq","32.0x","Velvet v. 1.2.10","","1","1","4194","Portugal","Human, Homo sapiens"
"Helicobacter pylori 1786/05","219516","210","210.3091","","","N/A","","ftp://ftp.ncbi.nlm.nih.gov/genomes/all/GCF/000/802/605/GCF_000802605.1_ASM80260v1","ftp://ftp.ncbi.nlm.nih.gov/genomes/all/GCA/000/802/605/GCA_000802605.1_ASM80260v1","SAMN03153600","PRJNA265862","GCA_000802605.1","1.61997","38.9729","plasmid pHPY1786:NZ_CM003130.1/CM003130.1","JSXW01","41","1586","1440/219516","12/16/2014","3/25/2017","Scaffold","2015-02-10T00:00:00Z","National Institute of Health, Portugal","Illumina MiSeq","50.0x","Velvet v. 1.2.10","","1","1","9960","","Human, Homo sapiens"
"Helicobacter pylori 1846/05","219635","210","210.3090","","","N/A","","ftp://ftp.ncbi.nlm.nih.gov/genomes/all/GCF/000/802/645/GCF_000802645.1_ASM80264v1","ftp://ftp.ncbi.nlm.nih.gov/genomes/all/GCA/000/802/645/GCA_000802645.1_ASM80264v1","SAMN03153510","PRJNA265846","GCA_000802645.1","1.64208","38.9967","plasmid pHPY1846:NZ_CM003129.1/CM003129.1","JSXV01","58","1618","1455/219635","12/16/2014","3/25/2017","Scaffold","2015-02-10T00:00:00Z","National Institute of Health, Portugal","Illumina MiSeq","52.0x","Velvet v. 1.2.10","","1","1","3161","","Human, Homo sapiens"
"Helicobacter pylori 207/99","214308","210","210.1348","","","N/A","","ftp://ftp.ncbi.nlm.nih.gov/genomes/all/GCF/000/802/505/GCF_000802505.1_ASM80250v1","ftp://ftp.ncbi.nlm.nih.gov/genomes/all/GCA/000/802/505/GCA_000802505.1_ASM80250v1","SAMN03145759","PRJNA265160","GCA_000802505.1","1.54445","39.2","-","JSXU01","47","1529","1376/214308","12/16/2014","3/25/2017","Scaffold","2014-12-16T00:00:00Z","National Institute of Health, Portugal","Illumina MiSeq","270.0x","Velvet v. 1.2.10","","","47","1544449","","Human, Homo sapiens"
"Helicobacter pylori 228/99","219515","210","210.3088","","","N/A","","ftp://ftp.ncbi.nlm.nih.gov/genomes/all/GCF/000/802/545/GCF_000802545.1_ASM80254v1","ftp://ftp.ncbi.nlm.nih.gov/genomes/all/GCA/000/802/545/GCA_000802545.1_ASM80254v1","SAMN03153534","PRJNA265858","GCA_000802545.1","1.61967","38.9933","plasmid pHPY228:NZ_CM003127.1/CM003127.1","JSXY01","54","1616","1457/219515","12/16/2014","3/25/2017","Scaffold","2015-02-10T00:00:00Z","National Institute of Health, Portugal","Illumina MiSeq","39.0x","Velvet v. 1.2.10","","1","1","4194","","Human, Homo sapiens"
"Helicobacter pylori 3843","372686","210","210.4176","","","N/A","","ftp://ftp.ncbi.nlm.nih.gov/genomes/all/GCF/003/059/605/GCF_003059605.1_ASM305960v1","ftp://ftp.ncbi.nlm.nih.gov/genomes/all/GCA/003/059/605/GCA_003059605.1_ASM305960v1","SAMN08381228","PRJNA395900","GCA_003059605.1","1.49031","39.3","-","QBQV01","268","1563","1359/372686","4/22/2018","8/11/2019","Scaffold","2018-04-22T00:00:00Z","University of Bath","Illumina","50x","Velvet v. 1.2.08","","","268","1490309","France","Human, Homo sapiens"
"Helicobacter pylori 499/02","214309","210","210.1349","","","N/A","","ftp://ftp.ncbi.nlm.nih.gov/genomes/all/GCF/000/802/525/GCF_000802525.1_ASM80252v1","ftp://ftp.ncbi.nlm.nih.gov/genomes/all/GCA/000/802/525/GCA_000802525.1_ASM80252v1","SAMN03153403","PRJNA265824","GCA_000802525.1","1.66674","38.9","-","JTDG01","73","1672","1496/214309","12/16/2014","3/25/2017","Scaffold","2014-12-16T00:00:00Z","National Institute of Health, Portugal","Illumina MiSeq","235.0x","Velvet v. 1.2.10","","","73","1666743","","Human, Homo sapiens"
"Helicobacter pylori 633","442519","210","210.5626","","","N/A","","ftp://ftp.ncbi.nlm.nih.gov/genomes/all/GCF/004/117/945/GCF_004117945.1_ASM411794v1","ftp://ftp.ncbi.nlm.nih.gov/genomes/all/GCA/004/117/945/GCA_004117945.1_ASM411794v1","SAMN04166966","PRJNA298832","GCA_004117945.1","1.69503","38.7","-","LMXQ01","176","1684","1466/442519","1/29/2019","3/22/2019","Scaffold","2019-01-31T00:00:00Z","Institute of Molecular and Cellular Biology","Illumina GAIIx","168.0x","IRAB v. Aug-2009","","","176","1695025","Taiwan","Human, Homo sapiens"
"Helicobacter pylori 655/99","214310","210","210.1346","","","N/A","","ftp://ftp.ncbi.nlm.nih.gov/genomes/all/GCF/000/802/575/GCF_000802575.1_ASM80257v1","ftp://ftp.ncbi.nlm.nih.gov/genomes/all/GCA/000/802/575/GCA_000802575.1_ASM80257v1","SAMN03151520","PRJNA265189","GCA_000802575.1","1.61567","39","-","JSXB01","45","1597","1434/214310","12/16/2014","3/25/2017","Scaffold","2014-12-16T00:00:00Z","National Institute of Health, Portugal","Illumina MiSeq","130x","Velvet v. 1.2.10","","","45","1615666","","Human, Homo sapiens"
"Helicobacter pylori 73","372682","210","210.4197","","","N/A","","ftp://ftp.ncbi.nlm.nih.gov/genomes/all/GCF/003/059/085/GCF_003059085.1_ASM305908v1","ftp://ftp.ncbi.nlm.nih.gov/genomes/all/GCA/003/059/085/GCA_003059085.1_ASM305908v1","SAMN08381266","PRJNA395900","GCA_003059085.1","1.58418","39.2","-","QBPT01","234","1646","1453/372682","4/22/2018","8/11/2019","Scaffold","2018-04-22T00:00:00Z","University of Bath","Illumina","50x","Velvet v. 1.2.08","","","234","1584177","Sweden","Human, Homo sapiens"
"Helicobacter pylori AFR58","410962","210","210.5169","","","N/A","","ftp://ftp.ncbi.nlm.nih.gov/genomes/all/GCF/003/639/965/GCF_003639965.1_ASM363996v1","ftp://ftp.ncbi.nlm.nih.gov/genomes/all/GCA/003/639/965/GCA_003639965.1_ASM363996v1","SAMN08999398","PRJNA449871","GCA_003639965.1","1.64879","38.9","-","QEHJ01","72","1636","1490/410962","10/12/2018","8/20/2019","Scaffold","2018-10-12T00:00:00Z","Facultat de Farmacia i Ciencies de l'Alimentacio; Universitat de Barcelona","Illumina HiSeq","487x","A5-miseq v. 20160825","","","72","1648791","Spain","Human, Homo sapiens"
"Helicobacter pylori B23+S27R2:R48","372690","210","210.4164","","","N/A","","ftp://ftp.ncbi.nlm.nih.gov/genomes/all/GCF/003/060/165/GCF_003060165.1_ASM306016v1","ftp://ftp.ncbi.nlm.nih.gov/genomes/all/GCA/003/060/165/GCA_003060165.1_ASM306016v1","SAMN08381202","PRJNA395900","GCA_003060165.1","1.52472","39.3","-","QBRU01","296","1588","1390/372690","4/22/2018","8/11/2019","Scaffold","2018-04-22T00:00:00Z","University of Bath","Illumina","50x","Velvet v. 1.2.08","","","296","1524717","France","Human, Homo sapiens"
"Helicobacter pylori B24","372689","210","210.4165","","","N/A","","ftp://ftp.ncbi.nlm.nih.gov/genomes/all/GCF/003/060/085/GCF_003060085.1_ASM306008v1","ftp://ftp.ncbi.nlm.nih.gov/genomes/all/GCA/003/060/085/GCA_003060085.1_ASM306008v1","SAMN08381203","PRJNA395900","GCA_003060085.1","1.62951","39","-","QBRT01","164","1645","1435/372689","4/22/2018","8/11/2019","Scaffold","2018-04-22T00:00:00Z","University of Bath","Illumina","50x","Velvet v. 1.2.08","","","164","1629509","France","Human, Homo sapiens"
"Helicobacter pylori B26","372685","210","210.4180","","","N/A","","ftp://ftp.ncbi.nlm.nih.gov/genomes/all/GCF/003/059/525/GCF_003059525.1_ASM305952v1","ftp://ftp.ncbi.nlm.nih.gov/genomes/all/GCA/003/059/525/GCA_003059525.1_ASM305952v1","SAMN08381205","PRJNA395900","GCA_003059525.1","1.61546","39","-","QBRR01","120","1598","1443/372685","4/22/2018","8/11/2019","Scaffold","2018-04-22T00:00:00Z","University of Bath","Illumina","50x","Velvet v. 1.2.08","","","120","1615460","France","Human, Homo sapiens"
"Helicobacter pylori B297","410961","210","210.5168","","","N/A","","ftp://ftp.ncbi.nlm.nih.gov/genomes/all/GCF/003/639/935/GCF_003639935.1_ASM363993v1","ftp://ftp.ncbi.nlm.nih.gov/genomes/all/GCA/003/639/935/GCA_003639935.1_ASM363993v1","SAMN08999402","PRJNA449871","GCA_003639935.1","1.66887","38.8","-","QEHF01","62","1645","1487/410961","10/12/2018","8/20/2019","Scaffold","2018-10-12T00:00:00Z","Facultat de Farmacia i Ciencies de l'Alimentacio; Universitat de Barcelona","Illumina HiSeq","754x","A5-miseq v. 20160825","","","62","1668869","Spain","Human, Homo sapiens"
"Helicobacter pylori B335","410951","210","210.5139","","","N/A","","ftp://ftp.ncbi.nlm.nih.gov/genomes/all/GCF/003/639/365/GCF_003639365.1_ASM363936v1","ftp://ftp.ncbi.nlm.nih.gov/genomes/all/GCA/003/639/365/GCA_003639365.1_ASM363936v1","SAMN08981258","PRJNA449871","GCA_003639365.1","1.62255","39","-","QDJT01","66","1666","1486/410951","10/12/2018","8/20/2019","Scaffold","2018-10-12T00:00:00Z","Facultat de Farmacia i Ciencies de l'Alimentacio; Universitat de Barcelona","Illumina HiSeq","715x","A5-miseq v. 20160825","","","66","1622555","Spain","Human, Homo sapiens"
"Helicobacter pylori B345","410960","210","210.5166","","","N/A","","ftp://ftp.ncbi.nlm.nih.gov/genomes/all/GCF/003/639/905/GCF_003639905.1_ASM363990v1","ftp://ftp.ncbi.nlm.nih.gov/genomes/all/GCA/003/639/905/GCA_003639905.1_ASM363990v1","SAMN08999405","PRJNA449871","GCA_003639905.1","1.63882","38.9","-","QEHC01","46","1642","1468/410960","10/12/2018","8/20/2019","Scaffold","2018-10-12T00:00:00Z","Facultat de Farmacia i Ciencies de l'Alimentacio; Universitat de Barcelona","Illumina MiSeq","250x","A5-miseq v. 20160825","","","46","1638825","Spain","Human, Homo sapiens"
"Helicobacter pylori B355","410950","210","210.5138","","","N/A","","ftp://ftp.ncbi.nlm.nih.gov/genomes/all/GCF/003/639/335/GCF_003639335.1_ASM363933v1","ftp://ftp.ncbi.nlm.nih.gov/genomes/all/GCA/003/639/335/GCA_003639335.1_ASM363933v1","SAMN08981259","PRJNA449871","GCA_003639335.1","1.66063","38.9","-","QDJS01","61","1642","1482/410950","10/12/2018","8/20/2019","Scaffold","2018-10-12T00:00:00Z","Facultat de Farmacia i Ciencies de l'Alimentacio; Universitat de Barcelona","Illumina HiSeq","474x","A5-miseq v. 20160825","","","61","1660633","Spain","Human, Homo sapiens"
"Helicobacter pylori B360","410959","210","210.5165","","","N/A","","ftp://ftp.ncbi.nlm.nih.gov/genomes/all/GCF/003/639/865/GCF_003639865.1_ASM363986v1","ftp://ftp.ncbi.nlm.nih.gov/genomes/all/GCA/003/639/865/GCA_003639865.1_ASM363986v1","SAMN08999406","PRJNA449871","GCA_003639865.1","1.64028","38.8","-","QEHB01","46","1615","1460/410959","10/12/2018","8/20/2019","Scaffold","2018-10-12T00:00:00Z","Facultat de Farmacia i Ciencies de l'Alimentacio; Universitat de Barcelona","Illumina HiSeq","646x","A5-miseq v. 20160825","","","46","1640283","Spain","Human, Homo sapiens"
"Helicobacter pylori B368","410965","210","210.5175","","","N/A","","ftp://ftp.ncbi.nlm.nih.gov/genomes/all/GCF/003/640/085/GCF_003640085.1_ASM364008v1","ftp://ftp.ncbi.nlm.nih.gov/genomes/all/GCA/003/640/085/GCA_003640085.1_ASM364008v1","SAMN08999409","PRJNA449871","GCA_003640085.1","1.66356","38.8","-","QEGY01","77","1663","1524/410965","10/12/2018","8/20/2019","Scaffold","2018-10-12T00:00:00Z","Facultat de Farmacia i Ciencies de l'Alimentacio; Universitat de Barcelona","Illumina HiSeq","628x","A5-miseq v. 20160825","","","77","1663557","Spain","Human, Homo sapiens"
"Helicobacter pylori B37","372684","210","210.4182","","","N/A","","ftp://ftp.ncbi.nlm.nih.gov/genomes/all/GCF/003/059/485/GCF_003059485.1_ASM305948v1","ftp://ftp.ncbi.nlm.nih.gov/genomes/all/GCA/003/059/485/GCA_003059485.1_ASM305948v1","SAMN08381210","PRJNA395900","GCA_003059485.1","1.5379","39.3","-","QBRM01","342","1603","1410/372684","4/22/2018","8/11/2019","Scaffold","2018-04-22T00:00:00Z","University of Bath","Illumina","50x","Velvet v. 1.2.08","","","342","1537897","France","Human, Homo sapiens"
"Helicobacter pylori B373","410952","210","210.5146","","","N/A","","ftp://ftp.ncbi.nlm.nih.gov/genomes/all/GCF/003/639/525/GCF_003639525.1_ASM363952v1","ftp://ftp.ncbi.nlm.nih.gov/genomes/all/GCA/003/639/525/GCA_003639525.1_ASM363952v1","SAMN08981260","PRJNA449871","GCA_003639525.1","1.66808","38.9","-","QDJR01","72","1664","1498/410952","10/12/2018","8/20/2019","Scaffold","2018-10-12T00:00:00Z","Facultat de Farmacia i Ciencies de l'Alimentacio; Universitat de Barcelona","Illumina HiSeq","746x","A5-miseq v. 20160825","","","72","1668084","Spain","Human, Homo sapiens"
"Helicobacter pylori B448","410964","210","210.5174","","","N/A","","ftp://ftp.ncbi.nlm.nih.gov/genomes/all/GCF/003/640/055/GCF_003640055.1_ASM364005v1","ftp://ftp.ncbi.nlm.nih.gov/genomes/all/GCA/003/640/055/GCA_003640055.1_ASM364005v1","SAMN08999411","PRJNA449871","GCA_003640055.1","1.66043","38.9","-","QEGW01","71","1655","1493/410964","10/12/2018","8/20/2019","Scaffold","2018-10-12T00:00:00Z","Facultat de Farmacia i Ciencies de l'Alimentacio; Universitat de Barcelona","Illumina HiSeq","554x","A5-miseq v. 20160825","","","71","1660426","Spain","Human, Homo sapiens"
"Helicobacter pylori B455","410958","210","210.5160","","","N/A","","ftp://ftp.ncbi.nlm.nih.gov/genomes/all/GCF/003/639/785/GCF_003639785.1_ASM363978v1","ftp://ftp.ncbi.nlm.nih.gov/genomes/all/GCA/003/639/785/GCA_003639785.1_ASM363978v1","SAMN08999412","PRJNA449871","GCA_003639785.1","1.6296","38.9","-","QEGV01","58","1622","1460/410958","10/12/2018","8/20/2019","Scaffold","2018-10-12T00:00:00Z","Facultat de Farmacia i Ciencies de l'Alimentacio; Universitat de Barcelona","Illumina HiSeq","483x","A5-miseq v. 20160825","","","58","1629598","Spain","Human, Homo sapiens"
"Helicobacter pylori B529A","410949","210","210.5136","","","N/A","","ftp://ftp.ncbi.nlm.nih.gov/genomes/all/GCF/003/639/305/GCF_003639305.1_ASM363930v1","ftp://ftp.ncbi.nlm.nih.gov/genomes/all/GCA/003/639/305/GCA_003639305.1_ASM363930v1","SAMN08981267","PRJNA449871","GCA_003639305.1","1.66709","38.7","-","QDJK01","51","1638","1500/410949","10/12/2018","8/20/2019","Scaffold","2018-10-12T00:00:00Z","Facultat de Farmacia i Ciencies de l'Alimentacio; Universitat de Barcelona","Illumina HiSeq","703x","A5-miseq v. 20160825","","","51","1667087","Spain","Human, Homo sapiens"
"Helicobacter pylori B547F","410948","210","210.5135","","","N/A","","ftp://ftp.ncbi.nlm.nih.gov/genomes/all/GCF/003/639/285/GCF_003639285.1_ASM363928v1","ftp://ftp.ncbi.nlm.nih.gov/genomes/all/GCA/003/639/285/GCA_003639285.1_ASM363928v1","SAMN08981268","PRJNA449871","GCA_003639285.1","1.67172","38.8","-","QDJJ01","66","1660","1499/410948","10/12/2018","8/20/2019","Scaffold","2018-10-12T00:00:00Z","Facultat de Farmacia i Ciencies de l'Alimentacio; Universitat de Barcelona","Illumina HiSeq","735x","A5-miseq v. 20160825","","","66","1671715","Spain","Human, Homo sapiens"
"Helicobacter pylori B659-C2","410947","210","210.5132","","","N/A","","ftp://ftp.ncbi.nlm.nih.gov/genomes/all/GCF/003/639/215/GCF_003639215.1_ASM363921v1","ftp://ftp.ncbi.nlm.nih.gov/genomes/all/GCA/003/639/215/GCA_003639215.1_ASM363921v1","SAMN08981273","PRJNA449871","GCA_003639215.1","1.56814","39.2","-","QDJE01","42","1557","1417/410947","10/12/2018","8/20/2019","Scaffold","2018-10-12T00:00:00Z","Facultat de Farmacia i Ciencies de l'Alimentacio; Universitat de Barcelona","Illumina MiSeq","360x","A5-miseq v. 20160825","","","42","1568140","Spain","Human, Homo sapiens"
"Helicobacter pylori B661A","410963","210","210.5171","","","N/A","","ftp://ftp.ncbi.nlm.nih.gov/genomes/all/GCF/003/639/995/GCF_003639995.1_ASM363999v1","ftp://ftp.ncbi.nlm.nih.gov/genomes/all/GCA/003/639/995/GCA_003639995.1_ASM363999v1","SAMN08999417","PRJNA449871","GCA_003639995.1","1.65362","38.8","-","QEGQ01","61","1658","1482/410963","10/12/2018","8/20/2019","Scaffold","2018-10-12T00:00:00Z","Facultat de Farmacia i Ciencies de l'Alimentacio; Universitat de Barcelona","Illumina HiSeq","576x","A5-miseq v. 20160825","","","61","1653624","Spain","Human, Homo sapiens"
"Helicobacter pylori B679","410957","210","210.5159","","","N/A","","ftp://ftp.ncbi.nlm.nih.gov/genomes/all/GCF/003/639/745/GCF_003639745.1_ASM363974v1","ftp://ftp.ncbi.nlm.nih.gov/genomes/all/GCA/003/639/745/GCA_003639745.1_ASM363974v1","SAMN08999418","PRJNA449871","GCA_003639745.1","1.66015","38.9","-","QEGP01","52","1659","1517/410957","10/12/2018","8/20/2019","Scaffold","2018-10-12T00:00:00Z","Facultat de Farmacia i Ciencies de l'Alimentacio; Universitat de Barcelona","Illumina HiSeq","696x","A5-miseq v. 20160825","","","52","1660154","Spain","Human, Homo sapiens"
"Helicobacter pylori ECF139-B065","410956","210","210.5157","","","N/A","","ftp://ftp.ncbi.nlm.nih.gov/genomes/all/GCF/003/639/725/GCF_003639725.1_ASM363972v1","ftp://ftp.ncbi.nlm.nih.gov/genomes/all/GCA/003/639/725/GCA_003639725.1_ASM363972v1","SAMN08999422","PRJNA449871","GCA_003639725.1","1.66176","38.9","-","QEGL01","59","1639","1482/410956","10/12/2018","8/20/2019","Scaffold","2018-10-12T00:00:00Z","Facultat de Farmacia i Ciencies de l'Alimentacio; Universitat de Barcelona","Illumina HiSeq","540x","A5-miseq v. 20160825","","","59","1661759","Spain","Human, Homo sapiens"
"Helicobacter pylori GAM117Ai","299778","1159026","1159026.3","","GCF_000455765-HMP","N/A","","ftp://ftp.ncbi.nlm.nih.gov/genomes/all/GCF/000/455/765/GCF_000455765.1_ASM45576v1","ftp://ftp.ncbi.nlm.nih.gov/genomes/all/GCA/000/455/765/GCA_000455765.1_ASM45576v1","SAMN02436822","PRJNA89223","GCA_000455765.1","1.64473","39.2","-","AWER01","60","1626","1441/299778","8/28/2013","3/24/2017","Scaffold","2013-08-28T00:00:00Z","Washington University","Illumina","90x","Velvet v. 1.1.06","","","98","1643967","","Human, Homo sapiens"
"Helicobacter pylori GC11-HL","372683","210","210.4185","","","N/A","","ftp://ftp.ncbi.nlm.nih.gov/genomes/all/GCF/003/059/405/GCF_003059405.1_ASM305940v1","ftp://ftp.ncbi.nlm.nih.gov/genomes/all/GCA/003/059/405/GCA_003059405.1_ASM305940v1","SAMN08381216","PRJNA395900","GCA_003059405.1","1.574","39.1","-","QBRG01","219","1608","1420/372683","4/22/2018","8/11/2019","Scaffold","2018-04-22T00:00:00Z","University of Bath","Illumina","50x","Velvet v. 1.2.08","","","219","1573996","France","Human, Homo sapiens"
"Helicobacter pylori GC27-HL","372687","210","210.4170","","","N/A","","ftp://ftp.ncbi.nlm.nih.gov/genomes/all/GCF/003/059/905/GCF_003059905.1_ASM305990v1","ftp://ftp.ncbi.nlm.nih.gov/genomes/all/GCA/003/059/905/GCA_003059905.1_ASM305990v1","SAMN08381219","PRJNA395900","GCA_003059905.1","1.6268","38.9","-","QBRD01","173","1656","1452/372687","4/22/2018","8/11/2019","Scaffold","2018-04-22T00:00:00Z","University of Bath","Illumina","50x","Velvet v. 1.2.08","","","173","1626803","France","Human, Homo sapiens"
"Helicobacter pylori GC43-HL","372688","210","210.4169","","","N/A","","ftp://ftp.ncbi.nlm.nih.gov/genomes/all/GCF/003/059/925/GCF_003059925.1_ASM305992v1","ftp://ftp.ncbi.nlm.nih.gov/genomes/all/GCA/003/059/925/GCA_003059925.1_ASM305992v1","SAMN08381222","PRJNA395900","GCA_003059925.1","1.61332","39","-","QBRB01","172","1649","1475/372688","4/22/2018","8/11/2019","Scaffold","2018-04-22T00:00:00Z","University of Bath","Illumina","50x","Velvet v. 1.2.08","","","172","1613318","France","Human, Homo sapiens"
"Helicobacter pylori GIL237","372691","210","210.4174","","","N/A","","-","ftp://ftp.ncbi.nlm.nih.gov/genomes/all/GCA/003/059/635/GCA_003059635.1_ASM305963v1","SAMN08381230","PRJNA395900","GCA_003059635.1","1.54442","39.1","-","QBQT01","547","1781","1661/372691","4/22/2018","4/22/2018","Scaffold","2018-04-22T00:00:00Z","University of Bath","Illumina","50x","Velvet v. 1.2.08","","","547","1544415","France","Human, Homo sapiens"
"Helicobacter pylori HLJHP193","163593","1213457","1213457.3","","","N/A","","ftp://ftp.ncbi.nlm.nih.gov/genomes/all/GCF/000/287/835/GCF_000287835.1_ASM28783v1","ftp://ftp.ncbi.nlm.nih.gov/genomes/all/GCA/000/287/835/GCA_000287835.1_ASM28783v1","SAMN02469498","PRJNA171124","GCA_000287835.1","1.56933","39","-","ALJI01","10","1555","1385/163593","8/13/2012","11/24/2017","Scaffold","2012-08-13T00:00:00Z","BGI-shenzhen","Illumina HiSeq 2000","120.0x","SOAPdenovo v. 1.05","","","55","1552322","China","Human, Homo sapiens"
"Helicobacter pylori HLJHP253","163592","1214223","1214223.3","","","N/A","","ftp://ftp.ncbi.nlm.nih.gov/genomes/all/GCF/000/287/775/GCF_000287775.1_H_pylori_HLJHP253_v1.0","ftp://ftp.ncbi.nlm.nih.gov/genomes/all/GCA/000/287/775/GCA_000287775.1_H_pylori_HLJHP253_v1.0","SAMN02469499","PRJNA171211","GCA_000287775.1","1.5896","38.8","-","ALKC01","11","1581","1417/163592","8/13/2012","11/24/2017","Scaffold","2012-08-13T00:00:00Z","BGI-shenzhen","Illumina HiSeq","120.0x","SOAPdenovo v. 1.3","","","20","1587316","China","Human, Homo sapiens"
"Helicobacter pylori HLJHP256","163590","1214221","1214221.3","","","N/A","","ftp://ftp.ncbi.nlm.nih.gov/genomes/all/GCF/000/287/735/GCF_000287735.1_H_pylori_HLJHP256_v1.0","ftp://ftp.ncbi.nlm.nih.gov/genomes/all/GCA/000/287/735/GCA_000287735.1_H_pylori_HLJHP256_v1.0","SAMN02469501","PRJNA171208","GCA_000287735.1","1.57641","39","-","ALKA01","14","1552","1388/163590","8/13/2012","11/24/2017","Scaffold","2012-08-13T00:00:00Z","BGI-shenzhen","Illumina HiSeq","120.0x","SOAPdenovo v. 1.05","","","40","1561171","China","Human, Homo sapiens"
"Helicobacter pylori HLJHP271","163591","1214222","1214222.3","","","N/A","","ftp://ftp.ncbi.nlm.nih.gov/genomes/all/GCF/000/287/755/GCF_000287755.1_H_pylori_HLJHP271_v1.0","ftp://ftp.ncbi.nlm.nih.gov/genomes/all/GCA/000/287/755/GCA_000287755.1_H_pylori_HLJHP271_v1.0","SAMN02469502","PRJNA171210","GCA_000287755.1","1.58823","38.9","-","ALKB01","11","1599","1426/163591","8/13/2012","11/24/2017","Scaffold","2012-08-13T00:00:00Z","BGI-shenzhen","Illumina HiSeq","120.0x","SOAPdenovo v. 1.05","","","43","1571832","China","Human, Homo sapiens"
"Helicobacter pylori JDX15","410955","210","210.5153","","","N/A","","ftp://ftp.ncbi.nlm.nih.gov/genomes/all/GCF/003/639/635/GCF_003639635.1_ASM363963v1","ftp://ftp.ncbi.nlm.nih.gov/genomes/all/GCA/003/639/635/GCA_003639635.1_ASM363963v1","SAMN08999423","PRJNA449871","GCA_003639635.1","1.60776","39","-","QEGK01","54","1590","1447/410955","10/12/2018","8/20/2019","Scaffold","2018-10-12T00:00:00Z","Facultat de Farmacia i Ciencies de l'Alimentacio; Universitat de Barcelona","Illumina HiSeq","519x","A5-miseq v. 20160825","","","54","1607760","Spain","Human, Homo sapiens"
"Helicobacter pylori JMM43","410954","210","210.5152","","","N/A","","ftp://ftp.ncbi.nlm.nih.gov/genomes/all/GCF/003/639/615/GCF_003639615.1_ASM363961v1","ftp://ftp.ncbi.nlm.nih.gov/genomes/all/GCA/003/639/615/GCA_003639615.1_ASM363961v1","SAMN08999425","PRJNA449871","GCA_003639615.1","1.61239","38.9","-","QEGI01","52","1611","1471/410954","10/12/2018","8/20/2019","Scaffold","2018-10-12T00:00:00Z","Facultat de Farmacia i Ciencies de l'Alimentacio; Universitat de Barcelona","Illumina HiSeq","461x","A5-miseq v. 20160825","","","52","1612392","Spain","Human, Homo sapiens"
"Helicobacter pylori JSS185-B120","410953","210","210.5151","","","N/A","","ftp://ftp.ncbi.nlm.nih.gov/genomes/all/GCF/003/639/605/GCF_003639605.1_ASM363960v1","ftp://ftp.ncbi.nlm.nih.gov/genomes/all/GCA/003/639/605/GCA_003639605.1_ASM363960v1","SAMN08999426","PRJNA449871","GCA_003639605.1","1.63463","38.9","-","QEGH01","66","1633","1476/410953","10/12/2018","8/20/2019","Scaffold","2018-10-12T00:00:00Z","Facultat de Farmacia i Ciencies de l'Alimentacio; Universitat de Barcelona","Illumina HiSeq","514x","A5-miseq v. 20160825","","","66","1634632","Spain","Human, Homo sapiens"
"Helicobacter pylori K21","454338","210","210.5632","","","N/A","","ftp://ftp.ncbi.nlm.nih.gov/genomes/all/GCF/004/307/235/GCF_004307235.1_ASM430723v1","ftp://ftp.ncbi.nlm.nih.gov/genomes/all/GCA/004/307/235/GCA_004307235.1_ASM430723v1","SAMD00019958","PRJDB3134","GCA_004307235.1","1.60128","38.9","-","BEGT01","34","1589","1443/454338","1/30/2019","2/28/2019","Scaffold","2019-01-30T00:00:00Z","Tokyo University of Agriculture","Illumina HiSeq 2500","360X","Abyss v. 3.1.0","","","34","1601277","","Human, Homo sapiens"
"Helicobacter pylori K22","454339","210","210.5633","","","N/A","","ftp://ftp.ncbi.nlm.nih.gov/genomes/all/GCF/004/307/275/GCF_004307275.1_ASM430727v1","ftp://ftp.ncbi.nlm.nih.gov/genomes/all/GCA/004/307/275/GCA_004307275.1_ASM430727v1","SAMD00019959","PRJDB3134","GCA_004307275.1","1.7164","38.9","-","BEGU01","31","1711","1535/454339","1/30/2019","2/28/2019","Scaffold","2019-01-30T00:00:00Z","Tokyo University of Agriculture","Illumina HiSeq 2500","730X","Abyss v. 3.1.0","","","31","1716397","","Human, Homo sapiens"
"Helicobacter pylori K25","454340","210","210.5634","","","N/A","","ftp://ftp.ncbi.nlm.nih.gov/genomes/all/GCF/004/307/295/GCF_004307295.1_ASM430729v1","ftp://ftp.ncbi.nlm.nih.gov/genomes/all/GCA/004/307/295/GCA_004307295.1_ASM430729v1","SAMD00019962","PRJDB3134","GCA_004307295.1","1.70413","38.6","-","BEGV01","49","1660","1478/454340","1/30/2019","2/28/2019","Scaffold","2019-01-30T00:00:00Z","Tokyo University of Agriculture","Illumina HiSeq 2500","703X","Abyss v. 3.1.0","","","49","1704131","","Human, Homo sapiens"
"Helicobacter pylori KH0001","592641","210","210.6038","","","N/A","","ftp://ftp.ncbi.nlm.nih.gov/genomes/all/GCF/006/440/325/GCF_006440325.1_ASM644032v1","ftp://ftp.ncbi.nlm.nih.gov/genomes/all/GCA/006/440/325/GCA_006440325.1_ASM644032v1","SAMN12011799","PRJNA547954","GCA_006440325.1","1.58877","39","-","VEZR01","50","1578","1436/592641","6/24/2019","6/28/2019","Scaffold","2019-06-24T00:00:00Z","Oita university","Illumina MiSeq","18x","SPAdes v. 3.12.0","","","50","1588767","Cambodia","Homo sapiens"
"Helicobacter pylori KH0012","592638","210","210.6033","","","N/A","","ftp://ftp.ncbi.nlm.nih.gov/genomes/all/GCF/006/440/225/GCF_006440225.1_ASM644022v1","ftp://ftp.ncbi.nlm.nih.gov/genomes/all/GCA/006/440/225/GCA_006440225.1_ASM644022v1","SAMN12011800","PRJNA547954","GCA_006440225.1","1.58124","38.8","-","VEZQ01","48","1576","1421/592638","6/24/2019","6/28/2019","Scaffold","2019-06-24T00:00:00Z","Oita university","Illumina MiSeq","3x","SPAdes v. 3.12.0","","","48","1581240","Cambodia","Homo sapiens"
"Helicobacter pylori KH0016","592639","210","210.6034","","","N/A","","ftp://ftp.ncbi.nlm.nih.gov/genomes/all/GCF/006/440/245/GCF_006440245.1_ASM644024v1","ftp://ftp.ncbi.nlm.nih.gov/genomes/all/GCA/006/440/245/GCA_006440245.1_ASM644024v1","SAMN12011801","PRJNA547954","GCA_006440245.1","1.60917","38.8","-","VEZP01","43","1600","1441/592639","6/24/2019","6/28/2019","Scaffold","2019-06-24T00:00:00Z","Oita university","Illumina MiSeq","4x","SPAdes v. 3.12.0","","","43","1609166","Cambodia","Homo sapiens"
"Helicobacter pylori KH0033","592632","210","210.6013","","","N/A","","ftp://ftp.ncbi.nlm.nih.gov/genomes/all/GCF/006/439/815/GCF_006439815.1_ASM643981v1","ftp://ftp.ncbi.nlm.nih.gov/genomes/all/GCA/006/439/815/GCA_006439815.1_ASM643981v1","SAMN12011806","PRJNA547954","GCA_006439815.1","1.63009","38.7","-","VEZK01","69","1630","1466/592632","6/24/2019","6/28/2019","Scaffold","2019-06-24T00:00:00Z","Oita university","Illumina MiSeq","3x","SPAdes v. 3.12.0","","","69","1630094","Cambodia","Homo sapiens"
"Helicobacter pylori KH0072","592637","210","210.6029","","","N/A","","ftp://ftp.ncbi.nlm.nih.gov/genomes/all/GCF/006/440/145/GCF_006440145.1_ASM644014v1","ftp://ftp.ncbi.nlm.nih.gov/genomes/all/GCA/006/440/145/GCA_006440145.1_ASM644014v1","SAMN12011815","PRJNA547954","GCA_006440145.1","1.65673","38.7","-","VEZB01","36","1635","1463/592637","6/24/2019","6/28/2019","Scaffold","2019-06-24T00:00:00Z","Oita university","Illumina MiSeq","14x","SPAdes v. 3.12.0","","","36","1656729","Cambodia","Homo sapiens"
"Helicobacter pylori KH0092","592634","210","210.6022","","","N/A","","ftp://ftp.ncbi.nlm.nih.gov/genomes/all/GCF/006/440/005/GCF_006440005.1_ASM644000v1","ftp://ftp.ncbi.nlm.nih.gov/genomes/all/GCA/006/440/005/GCA_006440005.1_ASM644000v1","SAMN12011818","PRJNA547954","GCA_006440005.1","1.63565","38.8","-","VEYY01","45","1627","1479/592634","6/24/2019","6/28/2019","Scaffold","2019-06-24T00:00:00Z","Oita university","Illumina MiSeq","17x","SPAdes v. 3.12.0","","","45","1635651","Cambodia","Homo sapiens"
"Helicobacter pylori KH0106","592633","210","210.6021","","","N/A","","ftp://ftp.ncbi.nlm.nih.gov/genomes/all/GCF/006/439/995/GCF_006439995.1_ASM643999v1","ftp://ftp.ncbi.nlm.nih.gov/genomes/all/GCA/006/439/995/GCA_006439995.1_ASM643999v1","SAMN12011821","PRJNA547954","GCA_006439995.1","1.62836","38.7","-","VEYV01","42","1617","1458/592633","6/24/2019","6/28/2019","Scaffold","2019-06-24T00:00:00Z","Oita university","Illumina MiSeq","19x","SPAdes v. 3.12.0","","","42","1628359","Cambodia","Homo sapiens"
"Helicobacter pylori KH0119","592636","210","210.6026","","","N/A","","ftp://ftp.ncbi.nlm.nih.gov/genomes/all/GCF/006/440/095/GCF_006440095.1_ASM644009v1","ftp://ftp.ncbi.nlm.nih.gov/genomes/all/GCA/006/440/095/GCA_006440095.1_ASM644009v1","SAMN12011824","PRJNA547954","GCA_006440095.1","1.59943","39","-","VEYS01","43","1576","1424/592636","6/24/2019","6/28/2019","Scaffold","2019-06-24T00:00:00Z","Oita university","Illumina MiSeq","18x","SPAdes v. 3.12.0","","","43","1599435","Cambodia","Homo sapiens"
"Helicobacter pylori KH0141","592631","210","210.6012","","","N/A","","ftp://ftp.ncbi.nlm.nih.gov/genomes/all/GCF/006/439/795/GCF_006439795.1_ASM643979v1","ftp://ftp.ncbi.nlm.nih.gov/genomes/all/GCA/006/439/795/GCA_006439795.1_ASM643979v1","SAMN12011831","PRJNA547954","GCA_006439795.1","1.60067","39","-","VEYL01","36","1594","1441/592631","6/24/2019","6/28/2019","Scaffold","2019-06-24T00:00:00Z","Oita university","Illumina MiSeq","19x","SPAdes v. 3.12.0","","","36","1600673","Cambodia","Homo sapiens"
"Helicobacter pylori KH0149","592630","210","210.6004","","","N/A","","ftp://ftp.ncbi.nlm.nih.gov/genomes/all/GCF/006/439/645/GCF_006439645.1_ASM643964v1","ftp://ftp.ncbi.nlm.nih.gov/genomes/all/GCA/006/439/645/GCA_006439645.1_ASM643964v1","SAMN12011834","PRJNA547954","GCA_006439645.1","1.6011","38.7","-","VEYI01","23","1601","1453/592630","6/24/2019","6/28/2019","Scaffold","2019-06-24T00:00:00Z","Oita university","Illumina MiSeq","13x","SPAdes v. 3.12.0","","","23","1601103","Cambodia","Homo sapiens"
"Helicobacter pylori KH0153","592635","210","210.6025","","","N/A","","ftp://ftp.ncbi.nlm.nih.gov/genomes/all/GCF/006/440/055/GCF_006440055.1_ASM644005v1","ftp://ftp.ncbi.nlm.nih.gov/genomes/all/GCA/006/440/055/GCA_006440055.1_ASM644005v1","SAMN12011835","PRJNA547954","GCA_006440055.1","1.61303","38.7","-","VEYH01","33","1601","1463/592635","6/24/2019","6/28/2019","Scaffold","2019-06-24T00:00:00Z","Oita university","Illumina MiSeq","13x","SPAdes v. 3.12.0","","","33","1613034","Cambodia","Homo sapiens"
"Helicobacter pylori KH0156","592640","210","210.6037","","","N/A","","ftp://ftp.ncbi.nlm.nih.gov/genomes/all/GCF/006/440/315/GCF_006440315.1_ASM644031v1","ftp://ftp.ncbi.nlm.nih.gov/genomes/all/GCA/006/440/315/GCA_006440315.1_ASM644031v1","SAMN12011836","PRJNA547954","GCA_006440315.1","1.57916","38.8","-","VEYG01","32","1567","1430/592640","6/24/2019","6/28/2019","Scaffold","2019-06-24T00:00:00Z","Oita university","Illumina MiSeq","32x","SPAdes v. 3.12.0","","","32","1579158","Cambodia","Homo sapiens"
"Helicobacter pylori KH0159","592628","210","210.6002","","","N/A","","ftp://ftp.ncbi.nlm.nih.gov/genomes/all/GCF/006/438/625/GCF_006438625.1_ASM643862v1","ftp://ftp.ncbi.nlm.nih.gov/genomes/all/GCA/006/438/625/GCA_006438625.1_ASM643862v1","SAMN12011838","PRJNA547954","GCA_006438625.1","1.60359","39","-","VEYE01","40","1583","1442/592628","6/24/2019","6/28/2019","Scaffold","2019-06-24T00:00:00Z","Oita university","Illumina MiSeq","43x","SPAdes v. 3.12.0","","","40","1603585","Cambodia","Homo sapiens"
"Helicobacter pylori KH0165","592624","210","210.5998","","","N/A","","ftp://ftp.ncbi.nlm.nih.gov/genomes/all/GCF/006/438/525/GCF_006438525.1_ASM643852v1","ftp://ftp.ncbi.nlm.nih.gov/genomes/all/GCA/006/438/525/GCA_006438525.1_ASM643852v1","SAMN12011840","PRJNA547954","GCA_006438525.1","1.6222","38.9","-","VEYC01","42","1610","1463/592624","6/24/2019","6/28/2019","Scaffold","2019-06-24T00:00:00Z","Oita university","Illumina MiSeq","21x","SPAdes v. 3.12.0","","","42","1622199","Cambodia","Homo sapiens"
"Helicobacter pylori KH0167","592625","210","210.5999","","","N/A","","ftp://ftp.ncbi.nlm.nih.gov/genomes/all/GCF/006/438/535/GCF_006438535.1_ASM643853v1","ftp://ftp.ncbi.nlm.nih.gov/genomes/all/GCA/006/438/535/GCA_006438535.1_ASM643853v1","SAMN12011841","PRJNA547954","GCA_006438535.1","1.60873","38.6","-","VEYB01","42","1615","1459/592625","6/24/2019","6/28/2019","Scaffold","2019-06-24T00:00:00Z","Oita university","Illumina MiSeq","11x","SPAdes v. 3.12.0","","","42","1608729","Cambodia","Homo sapiens"
"Helicobacter pylori KH0172","592642","210","210.6042","","","N/A","","ftp://ftp.ncbi.nlm.nih.gov/genomes/all/GCF/006/440/415/GCF_006440415.1_ASM644041v1","ftp://ftp.ncbi.nlm.nih.gov/genomes/all/GCA/006/440/415/GCA_006440415.1_ASM644041v1","SAMN12011842","PRJNA547954","GCA_006440415.1","1.61633","38.9","-","VEYA01","40","1594","1464/592642","6/24/2019","6/28/2019","Scaffold","2019-06-24T00:00:00Z","Oita university","Illumina MiSeq","28x","SPAdes v. 3.12.0","","","40","1616334","Cambodia","Homo sapiens"
"Helicobacter pylori KH0175","592623","210","210.5994","","","N/A","","ftp://ftp.ncbi.nlm.nih.gov/genomes/all/GCF/006/438/455/GCF_006438455.1_ASM643845v1","ftp://ftp.ncbi.nlm.nih.gov/genomes/all/GCA/006/438/455/GCA_006438455.1_ASM643845v1","SAMN12011844","PRJNA547954","GCA_006438455.1","1.58543","38.7","-","VEXY01","37","1585","1424/592623","6/24/2019","6/28/2019","Scaffold","2019-06-24T00:00:00Z","Oita university","Illumina MiSeq","17x","SPAdes v. 3.12.0","","","37","1585432","Cambodia","Homo sapiens"
"Helicobacter pylori KH0176","592626","210","210.6000","","","N/A","","ftp://ftp.ncbi.nlm.nih.gov/genomes/all/GCF/006/438/545/GCF_006438545.1_ASM643854v1","ftp://ftp.ncbi.nlm.nih.gov/genomes/all/GCA/006/438/545/GCA_006438545.1_ASM643854v1","SAMN12011845","PRJNA547954","GCA_006438545.1","1.63753","38.8","-","VEXX01","61","1637","1491/592626","6/24/2019","6/28/2019","Scaffold","2019-06-24T00:00:00Z","Oita university","Illumina MiSeq","19x","SPAdes v. 3.12.0","","","61","1637534","Cambodia","Homo sapiens"
"Helicobacter pylori KH0178","592629","210","210.6003","","","N/A","","ftp://ftp.ncbi.nlm.nih.gov/genomes/all/GCF/006/438/645/GCF_006438645.1_ASM643864v1","ftp://ftp.ncbi.nlm.nih.gov/genomes/all/GCA/006/438/645/GCA_006438645.1_ASM643864v1","SAMN12011846","PRJNA547954","GCA_006438645.1","1.59356","39","-","VEXW01","45","1583","1444/592629","6/24/2019","6/28/2019","Scaffold","2019-06-24T00:00:00Z","Oita university","Illumina MiSeq","12x","SPAdes v. 3.12.0","","","45","1593565","Cambodia","Homo sapiens"
"Helicobacter pylori KH0210","592627","210","210.6001","","","N/A","","ftp://ftp.ncbi.nlm.nih.gov/genomes/all/GCF/006/438/565/GCF_006438565.1_ASM643856v1","ftp://ftp.ncbi.nlm.nih.gov/genomes/all/GCA/006/438/565/GCA_006438565.1_ASM643856v1","SAMN12011851","PRJNA547954","GCA_006438565.1","1.5919","39","-","VEXR01","49","1595","1453/592627","6/24/2019","6/28/2019","Scaffold","2019-06-24T00:00:00Z","Oita university","Illumina MiSeq","21x","SPAdes v. 3.12.0","","","49","1591902","Cambodia","Homo sapiens"
"Helicobacter pylori MGYG-HGUT-01431","663977","210","210.6153","","","N/A","","ftp://ftp.ncbi.nlm.nih.gov/genomes/all/GCF/902/374/915/GCF_902374915.1_MGYG-HGUT-01431","ftp://ftp.ncbi.nlm.nih.gov/genomes/all/GCA/902/374/915/GCA_902374915.1_MGYG-HGUT-01431","SAMEA5850934","PRJEB33885","GCA_902374915.1","1.60342","39.4","-","CABKSD01","42","1558","1401/663977","8/22/2019","8/22/2019","Scaffold","2019-08-12T00:00:00Z","EMG","","","","","","42","1603423","",""
"Helicobacter pylori PIMM-FM-UNAM-11CaC2-9","694155","210","210.6146","","","N/A","","ftp://ftp.ncbi.nlm.nih.gov/genomes/all/GCF/008/681/515/GCF_008681515.1_ASM868151v1","ftp://ftp.ncbi.nlm.nih.gov/genomes/all/GCA/008/681/515/GCA_008681515.1_ASM868151v1","SAMN10715320","PRJNA513874","GCA_008681515.1","1.63193","38.9","-","SAZW01","14","1593","1441/694155","9/23/2019","9/27/2019","Scaffold","2019-09-23T00:00:00Z","Universidad Nacional Autonoma de Mexico","Illumina Miseq","67.23x","Velvet v. 1.2.10","","","14","1631925","","Homo sapiens"
"Helicobacter pylori PIMM-FM-UNAM-14CaC1","694169","210","210.6135","","","N/A","","ftp://ftp.ncbi.nlm.nih.gov/genomes/all/GCF/008/681/285/GCF_008681285.1_ASM868128v1","ftp://ftp.ncbi.nlm.nih.gov/genomes/all/GCA/008/681/285/GCA_008681285.1_ASM868128v1","SAMN10715447","PRJNA513874","GCA_008681285.1","1.63506","39","-","SBAI01","21","1609","1458/694169","9/23/2019","9/27/2019","Scaffold","2019-09-23T00:00:00Z","Universidad Nacional Autonoma de Mexico","Illumina Miseq","53.94x","Velvet v. 1.2.10","","","21","1635061","","Homo sapiens"
"Helicobacter pylori PIMM-FM-UNAM-14CaC1-2","694168","210","210.6131","","","N/A","","ftp://ftp.ncbi.nlm.nih.gov/genomes/all/GCF/008/681/215/GCF_008681215.1_ASM868121v1","ftp://ftp.ncbi.nlm.nih.gov/genomes/all/GCA/008/681/215/GCA_008681215.1_ASM868121v1","SAMN10715448","PRJNA513874","GCA_008681215.1","1.63828","39","-","SBAJ01","43","1621","1472/694168","9/23/2019","9/27/2019","Scaffold","2019-09-23T00:00:00Z","Universidad Nacional Autonoma de Mexico","Illumina Miseq","145.23x","Velvet v. 1.2.10","","","43","1638281","","Homo sapiens"
"Helicobacter pylori PIMM-FM-UNAM-16A8","694161","210","210.6138","","","N/A","","ftp://ftp.ncbi.nlm.nih.gov/genomes/all/GCF/008/681/355/GCF_008681355.1_ASM868135v1","ftp://ftp.ncbi.nlm.nih.gov/genomes/all/GCA/008/681/355/GCA_008681355.1_ASM868135v1","SAMN10715443","PRJNA513874","GCA_008681355.1","1.61722","38.9","-","SBAF01","17","1610","1456/694161","9/23/2019","9/27/2019","Scaffold","2019-09-23T00:00:00Z","Universidad Nacional Autonoma de Mexico","Illumina Miseq","44.52x","Velvet v. 1.2.10","","","17","1617225","","Homo sapiens"
"Helicobacter pylori PIMM-FM-UNAM-16C4","694160","210","210.6136","","","N/A","","ftp://ftp.ncbi.nlm.nih.gov/genomes/all/GCF/008/681/315/GCF_008681315.1_ASM868131v1","ftp://ftp.ncbi.nlm.nih.gov/genomes/all/GCA/008/681/315/GCA_008681315.1_ASM868131v1","SAMN10715444","PRJNA513874","GCA_008681315.1","1.61577","38.9","-","SBAG01","12","1610","1458/694160","9/23/2019","9/27/2019","Scaffold","2019-09-23T00:00:00Z","Universidad Nacional Autonoma de Mexico","Illumina Miseq","35.48x","Velvet v. 1.2.10","","","12","1615769","","Homo sapiens"
"Helicobacter pylori PIMM-FM-UNAM-16F10","694164","210","210.6139","","","N/A","","ftp://ftp.ncbi.nlm.nih.gov/genomes/all/GCF/008/681/365/GCF_008681365.1_ASM868136v1","ftp://ftp.ncbi.nlm.nih.gov/genomes/all/GCA/008/681/365/GCA_008681365.1_ASM868136v1","SAMN10715424","PRJNA513874","GCA_008681365.1","1.61616","38.9","-","SBAE01","15","1613","1461/694164","9/23/2019","9/27/2019","Scaffold","2019-09-23T00:00:00Z","Universidad Nacional Autonoma de Mexico","Illumina Miseq","45.87x","Velvet v. 1.2.10","","","15","1616159","","Homo sapiens"
"Helicobacter pylori PIMM-FM-UNAM-18CaC1","694170","210","210.6137","","","N/A","","ftp://ftp.ncbi.nlm.nih.gov/genomes/all/GCF/008/681/335/GCF_008681335.1_ASM868133v1","ftp://ftp.ncbi.nlm.nih.gov/genomes/all/GCA/008/681/335/GCA_008681335.1_ASM868133v1","SAMN10715445","PRJNA513874","GCA_008681335.1","1.61921","39","-","SBAH01","18","1612","1470/694170","9/23/2019","9/27/2019","Scaffold","2019-09-23T00:00:00Z","Universidad Nacional Autonoma de Mexico","Illumina Miseq","48.59x","Velvet v. 1.2.10","","","18","1619205","","Homo sapiens"
"Helicobacter pylori PIMM-FM-UNAM-21CaC3","694165","210","210.6134","","","N/A","","ftp://ftp.ncbi.nlm.nih.gov/genomes/all/GCF/008/681/245/GCF_008681245.1_ASM868124v1","ftp://ftp.ncbi.nlm.nih.gov/genomes/all/GCA/008/681/245/GCA_008681245.1_ASM868124v1","SAMN10715449","PRJNA513874","GCA_008681245.1","1.62906","38.9","-","SBAK01","15","1632","1464/694165","9/23/2019","9/27/2019","Scaffold","2019-09-23T00:00:00Z","Universidad Nacional Autonoma de Mexico","Illumina Miseq","53.07x","Velvet v. 1.2.10","","","15","1629061","","Homo sapiens"
"Helicobacter pylori PIMM-FM-UNAM-23CaC2","694163","210","210.6147","","","N/A","","ftp://ftp.ncbi.nlm.nih.gov/genomes/all/GCF/008/681/525/GCF_008681525.1_ASM868152v1","ftp://ftp.ncbi.nlm.nih.gov/genomes/all/GCA/008/681/525/GCA_008681525.1_ASM868152v1","SAMN10715324","PRJNA513874","GCA_008681525.1","1.62875","38.9","-","SAZX01","21","1606","1464/694163","9/23/2019","9/27/2019","Scaffold","2019-09-23T00:00:00Z","Universidad Nacional Autonoma de Mexico","Illumina Miseq","83.08x","Velvet v. 1.2.10","","","21","1628754","","Homo sapiens"
"Helicobacter pylori PIMM-FM-UNAM-29CaCe","694166","210","210.6144","","","N/A","","ftp://ftp.ncbi.nlm.nih.gov/genomes/all/GCF/008/681/475/GCF_008681475.1_ASM868147v1","ftp://ftp.ncbi.nlm.nih.gov/genomes/all/GCA/008/681/475/GCA_008681475.1_ASM868147v1","SAMN10715326","PRJNA513874","GCA_008681475.1","1.61832","39.2","-","SAZY01","23","1593","1424/694166","9/23/2019","9/27/2019","Scaffold","2019-09-23T00:00:00Z","Universidad Nacional Autonoma de Mexico","Illumina Miseq","53.61x","Velvet v. 1.2.10","","","23","1618323","","Homo sapiens"
"Helicobacter pylori PIMM-FM-UNAM-30Ca+5","694157","210","210.6141","","","N/A","","ftp://ftp.ncbi.nlm.nih.gov/genomes/all/GCF/008/681/415/GCF_008681415.1_ASM868141v1","ftp://ftp.ncbi.nlm.nih.gov/genomes/all/GCA/008/681/415/GCA_008681415.1_ASM868141v1","SAMN10715382","PRJNA513874","GCA_008681415.1","1.62895","39.1","-","SBAB01","6","1584","1442/694157","9/23/2019","9/27/2019","Scaffold","2019-09-23T00:00:00Z","Universidad Nacional Autonoma de Mexico","Illumina Miseq","38.9x","Velvet v. 1.2.10","","","6","1628948","","Homo sapiens"
"Helicobacter pylori PIMM-FM-UNAM-30CaCe","694162","210","210.6143","","","N/A","","ftp://ftp.ncbi.nlm.nih.gov/genomes/all/GCF/008/681/455/GCF_008681455.1_ASM868145v1","ftp://ftp.ncbi.nlm.nih.gov/genomes/all/GCA/008/681/455/GCA_008681455.1_ASM868145v1","SAMN10715327","PRJNA513874","GCA_008681455.1","1.62811","39.1","-","SAZZ01","13","1585","1429/694162","9/23/2019","9/27/2019","Scaffold","2019-09-23T00:00:00Z","Universidad Nacional Autonoma de Mexico","Illumina Miseq","61.41x","Velvet v. 1.2.10","","","13","1628114","","Homo sapiens"
"Helicobacter pylori PIMM-FM-UNAM-30CaF2","694156","210","210.6145","","","N/A","","ftp://ftp.ncbi.nlm.nih.gov/genomes/all/GCF/008/681/485/GCF_008681485.1_ASM868148v1","ftp://ftp.ncbi.nlm.nih.gov/genomes/all/GCA/008/681/485/GCA_008681485.1_ASM868148v1","SAMN10715333","PRJNA513874","GCA_008681485.1","1.63124","39.1","-","SBAA01","15","1588","1441/694156","9/23/2019","9/27/2019","Scaffold","2019-09-23T00:00:00Z","Universidad Nacional Autonoma de Mexico","Illumina Miseq","62.07x","Velvet v. 1.2.10","","","15","1631238","","Homo sapiens"
"Helicobacter pylori PIMM-FM-UNAM-34CaC2","694167","210","210.6142","","","N/A","","ftp://ftp.ncbi.nlm.nih.gov/genomes/all/GCF/008/681/425/GCF_008681425.1_ASM868142v1","ftp://ftp.ncbi.nlm.nih.gov/genomes/all/GCA/008/681/425/GCA_008681425.1_ASM868142v1","SAMN10715395","PRJNA513874","GCA_008681425.1","1.62019","39","-","SBAC01","16","1613","1467/694167","9/23/2019","9/27/2019","Scaffold","2019-09-23T00:00:00Z","Universidad Nacional Autonoma de Mexico","Illumina Miseq","30.32x","Velvet v. 1.2.10","","","16","1620187","","Homo sapiens"
"Helicobacter pylori PIMM-FM-UNAM-36C","694159","210","210.6140","","","N/A","","ftp://ftp.ncbi.nlm.nih.gov/genomes/all/GCF/008/681/395/GCF_008681395.1_ASM868139v1","ftp://ftp.ncbi.nlm.nih.gov/genomes/all/GCA/008/681/395/GCA_008681395.1_ASM868139v1","SAMN10715423","PRJNA513874","GCA_008681395.1","1.67084","38.8","-","SBAD01","21","1647","1489/694159","9/23/2019","9/27/2019","Scaffold","2019-09-23T00:00:00Z","Universidad Nacional Autonoma de Mexico","Illumina Miseq","78.17x","Velvet v. 1.2.10","","","21","1670843","","Homo sapiens"
"Helicobacter pylori PIMM-FM-UNAM-52A2","694171","210","210.6132","","","N/A","","ftp://ftp.ncbi.nlm.nih.gov/genomes/all/GCF/008/681/225/GCF_008681225.1_ASM868122v1","ftp://ftp.ncbi.nlm.nih.gov/genomes/all/GCA/008/681/225/GCA_008681225.1_ASM868122v1","SAMN10715452","PRJNA513874","GCA_008681225.1","1.58925","39.2","-","SBAN01","18","1565","1404/694171","9/23/2019","9/27/2019","Scaffold","2019-09-23T00:00:00Z","Universidad Nacional Autonoma de Mexico","Illumina Miseq","19.44x","Velvet v. 1.2.10","","","18","1589252","","Homo sapiens"
"Helicobacter pylori PIMM-FM-UNAM-53C1","694158","210","210.6133","","","N/A","","ftp://ftp.ncbi.nlm.nih.gov/genomes/all/GCF/008/681/235/GCF_008681235.1_ASM868123v1","ftp://ftp.ncbi.nlm.nih.gov/genomes/all/GCA/008/681/235/GCA_008681235.1_ASM868123v1","SAMN10715451","PRJNA513874","GCA_008681235.1","1.65191","38.9","-","SBAM01","33","1628","1479/694158","9/23/2019","9/27/2019","Scaffold","2019-09-23T00:00:00Z","Universidad Nacional Autonoma de Mexico","Illumina Miseq","538.9x","Velvet v. 1.2.10","","","33","1651910","","Homo sapiens"
"Helicobacter pylori PIMM-FM-UNAM-62A9","698586","210","210.6178","","","N/A","","ftp://ftp.ncbi.nlm.nih.gov/genomes/all/GCF/008/728/675/GCF_008728675.1_ASM872867v1","ftp://ftp.ncbi.nlm.nih.gov/genomes/all/GCA/008/728/675/GCA_008728675.1_ASM872867v1","SAMN10715450","PRJNA513874","GCA_008728675.1","1.64405","38.9","-","SBAL01","15","1631","1458/698586","9/26/2019","10/7/2019","Scaffold","2019-09-26T00:00:00Z","Universidad Nacional Autonoma de Mexico","Illumina Miseq","26.7x","Velvet v. 1.2.10","","","15","1644050","","Homo sapiens"
"Helicobacter pylori PMSS1","582026","1431450","1431450.6","","","N/A","","ftp://ftp.ncbi.nlm.nih.gov/genomes/all/GCF/901/687/245/GCF_901687245.1_25455_8_248","ftp://ftp.ncbi.nlm.nih.gov/genomes/all/GCA/901/687/245/GCA_901687245.1_25455_8_248","SAMEA104484363","PRJEB23817","GCA_901687245.1","1.60236","39","-","CABFJZ01","40","1593","1441/582026","5/28/2019","5/28/2019","Scaffold","2019-05-28T00:00:00Z","SC","","","","","","40","1602364","","Human (female)"
"Helicobacter pylori V1086","442521","210","210.5629","","","N/A","","ftp://ftp.ncbi.nlm.nih.gov/genomes/all/GCF/004/117/965/GCF_004117965.1_ASM411796v1","ftp://ftp.ncbi.nlm.nih.gov/genomes/all/GCA/004/117/965/GCA_004117965.1_ASM411796v1","SAMN04167067","PRJNA298832","GCA_004117965.1","1.69477","38.7","-","LMXS01","187","1702","1398/442521","1/29/2019","4/3/2019","Scaffold","2019-01-29T00:00:00Z","Institute of Molecular and Cellular Biology","Illumina GAIIx","167.0x","IRAB v. Aug-2009","","","187","1694772","Taiwan","Human, Homo sapiens"
"Helicobacter pylori V1267","442520","210","210.5628","","","N/A","","ftp://ftp.ncbi.nlm.nih.gov/genomes/all/GCF/004/117/955/GCF_004117955.1_ASM411795v1","ftp://ftp.ncbi.nlm.nih.gov/genomes/all/GCA/004/117/955/GCA_004117955.1_ASM411795v1","SAMN04167086","PRJNA298832","GCA_004117955.1","1.63565","38.7","-","LMXR01","143","1609","1402/442520","1/29/2019","2/1/2019","Scaffold","2019-01-29T00:00:00Z","Institute of Molecular and Cellular Biology","Illumina GAIIx","144.0x","IRAB v. Aug-2008","","","143","1635652","Taiwan","Human, Homo sapiens"
"Helicobacter pylori ","217371","210","210.1339","","","N/A","","ftp://ftp.ncbi.nlm.nih.gov/genomes/all/GCF/000/824/865/GCF_000824865.1_H3014","ftp://ftp.ncbi.nlm.nih.gov/genomes/all/GCA/000/824/865/GCA_000824865.1_H3014","SAMEA2674915","PRJEB6882","GCA_000824865.1","1.64227","38.8","-","CCMU01","51","1617","1444/217371","10/31/2014","3/25/2017","Contig","2014-10-31T00:00:00Z","Institute of Medical Microbiology and Hospital Epidemiology","","","","","","51","1642266","United Kingdom","Human, Homo sapiens"
"Helicobacter pylori ","217374","210","210.1341","","","N/A","","ftp://ftp.ncbi.nlm.nih.gov/genomes/all/GCF/000/824/925/GCF_000824925.1_H3018","ftp://ftp.ncbi.nlm.nih.gov/genomes/all/GCA/000/824/925/GCA_000824925.1_H3018","SAMEA2674918","PRJEB6882","GCA_000824925.1","1.65575","38.8","-","CCMW01","50","1624","1454/217374","10/31/2014","3/25/2017","Contig","2014-10-31T00:00:00Z","Institute of Medical Microbiology and Hospital Epidemiology","","","","","","50","1655748","United Kingdom","Human, Homo sapiens"
"Helicobacter pylori ","217372","210","210.1338","","","N/A","","ftp://ftp.ncbi.nlm.nih.gov/genomes/all/GCF/000/824/885/GCF_000824885.1_H3016","ftp://ftp.ncbi.nlm.nih.gov/genomes/all/GCA/000/824/885/GCA_000824885.1_H3016","SAMEA2674916","PRJEB6882","GCA_000824885.1","1.64276","38.9","-","CCMT01","101","1641","1313/217372","10/31/2014","7/21/2019","Contig","2014-10-31T00:00:00Z","Institute of Medical Microbiology and Hospital Epidemiology","","","","","","101","1642760","United Kingdom","Human, Homo sapiens"
"Helicobacter pylori ","217373","210","210.1340","","","N/A","","-","ftp://ftp.ncbi.nlm.nih.gov/genomes/all/GCA/000/824/905/GCA_000824905.1_H3017","SAMEA2674917","PRJEB6882","GCA_000824905.1","1.6502","38.8","-","CCMV01","48","-","-/217373","10/30/2014","12/16/2014","Contig","2014-10-30T00:00:00Z","Institute of Medical Microbiology and Hospital Epidemiology","","","","","","48","1650195","United Kingdom","Human, Homo sapiens"
"Helicobacter pylori 1002","423558","210","210.5247","","","N/A","","ftp://ftp.ncbi.nlm.nih.gov/genomes/all/GCF/003/815/575/GCF_003815575.1_ASM381557v1","ftp://ftp.ncbi.nlm.nih.gov/genomes/all/GCA/003/815/575/GCA_003815575.1_ASM381557v1","SAMN10419330","PRJNA505431","GCA_003815575.1","1.60957","39.1","-","RPFS01","37","1601","1453/423558","11/24/2018","8/23/2019","Contig","2018-11-24T00:00:00Z","Universidad de Ciencias Aplicadas y Ambientales UDCA","Illumina MiSeq","50.0x","A5 pipeline v. MAY-2015","","","37","1609572","Colombia",""
"Helicobacter pylori 1039","341725","210","210.3028","","","N/A","","ftp://ftp.ncbi.nlm.nih.gov/genomes/all/GCF/002/534/585/GCF_002534585.1_ASM253458v1","ftp://ftp.ncbi.nlm.nih.gov/genomes/all/GCA/002/534/585/GCA_002534585.1_ASM253458v1","SAMN05410759","PRJNA329371","GCA_002534585.1","1.66563","38.9","-","MBJR01","83","1692","1505/341725","10/13/2017","7/30/2019","Contig","2017-10-13T00:00:00Z","Universidad de Ciencias Aplicadas y Ambientales UDCA","Illumina MiSeq","101.98x","A5 pipeline v. MAY-2016","","","83","1665634","Colombia","Human, Homo sapiens"
"Helicobacter pylori 1057","423557","210","210.5246","","","N/A","","ftp://ftp.ncbi.nlm.nih.gov/genomes/all/GCF/003/815/525/GCF_003815525.1_ASM381552v1","ftp://ftp.ncbi.nlm.nih.gov/genomes/all/GCA/003/815/525/GCA_003815525.1_ASM381552v1","SAMN10419331","PRJNA505434","GCA_003815525.1","1.68155","38.8","-","RPFT01","44","1694","1511/423557","11/24/2018","8/23/2019","Contig","2018-11-24T00:00:00Z","Universidad de Ciencias Aplicadas y Ambientales UDCA","Illumina MiSeq","50.0x","A5 pipeline v. MAY-2015","","","44","1681551","Colombia",""
"Helicobacter pylori 1059","341723","210","210.3026","","","N/A","","ftp://ftp.ncbi.nlm.nih.gov/genomes/all/GCF/002/534/545/GCF_002534545.1_ASM253454v1","ftp://ftp.ncbi.nlm.nih.gov/genomes/all/GCA/002/534/545/GCA_002534545.1_ASM253454v1","SAMN05410756","PRJNA329370","GCA_002534545.1","1.62849","39","-","MBJS01","52","1630","1483/341723","10/13/2017","7/30/2019","Contig","2017-10-13T00:00:00Z","Universidad de Ciencias Aplicadas y Ambientales UDCA","Illumina MiSeq","301.95x","A5 pipeline v. MAY-2016","","","52","1628493","Colombia","Human, Homo sapiens"
"Helicobacter pylori 1061","341710","210","210.3013","","","N/A","","ftp://ftp.ncbi.nlm.nih.gov/genomes/all/GCF/002/534/295/GCF_002534295.1_ASM253429v1","ftp://ftp.ncbi.nlm.nih.gov/genomes/all/GCA/002/534/295/GCA_002534295.1_ASM253429v1","SAMN05410754","PRJNA329369","GCA_002534295.1","1.64458","39.1","-","MBJT01","53","1646","1489/341710","10/13/2017","7/30/2019","Contig","2017-10-13T00:00:00Z","Universidad de Ciencias Aplicadas y Ambientales UDCA","Illumina MiSeq","185.81x","A5 pipeline v. MAY-2016","","","53","1644581","Colombia","Human, Homo sapiens"
"Helicobacter pylori 1071","423556","210","210.5249","","","N/A","","ftp://ftp.ncbi.nlm.nih.gov/genomes/all/GCF/003/815/515/GCF_003815515.1_ASM381551v1","ftp://ftp.ncbi.nlm.nih.gov/genomes/all/GCA/003/815/515/GCA_003815515.1_ASM381551v1","SAMN10419325","PRJNA505430","GCA_003815515.1","1.65863","39","-","RPFR01","23","1642","1470/423556","11/24/2018","8/24/2019","Contig","2018-11-24T00:00:00Z","Universidad de Ciencias Aplicadas y Ambientales UDCA","Illumina MiSeq","50.0x","A5 pipeline v. MAY-2015","","","23","1658634","Colombia",""
"Helicobacter pylori 1077","341191","210","210.2931","","","N/A","","ftp://ftp.ncbi.nlm.nih.gov/genomes/all/GCF/002/532/685/GCF_002532685.1_ASM253268v1","ftp://ftp.ncbi.nlm.nih.gov/genomes/all/GCA/002/532/685/GCA_002532685.1_ASM253268v1","SAMN05410752","PRJNA329368","GCA_002532685.1","1.65515","38.9","-","MBKC01","72","1688","1493/341191","10/12/2017","7/30/2019","Contig","2017-10-12T00:00:00Z","Universidad de Ciencias Aplicadas y Ambientales UDCA","Illumina MiSeq","178.8x","A5 pipeline v. MAY-2016","","","72","1655152","Colombia","Human, Homo sapiens"
"Helicobacter pylori 1081","341709","210","210.3012","","","N/A","","ftp://ftp.ncbi.nlm.nih.gov/genomes/all/GCF/002/534/245/GCF_002534245.1_ASM253424v1","ftp://ftp.ncbi.nlm.nih.gov/genomes/all/GCA/002/534/245/GCA_002534245.1_ASM253424v1","SAMN05410748","PRJNA329367","GCA_002534245.1","1.64828","39","-","MBJP01","76","1653","1490/341709","10/13/2017","7/30/2019","Contig","2017-10-13T00:00:00Z","Universidad de Ciencias Aplicadas y Ambientales UDCA","Illumina MiSeq","63.12x","A5 pipeline v. MAY-2016","","","76","1648284","Colombia","Human, Homo sapiens"
"Helicobacter pylori 1086","341194","210","210.2937","","","N/A","","ftp://ftp.ncbi.nlm.nih.gov/genomes/all/GCF/002/532/735/GCF_002532735.1_ASM253273v1","ftp://ftp.ncbi.nlm.nih.gov/genomes/all/GCA/002/532/735/GCA_002532735.1_ASM253273v1","SAMN05410739","PRJNA329364","GCA_002532735.1","1.60622","39.1","-","MBKD01","117","1607","1452/341194","10/12/2017","7/30/2019","Contig","2017-10-12T00:00:00Z","Universidad de Ciencias Aplicadas y Ambientales UDCA","Illumina MiSeq","44.38x","A5 pipeline v. MAY-2016","","","117","1606219","Colombia","Human, Homo sapiens"
"Helicobacter pylori 1088","423554","210","210.5244","","","N/A","","ftp://ftp.ncbi.nlm.nih.gov/genomes/all/GCF/003/815/475/GCF_003815475.1_ASM381547v1","ftp://ftp.ncbi.nlm.nih.gov/genomes/all/GCA/003/815/475/GCA_003815475.1_ASM381547v1","SAMN10419332","PRJNA505435","GCA_003815475.1","1.64866","39","-","RPFU01","46","1641","1489/423554","11/24/2018","8/23/2019","Contig","2018-11-24T00:00:00Z","Universidad de Ciencias Aplicadas y Ambientales UDCA","Illumina MiSeq","50.0x","A5 pipeline v. MAY-2015","","","46","1648661","Colombia",""
"Helicobacter pylori 1093","341195","210","210.2938","","","N/A","","ftp://ftp.ncbi.nlm.nih.gov/genomes/all/GCF/002/532/745/GCF_002532745.1_ASM253274v1","ftp://ftp.ncbi.nlm.nih.gov/genomes/all/GCA/002/532/745/GCA_002532745.1_ASM253274v1","SAMN05410733","PRJNA329363","GCA_002532745.1","1.6436","38.9","-","MBKE01","57","1639","1478/341195","10/12/2017","7/30/2019","Contig","2017-10-12T00:00:00Z","Universidad de Ciencias Aplicadas y Ambientales UDCA","Illumina MiSeq","105.13x","A5 pipeline v. MAY-2016","","","57","1643605","Colombia","Human, Homo sapiens"
"Helicobacter pylori 1095","341196","210","210.2941","","","N/A","","ftp://ftp.ncbi.nlm.nih.gov/genomes/all/GCF/002/532/795/GCF_002532795.1_ASM253279v1","ftp://ftp.ncbi.nlm.nih.gov/genomes/all/GCA/002/532/795/GCA_002532795.1_ASM253279v1","SAMN05410724","PRJNA329362","GCA_002532795.1","1.66974","38.9","-","MBKF01","71","1684","1498/341196","10/12/2017","7/30/2019","Contig","2017-10-12T00:00:00Z","Universidad de Ciencias Aplicadas y Ambientales UDCA","Illumina MiSeq","123.64x","A5 pipeline v. MAY-2016","","","71","1669742","Colombia","Human, Homo sapiens"
"Helicobacter pylori 1102","341708","210","210.3011","","","N/A","","ftp://ftp.ncbi.nlm.nih.gov/genomes/all/GCF/002/534/235/GCF_002534235.1_ASM253423v1","ftp://ftp.ncbi.nlm.nih.gov/genomes/all/GCA/002/534/235/GCA_002534235.1_ASM253423v1","SAMN05410721","PRJNA329361","GCA_002534235.1","1.61179","39.1","-","MBJK01","49","1605","1463/341708","10/13/2017","7/30/2019","Contig","2017-10-13T00:00:00Z","Universidad de Ciencias Aplicadas y Ambientales UDCA","Illumina MiSeq","217.5x","A5 pipeline v. MAY-2016","","","49","1611787","Colombia","Human, Homo sapiens"
"Helicobacter pylori 18:02","372649","210","210.4199","","","N/A","","ftp://ftp.ncbi.nlm.nih.gov/genomes/all/GCF/003/059/045/GCF_003059045.1_ASM305904v1","ftp://ftp.ncbi.nlm.nih.gov/genomes/all/GCA/003/059/045/GCA_003059045.1_ASM305904v1","SAMN08381277","PRJNA395900","GCA_003059045.1","1.64646","38.9","-","QBPS01","111","1655","1475/372649","4/22/2018","8/11/2019","Contig","2018-04-22T00:00:00Z","University of Bath","Illumina","50x","Velvet v. 1.2.08","","","111","1646455","Sweden","Human, Homo sapiens"
"Helicobacter pylori 2006","341724","210","210.3027","","","N/A","","ftp://ftp.ncbi.nlm.nih.gov/genomes/all/GCF/002/534/555/GCF_002534555.1_ASM253455v1","ftp://ftp.ncbi.nlm.nih.gov/genomes/all/GCA/002/534/555/GCA_002534555.1_ASM253455v1","SAMN05410719","PRJNA329360","GCA_002534555.1","1.66428","39.1","-","MBJL01","319","1682","1490/341724","10/13/2017","7/30/2019","Contig","2017-10-13T00:00:00Z","Universidad de Ciencias Aplicadas y Ambientales UDCA","Illumina MiSeq","27.17x","A5 pipeline v. MAY-2016","","","319","1664276","Colombia","Human, Homo sapiens"
"Helicobacter pylori 2007","341707","210","210.3010","","","N/A","","ftp://ftp.ncbi.nlm.nih.gov/genomes/all/GCF/002/534/225/GCF_002534225.1_ASM253422v1","ftp://ftp.ncbi.nlm.nih.gov/genomes/all/GCA/002/534/225/GCA_002534225.1_ASM253422v1","SAMN05410718","PRJNA329359","GCA_002534225.1","1.67813","38.8","-","MBJM01","67","1676","1519/341707","10/13/2017","7/30/2019","Contig","2017-10-13T00:00:00Z","Universidad de Ciencias Aplicadas y Ambientales UDCA","Illumina MiSeq","183.02x","A5 pipeline v. MAY-2016","","","67","1678132","Colombia","Human, Homo sapiens"
"Helicobacter pylori 2010","341706","210","210.3009","","","N/A","","ftp://ftp.ncbi.nlm.nih.gov/genomes/all/GCF/002/534/215/GCF_002534215.1_ASM253421v1","ftp://ftp.ncbi.nlm.nih.gov/genomes/all/GCA/002/534/215/GCA_002534215.1_ASM253421v1","SAMN05410712","PRJNA329358","GCA_002534215.1","1.66904","39","-","MBJN01","68","1665","1497/341706","10/13/2017","7/30/2019","Contig","2017-10-13T00:00:00Z","Universidad de Ciencias Aplicadas y Ambientales UDCA","Illumina MiSeq","81.69x","A5 pipeline v. MAY-2016","","","68","1669035","Colombia","Human, Homo sapiens"
"Helicobacter pylori 2015","341704","210","210.3007","","","N/A","","ftp://ftp.ncbi.nlm.nih.gov/genomes/all/GCF/002/534/175/GCF_002534175.1_ASM253417v1","ftp://ftp.ncbi.nlm.nih.gov/genomes/all/GCA/002/534/175/GCA_002534175.1_ASM253417v1","SAMN05410682","PRJNA329355","GCA_002534175.1","1.60684","39","-","MBJO01","47","1599","1450/341704","10/13/2017","7/30/2019","Contig","2017-10-13T00:00:00Z","Universidad de Ciencias Aplicadas y Ambientales UDCA","Illumina MiSeq","160.67x","A5 pipeline v. MAY-2016","","","47","1606839","Colombia","Human, Homo sapiens"
"Helicobacter pylori 2020","341722","210","210.3024","","","N/A","","ftp://ftp.ncbi.nlm.nih.gov/genomes/all/GCF/002/534/535/GCF_002534535.1_ASM253453v1","ftp://ftp.ncbi.nlm.nih.gov/genomes/all/GCA/002/534/535/GCA_002534535.1_ASM253453v1","SAMN05410653","PRJNA329354","GCA_002534535.1","1.71972","38.9","-","MBJG01","149","1716","1547/341722","10/13/2017","7/30/2019","Contig","2017-10-13T00:00:00Z","Universidad de Ciencias Aplicadas y Ambientales UDCA","Illumina MiSeq","117.63x","A5 pipeline v. MAY-2016","","","149","1719718","Colombia","Human, Homo sapiens"
"Helicobacter pylori 2021","341721","210","210.3023","","","N/A","","ftp://ftp.ncbi.nlm.nih.gov/genomes/all/GCF/002/534/515/GCF_002534515.1_ASM253451v1","ftp://ftp.ncbi.nlm.nih.gov/genomes/all/GCA/002/534/515/GCA_002534515.1_ASM253451v1","SAMN05410649","PRJNA329353","GCA_002534515.1","1.67851","38.8","-","MBJH01","73","1666","1499/341721","10/13/2017","7/30/2019","Contig","2017-10-13T00:00:00Z","Universidad de Ciencias Aplicadas y Ambientales UDCA","Illumina MiSeq","99.92x","A5 pipeline v. MAY-2016","","","73","1678514","Colombia","Human, Homo sapiens"
"Helicobacter pylori 2025","341705","210","210.3008","","","N/A","","ftp://ftp.ncbi.nlm.nih.gov/genomes/all/GCF/002/534/185/GCF_002534185.1_ASM253418v1","ftp://ftp.ncbi.nlm.nih.gov/genomes/all/GCA/002/534/185/GCA_002534185.1_ASM253418v1","SAMN05410639","PRJNA329352","GCA_002534185.1","1.65016","38.9","-","MBJI01","61","1653","1494/341705","10/13/2017","7/30/2019","Contig","2017-10-13T00:00:00Z","Universidad de Ciencias Aplicadas y Ambientales UDCA","Illumina MiSeq","203.69x","A5 pipeline v. MAY-2016","","","61","1650159","Colombia","Human, Homo sapiens"
"Helicobacter pylori 2027","341703","210","210.3006","","","N/A","","ftp://ftp.ncbi.nlm.nih.gov/genomes/all/GCF/002/534/145/GCF_002534145.1_ASM253414v1","ftp://ftp.ncbi.nlm.nih.gov/genomes/all/GCA/002/534/145/GCA_002534145.1_ASM253414v1","SAMN05410635","PRJNA329351","GCA_002534145.1","1.65321","39","-","MBJJ01","81","1664","1477/341703","10/13/2017","7/30/2019","Contig","2017-10-13T00:00:00Z","Universidad de Ciencias Aplicadas y Ambientales UDCA","Illumina MiSeq","70.8x","A5 pipeline v. MAY-2016","","","81","1653213","Colombia","Human, Homo sapiens"
"Helicobacter pylori 2029","341197","210","210.2940","","","N/A","","ftp://ftp.ncbi.nlm.nih.gov/genomes/all/GCF/002/532/805/GCF_002532805.1_ASM253280v1","ftp://ftp.ncbi.nlm.nih.gov/genomes/all/GCA/002/532/805/GCA_002532805.1_ASM253280v1","SAMN05410630","PRJNA329350","GCA_002532805.1","1.64936","38.9","-","MBKG01","49","1636","1485/341197","10/12/2017","7/30/2019","Contig","2017-10-12T00:00:00Z","Universidad de Ciencias Aplicadas y Ambientales UDCA","Illumina MiSeq","84.94x","A5 pipeline v. MAY-2016","","","49","1649365","Colombia","Human, Homo sapiens"
"Helicobacter pylori 2036","341702","210","210.3005","","","N/A","","ftp://ftp.ncbi.nlm.nih.gov/genomes/all/GCF/002/534/135/GCF_002534135.1_ASM253413v1","ftp://ftp.ncbi.nlm.nih.gov/genomes/all/GCA/002/534/135/GCA_002534135.1_ASM253413v1","SAMN05410628","PRJNA329348","GCA_002534135.1","1.64795","38.9","-","MBJB01","60","1652","1490/341702","10/13/2017","7/30/2019","Contig","2017-10-13T00:00:00Z","Universidad de Ciencias Aplicadas y Ambientales UDCA","Illumina MiSeq","139.76x","A5 pipeline v. MAY-2016","","","60","1647948","Colombia","Human, Homo sapiens"
"Helicobacter pylori 2040","341701","210","210.3004","","","N/A","","ftp://ftp.ncbi.nlm.nih.gov/genomes/all/GCF/002/534/105/GCF_002534105.1_ASM253410v1","ftp://ftp.ncbi.nlm.nih.gov/genomes/all/GCA/002/534/105/GCA_002534105.1_ASM253410v1","SAMN05410617","PRJNA329346","GCA_002534105.1","1.66634","38.8","-","MBJC01","91","1700","1503/341701","10/13/2017","7/30/2019","Contig","2017-10-13T00:00:00Z","Universidad de Ciencias Aplicadas y Ambientales UDCA","Illumina MiSeq","71.54x","A5 pipeline v. MAY-2016","","","91","1666338","Colombia","Human, Homo sapiens"
"Helicobacter pylori 2047","341700","210","210.3003","","","N/A","","ftp://ftp.ncbi.nlm.nih.gov/genomes/all/GCF/002/534/095/GCF_002534095.1_ASM253409v1","ftp://ftp.ncbi.nlm.nih.gov/genomes/all/GCA/002/534/095/GCA_002534095.1_ASM253409v1","SAMN05410616","PRJNA329345","GCA_002534095.1","1.67223","38.8","-","MBJD01","52","1662","1497/341700","10/13/2017","7/30/2019","Contig","2017-10-13T00:00:00Z","Universidad de Ciencias Aplicadas y Ambientales UDCA","Illumina MiSeq","93.88x","A5 pipeline v. MAY-2016","","","52","1672229","Colombia","Human, Homo sapiens"
"Helicobacter pylori 2061","341698","210","210.3001","","","N/A","","ftp://ftp.ncbi.nlm.nih.gov/genomes/all/GCF/002/534/055/GCF_002534055.1_ASM253405v1","ftp://ftp.ncbi.nlm.nih.gov/genomes/all/GCA/002/534/055/GCA_002534055.1_ASM253405v1","SAMN05410615","PRJNA329344","GCA_002534055.1","1.60671","39.1","-","MBJE01","58","1601","1460/341698","10/13/2017","7/30/2019","Contig","2017-10-13T00:00:00Z","Universidad de Ciencias Aplicadas y Ambientales UDCA","Illumina MiSeq","63.36x","A5 pipeline v. MAY-2016","","","58","1606714","Colombia","Human, Homo sapiens"
"Helicobacter pylori 2065","341699","210","210.3002","","","N/A","","ftp://ftp.ncbi.nlm.nih.gov/genomes/all/GCF/002/534/065/GCF_002534065.1_ASM253406v1","ftp://ftp.ncbi.nlm.nih.gov/genomes/all/GCA/002/534/065/GCA_002534065.1_ASM253406v1","SAMN05410614","PRJNA329343","GCA_002534065.1","1.66551","38.9","-","MBJF01","61","1687","1506/341699","10/13/2017","7/30/2019","Contig","2017-10-13T00:00:00Z","Universidad de Ciencias Aplicadas y Ambientales UDCA","Illumina MiSeq","195.81x","A5 pipeline v. MAY-2016","","","61","1665508","Colombia","Human, Homo sapiens"
"Helicobacter pylori 22003","341717","210","210.3020","","","N/A","","ftp://ftp.ncbi.nlm.nih.gov/genomes/all/GCF/002/534/435/GCF_002534435.1_ASM253443v1","ftp://ftp.ncbi.nlm.nih.gov/genomes/all/GCA/002/534/435/GCA_002534435.1_ASM253443v1","SAMN05410579","PRJNA329324","GCA_002534435.1","1.62641","39","-","MBHH01","35","1607","1464/341717","10/13/2017","7/30/2019","Contig","2017-10-13T00:00:00Z","Universidad de Ciencias Aplicadas y Ambientales UDCA","Illumina MiSeq","198.05x","A5 pipeline v. MAY-2016","","","35","1626407","Colombia","Human, Homo sapiens"
"Helicobacter pylori 22013","341715","210","210.3018","","","N/A","","ftp://ftp.ncbi.nlm.nih.gov/genomes/all/GCF/002/534/385/GCF_002534385.1_ASM253438v1","ftp://ftp.ncbi.nlm.nih.gov/genomes/all/GCA/002/534/385/GCA_002534385.1_ASM253438v1","SAMN05410575","PRJNA329323","GCA_002534385.1","1.66099","38.9","-","MBHG01","56","1645","1488/341715","10/13/2017","7/30/2019","Contig","2017-10-13T00:00:00Z","Universidad de Ciencias Aplicadas y Ambientales UDCA","Illumina MiSeq","128.91x","A5 pipeline v. MAY-2016","","","56","1660987","Colombia","Human, Homo sapiens"
"Helicobacter pylori 22019","341692","210","210.2995","","","N/A","","ftp://ftp.ncbi.nlm.nih.gov/genomes/all/GCF/002/533/915/GCF_002533915.1_ASM253391v1","ftp://ftp.ncbi.nlm.nih.gov/genomes/all/GCA/002/533/915/GCA_002533915.1_ASM253391v1","SAMN05410572","PRJNA329322","GCA_002533915.1","1.63345","39","-","MBHF01","55","1626","1468/341692","10/13/2017","7/30/2019","Contig","2017-10-13T00:00:00Z","Universidad de Ciencias Aplicadas y Ambientales UDCA","Illumina MiSeq","84.53x","A5 pipeline v. MAY-2016","","","55","1633452","Colombia","Human, Homo sapiens"
"Helicobacter pylori 22020","341691","210","210.2994","","","N/A","","ftp://ftp.ncbi.nlm.nih.gov/genomes/all/GCF/002/533/905/GCF_002533905.1_ASM253390v1","ftp://ftp.ncbi.nlm.nih.gov/genomes/all/GCA/002/533/905/GCA_002533905.1_ASM253390v1","SAMN05410569","PRJNA329320","GCA_002533905.1","1.60366","39","-","MBHE01","58","1612","1456/341691","10/13/2017","7/30/2019","Contig","2017-10-13T00:00:00Z","Universidad de Ciencias Aplicadas y Ambientales UDCA","Illumina MiSeq","125.23x","A5 pipeline v. MAY-2016","","","58","1603665","Colombia","Human, Homo sapiens"
"Helicobacter pylori 22021","341690","210","210.2993","","","N/A","","ftp://ftp.ncbi.nlm.nih.gov/genomes/all/GCF/002/533/895/GCF_002533895.1_ASM253389v1","ftp://ftp.ncbi.nlm.nih.gov/genomes/all/GCA/002/533/895/GCA_002533895.1_ASM253389v1","SAMN05410567","PRJNA329319","GCA_002533895.1","1.62951","39","-","MBHD01","57","1640","1484/341690","10/13/2017","7/30/2019","Contig","2017-10-13T00:00:00Z","Universidad de Ciencias Aplicadas y Ambientales UDCA","Illumina MiSeq","108.29x","A5 pipeline v. MAY-2016","","","57","1629514","Colombia","Human, Homo sapiens"
"Helicobacter pylori 22023","341689","210","210.2992","","","N/A","","ftp://ftp.ncbi.nlm.nih.gov/genomes/all/GCF/002/533/855/GCF_002533855.1_ASM253385v1","ftp://ftp.ncbi.nlm.nih.gov/genomes/all/GCA/002/533/855/GCA_002533855.1_ASM253385v1","SAMN05410381","PRJNA329317","GCA_002533855.1","1.61883","39","-","MBHC01","37","1629","1465/341689","10/13/2017","7/30/2019","Contig","2017-10-13T00:00:00Z","Universidad de Ciencias Aplicadas y Ambientales UDCA","Illumina MiSeq","113.53x","A5 pipeline v. MAY-2016","","","37","1618831","Colombia","Human, Homo sapiens"
"Helicobacter pylori 22025","341714","210","210.3016","","","N/A","","ftp://ftp.ncbi.nlm.nih.gov/genomes/all/GCF/002/534/375/GCF_002534375.1_ASM253437v1","ftp://ftp.ncbi.nlm.nih.gov/genomes/all/GCA/002/534/375/GCA_002534375.1_ASM253437v1","SAMN05410354","PRJNA329315","GCA_002534375.1","1.6361","39","-","MBHB01","99","1636","1482/341714","10/13/2017","7/30/2019","Contig","2017-10-13T00:00:00Z","Universidad de Ciencias Aplicadas y Ambientales UDCA","Illumina MiSeq","29.14x","A5 pipeline v. MAY-2016","","","99","1636102","Colombia","Human, Homo sapiens"
"Helicobacter pylori 22046","341192","210","210.2932","","","N/A","","ftp://ftp.ncbi.nlm.nih.gov/genomes/all/GCF/002/532/715/GCF_002532715.1_ASM253271v1","ftp://ftp.ncbi.nlm.nih.gov/genomes/all/GCA/002/532/715/GCA_002532715.1_ASM253271v1","SAMN05410352","PRJNA329314","GCA_002532715.1","1.65336","38.9","-","MBKB01","60","1669","1497/341192","10/12/2017","7/30/2019","Contig","2017-10-12T00:00:00Z","Universidad de Ciencias Aplicadas y Ambientales UDCA","Illumina MiSeq","123.52x","A5 pipeline v. MAY-2016","","","60","1653357","Colombia","Human, Homo sapiens"
"Helicobacter pylori 22087","341687","210","210.2990","","","N/A","","ftp://ftp.ncbi.nlm.nih.gov/genomes/all/GCF/002/533/825/GCF_002533825.1_ASM253382v1","ftp://ftp.ncbi.nlm.nih.gov/genomes/all/GCA/002/533/825/GCA_002533825.1_ASM253382v1","SAMN05410345","PRJNA329313","GCA_002533825.1","1.6588","38.9","-","MBHA01","52","1650","1494/341687","10/13/2017","7/30/2019","Contig","2017-10-13T00:00:00Z","Universidad de Ciencias Aplicadas y Ambientales UDCA","Illumina MiSeq","119.96x","A5 pipeline v. MAY-2016","","","52","1658802","Colombia","Human, Homo sapiens"
"Helicobacter pylori 22093","341688","210","210.2991","","","N/A","","ftp://ftp.ncbi.nlm.nih.gov/genomes/all/GCF/002/533/845/GCF_002533845.1_ASM253384v1","ftp://ftp.ncbi.nlm.nih.gov/genomes/all/GCA/002/533/845/GCA_002533845.1_ASM253384v1","SAMN05410330","PRJNA329311","GCA_002533845.1","1.66042","39","-","MBGZ01","92","1699","1484/341688","10/13/2017","7/30/2019","Contig","2017-10-13T00:00:00Z","Universidad de Ciencias Aplicadas y Ambientales UDCA","Illumina MiSeq","58.06x","A5 pipeline v. MAY-2016","","","92","1660420","Colombia","Human, Homo sapiens"
"Helicobacter pylori 22095","341686","210","210.2989","","","N/A","","ftp://ftp.ncbi.nlm.nih.gov/genomes/all/GCF/002/533/815/GCF_002533815.1_ASM253381v1","ftp://ftp.ncbi.nlm.nih.gov/genomes/all/GCA/002/533/815/GCA_002533815.1_ASM253381v1","SAMN05410329","PRJNA329310","GCA_002533815.1","1.67059","38.9","-","MBGY01","48","1660","1504/341686","10/13/2017","7/30/2019","Contig","2017-10-13T00:00:00Z","Universidad de Ciencias Aplicadas y Ambientales UDCA","Illumina MiSeq","62.75x","A5 pipeline v. MAY-2016","","","48","1670586","Colombia","Human, Homo sapiens"
"Helicobacter pylori 22151","341684","210","210.2988","","","N/A","","ftp://ftp.ncbi.nlm.nih.gov/genomes/all/GCF/002/533/765/GCF_002533765.1_ASM253376v1","ftp://ftp.ncbi.nlm.nih.gov/genomes/all/GCA/002/533/765/GCA_002533765.1_ASM253376v1","SAMN05410328","PRJNA329308","GCA_002533765.1","1.67406","38.9","-","MBGX01","40","1642","1497/341684","10/13/2017","7/30/2019","Contig","2017-10-13T00:00:00Z","Universidad de Ciencias Aplicadas y Ambientales UDCA","Illumina MiSeq","140.69x","A5 pipeline v. MAY-2016","","","40","1674056","Colombia","Human, Homo sapiens"
"Helicobacter pylori 22211","341685","210","210.2987","","","N/A","","ftp://ftp.ncbi.nlm.nih.gov/genomes/all/GCF/002/533/775/GCF_002533775.1_ASM253377v1","ftp://ftp.ncbi.nlm.nih.gov/genomes/all/GCA/002/533/775/GCA_002533775.1_ASM253377v1","SAMN05408392","PRJNA329307","GCA_002533775.1","1.67944","38.9","-","MBGW01","72","1683","1526/341685","10/13/2017","7/30/2019","Contig","2017-10-13T00:00:00Z","Universidad de Ciencias Aplicadas y Ambientales UDCA","Illumina MiSeq","74.83x","A5 pipeline v. MAY-2016","","","72","1679435","Colombia","Human, Homo sapiens"
"Helicobacter pylori 22278","341193","210","210.2936","","","N/A","","ftp://ftp.ncbi.nlm.nih.gov/genomes/all/GCF/002/532/725/GCF_002532725.1_ASM253272v1","ftp://ftp.ncbi.nlm.nih.gov/genomes/all/GCA/002/532/725/GCA_002532725.1_ASM253272v1","SAMN05408387","PRJNA329306","GCA_002532725.1","1.61597","38.9","-","MBKA01","33","1603","1450/341193","10/12/2017","7/30/2019","Contig","2017-10-12T00:00:00Z","Universidad de Ciencias Aplicadas y Ambientales UDCA","Illumina MiSeq","137.15x","A5 pipeline v. MAY-2016","","","33","1615973","Colombia","Human, Homo sapiens"
"Helicobacter pylori 22308","341711","210","210.3014","","","N/A","","ftp://ftp.ncbi.nlm.nih.gov/genomes/all/GCF/002/534/305/GCF_002534305.1_ASM253430v1","ftp://ftp.ncbi.nlm.nih.gov/genomes/all/GCA/002/534/305/GCA_002534305.1_ASM253430v1","SAMN05408386","PRJNA329304","GCA_002534305.1","1.69542","38.9","-","MBGV01","109","1698","1545/341711","10/13/2017","7/30/2019","Contig","2017-10-13T00:00:00Z","Universidad de Ciencias Aplicadas y Ambientales UDCA","Illumina MiSeq","288.09x","A5 pipeline v. MAY-2016","","","109","1695419","Colombia","Human, Homo sapiens"
"Helicobacter pylori 22311","341683","210","210.2981","","","N/A","","ftp://ftp.ncbi.nlm.nih.gov/genomes/all/GCF/002/533/755/GCF_002533755.1_ASM253375v1","ftp://ftp.ncbi.nlm.nih.gov/genomes/all/GCA/002/533/755/GCA_002533755.1_ASM253375v1","SAMN05408385","PRJNA329302","GCA_002533755.1","1.65282","38.9","-","MBGU01","58","1647","1498/341683","10/13/2017","7/30/2019","Contig","2017-10-13T00:00:00Z","Universidad de Ciencias Aplicadas y Ambientales UDCA","Illumina MiSeq","103.67x","A5 pipeline v. MAY-2016","","","58","1652825","Colombia","Human, Homo sapiens"
"Helicobacter pylori 22312","341645","210","210.2948","","","N/A","","ftp://ftp.ncbi.nlm.nih.gov/genomes/all/GCF/002/532/985/GCF_002532985.1_ASM253298v1","ftp://ftp.ncbi.nlm.nih.gov/genomes/all/GCA/002/532/985/GCA_002532985.1_ASM253298v1","SAMN05408342","PRJNA329294","GCA_002532985.1","1.63462","39","-","MBGT01","50","1621","1470/341645","10/13/2017","7/30/2019","Contig","2017-10-13T00:00:00Z","Universidad de Ciencias Aplicadas y Ambientales UDCA","Illumina MiSeq","112.99x","A5 pipeline v. MAY-2016","","","50","1634624","Colombia","Human, Homo sapiens"
"Helicobacter pylori 22315","341647","210","210.2950","","","N/A","","ftp://ftp.ncbi.nlm.nih.gov/genomes/all/GCF/002/533/025/GCF_002533025.1_ASM253302v1","ftp://ftp.ncbi.nlm.nih.gov/genomes/all/GCA/002/533/025/GCA_002533025.1_ASM253302v1","SAMN05408341","PRJNA329293","GCA_002533025.1","1.66181","38.9","-","MBGS01","61","1684","1498/341647","10/13/2017","7/30/2019","Contig","2017-10-13T00:00:00Z","Universidad de Ciencias Aplicadas y Ambientales UDCA","Illumina MiSeq","143.46x","A5 pipeline v. MAY-2016","","","61","1661814","Colombia","Human, Homo sapiens"
"Helicobacter pylori 22316","341682","210","210.2982","","","N/A","","-","ftp://ftp.ncbi.nlm.nih.gov/genomes/all/GCA/002/533/705/GCA_002533705.1_ASM253370v1","SAMN05408340","PRJNA329292","GCA_002533705.1","1.88744","38.9","-","MBGR01","387","1776","1574/341682","10/13/2017","10/13/2017","Contig","2017-10-13T00:00:00Z","Universidad de Ciencias Aplicadas y Ambientales UDCA","Illumina MiSeq","45.09x","A5 pipeline v. MAY-2016","","","387","1887442","Colombia","Human, Homo sapiens"
"Helicobacter pylori 22317","341644","210","210.2947","","","N/A","","ftp://ftp.ncbi.nlm.nih.gov/genomes/all/GCF/002/532/975/GCF_002532975.1_ASM253297v1","ftp://ftp.ncbi.nlm.nih.gov/genomes/all/GCA/002/532/975/GCA_002532975.1_ASM253297v1","SAMN05408284","PRJNA329289","GCA_002532975.1","1.65812","38.9","-","MBGQ01","64","1654","1485/341644","10/13/2017","7/30/2019","Contig","2017-10-13T00:00:00Z","Universidad de Ciencias Aplicadas y Ambientales UDCA","Illumina MiSeq","148.93x","A5 pipeline v. MAY-2016","","","64","1658120","Colombia","Human, Homo sapiens"
"Helicobacter pylori 22322","341681","210","210.2983","","","N/A","","ftp://ftp.ncbi.nlm.nih.gov/genomes/all/GCF/002/533/695/GCF_002533695.1_ASM253369v1","ftp://ftp.ncbi.nlm.nih.gov/genomes/all/GCA/002/533/695/GCA_002533695.1_ASM253369v1","SAMN05408283","PRJNA329288","GCA_002533695.1","1.65636","39","-","MBHR01","86","1674","1504/341681","10/13/2017","7/30/2019","Contig","2017-10-13T00:00:00Z","Universidad de Ciencias Aplicadas y Ambientales UDCA","Illumina MiSeq","127.6x","A5 pipeline v. MAY-2016","","","86","1656363","Colombia","Human, Homo sapiens"
"Helicobacter pylori 22327","341712","210","210.3015","","","N/A","","ftp://ftp.ncbi.nlm.nih.gov/genomes/all/GCF/002/534/315/GCF_002534315.1_ASM253431v1","ftp://ftp.ncbi.nlm.nih.gov/genomes/all/GCA/002/534/315/GCA_002534315.1_ASM253431v1","SAMN05408282","PRJNA329287","GCA_002534315.1","1.74649","39","-","MBHQ01","245","1828","1578/341712","10/13/2017","7/30/2019","Contig","2017-10-13T00:00:00Z","Universidad de Ciencias Aplicadas y Ambientales UDCA","Illumina MiSeq","140.39x","A5 pipeline v. MAY-2016","","","245","1746488","Colombia","Human, Homo sapiens"
"Helicobacter pylori 22331","341680","210","210.2985","","","N/A","","ftp://ftp.ncbi.nlm.nih.gov/genomes/all/GCF/002/533/685/GCF_002533685.1_ASM253368v1","ftp://ftp.ncbi.nlm.nih.gov/genomes/all/GCA/002/533/685/GCA_002533685.1_ASM253368v1","SAMN05408281","PRJNA329286","GCA_002533685.1","1.67336","38.8","-","MBHP01","50","1653","1509/341680","10/13/2017","7/30/2019","Contig","2017-10-13T00:00:00Z","Universidad de Ciencias Aplicadas y Ambientales UDCA","Illumina MiSeq","127.75x","A5 pipeline v. MAY-2016","","","50","1673360","Colombia","Human, Homo sapiens"
"Helicobacter pylori 22335","341679","210","210.2979","","","N/A","","ftp://ftp.ncbi.nlm.nih.gov/genomes/all/GCF/002/533/675/GCF_002533675.1_ASM253367v1","ftp://ftp.ncbi.nlm.nih.gov/genomes/all/GCA/002/533/675/GCA_002533675.1_ASM253367v1","SAMN05408280","PRJNA329285","GCA_002533675.1","1.66625","39.1","-","MBHO01","88","1651","1491/341679","10/13/2017","7/30/2019","Contig","2017-10-13T00:00:00Z","Universidad de Ciencias Aplicadas y Ambientales UDCA","Illumina MiSeq","117.66x","A5 pipeline v. MAY-2016","","","88","1666250","Colombia","Human, Homo sapiens"
"Helicobacter pylori 22336","341678","210","210.2986","","","N/A","","ftp://ftp.ncbi.nlm.nih.gov/genomes/all/GCF/002/533/655/GCF_002533655.1_ASM253365v1","ftp://ftp.ncbi.nlm.nih.gov/genomes/all/GCA/002/533/655/GCA_002533655.1_ASM253365v1","SAMN05408279","PRJNA329284","GCA_002533655.1","1.6856","39.1","-","MBHN01","114","1685","1507/341678","10/13/2017","7/30/2019","Contig","2017-10-13T00:00:00Z","Universidad de Ciencias Aplicadas y Ambientales UDCA","Illumina MiSeq","225.05x","A5 pipeline v. MAY-2016","","","114","1685604","Colombia","Human, Homo sapiens"
"Helicobacter pylori 22337","341713","210","210.3017","","","N/A","","ftp://ftp.ncbi.nlm.nih.gov/genomes/all/GCF/002/534/325/GCF_002534325.1_ASM253432v1","ftp://ftp.ncbi.nlm.nih.gov/genomes/all/GCA/002/534/325/GCA_002534325.1_ASM253432v1","SAMN05408278","PRJNA329281","GCA_002534325.1","1.68554","39","-","MBIW01","120","1700","1517/341713","10/13/2017","7/30/2019","Contig","2017-10-13T00:00:00Z","Universidad de Ciencias Aplicadas y Ambientales UDCA","Illumina MiSeq","236.0x","A5 pipeline v. MAY-2016","","","120","1685536","Colombia","Human, Homo sapiens"
"Helicobacter pylori 22339","341677","210","210.2980","","","N/A","","ftp://ftp.ncbi.nlm.nih.gov/genomes/all/GCF/002/533/615/GCF_002533615.1_ASM253361v1","ftp://ftp.ncbi.nlm.nih.gov/genomes/all/GCA/002/533/615/GCA_002533615.1_ASM253361v1","SAMN05408023","PRJNA329280","GCA_002533615.1","1.78896","39.1","-","MBIV01","265","1902","1636/341677","10/13/2017","7/30/2019","Contig","2017-10-13T00:00:00Z","Universidad de Ciencias Aplicadas y Ambientales UDCA","Illumina MiSeq","117.15x","A5 pipeline v. MAY-2016","","","265","1788959","Colombia","Human, Homo sapiens"
"Helicobacter pylori 22341","341675","210","210.2984","","","N/A","","ftp://ftp.ncbi.nlm.nih.gov/genomes/all/GCF/002/533/595/GCF_002533595.1_ASM253359v1","ftp://ftp.ncbi.nlm.nih.gov/genomes/all/GCA/002/533/595/GCA_002533595.1_ASM253359v1","SAMN05408020","PRJNA329278","GCA_002533595.1","1.68366","39","-","MBIU01","77","1669","1501/341675","10/13/2017","7/30/2019","Contig","2017-10-13T00:00:00Z","Universidad de Ciencias Aplicadas y Ambientales UDCA","Illumina MiSeq","116.31x","A5 pipeline v. MAY-2016","","","77","1683657","Colombia","Human, Homo sapiens"
"Helicobacter pylori 22343","341676","210","210.2977","","","N/A","","ftp://ftp.ncbi.nlm.nih.gov/genomes/all/GCF/002/533/605/GCF_002533605.1_ASM253360v1","ftp://ftp.ncbi.nlm.nih.gov/genomes/all/GCA/002/533/605/GCA_002533605.1_ASM253360v1","SAMN05408006","PRJNA329277","GCA_002533605.1","1.76034","39","-","MBIT01","151","1811","1568/341676","10/13/2017","7/30/2019","Contig","2017-10-13T00:00:00Z","Universidad de Ciencias Aplicadas y Ambientales UDCA","Illumina MiSeq","113.29x","A5 pipeline v. MAY-2016","","","151","1760343","Colombia","Human, Homo sapiens"
"Helicobacter pylori 22345","423559","210","210.5248","","","N/A","","ftp://ftp.ncbi.nlm.nih.gov/genomes/all/GCF/003/815/595/GCF_003815595.1_ASM381559v1","ftp://ftp.ncbi.nlm.nih.gov/genomes/all/GCA/003/815/595/GCA_003815595.1_ASM381559v1","SAMN10419324","PRJNA505429","GCA_003815595.1","1.66169","38.9","-","RPFQ01","43","1683","1486/423559","11/24/2018","8/23/2019","Contig","2018-11-24T00:00:00Z","Universidad de Ciencias Aplicadas y Ambientales UDCA","Illumina MiSeq","50.0x","A5 pipeline v. MAY-2015","","","43","1661685","Colombia",""
"Helicobacter pylori 22346","341674","210","210.2976","","","N/A","","ftp://ftp.ncbi.nlm.nih.gov/genomes/all/GCF/002/533/575/GCF_002533575.1_ASM253357v1","ftp://ftp.ncbi.nlm.nih.gov/genomes/all/GCA/002/533/575/GCA_002533575.1_ASM253357v1","SAMN05408005","PRJNA329276","GCA_002533575.1","1.65625","39","-","MBIS01","93","1667","1500/341674","10/13/2017","7/30/2019","Contig","2017-10-13T00:00:00Z","Universidad de Ciencias Aplicadas y Ambientales UDCA","Illumina MiSeq","116.77x","A5 pipeline v. MAY-2016","","","93","1656254","Colombia","Human, Homo sapiens"
"Helicobacter pylori 22347","341190","210","210.2933","","","N/A","","ftp://ftp.ncbi.nlm.nih.gov/genomes/all/GCF/002/532/675/GCF_002532675.1_ASM253267v1","ftp://ftp.ncbi.nlm.nih.gov/genomes/all/GCA/002/532/675/GCA_002532675.1_ASM253267v1","SAMN05408004","PRJNA329274","GCA_002532675.1","1.65223","38.9","-","MBJZ01","34","1644","1478/341190","10/12/2017","7/30/2019","Contig","2017-10-12T00:00:00Z","Universidad de Ciencias Aplicadas y Ambientales UDCA","Illumina MiSeq","224.11x","A5 pipeline v. MAY-2016","","","34","1652228","Colombia","Human, Homo sapiens"
"Helicobacter pylori 22350","341673","210","210.2967","","","N/A","","ftp://ftp.ncbi.nlm.nih.gov/genomes/all/GCF/002/533/535/GCF_002533535.1_ASM253353v1","ftp://ftp.ncbi.nlm.nih.gov/genomes/all/GCA/002/533/535/GCA_002533535.1_ASM253353v1","SAMN05408003","PRJNA329273","GCA_002533535.1","1.75735","38.9","-","MBIR01","135","1802","1589/341673","10/13/2017","7/30/2019","Contig","2017-10-13T00:00:00Z","Universidad de Ciencias Aplicadas y Ambientales UDCA","Illumina MiSeq","230.14x","A5 pipeline v. MAY-2016","","","135","1757352","Colombia","Human, Homo sapiens"
"Helicobacter pylori 22351","341671","210","210.2970","","","N/A","","ftp://ftp.ncbi.nlm.nih.gov/genomes/all/GCF/002/533/515/GCF_002533515.1_ASM253351v1","ftp://ftp.ncbi.nlm.nih.gov/genomes/all/GCA/002/533/515/GCA_002533515.1_ASM253351v1","SAMN05407987","PRJNA329272","GCA_002533515.1","1.6365","39","-","MBIQ01","75","1625","1477/341671","10/13/2017","7/30/2019","Contig","2017-10-13T00:00:00Z","Universidad de Ciencias Aplicadas y Ambientales UDCA","Illumina MiSeq","38.41x","A5 pipeline v. MAY-2016","","","75","1636502","Colombia","Human, Homo sapiens"
"Helicobacter pylori 22352","341189","210","210.2939","","","N/A","","ftp://ftp.ncbi.nlm.nih.gov/genomes/all/GCF/002/532/625/GCF_002532625.1_ASM253262v1","ftp://ftp.ncbi.nlm.nih.gov/genomes/all/GCA/002/532/625/GCA_002532625.1_ASM253262v1","SAMN05407986","PRJNA329270","GCA_002532625.1","1.65654","38.9","-","MBJY01","46","1651","1501/341189","10/12/2017","7/30/2019","Contig","2017-10-12T00:00:00Z","Universidad de Ciencias Aplicadas y Ambientales UDCA","Illumina MiSeq","68.02x","A5 pipeline v. MAY-2016","","","46","1656538","Colombia","Human, Homo sapiens"
"Helicobacter pylori 22360","341672","210","210.2974","","","N/A","","ftp://ftp.ncbi.nlm.nih.gov/genomes/all/GCF/002/533/525/GCF_002533525.1_ASM253352v1","ftp://ftp.ncbi.nlm.nih.gov/genomes/all/GCA/002/533/525/GCA_002533525.1_ASM253352v1","SAMN05407985","PRJNA329269","GCA_002533525.1","1.70362","38.7","-","MBIP01","66","1708","1548/341672","10/13/2017","7/30/2019","Contig","2017-10-13T00:00:00Z","Universidad de Ciencias Aplicadas y Ambientales UDCA","Illumina MiSeq","87.29x","A5 pipeline v. MAY-2016","","","66","1703616","Colombia","Human, Homo sapiens"
"Helicobacter pylori 22362","341670","210","210.2968","","","N/A","","ftp://ftp.ncbi.nlm.nih.gov/genomes/all/GCF/002/533/495/GCF_002533495.1_ASM253349v1","ftp://ftp.ncbi.nlm.nih.gov/genomes/all/GCA/002/533/495/GCA_002533495.1_ASM253349v1","SAMN05407984","PRJNA329268","GCA_002533495.1","1.66473","38.9","-","MBIO01","34","1665","1491/341670","10/13/2017","7/30/2019","Contig","2017-10-13T00:00:00Z","Universidad de Ciencias Aplicadas y Ambientales UDCA","Illumina MiSeq","87.94x","A5 pipeline v. MAY-2016","","","34","1664727","Colombia","Human, Homo sapiens"
"Helicobacter pylori 22366","341668","210","210.2965","","","N/A","","ftp://ftp.ncbi.nlm.nih.gov/genomes/all/GCF/002/533/455/GCF_002533455.1_ASM253345v1","ftp://ftp.ncbi.nlm.nih.gov/genomes/all/GCA/002/533/455/GCA_002533455.1_ASM253345v1","SAMN05407983","PRJNA329266","GCA_002533455.1","1.64178","38.9","-","MBIN01","42","1622","1468/341668","10/13/2017","7/30/2019","Contig","2017-10-13T00:00:00Z","Universidad de Ciencias Aplicadas y Ambientales UDCA","Illumina MiSeq","293.99x","A5 pipeline v. MAY-2016","","","42","1641782","Colombia","Human, Homo sapiens"
"Helicobacter pylori 22367","341669","210","210.2966","","","N/A","","ftp://ftp.ncbi.nlm.nih.gov/genomes/all/GCF/002/533/465/GCF_002533465.1_ASM253346v1","ftp://ftp.ncbi.nlm.nih.gov/genomes/all/GCA/002/533/465/GCA_002533465.1_ASM253346v1","SAMN05407981","PRJNA329263","GCA_002533465.1","1.64466","39","-","MBIM01","45","1638","1479/341669","10/13/2017","7/30/2019","Contig","2017-10-13T00:00:00Z","Universidad de Ciencias Aplicadas y Ambientales UDCA","Illumina MiSeq","175.27x","A5 pipeline v. MAY-2016","","","45","1644660","Colombia","Human, Homo sapiens"
"Helicobacter pylori 22368","341667","210","210.2971","","","N/A","","ftp://ftp.ncbi.nlm.nih.gov/genomes/all/GCF/002/533/425/GCF_002533425.1_ASM253342v1","ftp://ftp.ncbi.nlm.nih.gov/genomes/all/GCA/002/533/425/GCA_002533425.1_ASM253342v1","SAMN05407978","PRJNA329262","GCA_002533425.1","1.65216","38.9","-","MBIL01","70","1660","1505/341667","10/13/2017","7/30/2019","Contig","2017-10-13T00:00:00Z","Universidad de Ciencias Aplicadas y Ambientales UDCA","Illumina MiSeq","58.19x","A5 pipeline v. MAY-2016","","","70","1652164","Colombia","Human, Homo sapiens"
"Helicobacter pylori 22370","341666","210","210.2964","","","N/A","","ftp://ftp.ncbi.nlm.nih.gov/genomes/all/GCF/002/533/415/GCF_002533415.1_ASM253341v1","ftp://ftp.ncbi.nlm.nih.gov/genomes/all/GCA/002/533/415/GCA_002533415.1_ASM253341v1","SAMN05407977","PRJNA329261","GCA_002533415.1","1.79891","39.1","-","MBIK01","254","1840","1638/341666","10/13/2017","7/30/2019","Contig","2017-10-13T00:00:00Z","Universidad de Ciencias Aplicadas y Ambientales UDCA","Illumina MiSeq","77.56x","A5 pipeline v. MAY-2016","","","254","1798914","Colombia","Human, Homo sapiens"
"Helicobacter pylori 22371","341665","210","210.2975","","","N/A","","ftp://ftp.ncbi.nlm.nih.gov/genomes/all/GCF/002/533/375/GCF_002533375.1_ASM253337v1","ftp://ftp.ncbi.nlm.nih.gov/genomes/all/GCA/002/533/375/GCA_002533375.1_ASM253337v1","SAMN05407976","PRJNA329259","GCA_002533375.1","1.69341","39","-","MBIJ01","152","1691","1506/341665","10/13/2017","7/30/2019","Contig","2017-10-13T00:00:00Z","Universidad de Ciencias Aplicadas y Ambientales UDCA","Illumina MiSeq","39.15x","A5 pipeline v. MAY-2016","","","152","1693405","Colombia","Human, Homo sapiens"
"Helicobacter pylori 22377","341663","210","210.2963","","","N/A","","ftp://ftp.ncbi.nlm.nih.gov/genomes/all/GCF/002/533/355/GCF_002533355.1_ASM253335v1","ftp://ftp.ncbi.nlm.nih.gov/genomes/all/GCA/002/533/355/GCA_002533355.1_ASM253335v1","SAMN05407975","PRJNA329258","GCA_002533355.1","1.68013","38.9","-","MBII01","82","1656","1511/341663","10/13/2017","7/30/2019","Contig","2017-10-13T00:00:00Z","Universidad de Ciencias Aplicadas y Ambientales UDCA","Illumina MiSeq","50.39x","A5 pipeline v. MAY-2016","","","82","1680132","Colombia","Human, Homo sapiens"
"Helicobacter pylori 22378","341664","210","210.2978","","","N/A","","ftp://ftp.ncbi.nlm.nih.gov/genomes/all/GCF/002/533/365/GCF_002533365.1_ASM253336v1","ftp://ftp.ncbi.nlm.nih.gov/genomes/all/GCA/002/533/365/GCA_002533365.1_ASM253336v1","SAMN05407974","PRJNA329253","GCA_002533365.1","1.67215","38.9","-","MBIH01","67","1692","1509/341664","10/13/2017","7/30/2019","Contig","2017-10-13T00:00:00Z","Universidad de Ciencias Aplicadas y Ambientales UDCA","Illumina MiSeq","46.54x","A5 pipeline v. MAY-2016","","","67","1672150","Colombia","Human, Homo sapiens"
"Helicobacter pylori 22385","341662","210","210.2969","","","N/A","","ftp://ftp.ncbi.nlm.nih.gov/genomes/all/GCF/002/533/335/GCF_002533335.1_ASM253333v1","ftp://ftp.ncbi.nlm.nih.gov/genomes/all/GCA/002/533/335/GCA_002533335.1_ASM253333v1","SAMN05407973","PRJNA329252","GCA_002533335.1","1.67383","38.8","-","MBIG01","54","1675","1526/341662","10/13/2017","7/30/2019","Contig","2017-10-13T00:00:00Z","Universidad de Ciencias Aplicadas y Ambientales UDCA","Illumina MiSeq","118.22x","A5 pipeline v. MAY-2016","","","54","1673830","Colombia","Human, Homo sapiens"
"Helicobacter pylori 22386","341661","210","210.2961","","","N/A","","ftp://ftp.ncbi.nlm.nih.gov/genomes/all/GCF/002/533/295/GCF_002533295.1_ASM253329v1","ftp://ftp.ncbi.nlm.nih.gov/genomes/all/GCA/002/533/295/GCA_002533295.1_ASM253329v1","SAMN05407971","PRJNA329251","GCA_002533295.1","1.64248","38.9","-","MBIF01","50","1672","1484/341661","10/13/2017","7/30/2019","Contig","2017-10-13T00:00:00Z","Universidad de Ciencias Aplicadas y Ambientales UDCA","Illumina MiSeq","126.7x","A5 pipeline v. MAY-2016","","","50","1642484","Colombia","Human, Homo sapiens"
"Helicobacter pylori 22388","423555","210","210.5245","","","N/A","","-","ftp://ftp.ncbi.nlm.nih.gov/genomes/all/GCA/003/815/485/GCA_003815485.1_ASM381548v1","SAMN10419323","PRJNA505428","GCA_003815485.1","1.91281","38.9","-","RPFP01","314","2068","1912/423555","11/24/2018","11/24/2018","Contig","2018-11-24T00:00:00Z","Universidad de Ciencias Aplicadas y Ambientales UDCA","Illumina MiSeq","50.0x","A5 pipeline v. MAY-2015","","","314","1912812","Colombia",""
"Helicobacter pylori 22389","341188","210","210.2935","","","N/A","","ftp://ftp.ncbi.nlm.nih.gov/genomes/all/GCF/002/532/615/GCF_002532615.1_ASM253261v1","ftp://ftp.ncbi.nlm.nih.gov/genomes/all/GCA/002/532/615/GCA_002532615.1_ASM253261v1","SAMN05407970","PRJNA329249","GCA_002532615.1","1.59865","39","-","MBJX01","42","1589","1453/341188","10/12/2017","7/30/2019","Contig","2017-10-12T00:00:00Z","Universidad de Ciencias Aplicadas y Ambientales UDCA","Illumina MiSeq","169.89x","A5 pipeline v. MAY-2016","","","42","1598649","Colombia","Human, Homo sapiens"
"Helicobacter pylori 22390","341660","210","210.2962","","","N/A","","ftp://ftp.ncbi.nlm.nih.gov/genomes/all/GCF/002/533/285/GCF_002533285.1_ASM253328v1","ftp://ftp.ncbi.nlm.nih.gov/genomes/all/GCA/002/533/285/GCA_002533285.1_ASM253328v1","SAMN05407969","PRJNA329248","GCA_002533285.1","1.59321","39.1","-","MBIE01","56","1625","1453/341660","10/13/2017","7/30/2019","Contig","2017-10-13T00:00:00Z","Universidad de Ciencias Aplicadas y Ambientales UDCA","Illumina MiSeq","194.94x","A5 pipeline v. MAY-2016","","","56","1593210","Colombia","Human, Homo sapiens"
"Helicobacter pylori 22393","341659","210","210.2972","","","N/A","","ftp://ftp.ncbi.nlm.nih.gov/genomes/all/GCF/002/533/275/GCF_002533275.1_ASM253327v1","ftp://ftp.ncbi.nlm.nih.gov/genomes/all/GCA/002/533/275/GCA_002533275.1_ASM253327v1","SAMN05407497","PRJNA329246","GCA_002533275.1","1.75524","38.9","-","MBID01","130","1762","1580/341659","10/13/2017","7/30/2019","Contig","2017-10-13T00:00:00Z","Universidad de Ciencias Aplicadas y Ambientales UDCA","Illumina MiSeq","74.21x","A5 pipeline v. MAY-2016","","","130","1755241","Colombia","Human, Homo sapiens"
"Helicobacter pylori 22395","341656","210","210.2959","","","N/A","","ftp://ftp.ncbi.nlm.nih.gov/genomes/all/GCF/002/533/205/GCF_002533205.1_ASM253320v1","ftp://ftp.ncbi.nlm.nih.gov/genomes/all/GCA/002/533/205/GCA_002533205.1_ASM253320v1","SAMN05406444","PRJNA329244","GCA_002533205.1","1.7659","39.1","-","MBIC01","215","1767","1570/341656","10/13/2017","7/30/2019","Contig","2017-10-13T00:00:00Z","Universidad de Ciencias Aplicadas y Ambientales UDCA","Illumina MiSeq","111.19x","A5 pipeline v. MAY-2016","","","215","1765897","Colombia","Human, Homo sapiens"
"Helicobacter pylori 22402","341657","210","210.2960","","","N/A","","ftp://ftp.ncbi.nlm.nih.gov/genomes/all/GCF/002/533/225/GCF_002533225.1_ASM253322v1","ftp://ftp.ncbi.nlm.nih.gov/genomes/all/GCA/002/533/225/GCA_002533225.1_ASM253322v1","SAMN05405368","PRJNA329243","GCA_002533225.1","1.62821","38.9","-","MBIB01","48","1610","1462/341657","10/13/2017","7/30/2019","Contig","2017-10-13T00:00:00Z","Universidad de Ciencias Aplicadas y Ambientales UDCA","Illumina MiSeq","194.46x","A5 pipeline v. MAY-2016","","","48","1628208","Colombia","Human, Homo sapiens"
"Helicobacter pylori 23:2_single","372650","210","210.4198","","","N/A","","ftp://ftp.ncbi.nlm.nih.gov/genomes/all/GCF/003/059/065/GCF_003059065.1_ASM305906v1","ftp://ftp.ncbi.nlm.nih.gov/genomes/all/GCA/003/059/065/GCA_003059065.1_ASM305906v1","SAMN08381284","PRJNA395900","GCA_003059065.1","1.64745","38.9","-","QBPR01","77","1668","1479/372650","4/22/2018","8/11/2019","Contig","2018-04-22T00:00:00Z","University of Bath","Illumina","50x","Velvet v. 1.2.08","","","77","1647450","Sweden","Human, Homo sapiens"
"Helicobacter pylori 24004","341658","210","210.2973","","","N/A","","ftp://ftp.ncbi.nlm.nih.gov/genomes/all/GCF/002/533/235/GCF_002533235.1_ASM253323v1","ftp://ftp.ncbi.nlm.nih.gov/genomes/all/GCA/002/533/235/GCA_002533235.1_ASM253323v1","SAMN05404045","PRJNA329242","GCA_002533235.1","1.66494","38.9","-","MBIA01","61","1662","1512/341658","10/13/2017","7/30/2019","Contig","2017-10-13T00:00:00Z","Universidad de Ciencias Aplicadas y Ambientales UDCA","Illumina MiSeq","162.95x","A5 pipeline v. MAY-2016","","","61","1664940","Colombia","Human, Homo sapiens"
"Helicobacter pylori 24012","341186","210","210.2930","","","N/A","","ftp://ftp.ncbi.nlm.nih.gov/genomes/all/GCF/002/532/595/GCF_002532595.1_ASM253259v1","ftp://ftp.ncbi.nlm.nih.gov/genomes/all/GCA/002/532/595/GCA_002532595.1_ASM253259v1","SAMN05402748","PRJNA329239","GCA_002532595.1","1.59883","39.1","-","MBJW01","135","1618","1461/341186","10/12/2017","7/30/2019","Contig","2017-10-12T00:00:00Z","Universidad de Ciencias Aplicadas y Ambientales UDCA","Illumina MiSeq","37.78x","A5 pipeline v. MAY-2016","","","135","1598826","Colombia","Human, Homo sapiens"
"Helicobacter pylori 24013","341655","210","210.2957","","","N/A","","ftp://ftp.ncbi.nlm.nih.gov/genomes/all/GCF/002/533/195/GCF_002533195.1_ASM253319v1","ftp://ftp.ncbi.nlm.nih.gov/genomes/all/GCA/002/533/195/GCA_002533195.1_ASM253319v1","SAMN05400733","PRJNA329229","GCA_002533195.1","1.64637","38.8","-","MBHZ01","48","1629","1476/341655","10/13/2017","7/30/2019","Contig","2017-10-13T00:00:00Z","Universidad de Ciencias Aplicadas y Ambientales UDCA","Illumina MiSeq","107.6x","A5 pipeline v. MAY-2016","","","48","1646368","Colombia","Human, Homo sapiens"
"Helicobacter pylori 26024","341654","210","210.2958","","","N/A","","ftp://ftp.ncbi.nlm.nih.gov/genomes/all/GCF/002/533/175/GCF_002533175.1_ASM253317v1","ftp://ftp.ncbi.nlm.nih.gov/genomes/all/GCA/002/533/175/GCA_002533175.1_ASM253317v1","SAMN05399447","PRJNA329227","GCA_002533175.1","1.671","38.9","-","MBHY01","43","1666","1507/341654","10/13/2017","7/30/2019","Contig","2017-10-13T00:00:00Z","Universidad de Ciencias Aplicadas y Ambientales UDCA","Illumina MiSeq","106.5x","A5 pipeline v. MAY-2016","","","43","1671004","Colombia","Human, Homo sapiens"
"Helicobacter pylori 26083","341187","210","210.2934","","","N/A","","ftp://ftp.ncbi.nlm.nih.gov/genomes/all/GCF/002/532/605/GCF_002532605.1_ASM253260v1","ftp://ftp.ncbi.nlm.nih.gov/genomes/all/GCA/002/532/605/GCA_002532605.1_ASM253260v1","SAMN05397823","PRJNA329225","GCA_002532605.1","1.66681","38.9","-","MBJV01","47","1648","1493/341187","10/12/2017","7/30/2019","Contig","2017-10-12T00:00:00Z","Universidad de Ciencias Aplicadas y Ambientales UDCA","Illumina MiSeq","61.71x","A5 pipeline v. MAY-2016","","","47","1666814","Colombia","Human, Homo sapiens"
"Helicobacter pylori 26084","341653","210","210.2956","","","N/A","","ftp://ftp.ncbi.nlm.nih.gov/genomes/all/GCF/002/533/145/GCF_002533145.1_ASM253314v1","ftp://ftp.ncbi.nlm.nih.gov/genomes/all/GCA/002/533/145/GCA_002533145.1_ASM253314v1","SAMN05395355","PRJNA329223","GCA_002533145.1","1.65119","39","-","MBHX01","46","1628","1476/341653","10/13/2017","7/30/2019","Contig","2017-10-13T00:00:00Z","Universidad de Ciencias Aplicadas y Ambientales UDCA","Illumina MiSeq","109.53x","A5 pipeline v. MAY-2016","","","46","1651187","Colombia","Human, Homo sapiens"
"Helicobacter pylori 26093","341648","210","210.2951","","","N/A","","ftp://ftp.ncbi.nlm.nih.gov/genomes/all/GCF/002/533/055/GCF_002533055.1_ASM253305v1","ftp://ftp.ncbi.nlm.nih.gov/genomes/all/GCA/002/533/055/GCA_002533055.1_ASM253305v1","SAMN05394518","PRJNA329221","GCA_002533055.1","1.64173","38.9","-","MBHW01","53","1639","1479/341648","10/13/2017","7/30/2019","Contig","2017-10-13T00:00:00Z","Universidad de Ciencias Aplicadas y Ambientales UDCA","Illumina MiSeq","116.65x","A5 pipeline v. MAY-2016","","","53","1641735","Colombia","Human, Homo sapiens"
"Helicobacter pylori 26100","341652","210","210.2954","","","N/A","","ftp://ftp.ncbi.nlm.nih.gov/genomes/all/GCF/002/533/135/GCF_002533135.1_ASM253313v1","ftp://ftp.ncbi.nlm.nih.gov/genomes/all/GCA/002/533/135/GCA_002533135.1_ASM253313v1","SAMN05393257","PRJNA329220","GCA_002533135.1","1.67836","38.9","-","MBHV01","81","1661","1496/341652","10/13/2017","7/30/2019","Contig","2017-10-13T00:00:00Z","Universidad de Ciencias Aplicadas y Ambientales UDCA","Illumina MiSeq","397.83x","A5 pipeline v. MAY-2016","","","81","1678362","Colombia","Human, Homo sapiens"
"Helicobacter pylori 27:04:00","372648","210","210.4200","","","N/A","","ftp://ftp.ncbi.nlm.nih.gov/genomes/all/GCF/003/059/025/GCF_003059025.1_ASM305902v1","ftp://ftp.ncbi.nlm.nih.gov/genomes/all/GCA/003/059/025/GCA_003059025.1_ASM305902v1","SAMN08381287","PRJNA395900","GCA_003059025.1","1.60703","39.1","-","QBPQ01","73","1599","1430/372648","4/22/2018","8/11/2019","Contig","2018-04-22T00:00:00Z","University of Bath","Illumina","50x","Velvet v. 1.2.08","","","73","1607034","Sweden","Human, Homo sapiens"
"Helicobacter pylori 29:2_single","372647","210","210.4201","","","N/A","","ftp://ftp.ncbi.nlm.nih.gov/genomes/all/GCF/003/058/995/GCF_003058995.1_ASM305899v1","ftp://ftp.ncbi.nlm.nih.gov/genomes/all/GCA/003/058/995/GCA_003058995.1_ASM305899v1","SAMN08381288","PRJNA395900","GCA_003058995.1","1.59624","39.1","-","QBPP01","72","1608","1455/372647","4/22/2018","8/11/2019","Contig","2018-04-22T00:00:00Z","University of Bath","Illumina","50x","Velvet v. 1.2.08","","","72","1596241","Sweden","Human, Homo sapiens"
"Helicobacter pylori 3004","341720","210","210.3022","","","N/A","","ftp://ftp.ncbi.nlm.nih.gov/genomes/all/GCF/002/534/495/GCF_002534495.1_ASM253449v1","ftp://ftp.ncbi.nlm.nih.gov/genomes/all/GCA/002/534/495/GCA_002534495.1_ASM253449v1","SAMN05410613","PRJNA329342","GCA_002534495.1","1.68779","38.8","-","MBIX01","75","1691","1510/341720","10/13/2017","7/30/2019","Contig","2017-10-13T00:00:00Z","Universidad de Ciencias Aplicadas y Ambientales UDCA","Illumina MiSeq","63.76x","A5 pipeline v. MAY-2016","","","75","1687786","Colombia","Human, Homo sapiens"
"Helicobacter pylori 3026","341697","210","210.3000","","","N/A","","ftp://ftp.ncbi.nlm.nih.gov/genomes/all/GCF/002/534/005/GCF_002534005.1_ASM253400v1","ftp://ftp.ncbi.nlm.nih.gov/genomes/all/GCA/002/534/005/GCA_002534005.1_ASM253400v1","SAMN05410611","PRJNA329341","GCA_002534005.1","1.67879","38.9","-","MBIY01","238","1747","1520/341697","10/13/2017","7/30/2019","Contig","2017-10-13T00:00:00Z","Universidad de Ciencias Aplicadas y Ambientales UDCA","Illumina MiSeq","28.62x","A5 pipeline v. MAY-2016","","","238","1678789","Colombia","Human, Homo sapiens"
"Helicobacter pylori 3029","341695","210","210.2999","","","N/A","","ftp://ftp.ncbi.nlm.nih.gov/genomes/all/GCF/002/533/985/GCF_002533985.1_ASM253398v1","ftp://ftp.ncbi.nlm.nih.gov/genomes/all/GCA/002/533/985/GCA_002533985.1_ASM253398v1","SAMN05410610","PRJNA329340","GCA_002533985.1","1.64561","39","-","MBIZ01","118","1662","1501/341695","10/13/2017","7/30/2019","Contig","2017-10-13T00:00:00Z","Universidad de Ciencias Aplicadas y Ambientales UDCA","Illumina MiSeq","36.39x","A5 pipeline v. MAY-2016","","","118","1645607","Colombia","Human, Homo sapiens"
"Helicobacter pylori 3033","341696","210","210.2998","","","N/A","","ftp://ftp.ncbi.nlm.nih.gov/genomes/all/GCF/002/533/995/GCF_002533995.1_ASM253399v1","ftp://ftp.ncbi.nlm.nih.gov/genomes/all/GCA/002/533/995/GCA_002533995.1_ASM253399v1","SAMN05410609","PRJNA329338","GCA_002533995.1","1.62687","39","-","MBJA01","113","1629","1472/341696","10/13/2017","7/30/2019","Contig","2017-10-13T00:00:00Z","Universidad de Ciencias Aplicadas y Ambientales UDCA","Illumina MiSeq","42.06x","A5 pipeline v. MAY-2016","","","113","1626867","Colombia","Human, Homo sapiens"
"Helicobacter pylori 3045","341198","210","210.2942","","","N/A","","ftp://ftp.ncbi.nlm.nih.gov/genomes/all/GCF/002/532/815/GCF_002532815.1_ASM253281v1","ftp://ftp.ncbi.nlm.nih.gov/genomes/all/GCA/002/532/815/GCA_002532815.1_ASM253281v1","SAMN05410608","PRJNA329337","GCA_002532815.1","1.62939","39.1","-","MBKH01","316","1697","1477/341198","10/12/2017","7/30/2019","Contig","2017-10-12T00:00:00Z","Universidad de Ciencias Aplicadas y Ambientales UDCA","Illumina MiSeq","20.22x","A5 pipeline v. MAY-2016","","","316","1629395","Colombia","Human, Homo sapiens"
"Helicobacter pylori 3046","341641","210","210.2943","","","N/A","","ftp://ftp.ncbi.nlm.nih.gov/genomes/all/GCF/002/532/905/GCF_002532905.1_ASM253290v1","ftp://ftp.ncbi.nlm.nih.gov/genomes/all/GCA/002/532/905/GCA_002532905.1_ASM253290v1","SAMN05410604","PRJNA329336","GCA_002532905.1","1.67788","38.8","-","MBGP01","44","1671","1513/341641","10/13/2017","7/30/2019","Contig","2017-10-13T00:00:00Z","Universidad de Ciencias Aplicadas y Ambientales UDCA","Illumina MiSeq","78.55x","A5 pipeline v. MAY-2016","","","44","1677884","Colombia","Human, Homo sapiens"
"Helicobacter pylori 3053","341646","210","210.2949","","","N/A","","ftp://ftp.ncbi.nlm.nih.gov/genomes/all/GCF/002/532/995/GCF_002532995.1_ASM253299v1","ftp://ftp.ncbi.nlm.nih.gov/genomes/all/GCA/002/532/995/GCA_002532995.1_ASM253299v1","SAMN05410598","PRJNA329334","GCA_002532995.1","1.61064","39","-","MBGO01","42","1591","1439/341646","10/13/2017","7/30/2019","Contig","2017-10-13T00:00:00Z","Universidad de Ciencias Aplicadas y Ambientales UDCA","Illumina MiSeq","71.17x","A5 pipeline v. MAY-2016","","","42","1610637","Colombia","Human, Homo sapiens"
"Helicobacter pylori 3056","341640","210","210.2944","","","N/A","","ftp://ftp.ncbi.nlm.nih.gov/genomes/all/GCF/002/532/895/GCF_002532895.1_ASM253289v1","ftp://ftp.ncbi.nlm.nih.gov/genomes/all/GCA/002/532/895/GCA_002532895.1_ASM253289v1","SAMN05410597","PRJNA329333","GCA_002532895.1","1.63032","39","-","MBGN01","60","1630","1459/341640","10/13/2017","7/30/2019","Contig","2017-10-13T00:00:00Z","Universidad de Ciencias Aplicadas y Ambientales UDCA","Illumina MiSeq","47.83x","A5 pipeline v. MAY-2016","","","60","1630322","Colombia","Human, Homo sapiens"
"Helicobacter pylori 3076","341642","210","210.2945","","","N/A","","ftp://ftp.ncbi.nlm.nih.gov/genomes/all/GCF/002/532/915/GCF_002532915.1_ASM253291v1","ftp://ftp.ncbi.nlm.nih.gov/genomes/all/GCA/002/532/915/GCA_002532915.1_ASM253291v1","SAMN05410596","PRJNA329331","GCA_002532915.1","1.64883","39","-","MBGM01","35","1658","1493/341642","10/13/2017","7/30/2019","Contig","2017-10-13T00:00:00Z","Universidad de Ciencias Aplicadas y Ambientales UDCA","Illumina MiSeq","227.33x","A5 pipeline v. MAY-2016","","","35","1648828","Colombia","Human, Homo sapiens"
"Helicobacter pylori 30908","372641","210","210.4207","","","N/A","","ftp://ftp.ncbi.nlm.nih.gov/genomes/all/GCF/003/058/885/GCF_003058885.1_ASM305888v1","ftp://ftp.ncbi.nlm.nih.gov/genomes/all/GCA/003/058/885/GCA_003058885.1_ASM305888v1","SAMN08381242","PRJNA395900","GCA_003058885.1","1.66074","39","-","QBQI01","136","1670","1507/372641","4/22/2018","8/11/2019","Contig","2018-04-22T00:00:00Z","University of Bath","Illumina","50x","Velvet v. 1.2.08","","","136","1660741","Belgium","Human, Homo sapiens"
"Helicobacter pylori 30950","372639","210","210.4155","","","N/A","","ftp://ftp.ncbi.nlm.nih.gov/genomes/all/GCF/003/058/845/GCF_003058845.1_ASM305884v1","ftp://ftp.ncbi.nlm.nih.gov/genomes/all/GCA/003/058/845/GCA_003058845.1_ASM305884v1","SAMN08381243","PRJNA395900","GCA_003058845.1","1.64881","38.8","-","QBQH01","35","1633","1469/372639","4/22/2018","8/11/2019","Contig","2018-04-22T00:00:00Z","University of Bath","Illumina","50x","Velvet v. 1.2.08","","","35","1648813","Belgium","Human, Homo sapiens"
"Helicobacter pylori 3096","341643","210","210.2946","","","N/A","","ftp://ftp.ncbi.nlm.nih.gov/genomes/all/GCF/002/532/925/GCF_002532925.1_ASM253292v1","ftp://ftp.ncbi.nlm.nih.gov/genomes/all/GCA/002/532/925/GCA_002532925.1_ASM253292v1","SAMN05410595","PRJNA329330","GCA_002532925.1","1.66512","38.9","-","MBGL01","78","1685","1501/341643","10/13/2017","7/30/2019","Contig","2017-10-13T00:00:00Z","Universidad de Ciencias Aplicadas y Ambientales UDCA","Illumina MiSeq","56.92x","A5 pipeline v. MAY-2016","","","78","1665124","Colombia","Human, Homo sapiens"
"Helicobacter pylori 3118","341718","210","210.3025","","","N/A","","ftp://ftp.ncbi.nlm.nih.gov/genomes/all/GCF/002/534/445/GCF_002534445.1_ASM253444v1","ftp://ftp.ncbi.nlm.nih.gov/genomes/all/GCA/002/534/445/GCA_002534445.1_ASM253444v1","SAMN05410594","PRJNA329329","GCA_002534445.1","1.63861","39","-","MBHM01","46","1634","1477/341718","10/13/2017","7/30/2019","Contig","2017-10-13T00:00:00Z","Universidad de Ciencias Aplicadas y Ambientales UDCA","Illumina MiSeq","186.37x","A5 pipeline v. MAY-2016","","","46","1638615","Colombia","Human, Homo sapiens"
"Helicobacter pylori 3120","341719","210","210.3021","","","N/A","","ftp://ftp.ncbi.nlm.nih.gov/genomes/all/GCF/002/534/455/GCF_002534455.1_ASM253445v1","ftp://ftp.ncbi.nlm.nih.gov/genomes/all/GCA/002/534/455/GCA_002534455.1_ASM253445v1","SAMN05410593","PRJNA329328","GCA_002534455.1","1.63855","38.9","-","MBHL01","41","1626","1482/341719","10/13/2017","7/30/2019","Contig","2017-10-13T00:00:00Z","Universidad de Ciencias Aplicadas y Ambientales UDCA","Illumina MiSeq","201.5x","A5 pipeline v. MAY-2016","","","41","1638552","Colombia","Human, Homo sapiens"
"Helicobacter pylori 31235","372640","210","210.4208","","","N/A","","ftp://ftp.ncbi.nlm.nih.gov/genomes/all/GCF/003/058/865/GCF_003058865.1_ASM305886v1","ftp://ftp.ncbi.nlm.nih.gov/genomes/all/GCA/003/058/865/GCA_003058865.1_ASM305886v1","SAMN08381244","PRJNA395900","GCA_003058865.1","1.64151","38.9","-","QBQG01","65","1648","1483/372640","4/22/2018","8/11/2019","Contig","2018-04-22T00:00:00Z","University of Bath","Illumina","50x","Velvet v. 1.2.08","","","65","1641511","Belgium","Human, Homo sapiens"
"Helicobacter pylori 3125","341716","210","210.3019","","","N/A","","ftp://ftp.ncbi.nlm.nih.gov/genomes/all/GCF/002/534/395/GCF_002534395.1_ASM253439v1","ftp://ftp.ncbi.nlm.nih.gov/genomes/all/GCA/002/534/395/GCA_002534395.1_ASM253439v1","SAMN05410592","PRJNA329327","GCA_002534395.1","1.64348","39","-","MBHK01","49","1653","1495/341716","10/13/2017","7/30/2019","Contig","2017-10-13T00:00:00Z","Universidad de Ciencias Aplicadas y Ambientales UDCA","Illumina MiSeq","211.34x","A5 pipeline v. MAY-2016","","","49","1643481","Colombia","Human, Homo sapiens"
"Helicobacter pylori 3133","341694","210","210.2997","","","N/A","","ftp://ftp.ncbi.nlm.nih.gov/genomes/all/GCF/002/533/975/GCF_002533975.1_ASM253397v1","ftp://ftp.ncbi.nlm.nih.gov/genomes/all/GCA/002/533/975/GCA_002533975.1_ASM253397v1","SAMN05410589","PRJNA329326","GCA_002533975.1","1.68421","38.9","-","MBHJ01","72","1705","1519/341694","10/13/2017","7/30/2019","Contig","2017-10-13T00:00:00Z","Universidad de Ciencias Aplicadas y Ambientales UDCA","Illumina MiSeq","169.34x","A5 pipeline v. MAY-2016","","","72","1684208","Colombia","Human, Homo sapiens"
"Helicobacter pylori 3136","341693","210","210.2996","","","N/A","","ftp://ftp.ncbi.nlm.nih.gov/genomes/all/GCF/002/533/925/GCF_002533925.1_ASM253392v1","ftp://ftp.ncbi.nlm.nih.gov/genomes/all/GCA/002/533/925/GCA_002533925.1_ASM253392v1","SAMN05410584","PRJNA329325","GCA_002533925.1","1.60594","39","-","MBHI01","32","1616","1448/341693","10/13/2017","7/30/2019","Contig","2017-10-13T00:00:00Z","Universidad de Ciencias Aplicadas y Ambientales UDCA","Illumina MiSeq","211.58x","A5 pipeline v. MAY-2016","","","32","1605938","Colombia","Human, Homo sapiens"
"Helicobacter pylori 32","372651","210","210.4196","","","N/A","","ftp://ftp.ncbi.nlm.nih.gov/genomes/all/GCF/003/059/105/GCF_003059105.1_ASM305910v1","ftp://ftp.ncbi.nlm.nih.gov/genomes/all/GCA/003/059/105/GCA_003059105.1_ASM305910v1","SAMN08381254","PRJNA395900","GCA_003059105.1","1.65957","38.9","-","QBPY01","83","1641","1452/372651","4/22/2018","8/11/2019","Contig","2018-04-22T00:00:00Z","University of Bath","Illumina","50x","Velvet v. 1.2.08","","","83","1659566","Sweden","Human, Homo sapiens"
"Helicobacter pylori 36:03:00","372633","210","210.4212","","","N/A","","ftp://ftp.ncbi.nlm.nih.gov/genomes/all/GCF/003/058/715/GCF_003058715.1_ASM305871v1","ftp://ftp.ncbi.nlm.nih.gov/genomes/all/GCA/003/058/715/GCA_003058715.1_ASM305871v1","SAMN08381294","PRJNA395900","GCA_003058715.1","1.59676","39.1","-","QBPO01","137","1608","1431/372633","4/22/2018","8/11/2019","Contig","2018-04-22T00:00:00Z","University of Bath","Illumina","50x","Velvet v. 1.2.08","","","137","1596762","Sweden","Human, Homo sapiens"
"Helicobacter pylori 36166","372656","210","210.4192","","","N/A","","ftp://ftp.ncbi.nlm.nih.gov/genomes/all/GCF/003/059/195/GCF_003059195.1_ASM305919v1","ftp://ftp.ncbi.nlm.nih.gov/genomes/all/GCA/003/059/195/GCA_003059195.1_ASM305919v1","SAMN08381245","PRJNA395900","GCA_003059195.1","1.59965","39","-","QBQF01","46","1594","1441/372656","4/22/2018","8/11/2019","Contig","2018-04-22T00:00:00Z","University of Bath","Illumina","50x","Velvet v. 1.2.08","","","46","1599652","Belgium","Human, Homo sapiens"
"Helicobacter pylori 3699","372658","210","210.4190","","","N/A","","ftp://ftp.ncbi.nlm.nih.gov/genomes/all/GCF/003/059/245/GCF_003059245.1_ASM305924v1","ftp://ftp.ncbi.nlm.nih.gov/genomes/all/GCA/003/059/245/GCA_003059245.1_ASM305924v1","SAMN08381239","PRJNA395900","GCA_003059245.1","1.6428","39","-","QBQK01","48","1606","1481/372658","4/22/2018","8/11/2019","Contig","2018-04-22T00:00:00Z","University of Bath","Illumina","50x","Velvet v. 1.2.08","","","48","1642798","France","Human, Homo sapiens"
"Helicobacter pylori 3755","372661","210","210.4158","","","N/A","","ftp://ftp.ncbi.nlm.nih.gov/genomes/all/GCF/003/059/305/GCF_003059305.1_ASM305930v1","ftp://ftp.ncbi.nlm.nih.gov/genomes/all/GCA/003/059/305/GCA_003059305.1_ASM305930v1","SAMN08381233","PRJNA395900","GCA_003059305.1","1.59648","39.3","-","QBQQ01","54","1585","1418/372661","4/22/2018","8/11/2019","Contig","2018-04-22T00:00:00Z","University of Bath","Illumina","50x","Velvet v. 1.2.08","","","54","1596484","France","Human, Homo sapiens"
"Helicobacter pylori 3770","372673","210","210.4175","","","N/A","","ftp://ftp.ncbi.nlm.nih.gov/genomes/all/GCF/003/059/615/GCF_003059615.1_ASM305961v1","ftp://ftp.ncbi.nlm.nih.gov/genomes/all/GCA/003/059/615/GCA_003059615.1_ASM305961v1","SAMN08381234","PRJNA395900","GCA_003059615.1","1.67582","39.3","-","QBQP01","207","1699","1503/372673","4/22/2018","8/11/2019","Contig","2018-04-22T00:00:00Z","University of Bath","Illumina","50x","Velvet v. 1.2.08","","","207","1675815","France","Human, Homo sapiens"
"Helicobacter pylori 3774","372676","210","210.4171","","","N/A","","ftp://ftp.ncbi.nlm.nih.gov/genomes/all/GCF/003/059/865/GCF_003059865.1_ASM305986v1","ftp://ftp.ncbi.nlm.nih.gov/genomes/all/GCA/003/059/865/GCA_003059865.1_ASM305986v1","SAMN08381227","PRJNA395900","GCA_003059865.1","1.68231","39","-","QBQW01","129","1702","1534/372676","4/22/2018","8/11/2019","Contig","2018-04-22T00:00:00Z","University of Bath","Illumina","50x","Velvet v. 1.2.08","","","129","1682308","France","Human, Homo sapiens"
"Helicobacter pylori 38:02:00","372631","210","210.4214","","","N/A","","ftp://ftp.ncbi.nlm.nih.gov/genomes/all/GCF/003/058/685/GCF_003058685.1_ASM305868v1","ftp://ftp.ncbi.nlm.nih.gov/genomes/all/GCA/003/058/685/GCA_003058685.1_ASM305868v1","SAMN08381295","PRJNA395900","GCA_003058685.1","1.61698","38.9","-","QBPN01","60","1599","1422/372631","4/22/2018","8/11/2019","Contig","2018-04-22T00:00:00Z","University of Bath","Illumina","50x","Velvet v. 1.2.08","","","60","1616978","Sweden","Human, Homo sapiens"
"Helicobacter pylori 38:05:00","372630","210","210.4215","","","N/A","","ftp://ftp.ncbi.nlm.nih.gov/genomes/all/GCF/003/058/655/GCF_003058655.1_ASM305865v1","ftp://ftp.ncbi.nlm.nih.gov/genomes/all/GCA/003/058/655/GCA_003058655.1_ASM305865v1","SAMN08381297","PRJNA395900","GCA_003058655.1","1.61709","38.9","-","QBPM01","64","1600","1450/372630","4/22/2018","8/11/2019","Contig","2018-04-22T00:00:00Z","University of Bath","Illumina","50x","Velvet v. 1.2.08","","","64","1617088","Sweden","Human, Homo sapiens"
"Helicobacter pylori 3802","372672","210","210.4177","","","N/A","","ftp://ftp.ncbi.nlm.nih.gov/genomes/all/GCF/003/059/565/GCF_003059565.1_ASM305956v1","ftp://ftp.ncbi.nlm.nih.gov/genomes/all/GCA/003/059/565/GCA_003059565.1_ASM305956v1","SAMN08381235","PRJNA395900","GCA_003059565.1","1.54678","39.5","-","QBQO01","64","1530","1403/372672","4/22/2018","8/11/2019","Contig","2018-04-22T00:00:00Z","University of Bath","Illumina","50x","Velvet v. 1.2.08","","","64","1546782","France","Human, Homo sapiens"
"Helicobacter pylori 38185","372654","210","210.4194","","","N/A","","ftp://ftp.ncbi.nlm.nih.gov/genomes/all/GCF/003/059/165/GCF_003059165.1_ASM305916v1","ftp://ftp.ncbi.nlm.nih.gov/genomes/all/GCA/003/059/165/GCA_003059165.1_ASM305916v1","SAMN08381246","PRJNA395900","GCA_003059165.1","1.66637","39","-","QBQE01","81","1670","1506/372654","4/22/2018","8/11/2019","Contig","2018-04-22T00:00:00Z","University of Bath","Illumina","50x","Velvet v. 1.2.08","","","81","1666367","Belgium","Human, Homo sapiens"
"Helicobacter pylori 3824","372657","210","210.4191","","","N/A","","ftp://ftp.ncbi.nlm.nih.gov/genomes/all/GCF/003/059/225/GCF_003059225.1_ASM305922v1","ftp://ftp.ncbi.nlm.nih.gov/genomes/all/GCA/003/059/225/GCA_003059225.1_ASM305922v1","SAMN08381236","PRJNA395900","GCA_003059225.1","1.69486","39.1","-","QBQN01","90","1664","1519/372657","4/22/2018","8/11/2019","Contig","2018-04-22T00:00:00Z","University of Bath","Illumina","50x","Velvet v. 1.2.08","","","90","1694860","France","Human, Homo sapiens"
"Helicobacter pylori 448","372637","210","210.4209","","","N/A","","ftp://ftp.ncbi.nlm.nih.gov/genomes/all/GCF/003/058/805/GCF_003058805.1_ASM305880v1","ftp://ftp.ncbi.nlm.nih.gov/genomes/all/GCA/003/058/805/GCA_003058805.1_ASM305880v1","SAMN08381248","PRJNA395900","GCA_003058805.1","1.6334","38.9","-","QBQD01","51","1627","1471/372637","4/22/2018","8/11/2019","Contig","2018-04-22T00:00:00Z","University of Bath","Illumina","50x","Velvet v. 1.2.08","","","51","1633401","United Kingdom","Human, Homo sapiens"
"Helicobacter pylori 456","372636","210","210.4210","","","N/A","","ftp://ftp.ncbi.nlm.nih.gov/genomes/all/GCF/003/058/785/GCF_003058785.1_ASM305878v1","ftp://ftp.ncbi.nlm.nih.gov/genomes/all/GCA/003/058/785/GCA_003058785.1_ASM305878v1","SAMN08381249","PRJNA395900","GCA_003058785.1","1.60389","39","-","QBQC01","48","1597","1451/372636","4/22/2018","8/11/2019","Contig","2018-04-22T00:00:00Z","University of Bath","Illumina","50x","Velvet v. 1.2.08","","","48","1603894","United Kingdom","Human, Homo sapiens"
"Helicobacter pylori 462","372655","210","210.4193","","","N/A","","ftp://ftp.ncbi.nlm.nih.gov/genomes/all/GCF/003/059/185/GCF_003059185.1_ASM305918v1","ftp://ftp.ncbi.nlm.nih.gov/genomes/all/GCA/003/059/185/GCA_003059185.1_ASM305918v1","SAMN08381250","PRJNA395900","GCA_003059185.1","1.76566","39.2","-","QBQB01","231","1742","1574/372655","4/22/2018","8/11/2019","Contig","2018-04-22T00:00:00Z","University of Bath","Illumina","50x","Velvet v. 1.2.08","","","231","1765663","United Kingdom","Human, Homo sapiens"
"Helicobacter pylori 47:05:00","372628","210","210.4217","","","N/A","","ftp://ftp.ncbi.nlm.nih.gov/genomes/all/GCF/003/058/625/GCF_003058625.1_ASM305862v1","ftp://ftp.ncbi.nlm.nih.gov/genomes/all/GCA/003/058/625/GCA_003058625.1_ASM305862v1","SAMN08381299","PRJNA395900","GCA_003058625.1","1.64513","38.9","-","QBPL01","80","1630","1467/372628","4/22/2018","8/11/2019","Contig","2018-04-22T00:00:00Z","University of Bath","Illumina","50x","Velvet v. 1.2.08","","","80","1645133","Sweden","Human, Homo sapiens"
"Helicobacter pylori 50","372638","210","210.4154","","","N/A","","ftp://ftp.ncbi.nlm.nih.gov/genomes/all/GCF/003/058/825/GCF_003058825.1_ASM305882v1","ftp://ftp.ncbi.nlm.nih.gov/genomes/all/GCA/003/058/825/GCA_003058825.1_ASM305882v1","SAMN08381259","PRJNA395900","GCA_003058825.1","1.67576","38.8","-","QBPX01","43","1652","1502/372638","4/22/2018","8/11/2019","Contig","2018-04-22T00:00:00Z","University of Bath","Illumina","50x","Velvet v. 1.2.08","","","43","1675758","Sweden","Human, Homo sapiens"
"Helicobacter pylori 518","372653","210","210.4195","","","N/A","","ftp://ftp.ncbi.nlm.nih.gov/genomes/all/GCF/003/059/145/GCF_003059145.1_ASM305914v1","ftp://ftp.ncbi.nlm.nih.gov/genomes/all/GCA/003/059/145/GCA_003059145.1_ASM305914v1","SAMN08381251","PRJNA395900","GCA_003059145.1","1.62595","39","-","QBQA01","47","1636","1466/372653","4/22/2018","8/11/2019","Contig","2018-04-22T00:00:00Z","University of Bath","Illumina","50x","Velvet v. 1.2.08","","","47","1625947","United Kingdom","Human, Homo sapiens"
"Helicobacter pylori 52","372635","210","210.4211","","HPYL684950","N/A","","ftp://ftp.ncbi.nlm.nih.gov/genomes/all/GCF/003/058/755/GCF_003058755.1_ASM305875v1","ftp://ftp.ncbi.nlm.nih.gov/genomes/all/GCA/003/058/755/GCA_003058755.1_ASM305875v1","SAMN08381260","PRJNA395900","GCA_003058755.1","1.60187","39","-","QBPW01","54","1589","1426/372635","4/22/2018","8/11/2019","Contig","2018-04-22T00:00:00Z","University of Bath","Illumina","50x","Velvet v. 1.2.08","","","54","1601870","Sweden","Human, Homo sapiens"
"Helicobacter pylori 55:01:00","372626","210","210.4219","","","N/A","","ftp://ftp.ncbi.nlm.nih.gov/genomes/all/GCF/003/058/585/GCF_003058585.1_ASM305858v1","ftp://ftp.ncbi.nlm.nih.gov/genomes/all/GCA/003/058/585/GCA_003058585.1_ASM305858v1","SAMN08381300","PRJNA395900","GCA_003058585.1","1.63374","38.9","-","QBPK01","66","1643","1467/372626","4/22/2018","8/11/2019","Contig","2018-04-22T00:00:00Z","University of Bath","Illumina","50x","Velvet v. 1.2.08","","","66","1633743","Sweden","Human, Homo sapiens"
"Helicobacter pylori 55:02:00","372629","210","210.4216","","","N/A","","ftp://ftp.ncbi.nlm.nih.gov/genomes/all/GCF/003/058/635/GCF_003058635.1_ASM305863v1","ftp://ftp.ncbi.nlm.nih.gov/genomes/all/GCA/003/058/635/GCA_003058635.1_ASM305863v1","SAMN08381301","PRJNA395900","GCA_003058635.1","1.60372","39","-","QBPJ01","50","1609","1458/372629","4/22/2018","8/11/2019","Contig","2018-04-22T00:00:00Z","University of Bath","Illumina","50x","Velvet v. 1.2.08","","","50","1603720","Sweden","Human, Homo sapiens"
"Helicobacter pylori 55:05:00","372645","210","210.4203","","","N/A","","ftp://ftp.ncbi.nlm.nih.gov/genomes/all/GCF/003/058/965/GCF_003058965.1_ASM305896v1","ftp://ftp.ncbi.nlm.nih.gov/genomes/all/GCA/003/058/965/GCA_003058965.1_ASM305896v1","SAMN08381302","PRJNA395900","GCA_003058965.1","1.67774","38.9","-","QBPI01","152","1660","1514/372645","4/22/2018","8/11/2019","Contig","2018-04-22T00:00:00Z","University of Bath","Illumina","50x","Velvet v. 1.2.08","","","152","1677739","Sweden","Human, Homo sapiens"
"Helicobacter pylori 565-99","372643","210","210.4205","","","N/A","","ftp://ftp.ncbi.nlm.nih.gov/genomes/all/GCF/003/058/925/GCF_003058925.1_ASM305892v1","ftp://ftp.ncbi.nlm.nih.gov/genomes/all/GCA/003/058/925/GCA_003058925.1_ASM305892v1","SAMN08381238","PRJNA395900","GCA_003058925.1","1.57882","39","-","QBQL01","42","1568","1423/372643","4/22/2018","8/12/2019","Contig","2018-04-22T00:00:00Z","University of Bath","Illumina","50x","Velvet v. 1.2.08","","","42","1578819","","Human, Homo sapiens"
"Helicobacter pylori 57_single","372632","210","210.4213","","","N/A","","ftp://ftp.ncbi.nlm.nih.gov/genomes/all/GCF/003/058/705/GCF_003058705.1_ASM305870v1","ftp://ftp.ncbi.nlm.nih.gov/genomes/all/GCA/003/058/705/GCA_003058705.1_ASM305870v1","SAMN08381262","PRJNA395900","GCA_003058705.1","1.68396","38.8","-","QBPV01","151","1668","1501/372632","4/22/2018","8/11/2019","Contig","2018-04-22T00:00:00Z","University of Bath","Illumina","50x","Velvet v. 1.2.08","","","151","1683959","Sweden","Human, Homo sapiens"
"Helicobacter pylori 60:1_single","372646","210","210.4202","","","N/A","","ftp://ftp.ncbi.nlm.nih.gov/genomes/all/GCF/003/058/985/GCF_003058985.1_ASM305898v1","ftp://ftp.ncbi.nlm.nih.gov/genomes/all/GCA/003/058/985/GCA_003058985.1_ASM305898v1","SAMN08381303","PRJNA395900","GCA_003058985.1","1.63211","38.9","-","QBPH01","66","1629","1455/372646","4/22/2018","8/11/2019","Contig","2018-04-22T00:00:00Z","University of Bath","Illumina","50x","Velvet v. 1.2.08","","","66","1632110","Sweden","Human, Homo sapiens"
"Helicobacter pylori 638","372652","210","210.4156","","","N/A","","ftp://ftp.ncbi.nlm.nih.gov/genomes/all/GCF/003/059/125/GCF_003059125.1_ASM305912v1","ftp://ftp.ncbi.nlm.nih.gov/genomes/all/GCA/003/059/125/GCA_003059125.1_ASM305912v1","SAMN08381252","PRJNA395900","GCA_003059125.1","1.58504","39","-","QBPZ01","43","1568","1421/372652","4/22/2018","8/11/2019","Contig","2018-04-22T00:00:00Z","University of Bath","Illumina","50x","Velvet v. 1.2.08","","","43","1585043","United Kingdom","Human, Homo sapiens"
"Helicobacter pylori 66","372634","210","210.4153","","","N/A","","ftp://ftp.ncbi.nlm.nih.gov/genomes/all/GCF/003/058/745/GCF_003058745.1_ASM305874v1","ftp://ftp.ncbi.nlm.nih.gov/genomes/all/GCA/003/058/745/GCA_003058745.1_ASM305874v1","SAMN08381265","PRJNA395900","GCA_003058745.1","1.67218","38.8","-","QBPU01","78","1668","1495/372634","4/22/2018","8/11/2019","Contig","2018-04-22T00:00:00Z","University of Bath","Illumina","50x","Velvet v. 1.2.08","","","78","1672180","Sweden","Human, Homo sapiens"
"Helicobacter pylori 8A3","163753","981211","981211.3","","","N/A","","ftp://ftp.ncbi.nlm.nih.gov/genomes/all/GCF/000/285/055/GCF_000285055.1_ASM28505v1","ftp://ftp.ncbi.nlm.nih.gov/genomes/all/GCA/000/285/055/GCA_000285055.1_ASM28505v1","SAMEA2272407","PRJEA62409","GCA_000285055.1","1.54718","39","-","CADD01","44","1547","1288/163753","3/9/2011","4/2/2019","Contig","2011-03-09T00:00:00Z","MHH Hannover Medical School","","","","","","44","1547179","","Human, Homo sapiens"
"Helicobacter pylori 9:1_single","372627","210","210.4218","","","N/A","","ftp://ftp.ncbi.nlm.nih.gov/genomes/all/GCF/003/058/595/GCF_003058595.1_ASM305859v1","ftp://ftp.ncbi.nlm.nih.gov/genomes/all/GCA/003/058/595/GCA_003058595.1_ASM305859v1","SAMN08381307","PRJNA395900","GCA_003058595.1","1.57435","39","-","QBPG01","58","1569","1402/372627","4/22/2018","8/11/2019","Contig","2018-04-22T00:00:00Z","University of Bath","Illumina","50x","Velvet v. 1.2.08","","","58","1574352","Sweden","Human, Homo sapiens"
"Helicobacter pylori 98-10","163655","544405","544405.3","","","N/A","","ftp://ftp.ncbi.nlm.nih.gov/genomes/all/GCF/000/172/935/GCF_000172935.1_ASM17293v1","ftp://ftp.ncbi.nlm.nih.gov/genomes/all/GCA/000/172/935/GCA_000172935.1_ASM17293v1","SAMN02472069","PRJNA30395","GCA_000172935.1","1.57177","38.8","-","ABSX01","51","1567","1374/163655","12/9/2008","11/15/2017","Contig","2008-12-09T00:00:00Z","Vanderbilt University School of Medicine","","","","","","51","1571772","",""
"Helicobacter pylori A033","341726","210","210.3029","","","N/A","","ftp://ftp.ncbi.nlm.nih.gov/genomes/all/GCF/002/534/615/GCF_002534615.1_ASM253461v1","ftp://ftp.ncbi.nlm.nih.gov/genomes/all/GCA/002/534/615/GCA_002534615.1_ASM253461v1","SAMN05410761","PRJNA329372","GCA_002534615.1","1.67216","39","-","MBJQ01","59","1670","1496/341726","10/13/2017","7/30/2019","Contig","2017-10-13T00:00:00Z","Universidad de Ciencias Aplicadas y Ambientales UDCA","Illumina MiSeq","108.32x","A5 pipeline v. MAY-2016","","","59","1672165","Colombia","Human, Homo sapiens"
"Helicobacter pylori A037","341650","210","210.2955","","","N/A","","ftp://ftp.ncbi.nlm.nih.gov/genomes/all/GCF/002/533/095/GCF_002533095.1_ASM253309v1","ftp://ftp.ncbi.nlm.nih.gov/genomes/all/GCA/002/533/095/GCA_002533095.1_ASM253309v1","SAMN05393172","PRJNA329217","GCA_002533095.1","1.64599","39","-","MBHU01","50","1627","1475/341650","10/13/2017","7/30/2019","Contig","2017-10-13T00:00:00Z","Universidad de Ciencias Aplicadas y Ambientales UDCA","Illumina HiSeq","172.42x","A5 pipeline v. MAY-2016","","","50","1645991","Colombia","Human, Homo sapiens"
"Helicobacter pylori A039","341649","210","210.2952","","","N/A","","ftp://ftp.ncbi.nlm.nih.gov/genomes/all/GCF/002/533/065/GCF_002533065.1_ASM253306v1","ftp://ftp.ncbi.nlm.nih.gov/genomes/all/GCA/002/533/065/GCA_002533065.1_ASM253306v1","SAMN05393170","PRJNA329216","GCA_002533065.1","1.59756","39.1","-","MBHT01","64","1595","1441/341649","10/13/2017","7/30/2019","Contig","2017-10-13T00:00:00Z","Universidad de Ciencias Aplicadas y Ambientales UDCA","Illumina MiSeq","64.6x","A5 pipeline v. MAY-2016","","","64","1597563","Colombia","Human, Homo sapiens"
"Helicobacter pylori A077","341651","210","210.2953","","","N/A","","ftp://ftp.ncbi.nlm.nih.gov/genomes/all/GCF/002/533/105/GCF_002533105.1_ASM253310v1","ftp://ftp.ncbi.nlm.nih.gov/genomes/all/GCA/002/533/105/GCA_002533105.1_ASM253310v1","SAMN05393166","PRJNA329202","GCA_002533105.1","1.65207","38.9","-","MBHS01","55","1647","1500/341651","10/13/2017","7/30/2019","Contig","2017-10-13T00:00:00Z","Universidad de Ciencias Aplicadas y Ambientales UDCA","Illumina MiSeq","176.14x","A5 pipeline v. MAY-2016","","","55","1652075","Colombia","Human, Homo sapiens"
"Helicobacter pylori A45","163783","1231719","1231719.3","","GCF_000333835","N/A","","ftp://ftp.ncbi.nlm.nih.gov/genomes/all/GCF/000/333/835/GCF_000333835.1_ASM33383v1","ftp://ftp.ncbi.nlm.nih.gov/genomes/all/GCA/000/333/835/GCA_000333835.1_ASM33383v1","SAMN02470830","PRJNA175046","GCA_000333835.1","1.64393","38.7","-","AMYU01","33","1614","1453/163783","1/25/2013","11/23/2017","Contig","2013-01-25T00:00:00Z","Scientific Research Institute of Physical-Chemical Medicine","454 GS FLX","49x","GS De Novo Assembler v. 2.6","","","33","1643927","Russia","Human, Homo sapiens"
"Helicobacter pylori AAP164","410922","210","210.5141","","","N/A","","ftp://ftp.ncbi.nlm.nih.gov/genomes/all/GCF/003/639/405/GCF_003639405.1_ASM363940v1","ftp://ftp.ncbi.nlm.nih.gov/genomes/all/GCA/003/639/405/GCA_003639405.1_ASM363940v1","SAMN08981256","PRJNA449871","GCA_003639405.1","1.611","39","-","QDJV01","34","1591","1436/410922","10/12/2018","8/20/2019","Contig","2018-10-12T00:00:00Z","Facultat de Farmacia i Ciencies de l'Alimentacio; Universitat de Barcelona","Illumina HiSeq","684x","A5-miseq v. 20160825","","","34","1611004","Spain","Human, Homo sapiens"
"Helicobacter pylori ANT170","372674","210","210.4172","","","N/A","","ftp://ftp.ncbi.nlm.nih.gov/genomes/all/GCF/003/059/715/GCF_003059715.1_ASM305971v1","ftp://ftp.ncbi.nlm.nih.gov/genomes/all/GCA/003/059/715/GCA_003059715.1_ASM305971v1","SAMN08381229","PRJNA395900","GCA_003059715.1","1.6346","39","-","QBQU01","53","1617","1478/372674","4/22/2018","8/11/2019","Contig","2018-04-22T00:00:00Z","University of Bath","Illumina","50x","Velvet v. 1.2.08","","","53","1634603","France","Human, Homo sapiens"
"Helicobacter pylori APR133","410946","210","210.5179","","","N/A","","ftp://ftp.ncbi.nlm.nih.gov/genomes/all/GCF/003/640/155/GCF_003640155.1_ASM364015v1","ftp://ftp.ncbi.nlm.nih.gov/genomes/all/GCA/003/640/155/GCA_003640155.1_ASM364015v1","SAMN08999399","PRJNA449871","GCA_003640155.1","1.62589","39.1","-","QEHI01","38","1611","1440/410946","10/12/2018","8/20/2019","Contig","2018-10-12T00:00:00Z","Facultat de Farmacia i Ciencies de l'Alimentacio; Universitat de Barcelona","Illumina MiSeq","198x","A5-miseq v. 20160825","","","38","1625889","Spain","Human, Homo sapiens"
"Helicobacter pylori B126","410945","210","210.5178","","","N/A","","ftp://ftp.ncbi.nlm.nih.gov/genomes/all/GCF/003/640/145/GCF_003640145.1_ASM364014v1","ftp://ftp.ncbi.nlm.nih.gov/genomes/all/GCA/003/640/145/GCA_003640145.1_ASM364014v1","SAMN08999400","PRJNA449871","GCA_003640145.1","1.66872","38.8","-","QEHH01","58","1664","1502/410945","10/12/2018","8/20/2019","Contig","2018-10-12T00:00:00Z","Facultat de Farmacia i Ciencies de l'Alimentacio; Universitat de Barcelona","Illumina HiSeq","641x","A5-miseq v. 20160825","","","58","1668723","Spain","Human, Homo sapiens"
"Helicobacter pylori B128","163656","544406","544406.3","","","N/A","","ftp://ftp.ncbi.nlm.nih.gov/genomes/all/GCF/000/172/955/GCF_000172955.1_ASM17295v1","ftp://ftp.ncbi.nlm.nih.gov/genomes/all/GCA/000/172/955/GCA_000172955.1_ASM17295v1","SAMN02472068","PRJNA30397","GCA_000172955.1","1.64922","38.8","-","ABSY01","73","1652","1263/163656","12/9/2008","10/8/2019","Contig","2008-12-09T00:00:00Z","Vanderbilt University School of Medicine","","","","","","73","1649221","",""
"Helicobacter pylori B247A","410921","210","210.5140","","","N/A","","ftp://ftp.ncbi.nlm.nih.gov/genomes/all/GCF/003/639/385/GCF_003639385.1_ASM363938v1","ftp://ftp.ncbi.nlm.nih.gov/genomes/all/GCA/003/639/385/GCA_003639385.1_ASM363938v1","SAMN08981257","PRJNA449871","GCA_003639385.1","1.66912","38.9","-","QDJU01","65","1649","1478/410921","10/12/2018","8/20/2019","Contig","2018-10-12T00:00:00Z","Facultat de Farmacia i Ciencies de l'Alimentacio; Universitat de Barcelona","Illumina HiSeq","746x","A5-miseq v. 20160825","","","65","1669116","Spain","Human, Homo sapiens"
"Helicobacter pylori B25","372681","210","210.4162","","","N/A","","ftp://ftp.ncbi.nlm.nih.gov/genomes/all/GCF/003/060/065/GCF_003060065.1_ASM306006v1","ftp://ftp.ncbi.nlm.nih.gov/genomes/all/GCA/003/060/065/GCA_003060065.1_ASM306006v1","SAMN08381204","PRJNA395900","GCA_003060065.1","1.60217","39","-","QBRS01","50","1574","1442/372681","4/22/2018","8/11/2019","Contig","2018-04-22T00:00:00Z","University of Bath","Illumina","50x","Velvet v. 1.2.08","","","50","1602166","France","Human, Homo sapiens"
"Helicobacter pylori B274","410944","210","210.5177","","","N/A","","ftp://ftp.ncbi.nlm.nih.gov/genomes/all/GCF/003/640/105/GCF_003640105.1_ASM364010v1","ftp://ftp.ncbi.nlm.nih.gov/genomes/all/GCA/003/640/105/GCA_003640105.1_ASM364010v1","SAMN08999401","PRJNA449871","GCA_003640105.1","1.66141","38.8","-","QEHG01","73","1666","1497/410944","10/12/2018","8/20/2019","Contig","2018-10-12T00:00:00Z","Facultat de Farmacia i Ciencies de l'Alimentacio; Universitat de Barcelona","Illumina HiSeq","621x","A5-miseq v. 20160825","","","73","1661409","Spain","Human, Homo sapiens"
"Helicobacter pylori B29","372680","210","210.4166","","","N/A","","ftp://ftp.ncbi.nlm.nih.gov/genomes/all/GCF/003/060/035/GCF_003060035.1_ASM306003v1","ftp://ftp.ncbi.nlm.nih.gov/genomes/all/GCA/003/060/035/GCA_003060035.1_ASM306003v1","SAMN08381206","PRJNA395900","GCA_003060035.1","1.58958","39","-","QBRQ01","62","1570","1431/372680","4/22/2018","8/11/2019","Contig","2018-04-22T00:00:00Z","University of Bath","Illumina","50x","Velvet v. 1.2.08","","","62","1589584","France","Human, Homo sapiens"
"Helicobacter pylori B30","372671","210","210.4178","","","N/A","","ftp://ftp.ncbi.nlm.nih.gov/genomes/all/GCF/003/059/545/GCF_003059545.1_ASM305954v1","ftp://ftp.ncbi.nlm.nih.gov/genomes/all/GCA/003/059/545/GCA_003059545.1_ASM305954v1","SAMN08381207","PRJNA395900","GCA_003059545.1","1.59764","39","-","QBRP01","33","1580","1424/372671","4/22/2018","8/11/2019","Contig","2018-04-22T00:00:00Z","University of Bath","Illumina","50x","Velvet v. 1.2.08","","","33","1597644","France","Human, Homo sapiens"
"Helicobacter pylori B31","372679","210","210.4167","","","N/A","","ftp://ftp.ncbi.nlm.nih.gov/genomes/all/GCF/003/060/025/GCF_003060025.1_ASM306002v1","ftp://ftp.ncbi.nlm.nih.gov/genomes/all/GCA/003/060/025/GCA_003060025.1_ASM306002v1","SAMN08381208","PRJNA395900","GCA_003060025.1","1.67869","38.8","-","QBRO01","68","1659","1517/372679","4/22/2018","8/11/2019","Contig","2018-04-22T00:00:00Z","University of Bath","Illumina","50x","Velvet v. 1.2.08","","","68","1678687","France","Human, Homo sapiens"
"Helicobacter pylori B314","410939","210","210.5167","","","N/A","","ftp://ftp.ncbi.nlm.nih.gov/genomes/all/GCF/003/639/915/GCF_003639915.1_ASM363991v1","ftp://ftp.ncbi.nlm.nih.gov/genomes/all/GCA/003/639/915/GCA_003639915.1_ASM363991v1","SAMN08999403","PRJNA449871","GCA_003639915.1","1.67798","38.8","-","QEHE01","53","1666","1497/410939","10/12/2018","9/1/2019","Contig","2018-10-12T00:00:00Z","Facultat de Farmacia i Ciencies de l'Alimentacio; Universitat de Barcelona","Illumina HiSeq","633x","A5-miseq v. 20160825","","","53","1677976","Spain","Human, Homo sapiens"
"Helicobacter pylori B319","410917","210","210.5131","","","N/A","","ftp://ftp.ncbi.nlm.nih.gov/genomes/all/GCF/003/639/195/GCF_003639195.1_ASM363919v1","ftp://ftp.ncbi.nlm.nih.gov/genomes/all/GCA/003/639/195/GCA_003639195.1_ASM363919v1","SAMN08920035","PRJNA449871","GCA_003639195.1","1.64631","38.9","-","QELC01","46","1650","1460/410917","10/12/2018","8/20/2019","Contig","2018-10-12T00:00:00Z","Facultat de Farmacia i Ciencies de l'Alimentacio; Universitat de Barcelona","Illumina HiSeq","714x","A5-miseq v. 20160825","","","46","1646314","Spain","Human, Homo sapiens"
"Helicobacter pylori B344","410943","210","210.5176","","","N/A","","ftp://ftp.ncbi.nlm.nih.gov/genomes/all/GCF/003/640/095/GCF_003640095.1_ASM364009v1","ftp://ftp.ncbi.nlm.nih.gov/genomes/all/GCA/003/640/095/GCA_003640095.1_ASM364009v1","SAMN08999404","PRJNA449871","GCA_003640095.1","1.54836","39.1","-","QEHD01","24","1552","1402/410943","10/12/2018","8/20/2019","Contig","2018-10-12T00:00:00Z","Facultat de Farmacia i Ciencies de l'Alimentacio; Universitat de Barcelona","Illumina MiSeq","242x","A5-miseq v. 20160825","","","24","1548362","Spain","Human, Homo sapiens"
"Helicobacter pylori B35","372670","210","210.4179","","","N/A","","ftp://ftp.ncbi.nlm.nih.gov/genomes/all/GCF/003/059/535/GCF_003059535.1_ASM305953v1","ftp://ftp.ncbi.nlm.nih.gov/genomes/all/GCA/003/059/535/GCA_003059535.1_ASM305953v1","SAMN08381209","PRJNA395900","GCA_003059535.1","1.63373","38.9","-","QBRN01","54","1639","1457/372670","4/22/2018","8/11/2019","Contig","2018-04-22T00:00:00Z","University of Bath","Illumina","50x","Velvet v. 1.2.08","","","54","1633732","France","Human, Homo sapiens"
"Helicobacter pylori B362","410937","210","210.5163","","","N/A","","ftp://ftp.ncbi.nlm.nih.gov/genomes/all/GCF/003/639/845/GCF_003639845.1_ASM363984v1","ftp://ftp.ncbi.nlm.nih.gov/genomes/all/GCA/003/639/845/GCA_003639845.1_ASM363984v1","SAMN08999407","PRJNA449871","GCA_003639845.1","1.5977","39","-","QEHA01","58","1616","1448/410937","10/12/2018","8/20/2019","Contig","2018-10-12T00:00:00Z","Facultat de Farmacia i Ciencies de l'Alimentacio; Universitat de Barcelona","Illumina HiSeq","546x","A5-miseq v. 20160825","","","58","1597704","Spain","Human, Homo sapiens"
"Helicobacter pylori B366","410938","210","210.5164","","","N/A","","ftp://ftp.ncbi.nlm.nih.gov/genomes/all/GCF/003/639/855/GCF_003639855.1_ASM363985v1","ftp://ftp.ncbi.nlm.nih.gov/genomes/all/GCA/003/639/855/GCA_003639855.1_ASM363985v1","SAMN08999408","PRJNA449871","GCA_003639855.1","1.62548","38.9","-","QEGZ01","29","1619","1460/410938","10/12/2018","8/20/2019","Contig","2018-10-12T00:00:00Z","Facultat de Farmacia i Ciencies de l'Alimentacio; Universitat de Barcelona","Illumina MiSeq","323x","A5-miseq v. 20160825","","","29","1625481","Spain","Human, Homo sapiens"
"Helicobacter pylori B40","372678","210","210.4161","","","N/A","","ftp://ftp.ncbi.nlm.nih.gov/genomes/all/GCF/003/059/985/GCF_003059985.1_ASM305998v1","ftp://ftp.ncbi.nlm.nih.gov/genomes/all/GCA/003/059/985/GCA_003059985.1_ASM305998v1","SAMN08381211","PRJNA395900","GCA_003059985.1","1.60008","39","-","QBRL01","46","1581","1443/372678","4/22/2018","8/11/2019","Contig","2018-04-22T00:00:00Z","University of Bath","Illumina","50x","Velvet v. 1.2.08","","","46","1600079","France","Human, Homo sapiens"
"Helicobacter pylori B400","410936","210","210.5162","","","N/A","","ftp://ftp.ncbi.nlm.nih.gov/genomes/all/GCF/003/639/805/GCF_003639805.1_ASM363980v1","ftp://ftp.ncbi.nlm.nih.gov/genomes/all/GCA/003/639/805/GCA_003639805.1_ASM363980v1","SAMN08999410","PRJNA449871","GCA_003639805.1","1.65587","38.9","-","QEGX01","42","1664","1491/410936","10/12/2018","8/20/2019","Contig","2018-10-12T00:00:00Z","Facultat de Farmacia i Ciencies de l'Alimentacio; Universitat de Barcelona","Illumina MiSeq","275x","A5-miseq v. 20160825","","","42","1655874","Spain","Human, Homo sapiens"
"Helicobacter pylori B41","372669","210","210.4181","","","N/A","","ftp://ftp.ncbi.nlm.nih.gov/genomes/all/GCF/003/059/505/GCF_003059505.1_ASM305950v1","ftp://ftp.ncbi.nlm.nih.gov/genomes/all/GCA/003/059/505/GCA_003059505.1_ASM305950v1","SAMN08381212","PRJNA395900","GCA_003059505.1","1.68437","39.1","-","QBRK01","65","1660","1507/372669","4/22/2018","8/11/2019","Contig","2018-04-22T00:00:00Z","University of Bath","Illumina","50x","Velvet v. 1.2.08","","","65","1684372","France","Human, Homo sapiens"
"Helicobacter pylori B43","373111","210","210.4163","","","N/A","","ftp://ftp.ncbi.nlm.nih.gov/genomes/all/GCF/003/070/765/GCF_003070765.1_ASM307076v1","ftp://ftp.ncbi.nlm.nih.gov/genomes/all/GCA/003/070/765/GCA_003070765.1_ASM307076v1","SAMN08381213","PRJNA395900","GCA_003070765.1","1.64068","38.9","-","QBRJ01","54","1607","1469/373111","4/24/2018","8/11/2019","Contig","2018-04-24T00:00:00Z","University of Bath","Illumina","50x","Velvet v. 1.2.08","","","54","1640677","France","Human, Homo sapiens"
"Helicobacter pylori B44","372667","210","210.4160","","","N/A","","ftp://ftp.ncbi.nlm.nih.gov/genomes/all/GCF/003/059/445/GCF_003059445.1_ASM305944v1","ftp://ftp.ncbi.nlm.nih.gov/genomes/all/GCA/003/059/445/GCA_003059445.1_ASM305944v1","SAMN08381214","PRJNA395900","GCA_003059445.1","1.61985","38.9","-","QBRI01","55","1616","1467/372667","4/22/2018","8/11/2019","Contig","2018-04-22T00:00:00Z","University of Bath","Illumina","50x","Velvet v. 1.2.08","","","55","1619848","France","Human, Homo sapiens"
"Helicobacter pylori B444A","410927","210","210.5147","","","N/A","","ftp://ftp.ncbi.nlm.nih.gov/genomes/all/GCF/003/639/495/GCF_003639495.1_ASM363949v1","ftp://ftp.ncbi.nlm.nih.gov/genomes/all/GCA/003/639/495/GCA_003639495.1_ASM363949v1","SAMN08981261","PRJNA449871","GCA_003639495.1","1.6446","38.9","-","QDJQ01","129","1667","1463/410927","10/12/2018","8/20/2019","Contig","2018-10-12T00:00:00Z","Facultat de Farmacia i Ciencies de l'Alimentacio; Universitat de Barcelona","Illumina MiSeq","29x","A5-miseq v. 20160825","","","129","1644603","Spain","Human, Homo sapiens"
"Helicobacter pylori B464A","410926","210","210.5145","","","N/A","","ftp://ftp.ncbi.nlm.nih.gov/genomes/all/GCF/003/639/485/GCF_003639485.1_ASM363948v1","ftp://ftp.ncbi.nlm.nih.gov/genomes/all/GCA/003/639/485/GCA_003639485.1_ASM363948v1","SAMN08981262","PRJNA449871","GCA_003639485.1","1.649","38.9","-","QDJP01","60","1633","1489/410926","10/12/2018","8/20/2019","Contig","2018-10-12T00:00:00Z","Facultat de Farmacia i Ciencies de l'Alimentacio; Universitat de Barcelona","Illumina HiSeq","670x","A5-miseq v. 20160825","","","60","1649000","Spain","Human, Homo sapiens"
"Helicobacter pylori B47","372666","210","210.4184","","","N/A","","ftp://ftp.ncbi.nlm.nih.gov/genomes/all/GCF/003/059/425/GCF_003059425.1_ASM305942v1","ftp://ftp.ncbi.nlm.nih.gov/genomes/all/GCA/003/059/425/GCA_003059425.1_ASM305942v1","SAMN08381215","PRJNA395900","GCA_003059425.1","1.59581","39","-","QBRH01","51","1569","1424/372666","4/22/2018","8/11/2019","Contig","2018-04-22T00:00:00Z","University of Bath","Illumina","50x","Velvet v. 1.2.08","","","51","1595814","France","Human, Homo sapiens"
"Helicobacter pylori B491","410920","210","210.5137","","","N/A","","ftp://ftp.ncbi.nlm.nih.gov/genomes/all/GCF/003/639/325/GCF_003639325.1_ASM363932v1","ftp://ftp.ncbi.nlm.nih.gov/genomes/all/GCA/003/639/325/GCA_003639325.1_ASM363932v1","SAMN08981263","PRJNA449871","GCA_003639325.1","1.68415","38.8","-","QDJO01","60","1696","1523/410920","10/12/2018","8/20/2019","Contig","2018-10-12T00:00:00Z","Facultat de Farmacia i Ciencies de l'Alimentacio; Universitat de Barcelona","Illumina HiSeq","742x","A5-miseq v. 20160825","","","60","1684150","Spain","Human, Homo sapiens"
"Helicobacter pylori B497A","410942","210","210.5173","","","N/A","","ftp://ftp.ncbi.nlm.nih.gov/genomes/all/GCF/003/640/045/GCF_003640045.1_ASM364004v1","ftp://ftp.ncbi.nlm.nih.gov/genomes/all/GCA/003/640/045/GCA_003640045.1_ASM364004v1","SAMN08999413","PRJNA449871","GCA_003640045.1","1.61084","39","-","QEGU01","33","1615","1472/410942","10/12/2018","8/20/2019","Contig","2018-10-12T00:00:00Z","Facultat de Farmacia i Ciencies de l'Alimentacio; Universitat de Barcelona","Illumina MiSeq","223x","A5-miseq v. 20160825","","","33","1610841","Spain","Human, Homo sapiens"
"Helicobacter pylori B508A-S1","394560","210","210.4854","","","N/A","","ftp://ftp.ncbi.nlm.nih.gov/genomes/all/GCF/003/382/545/GCF_003382545.1_ASM338254v1","ftp://ftp.ncbi.nlm.nih.gov/genomes/all/GCA/003/382/545/GCA_003382545.1_ASM338254v1","SAMN08981264","PRJNA449871","GCA_003382545.1","1.58055","39","-","QDJN01","34","1575","1441/394560","8/13/2018","8/17/2019","Contig","2018-08-13T00:00:00Z","Facultat de Farmacia i Ciencies de l'Alimentacio; Universitat de Barcelona","Illumina HiSeq","780x","A5-miseq v. 20160825","","","34","1580553","Spain","Human, Homo sapiens"
"Helicobacter pylori B508A-T2A","394559","210","210.4853","","","N/A","","ftp://ftp.ncbi.nlm.nih.gov/genomes/all/GCF/003/382/515/GCF_003382515.1_ASM338251v1","ftp://ftp.ncbi.nlm.nih.gov/genomes/all/GCA/003/382/515/GCA_003382515.1_ASM338251v1","SAMN08981265","PRJNA449871","GCA_003382515.1","1.5785","39","-","QDJM01","42","1563","1427/394559","8/13/2018","8/17/2019","Contig","2018-08-13T00:00:00Z","Facultat de Farmacia i Ciencies de l'Alimentacio; Universitat de Barcelona","Illumina HiSeq","794x","A5-miseq v. 20160825","","","42","1578500","Spain","Human, Homo sapiens"
"Helicobacter pylori B508A-T4","394558","210","210.4852","","","N/A","","ftp://ftp.ncbi.nlm.nih.gov/genomes/all/GCF/003/382/505/GCF_003382505.1_ASM338250v1","ftp://ftp.ncbi.nlm.nih.gov/genomes/all/GCA/003/382/505/GCA_003382505.1_ASM338250v1","SAMN08981266","PRJNA449871","GCA_003382505.1","1.58526","39","-","QDJL01","25","1577","1430/394558","8/13/2018","8/17/2019","Contig","2018-08-13T00:00:00Z","Facultat de Farmacia i Ciencies de l'Alimentacio; Universitat de Barcelona","Illumina MiSeq","297x","A5-miseq v. 20160825","","","25","1585256","Spain","Human, Homo sapiens"
"Helicobacter pylori B518","410916","210","210.5130","","","N/A","","-","ftp://ftp.ncbi.nlm.nih.gov/genomes/all/GCA/003/639/165/GCA_003639165.1_ASM363916v1","SAMN08920036","PRJNA449871","GCA_003639165.1","1.83586","38.9","-","QELB01","346","1989","1780/410916","10/12/2018","10/12/2018","Contig","2018-10-12T00:00:00Z","Facultat de Farmacia i Ciencies de l'Alimentacio; Universitat de Barcelona","Illumina HiSeq","508x","A5-miseq v. 20160825","","","346","1835857","Spain","Human, Homo sapiens"
"Helicobacter pylori B528A","410935","210","210.5161","","","N/A","","ftp://ftp.ncbi.nlm.nih.gov/genomes/all/GCF/003/639/795/GCF_003639795.1_ASM363979v1","ftp://ftp.ncbi.nlm.nih.gov/genomes/all/GCA/003/639/795/GCA_003639795.1_ASM363979v1","SAMN08999414","PRJNA449871","GCA_003639795.1","1.57338","39.1","-","QEGT01","22","1571","1418/410935","10/12/2018","8/20/2019","Contig","2018-10-12T00:00:00Z","Facultat de Farmacia i Ciencies de l'Alimentacio; Universitat de Barcelona","Illumina MiSeq","207x","A5-miseq v. 20160825","","","22","1573376","Spain","Human, Homo sapiens"
"Helicobacter pylori B572A","410941","210","210.5172","","","N/A","","ftp://ftp.ncbi.nlm.nih.gov/genomes/all/GCF/003/640/025/GCF_003640025.1_ASM364002v1","ftp://ftp.ncbi.nlm.nih.gov/genomes/all/GCA/003/640/025/GCA_003640025.1_ASM364002v1","SAMN08999415","PRJNA449871","GCA_003640025.1","1.66158","38.9","-","QEGS01","45","1632","1509/410941","10/12/2018","8/20/2019","Contig","2018-10-12T00:00:00Z","Facultat de Farmacia i Ciencies de l'Alimentacio; Universitat de Barcelona","Illumina HiSeq","730x","A5-miseq v. 20160825","","","45","1661578","Spain","Human, Homo sapiens"
"Helicobacter pylori B630","410934","210","210.5158","","","N/A","","ftp://ftp.ncbi.nlm.nih.gov/genomes/all/GCF/003/639/735/GCF_003639735.1_ASM363973v1","ftp://ftp.ncbi.nlm.nih.gov/genomes/all/GCA/003/639/735/GCA_003639735.1_ASM363973v1","SAMN08999416","PRJNA449871","GCA_003639735.1","1.61379","39","-","QEGR01","54","1603","1460/410934","10/12/2018","8/20/2019","Contig","2018-10-12T00:00:00Z","Facultat de Farmacia i Ciencies de l'Alimentacio; Universitat de Barcelona","Illumina HiSeq","476x","A5-miseq v. 20160825","","","54","1613788","Spain","Human, Homo sapiens"
"Helicobacter pylori B657-A1","410925","210","210.5144","","","N/A","","ftp://ftp.ncbi.nlm.nih.gov/genomes/all/GCF/003/639/455/GCF_003639455.1_ASM363945v1","ftp://ftp.ncbi.nlm.nih.gov/genomes/all/GCA/003/639/455/GCA_003639455.1_ASM363945v1","SAMN08981269","PRJNA449871","GCA_003639455.1","1.62566","38.9","-","QDJI01","32","1609","1460/410925","10/12/2018","8/20/2019","Contig","2018-10-12T00:00:00Z","Facultat de Farmacia i Ciencies de l'Alimentacio; Universitat de Barcelona","Illumina HiSeq","898x","A5-miseq v. 20160825","","","32","1625656","Spain","Human, Homo sapiens"
"Helicobacter pylori B657-A4","410919","210","210.5134","","","N/A","","ftp://ftp.ncbi.nlm.nih.gov/genomes/all/GCF/003/639/265/GCF_003639265.1_ASM363926v1","ftp://ftp.ncbi.nlm.nih.gov/genomes/all/GCA/003/639/265/GCA_003639265.1_ASM363926v1","SAMN08981270","PRJNA449871","GCA_003639265.1","1.5897","39","-","QDJH01","23","1575","1446/410919","10/12/2018","8/20/2019","Contig","2018-10-12T00:00:00Z","Facultat de Farmacia i Ciencies de l'Alimentacio; Universitat de Barcelona","Illumina MiSeq","195x","A5-miseq v. 20160825","","","23","1589699","Spain","Human, Homo sapiens"
"Helicobacter pylori B657-C1","410918","210","210.5133","","","N/A","","ftp://ftp.ncbi.nlm.nih.gov/genomes/all/GCF/003/639/245/GCF_003639245.1_ASM363924v1","ftp://ftp.ncbi.nlm.nih.gov/genomes/all/GCA/003/639/245/GCA_003639245.1_ASM363924v1","SAMN08981271","PRJNA449871","GCA_003639245.1","1.5862","39","-","QDJG01","34","1570","1439/410918","10/12/2018","8/20/2019","Contig","2018-10-12T00:00:00Z","Facultat de Farmacia i Ciencies de l'Alimentacio; Universitat de Barcelona","Illumina HiSeq","842x","A5-miseq v. 20160825","","","34","1586198","Spain","Human, Homo sapiens"
"Helicobacter pylori B659-A1","410924","210","210.5143","","","N/A","","ftp://ftp.ncbi.nlm.nih.gov/genomes/all/GCF/003/639/445/GCF_003639445.1_ASM363944v1","ftp://ftp.ncbi.nlm.nih.gov/genomes/all/GCA/003/639/445/GCA_003639445.1_ASM363944v1","SAMN08981272","PRJNA449871","GCA_003639445.1","1.55651","39.2","-","QDJF01","48","1539","1405/410924","10/12/2018","9/1/2019","Contig","2018-10-12T00:00:00Z","Facultat de Farmacia i Ciencies de l'Alimentacio; Universitat de Barcelona","Illumina HiSeq","850x","A5-miseq v. 20160825","","","48","1556506","Spain","Human, Homo sapiens"
"Helicobacter pylori B712A","410940","210","210.5170","","","N/A","","ftp://ftp.ncbi.nlm.nih.gov/genomes/all/GCF/003/639/985/GCF_003639985.1_ASM363998v1","ftp://ftp.ncbi.nlm.nih.gov/genomes/all/GCA/003/639/985/GCA_003639985.1_ASM363998v1","SAMN08999419","PRJNA449871","GCA_003639985.1","1.56633","39.1","-","QEGO01","38","1554","1420/410940","10/12/2018","8/20/2019","Contig","2018-10-12T00:00:00Z","Facultat de Farmacia i Ciencies de l'Alimentacio; Universitat de Barcelona","Illumina HiSeq","846x","A5-miseq v. 20160825","","","38","1566326","Spain","Human, Homo sapiens"
"Helicobacter pylori BCS100H1","163752","981210","981210.3","","","N/A","","ftp://ftp.ncbi.nlm.nih.gov/genomes/all/GCF/000/285/035/GCF_000285035.1_ASM28503v1","ftp://ftp.ncbi.nlm.nih.gov/genomes/all/GCA/000/285/035/GCA_000285035.1_ASM28503v1","SAMEA2272805","PRJEA62405","GCA_000285035.1","1.5484","38.9","-","CADC01","31","1541","1345/163752","3/9/2011","4/2/2019","Contig","2011-03-09T00:00:00Z","MHH Hannover Medical School","","","","","","31","1548400","","Human, Homo sapiens"
"Helicobacter pylori BMG112","410933","210","210.5156","","","N/A","","ftp://ftp.ncbi.nlm.nih.gov/genomes/all/GCF/003/639/685/GCF_003639685.1_ASM363968v1","ftp://ftp.ncbi.nlm.nih.gov/genomes/all/GCA/003/639/685/GCA_003639685.1_ASM363968v1","SAMN08999420","PRJNA449871","GCA_003639685.1","1.56843","39.1","-","QEGN01","19","1561","1432/410933","10/12/2018","8/20/2019","Contig","2018-10-12T00:00:00Z","Facultat de Farmacia i Ciencies de l'Alimentacio; Universitat de Barcelona","Illumina MiSeq","166x","A5-miseq v. 20160825","","","19","1568426","Spain","Human, Homo sapiens"
"Helicobacter pylori C333","321881","1225482","1225482.3","","","N/A","","ftp://ftp.ncbi.nlm.nih.gov/genomes/all/GCF/002/204/015/GCF_002204015.1_HpC333v1.0","ftp://ftp.ncbi.nlm.nih.gov/genomes/all/GCA/002/204/015/GCA_002204015.1_HpC333v1.0","SAMN03013095","PRJNA173329","GCA_002204015.1","1.60224","38.6","-","AMFG01","20","1579","1419/321881","6/20/2017","7/30/2019","Contig","2017-06-20T00:00:00Z","Zhejiang-California International Nanosystems Institute (ZCNI), Zhejiang University","Illumina GAII; 454","2954.0x","Velvet v. Jun-2012; Newbler v. Jun-2012","","","20","1602237","China","Human, Homo sapiens"
"Helicobacter pylori C664","321880","1225175","1225175.3","","","N/A","","ftp://ftp.ncbi.nlm.nih.gov/genomes/all/GCF/002/203/985/GCF_002203985.1_HpC664v1.0","ftp://ftp.ncbi.nlm.nih.gov/genomes/all/GCA/002/203/985/GCA_002203985.1_HpC664v1.0","SAMN03013094","PRJNA173201","GCA_002203985.1","1.63154","38.7","-","AMFC01","30","1614","1457/321880","6/20/2017","7/30/2019","Contig","2017-06-20T00:00:00Z","Zhejiang-California International Nanosystems Institute (ZCNI), Zhejiang University","Illumina GAII; 454","2178.0x","Velvet v. Jun-2012; Newbler v. Jun-2012","","","30","1631539","China","Human, Homo sapiens"
"Helicobacter pylori CCHI 33","163786","1200325","1200325.3","","","N/A","","ftp://ftp.ncbi.nlm.nih.gov/genomes/all/GCF/000/349/485/GCF_000349485.1_ASM34948v1","ftp://ftp.ncbi.nlm.nih.gov/genomes/all/GCA/000/349/485/GCA_000349485.1_ASM34948v1","SAMN01178404","PRJNA168620","GCA_000349485.1","1.65933","39.2","-","AOTU01","11","1638","1477/163786","3/27/2013","3/23/2017","Contig","2013-03-27T00:00:00Z","IGS","Illumina; 454","30x from 454; 30x from Illumina","Celera Assembler v. 7.0","","","11","1659327","Canada","Human, Homo sapiens"
"Helicobacter pylori CG-IMSS-2012","163815","1292040","1292040.3","","","N/A","","ftp://ftp.ncbi.nlm.nih.gov/genomes/all/GCF/000/472/305/GCF_000472305.1_CGIMSS2012","ftp://ftp.ncbi.nlm.nih.gov/genomes/all/GCA/000/472/305/GCA_000472305.1_CGIMSS2012","SAMN02471329","PRJNA188779","GCA_000472305.1","1.59905","39","-","AWUL01","45","1589","1343/163815","9/30/2013","4/2/2019","Contig","2013-09-30T00:00:00Z","INSTITUTO POLITECNICO NACIONAL","454","35.0x","Newbler v. 2.3; AMOS assembler v. 3.1.0","","","45","1599050","Mexico","Human, Homo sapiens"
"Helicobacter pylori CPY1313","163732","992014","992014.3","","","N/A","","ftp://ftp.ncbi.nlm.nih.gov/genomes/all/GCF/000/275/205/GCF_000275205.1_ASM27520v1","ftp://ftp.ncbi.nlm.nih.gov/genomes/all/GCA/000/275/205/GCA_000275205.1_ASM27520v1","SAMN00777156","PRJNA64055","GCA_000275205.1","1.58144","38.8","-","AKNK01","5","1574","1376/163732","6/28/2012","2/12/2019","Contig","2012-06-28T00:00:00Z","Institute for Genome Sciences","Illumina;454","53.36x","Celera Assembler v. 6.1","","","5","1581437","Japan","Human, Homo sapiens"
"Helicobacter pylori CPY1662","163787","992015","992015.3","","","N/A","","ftp://ftp.ncbi.nlm.nih.gov/genomes/all/GCF/000/349/505/GCF_000349505.1_ASM34950v1","ftp://ftp.ncbi.nlm.nih.gov/genomes/all/GCA/000/349/505/GCA_000349505.1_ASM34950v1","SAMN01178408","PRJNA64057","GCA_000349505.1","1.59582","38.8","-","AOTT01","9","1586","1421/163787","3/27/2013","3/23/2017","Contig","2013-03-27T00:00:00Z","Institute for Genome Sciences","Illumina; 454","22x from 454; 40x from Illumina","Celera Assembler v. 7.0","","","9","1595824","Japan","Human, Homo sapiens"
"Helicobacter pylori CPY1962","163731","992016","992016.3","","GCF_000275185","N/A","","ftp://ftp.ncbi.nlm.nih.gov/genomes/all/GCF/000/275/185/GCF_000275185.1_ASM27518v1","ftp://ftp.ncbi.nlm.nih.gov/genomes/all/GCA/000/275/185/GCA_000275185.1_ASM27518v1","SAMN00777159","PRJNA64059","GCA_000275185.1","1.56156","38.9","-","AKNL01","8","1565","1391/163731","6/28/2012","3/23/2017","Contig","2012-06-28T00:00:00Z","Institute for Genome Sciences","Illumina;454","72.02x","Celera Assembler v. 6.1","","","8","1561561","Japan","Human, Homo sapiens"
"Helicobacter pylori CPY3281","163708","992017","992017.3","","","N/A","","ftp://ftp.ncbi.nlm.nih.gov/genomes/all/GCF/000/274/725/GCF_000274725.1_ASM27472v1","ftp://ftp.ncbi.nlm.nih.gov/genomes/all/GCA/000/274/725/GCA_000274725.1_ASM27472v1","SAMN00777162","PRJNA64061","GCA_000274725.1","1.60653","38.7","-","AKNM01","8","1611","1412/163708","6/28/2012","4/2/2019","Contig","2012-06-28T00:00:00Z","Institute for Genome Sciences","Illumina;454","51.27x","Celera Assembler v. 6.1","","","8","1606528","Japan","Human, Homo sapiens"
"Helicobacter pylori CPY6081","163707","992018","992018.3","","","N/A","","ftp://ftp.ncbi.nlm.nih.gov/genomes/all/GCF/000/274/705/GCF_000274705.1_ASM27470v1","ftp://ftp.ncbi.nlm.nih.gov/genomes/all/GCA/000/274/705/GCA_000274705.1_ASM27470v1","SAMN00777164","PRJNA64063","GCA_000274705.1","1.5991","38.7","-","AKNN01","9","1590","1388/163707","6/28/2012","4/2/2019","Contig","2012-06-28T00:00:00Z","Institute for Genome Sciences","Illumina;454","34.67x","Celera Assembler v. 6.1","","","9","1599100","Japan","Human, Homo sapiens"
"Helicobacter pylori CPY6261","163706","992019","992019.3","","","N/A","","ftp://ftp.ncbi.nlm.nih.gov/genomes/all/GCF/000/274/685/GCF_000274685.1_ASM27468v1","ftp://ftp.ncbi.nlm.nih.gov/genomes/all/GCA/000/274/685/GCA_000274685.1_ASM27468v1","SAMN00777167","PRJNA64065","GCA_000274685.1","1.609","38.8","-","AKNO01","5","1596","1423/163706","6/28/2012","3/23/2017","Contig","2012-06-28T00:00:00Z","Institute for Genome Sciences","Illumina;454","61.50x","Celera Assembler v. 6.1","","","5","1608996","Japan","Human, Homo sapiens"
"Helicobacter pylori CPY6271","163705","992020","992020.3","","","N/A","","ftp://ftp.ncbi.nlm.nih.gov/genomes/all/GCF/000/274/665/GCF_000274665.1_ASM27466v1","ftp://ftp.ncbi.nlm.nih.gov/genomes/all/GCA/000/274/665/GCA_000274665.1_ASM27466v1","SAMN00777263","PRJNA64067","GCA_000274665.1","1.60212","38.8","-","AKNP01","8","1585","1428/163705","6/28/2012","3/23/2017","Contig","2012-06-28T00:00:00Z","Institute for Genome Sciences","Illumina;454","70.39x","Celera Assembler v. 6.1","","","8","1602120","Japan","Human, Homo sapiens"
"Helicobacter pylori CRL122","410923","210","210.5142","","","N/A","","ftp://ftp.ncbi.nlm.nih.gov/genomes/all/GCF/003/639/425/GCF_003639425.1_ASM363942v1","ftp://ftp.ncbi.nlm.nih.gov/genomes/all/GCA/003/639/425/GCA_003639425.1_ASM363942v1","SAMN08981274","PRJNA449871","GCA_003639425.1","1.6171","38.9","-","QDJD01","32","1625","1462/410923","10/12/2018","8/20/2019","Contig","2018-10-12T00:00:00Z","Facultat de Farmacia i Ciencies de l'Alimentacio; Universitat de Barcelona","Illumina MiSeq","215x","A5-miseq v. 20160825","","","32","1617097","Spain","Human, Homo sapiens"
"Helicobacter pylori CRM21","410931","210","210.5154","","","N/A","","ftp://ftp.ncbi.nlm.nih.gov/genomes/all/GCF/003/639/665/GCF_003639665.1_ASM363966v1","ftp://ftp.ncbi.nlm.nih.gov/genomes/all/GCA/003/639/665/GCA_003639665.1_ASM363966v1","SAMN08999421","PRJNA449871","GCA_003639665.1","1.64234","39.1","-","QEGM01","54","1621","1480/410931","10/12/2018","8/20/2019","Contig","2018-10-12T00:00:00Z","Facultat de Farmacia i Ciencies de l'Alimentacio; Universitat de Barcelona","Illumina HiSeq","622x","A5-miseq v. 20160825","","","54","1642342","Spain","Human, Homo sapiens"
"Helicobacter pylori D33","203394","1249613","1249613.3","","","N/A","","ftp://ftp.ncbi.nlm.nih.gov/genomes/all/GCF/000/709/945/GCF_000709945.1_D33","ftp://ftp.ncbi.nlm.nih.gov/genomes/all/GCA/000/709/945/GCA_000709945.1_D33","SAMN02866191","PRJNA178929","GCA_000709945.1","1.54515","38.9","-","ANIO01","64","1541","1394/203394","6/18/2014","3/24/2017","Contig","2014-06-18T00:00:00Z","Qingdao municipal Hospital","Illumina HiSeq","297.0x","SOAPdenovo v. Version 1.3","","","64","1545148","","Human, Homo sapiens"
"Helicobacter pylori E48","163908","1400820","1400820.3","","","N/A","","ftp://ftp.ncbi.nlm.nih.gov/genomes/all/GCF/000/499/345/GCF_000499345.1_E48","ftp://ftp.ncbi.nlm.nih.gov/genomes/all/GCA/000/499/345/GCA_000499345.1_E48","SAMN02356207","PRJNA219052","GCA_000499345.1","1.66192","38.7","-","AYHQ01","61","1666","1221/163908","11/25/2013","10/8/2019","Contig","2013-11-25T00:00:00Z","Scientific Research Institute of Physical-Chemical Medicine","IonTorrent","44.0x","Newbler v. 2.6","","","61","1661917","Russia","Human, Homo sapiens"
"Helicobacter pylori FDAARGOS_299","360746","210","210.2680","","","N/A","","-","ftp://ftp.ncbi.nlm.nih.gov/genomes/all/GCA/002/206/465/GCA_002206465.2_ASM220646v2","SAMN06173312","PRJNA231221","GCA_002206465.2","1.81948","38.9","-","NJFC02","3","1799","1524/360746","6/23/2017","7/23/2019","Contig","2017-06-23T00:00:00Z","US Food and Drug Administration","PacBio","24x","CA v. 8.2","","","3","1818367","United States","Human, Homo sapiens"
"Helicobacter pylori G4","314404","210","210.2677","","","N/A","","ftp://ftp.ncbi.nlm.nih.gov/genomes/all/GCF/002/093/735/GCF_002093735.1_ASM209373v1","ftp://ftp.ncbi.nlm.nih.gov/genomes/all/GCA/002/093/735/GCA_002093735.1_ASM209373v1","SAMN06459236","PRJNA362473","GCA_002093735.1","1.60634","39.2","-","MWUG01","122","1617","1451/314404","4/14/2017","7/30/2019","Contig","2017-04-14T00:00:00Z","MedBiotech laboratory, faculty of medicine and pharmacy, rabat/ Mohamed V university rabat","Illumina MiSeq","540.0x","Minia v. 2.0.7","","","122","1606340","Morocco","Human, Homo sapiens"
"Helicobacter pylori GC23-HL","372668","210","210.4183","","","N/A","","ftp://ftp.ncbi.nlm.nih.gov/genomes/all/GCF/003/059/455/GCF_003059455.1_ASM305945v1","ftp://ftp.ncbi.nlm.nih.gov/genomes/all/GCA/003/059/455/GCA_003059455.1_ASM305945v1","SAMN08381217","PRJNA395900","GCA_003059455.1","1.62964","38.9","-","QBRF01","71","1632","1459/372668","4/22/2018","8/11/2019","Contig","2018-04-22T00:00:00Z","University of Bath","Illumina","50x","Velvet v. 1.2.08","","","71","1629644","France","Human, Homo sapiens"
"Helicobacter pylori GC26-HL","372664","210","210.4187","","","N/A","","ftp://ftp.ncbi.nlm.nih.gov/genomes/all/GCF/003/059/365/GCF_003059365.1_ASM305936v1","ftp://ftp.ncbi.nlm.nih.gov/genomes/all/GCA/003/059/365/GCA_003059365.1_ASM305936v1","SAMN08381218","PRJNA395900","GCA_003059365.1","1.59602","38.9","-","QBRE01","51","1590","1440/372664","4/22/2018","8/11/2019","Contig","2018-04-22T00:00:00Z","University of Bath","Illumina","50x","Velvet v. 1.2.08","","","51","1596021","France","Human, Homo sapiens"
"Helicobacter pylori GC30-HL","372660","210","210.4157","","","N/A","","ftp://ftp.ncbi.nlm.nih.gov/genomes/all/GCF/003/059/285/GCF_003059285.1_ASM305928v1","ftp://ftp.ncbi.nlm.nih.gov/genomes/all/GCA/003/059/285/GCA_003059285.1_ASM305928v1","SAMN08381231","PRJNA395900","GCA_003059285.1","1.60914","38.9","-","QBQS01","62","1606","1447/372660","4/22/2018","8/11/2019","Contig","2018-04-22T00:00:00Z","University of Bath","Illumina","50x","Velvet v. 1.2.08","","","62","1609142","France","Human, Homo sapiens"
"Helicobacter pylori GC31-B","372677","210","210.4168","","","N/A","","ftp://ftp.ncbi.nlm.nih.gov/genomes/all/GCF/003/059/965/GCF_003059965.1_ASM305996v1","ftp://ftp.ncbi.nlm.nih.gov/genomes/all/GCA/003/059/965/GCA_003059965.1_ASM305996v1","SAMN08381220","PRJNA395900","GCA_003059965.1","1.65631","38.8","-","QBRC01","51","1630","1485/372677","4/22/2018","8/11/2019","Contig","2018-04-22T00:00:00Z","University of Bath","Illumina","50x","Velvet v. 1.2.08","","","51","1656312","France","Human, Homo sapiens"
"Helicobacter pylori GC52-HL","372659","210","210.4189","","","N/A","","ftp://ftp.ncbi.nlm.nih.gov/genomes/all/GCF/003/059/265/GCF_003059265.1_ASM305926v1","ftp://ftp.ncbi.nlm.nih.gov/genomes/all/GCA/003/059/265/GCA_003059265.1_ASM305926v1","SAMN08381232","PRJNA395900","GCA_003059265.1","1.64143","38.9","-","QBQR01","70","1646","1488/372659","4/22/2018","8/11/2019","Contig","2018-04-22T00:00:00Z","University of Bath","Illumina","50x","Velvet v. 1.2.08","","","70","1641427","France","Human, Homo sapiens"
"Helicobacter pylori GC54-HL","372665","210","210.4186","","","N/A","","ftp://ftp.ncbi.nlm.nih.gov/genomes/all/GCF/003/059/385/GCF_003059385.1_ASM305938v1","ftp://ftp.ncbi.nlm.nih.gov/genomes/all/GCA/003/059/385/GCA_003059385.1_ASM305938v1","SAMN08381223","PRJNA395900","GCA_003059385.1","1.62369","38.9","-","QBRA01","50","1604","1449/372665","4/22/2018","8/11/2019","Contig","2018-04-22T00:00:00Z","University of Bath","Illumina","50x","Velvet v. 1.2.08","","","50","1623691","France","Human, Homo sapiens"
"Helicobacter pylori GC65-HL","372662","210","210.4159","","","N/A","","ftp://ftp.ncbi.nlm.nih.gov/genomes/all/GCF/003/059/325/GCF_003059325.1_ASM305932v1","ftp://ftp.ncbi.nlm.nih.gov/genomes/all/GCA/003/059/325/GCA_003059325.1_ASM305932v1","SAMN08381224","PRJNA395900","GCA_003059325.1","1.66884","38.8","-","QBQZ01","63","1649","1502/372662","4/22/2018","8/11/2019","Contig","2018-04-22T00:00:00Z","University of Bath","Illumina","50x","Velvet v. 1.2.08","","","63","1668838","France","Human, Homo sapiens"
"Helicobacter pylori GC67-HL","372663","210","210.4188","","","N/A","","ftp://ftp.ncbi.nlm.nih.gov/genomes/all/GCF/003/059/335/GCF_003059335.1_ASM305933v1","ftp://ftp.ncbi.nlm.nih.gov/genomes/all/GCA/003/059/335/GCA_003059335.1_ASM305933v1","SAMN08381225","PRJNA395900","GCA_003059335.1","1.61376","39","-","QBQY01","56","1597","1460/372663","4/22/2018","8/11/2019","Contig","2018-04-22T00:00:00Z","University of Bath","Illumina","50x","Velvet v. 1.2.08","","","56","1613756","France","Human, Homo sapiens"
"Helicobacter pylori GC69-HL","372642","210","210.4206","","","N/A","","ftp://ftp.ncbi.nlm.nih.gov/genomes/all/GCF/003/058/905/GCF_003058905.1_ASM305890v1","ftp://ftp.ncbi.nlm.nih.gov/genomes/all/GCA/003/058/905/GCA_003058905.1_ASM305890v1","SAMN08381240","PRJNA395900","GCA_003058905.1","1.60136","39","-","QBQJ01","61","1588","1434/372642","4/22/2018","8/11/2019","Contig","2018-04-22T00:00:00Z","University of Bath","Illumina","50x","Velvet v. 1.2.08","","","61","1601364","France","Human, Homo sapiens"
"Helicobacter pylori H13-1","163907","1400821","1400821.3","","","N/A","","ftp://ftp.ncbi.nlm.nih.gov/genomes/all/GCF/000/499/325/GCF_000499325.1_H13-1","ftp://ftp.ncbi.nlm.nih.gov/genomes/all/GCA/000/499/325/GCA_000499325.1_H13-1","SAMN02355411","PRJNA219053","GCA_000499325.1","1.63147","38.7","-","AYUH01","96","1655","1141/163907","11/25/2013","10/8/2019","Contig","2013-11-25T00:00:00Z","Scientific Research Institute of Physical-Chemical Medicine","IonTorrent","39.0x","Newbler v. 2.6","","","96","1631474","Russia","Human, Homo sapiens"
"Helicobacter pylori HLJ039","163910","1442601","1442601.3","","","N/A","","ftp://ftp.ncbi.nlm.nih.gov/genomes/all/GCF/000/521/245/GCF_000521245.1_Helicobacter_pylori_HLJ039","ftp://ftp.ncbi.nlm.nih.gov/genomes/all/GCA/000/521/245/GCA_000521245.1_Helicobacter_pylori_HLJ039","SAMN02597427","PRJNA232950","GCA_000521245.1","1.61","38.7","-","JAAA01","34","1612","1428/163910","1/21/2014","3/24/2017","Contig","2014-01-21T00:00:00Z","'State Key Laboratory for Infectious Disease Prevention and Control, National Institute for Communicable Disease Control and Prevention, Chinese Center for Disease Control and Prevention'","Illumina","120x","SOAPdenovo v. 1.05","","","34","1609997","China","Human, Homo sapiens"
"Helicobacter pylori Hp A-11","163788","992035","992035.3","","","N/A","","ftp://ftp.ncbi.nlm.nih.gov/genomes/all/GCF/000/359/645/GCF_000359645.1_ASM35964v1","ftp://ftp.ncbi.nlm.nih.gov/genomes/all/GCA/000/359/645/GCA_000359645.1_ASM35964v1","SAMN00778850","PRJNA64097","GCA_000359645.1","1.66834","38.8","-","AOTW01","1","1654","1484/163788","4/9/2013","3/23/2017","Contig","2013-04-09T00:00:00Z","Institute for Genome Sciences","Illumina; 454","25x from 454; 50x from Illumina","Celera Assembler v. 7.0","","","1","1668342","United States","Human, Homo sapiens"
"Helicobacter pylori Hp A-16","163730","992055","992055.3","","GCF_000275165","N/A","","ftp://ftp.ncbi.nlm.nih.gov/genomes/all/GCF/000/275/165/GCF_000275165.1_ASM27516v1","ftp://ftp.ncbi.nlm.nih.gov/genomes/all/GCA/000/275/165/GCA_000275165.1_ASM27516v1","SAMN00778861","PRJNA64137","GCA_000275165.1","1.6378","39.2","-","AKOU01","11","1615","1460/163730","6/28/2012","3/23/2017","Contig","2012-06-28T00:00:00Z","Institute for Genome Sciences","Illumina;454","65.73x","Celera Assembler v. 6.1","","","11","1637800","United States","Human, Homo sapiens"
"Helicobacter pylori Hp A-20","163736","992037","992037.3","","GCF_000275285","N/A","","ftp://ftp.ncbi.nlm.nih.gov/genomes/all/GCF/000/275/285/GCF_000275285.1_ASM27528v1","ftp://ftp.ncbi.nlm.nih.gov/genomes/all/GCA/000/275/285/GCA_000275285.1_ASM27528v1","SAMN00778862","PRJNA64101","GCA_000275285.1","1.6746","39.2","-","AKOE01","10","1657","1481/163736","6/28/2012","3/23/2017","Contig","2012-06-28T00:00:00Z","Institute for Genome Sciences","Illumina;454","36.23x","Celera Assembler v. 6.1","","","10","1674600","United States","Human, Homo sapiens"
"Helicobacter pylori Hp A-26","163673","992056","992056.3","","GCF_000274025","N/A","","ftp://ftp.ncbi.nlm.nih.gov/genomes/all/GCF/000/274/025/GCF_000274025.1_ASM27402v1","ftp://ftp.ncbi.nlm.nih.gov/genomes/all/GCA/000/274/025/GCA_000274025.1_ASM27402v1","SAMN00778866","PRJNA64139","GCA_000274025.1","1.62419","39","-","AKOV01","9","1606","1438/163673","6/28/2012","3/23/2017","Contig","2012-06-28T00:00:00Z","Institute for Genome Sciences","Illumina;454","69.93x","Celera Assembler v. 6.1","","","9","1624194","United States","Human, Homo sapiens"
"Helicobacter pylori Hp A-5","163724","992033","992033.3","","","N/A","","ftp://ftp.ncbi.nlm.nih.gov/genomes/all/GCF/000/275/045/GCF_000275045.1_ASM27504v1","ftp://ftp.ncbi.nlm.nih.gov/genomes/all/GCA/000/275/045/GCA_000275045.1_ASM27504v1","SAMN00778869","PRJNA64093","GCA_000275045.1","1.63593","39.2","-","AKOB01","7","1592","1445/163724","6/28/2012","3/23/2017","Contig","2012-06-28T00:00:00Z","Institute for Genome Sciences","Illumina;454","50.92x","Celera Assembler v. 6.1","","","7","1635925","United States","Human, Homo sapiens"
"Helicobacter pylori Hp A-6","163671","992052","992052.3","","","N/A","","ftp://ftp.ncbi.nlm.nih.gov/genomes/all/GCF/000/273/985/GCF_000273985.1_ASM27398v1","ftp://ftp.ncbi.nlm.nih.gov/genomes/all/GCA/000/273/985/GCA_000273985.1_ASM27398v1","SAMN00778863","PRJNA64131","GCA_000273985.1","1.65338","39.2","-","AKOR01","12","1621","1456/163671","6/28/2012","3/23/2017","Contig","2012-06-28T00:00:00Z","Institute for Genome Sciences","Illumina;454","62.37x","Celera Assembler v. 6.1","","","12","1653378","United States","Human, Homo sapiens"
"Helicobacter pylori Hp A-8","163663","992053","992053.3","","GCF_000273825","N/A","","ftp://ftp.ncbi.nlm.nih.gov/genomes/all/GCF/000/273/825/GCF_000273825.1_ASM27382v1","ftp://ftp.ncbi.nlm.nih.gov/genomes/all/GCA/000/273/825/GCA_000273825.1_ASM27382v1","SAMN00778858","PRJNA64133","GCA_000273825.1","1.64063","39.2","-","AKOS01","7","1610","1456/163663","6/28/2012","3/23/2017","Contig","2012-06-28T00:00:00Z","Institute for Genome Sciences","Illumina;454","68.28x","Celera Assembler v. 6.1","","","7","1640628","United States","Human, Homo sapiens"
"Helicobacter pylori Hp H-1","163784","992058","992058.3","","","N/A","","ftp://ftp.ncbi.nlm.nih.gov/genomes/all/GCF/000/349/405/GCF_000349405.1_ASM34940v1","ftp://ftp.ncbi.nlm.nih.gov/genomes/all/GCA/000/349/405/GCA_000349405.1_ASM34940v1","SAMN01178406","PRJNA64143","GCA_000349405.1","1.68293","39","-","AOTX01","54","1658","1510/163784","3/27/2013","3/23/2017","Contig","2013-03-27T00:00:00Z","Institute for Genome Sciences","Illumina; 454","20x from 454; 60x from Illumina","Celera Assembler v. 7.0","","","54","1682934","United States","Human, Homo sapiens"
"Helicobacter pylori Hp H-10","163738","992063","992063.3","","","N/A","","ftp://ftp.ncbi.nlm.nih.gov/genomes/all/GCF/000/275/325/GCF_000275325.1_ASM27532v1","ftp://ftp.ncbi.nlm.nih.gov/genomes/all/GCA/000/275/325/GCA_000275325.1_ASM27532v1","SAMN00778859","PRJNA64153","GCA_000275325.1","1.64982","39.2","-","AKPB01","32","1645","1459/163738","6/28/2012","3/23/2017","Contig","2012-06-28T00:00:00Z","Institute for Genome Sciences","Illumina;454","58.91x","Celera Assembler v. 6.1","","","32","1649818","United States","Human, Homo sapiens"
"Helicobacter pylori Hp H-18","163697","992065","992065.3","","GCF_000274505","N/A","","ftp://ftp.ncbi.nlm.nih.gov/genomes/all/GCF/000/274/505/GCF_000274505.1_ASM27450v1","ftp://ftp.ncbi.nlm.nih.gov/genomes/all/GCA/000/274/505/GCA_000274505.1_ASM27450v1","SAMN00778853","PRJNA64157","GCA_000274505.1","1.76069","39","-","AKPD01","21","1749","1554/163697","6/28/2012","3/23/2017","Contig","2012-06-28T00:00:00Z","Institute for Genome Sciences","Illumina;454","44.71x","Celera Assembler v. 6.1","","","21","1760691","United States","Human, Homo sapiens"
"Helicobacter pylori Hp H-19","163678","992066","992066.3","","","N/A","","ftp://ftp.ncbi.nlm.nih.gov/genomes/all/GCF/000/274/125/GCF_000274125.1_ASM27412v1","ftp://ftp.ncbi.nlm.nih.gov/genomes/all/GCA/000/274/125/GCA_000274125.1_ASM27412v1","SAMN00778854","PRJNA64159","GCA_000274125.1","1.63437","39.3","-","AKPE01","7","1600","1430/163678","6/28/2012","3/23/2017","Contig","2012-06-28T00:00:00Z","Institute for Genome Sciences","Illumina;454","60.04x","Celera Assembler v. 6.1","","","7","1634366","United States","Human, Homo sapiens"
"Helicobacter pylori Hp H-23","163680","992068","992068.3","","","N/A","","ftp://ftp.ncbi.nlm.nih.gov/genomes/all/GCF/000/274/165/GCF_000274165.1_ASM27416v1","ftp://ftp.ncbi.nlm.nih.gov/genomes/all/GCA/000/274/165/GCA_000274165.1_ASM27416v1","SAMN00778865","PRJNA64163","GCA_000274165.1","1.64806","39.1","-","AKPG01","9","1619","1468/163680","6/28/2012","3/23/2017","Contig","2012-06-28T00:00:00Z","Institute for Genome Sciences","Illumina;454","62.21x","Celera Assembler v. 6.1","","","9","1648064","United States","Human, Homo sapiens"
"Helicobacter pylori Hp H-24","163726","992039","992039.3","","","N/A","","ftp://ftp.ncbi.nlm.nih.gov/genomes/all/GCF/000/275/085/GCF_000275085.1_ASM27508v1","ftp://ftp.ncbi.nlm.nih.gov/genomes/all/GCA/000/275/085/GCA_000275085.1_ASM27508v1","SAMN00778905","PRJNA64105","GCA_000275085.1","1.67018","39.2","-","AKOG01","8","1643","1465/163726","6/28/2012","3/23/2017","Contig","2012-06-28T00:00:00Z","Institute for Genome Sciences","Illumina;454","23.47x","Celera Assembler v. 6.1","","","8","1670182","United States","Human, Homo sapiens"
"Helicobacter pylori Hp H-27","163727","992040","992040.3","","","N/A","","ftp://ftp.ncbi.nlm.nih.gov/genomes/all/GCF/000/275/105/GCF_000275105.1_ASM27510v1","ftp://ftp.ncbi.nlm.nih.gov/genomes/all/GCA/000/275/105/GCA_000275105.1_ASM27510v1","SAMN00778914","PRJNA64107","GCA_000275105.1","1.61204","39","-","AKOH01","5","1597","1455/163727","6/28/2012","3/23/2017","Contig","2012-06-28T00:00:00Z","Institute for Genome Sciences","Illumina;454","43.17x","Celera Assembler v. 6.1","","","5","1612044","United States","Human, Homo sapiens"
"Helicobacter pylori Hp H-28","163728","992041","992041.3","","","N/A","","ftp://ftp.ncbi.nlm.nih.gov/genomes/all/GCF/000/275/125/GCF_000275125.1_ASM27512v1","ftp://ftp.ncbi.nlm.nih.gov/genomes/all/GCA/000/275/125/GCA_000275125.1_ASM27512v1","SAMN00778915","PRJNA64109","GCA_000275125.1","1.625","39","-","AKOI01","16","1612","1442/163728","6/28/2012","11/23/2017","Contig","2012-06-28T00:00:00Z","Institute for Genome Sciences","Illumina;454","56.60x","Celera Assembler v. 6.1","","","16","1625000","United States","Human, Homo sapiens"
"Helicobacter pylori Hp H-29","163666","992042","992042.3","","","N/A","","ftp://ftp.ncbi.nlm.nih.gov/genomes/all/GCF/000/273/885/GCF_000273885.1_ASM27388v1","ftp://ftp.ncbi.nlm.nih.gov/genomes/all/GCA/000/273/885/GCA_000273885.1_ASM27388v1","SAMN00778898","PRJNA64111","GCA_000273885.1","1.67761","39.1","-","AKOJ01","16","1642","1480/163666","6/28/2012","3/23/2017","Contig","2012-06-28T00:00:00Z","Institute for Genome Sciences","Illumina;454","70.76x","Celera Assembler v. 6.1","","","16","1677607","United States","Human, Homo sapiens"
"Helicobacter pylori Hp H-3","163675","992059","992059.3","","","N/A","","ftp://ftp.ncbi.nlm.nih.gov/genomes/all/GCF/000/274/065/GCF_000274065.1_ASM27406v1","ftp://ftp.ncbi.nlm.nih.gov/genomes/all/GCA/000/274/065/GCA_000274065.1_ASM27406v1","SAMN00778911","PRJNA64145","GCA_000274065.1","1.71204","38.9","-","AKOX01","11","1645","1492/163675","6/28/2012","3/23/2017","Contig","2012-06-28T00:00:00Z","Institute for Genome Sciences","Illumina;454","44.54x","Celera Assembler v. 6.1","","","11","1712042","United States","Human, Homo sapiens"
"Helicobacter pylori Hp H-34","163685","992069","992069.3","","","N/A","","ftp://ftp.ncbi.nlm.nih.gov/genomes/all/GCF/000/274/265/GCF_000274265.1_ASM27426v1","ftp://ftp.ncbi.nlm.nih.gov/genomes/all/GCA/000/274/265/GCA_000274265.1_ASM27426v1","SAMN00778906","PRJNA64165","GCA_000274265.1","1.62724","39.2","-","AKPH01","8","1608","1456/163685","6/28/2012","3/23/2017","Contig","2012-06-28T00:00:00Z","Institute for Genome Sciences","Illumina;454","75.16x","Celera Assembler v. 6.1","","","8","1627237","United States","Human, Homo sapiens"
"Helicobacter pylori Hp H-36","163664","992044","992044.3","","","N/A","","ftp://ftp.ncbi.nlm.nih.gov/genomes/all/GCF/000/273/845/GCF_000273845.1_ASM27384v1","ftp://ftp.ncbi.nlm.nih.gov/genomes/all/GCA/000/273/845/GCA_000273845.1_ASM27384v1","SAMN00778917","PRJNA64115","GCA_000273845.1","1.67591","39.1","-","AKOL01","16","1658","1491/163664","6/28/2012","3/23/2017","Contig","2012-06-28T00:00:00Z","Institute for Genome Sciences","Illumina;454","54.02x","Celera Assembler v. 6.1","","","16","1675907","United States","Human, Homo sapiens"
"Helicobacter pylori Hp H-4","163679","992060","992060.3","","GCF_000274145","N/A","","ftp://ftp.ncbi.nlm.nih.gov/genomes/all/GCF/000/274/145/GCF_000274145.1_ASM27414v1","ftp://ftp.ncbi.nlm.nih.gov/genomes/all/GCA/000/274/145/GCA_000274145.1_ASM27414v1","SAMN00778902","PRJNA64147","GCA_000274145.1","1.66509","39.1","-","AKOY01","9","1631","1478/163679","6/28/2012","3/23/2017","Contig","2012-06-28T00:00:00Z","Institute for Genome Sciences","Illumina;454","29.54x","Celera Assembler v. 6.1","","","9","1665093","United States","Human, Homo sapiens"
"Helicobacter pylori Hp H-41","163662","992046","992046.3","","GCF_000273805","N/A","","ftp://ftp.ncbi.nlm.nih.gov/genomes/all/GCF/000/273/805/GCF_000273805.1_ASM27380v1","ftp://ftp.ncbi.nlm.nih.gov/genomes/all/GCA/000/273/805/GCA_000273805.1_ASM27380v1","SAMN00778907","PRJNA64119","GCA_000273805.1","1.66057","39.2","-","AKOM01","11","1636","1472/163662","6/28/2012","3/23/2017","Contig","2012-06-28T00:00:00Z","Institute for Genome Sciences","Illumina;454","59.34x","Celera Assembler v. 6.1","","","11","1660567","United States","Human, Homo sapiens"
"Helicobacter pylori Hp H-42","163667","992047","992047.3","","","N/A","","ftp://ftp.ncbi.nlm.nih.gov/genomes/all/GCF/000/273/905/GCF_000273905.1_ASM27390v1","ftp://ftp.ncbi.nlm.nih.gov/genomes/all/GCA/000/273/905/GCA_000273905.1_ASM27390v1","SAMN00778881","PRJNA64121","GCA_000273905.1","1.70229","39.1","-","AKON01","19","1680","1502/163667","6/28/2012","3/23/2017","Contig","2012-06-28T00:00:00Z","Institute for Genome Sciences","Illumina;454","40.61x","Celera Assembler v. 6.1","","","19","1702292","United States","Human, Homo sapiens"
"Helicobacter pylori Hp H-43","163670","992048","992048.3","","","N/A","","ftp://ftp.ncbi.nlm.nih.gov/genomes/all/GCF/000/273/965/GCF_000273965.1_ASM27396v1","ftp://ftp.ncbi.nlm.nih.gov/genomes/all/GCA/000/273/965/GCA_000273965.1_ASM27396v1","SAMN00778893","PRJNA64123","GCA_000273965.1","1.60766","39.1","-","AKOO01","12","1583","1443/163670","6/28/2012","3/23/2017","Contig","2012-06-28T00:00:00Z","Institute for Genome Sciences","Illumina;454","67.18x","Celera Assembler v. 6.1","","","12","1607665","United States","Human, Homo sapiens"
"Helicobacter pylori Hp H-44","163668","992049","992049.3","","GCF_000273925","N/A","","ftp://ftp.ncbi.nlm.nih.gov/genomes/all/GCF/000/273/925/GCF_000273925.1_ASM27392v1","ftp://ftp.ncbi.nlm.nih.gov/genomes/all/GCA/000/273/925/GCA_000273925.1_ASM27392v1","SAMN00778872","PRJNA64125","GCA_000273925.1","1.66584","39.1","-","AKOP01","16","1631","1478/163668","6/28/2012","3/23/2017","Contig","2012-06-28T00:00:00Z","Institute for Genome Sciences","Illumina;454","54.05x","Celera Assembler v. 6.1","","","16","1665840","United States","Human, Homo sapiens"
"Helicobacter pylori Hp H-45","163669","992050","992050.3","","GCF_000273945","N/A","","ftp://ftp.ncbi.nlm.nih.gov/genomes/all/GCF/000/273/945/GCF_000273945.1_ASM27394v1","ftp://ftp.ncbi.nlm.nih.gov/genomes/all/GCA/000/273/945/GCA_000273945.1_ASM27394v1","SAMN00778904","PRJNA64127","GCA_000273945.1","1.6554","38.9","-","AKOQ01","14","1637","1473/163669","6/28/2012","3/23/2017","Contig","2012-06-28T00:00:00Z","Institute for Genome Sciences","Illumina;454","51.29x","Celera Assembler v. 6.1","","","14","1655397","United States","Human, Homo sapiens"
"Helicobacter pylori Hp H-5b","163690","992092","992092.3","","GCF_000274365","N/A","","ftp://ftp.ncbi.nlm.nih.gov/genomes/all/GCF/000/274/365/GCF_000274365.1_ASM27436v1","ftp://ftp.ncbi.nlm.nih.gov/genomes/all/GCA/000/274/365/GCA_000274365.1_ASM27436v1","SAMN00778873","PRJNA64211","GCA_000274365.1","1.70853","39","-","AKQF01","11","1663","1488/163690","6/28/2012","3/23/2017","Contig","2012-06-28T00:00:00Z","Institute for Genome Sciences","Illumina;454","26.75x","Celera Assembler v. 6.1","","","11","1708533","United States","Human, Homo sapiens"
"Helicobacter pylori Hp H-6","163677","992061","992061.3","","GCF_000274105","N/A","","ftp://ftp.ncbi.nlm.nih.gov/genomes/all/GCF/000/274/105/GCF_000274105.1_ASM27410v1","ftp://ftp.ncbi.nlm.nih.gov/genomes/all/GCA/000/274/105/GCA_000274105.1_ASM27410v1","SAMN00778894","PRJNA64149","GCA_000274105.1","1.70799","39","-","AKOZ01","10","1642","1455/163677","6/28/2012","2/12/2019","Contig","2012-06-28T00:00:00Z","Institute for Genome Sciences","Illumina;454","26.35x","Celera Assembler v. 6.1","","","10","1707985","United States","Human, Homo sapiens"
"Helicobacter pylori Hp P-1","163711","992072","992072.3","","GCF_000274785","N/A","","ftp://ftp.ncbi.nlm.nih.gov/genomes/all/GCF/000/274/785/GCF_000274785.1_ASM27478v1","ftp://ftp.ncbi.nlm.nih.gov/genomes/all/GCA/000/274/785/GCA_000274785.1_ASM27478v1","SAMN00778885","PRJNA64171","GCA_000274785.1","1.66964","39.1","-","AKPI01","6","1634","1489/163711","6/28/2012","3/23/2017","Contig","2012-06-28T00:00:00Z","Institute for Genome Sciences","Illumina;454","63.40x","Celera Assembler v. 6.1","","","6","1669637","United States","Human, Homo sapiens"
"Helicobacter pylori Hp P-13","163683","992079","992079.3","","HPYL992079","N/A","","ftp://ftp.ncbi.nlm.nih.gov/genomes/all/GCF/000/274/225/GCF_000274225.1_ASM27422v1","ftp://ftp.ncbi.nlm.nih.gov/genomes/all/GCA/000/274/225/GCA_000274225.1_ASM27422v1","SAMN00778884","PRJNA64185","GCA_000274225.1","1.71441","39","-","AKPO01","10","1692","1418/163683","6/28/2012","4/2/2019","Contig","2012-06-28T00:00:00Z","Institute for Genome Sciences","Illumina;454","27.75x","Celera Assembler v. 6.1","","","10","1714414","United States","Human, Homo sapiens"
"Helicobacter pylori Hp P-13b","163692","992107","992107.3","","GCF_000274405","N/A","","ftp://ftp.ncbi.nlm.nih.gov/genomes/all/GCF/000/274/405/GCF_000274405.1_ASM27440v1","ftp://ftp.ncbi.nlm.nih.gov/genomes/all/GCA/000/274/405/GCA_000274405.1_ASM27440v1","SAMN00778900","PRJNA64241","GCA_000274405.1","1.71153","39","-","AKQI01","8","1679","1517/163692","6/28/2012","11/23/2017","Contig","2012-06-28T00:00:00Z","Institute for Genome Sciences","Illumina;454","60.55x","Celera Assembler v. 6.1","","","8","1711532","United States","Human, Homo sapiens"
"Helicobacter pylori Hp P-15","163686","992080","992080.3","","GCF_000274285","N/A","","ftp://ftp.ncbi.nlm.nih.gov/genomes/all/GCF/000/274/285/GCF_000274285.1_ASM27428v1","ftp://ftp.ncbi.nlm.nih.gov/genomes/all/GCA/000/274/285/GCA_000274285.1_ASM27428v1","SAMN00778875","PRJNA64187","GCA_000274285.1","1.65282","38.9","-","AKPP01","4","1636","1481/163686","6/28/2012","3/23/2017","Contig","2012-06-28T00:00:00Z","Institute for Genome Sciences","Illumina;454","73.62x","Celera Assembler v. 6.1","","","4","1652821","United States","Human, Homo sapiens"
"Helicobacter pylori Hp P-16","163687","992081","992081.3","","GCF_000274305","N/A","","ftp://ftp.ncbi.nlm.nih.gov/genomes/all/GCF/000/274/305/GCF_000274305.1_ASM27430v1","ftp://ftp.ncbi.nlm.nih.gov/genomes/all/GCA/000/274/305/GCA_000274305.1_ASM27430v1","SAMN00778876","PRJNA64189","GCA_000274305.1","1.54913","39.1","-","AKPQ01","5","1534","1392/163687","6/28/2012","3/23/2017","Contig","2012-06-28T00:00:00Z","Institute for Genome Sciences","Illumina;454","71.01x","Celera Assembler v. 6.1","","","5","1549132","United States","Human, Homo sapiens"
"Helicobacter pylori Hp P-2","163712","992073","992073.3","","","N/A","","ftp://ftp.ncbi.nlm.nih.gov/genomes/all/GCF/000/274/805/GCF_000274805.1_ASM27480v1","ftp://ftp.ncbi.nlm.nih.gov/genomes/all/GCA/000/274/805/GCA_000274805.1_ASM27480v1","SAMN00778901","PRJNA64173","GCA_000274805.1","1.69387","39","-","AKPJ01","6","1651","1503/163712","6/28/2012","11/23/2017","Contig","2012-06-28T00:00:00Z","Institute for Genome Sciences","Illumina;454","74.91x","Celera Assembler v. 6.1","","","6","1693870","United States","Human, Homo sapiens"
"Helicobacter pylori Hp P-23","163688","992083","992083.3","","GCF_000274325","N/A","","ftp://ftp.ncbi.nlm.nih.gov/genomes/all/GCF/000/274/325/GCF_000274325.1_ASM27432v1","ftp://ftp.ncbi.nlm.nih.gov/genomes/all/GCA/000/274/325/GCA_000274325.1_ASM27432v1","SAMN00778896","PRJNA64193","GCA_000274325.1","1.64352","38.8","-","AKPR01","3","1647","1470/163688","6/28/2012","3/23/2017","Contig","2012-06-28T00:00:00Z","Institute for Genome Sciences","Illumina;454","51.97x","Celera Assembler v. 6.1","","","3","1643525","United States","Human, Homo sapiens"
"Helicobacter pylori Hp P-25","163715","992084","992084.3","","HPYL992084","N/A","","ftp://ftp.ncbi.nlm.nih.gov/genomes/all/GCF/000/274/865/GCF_000274865.1_ASM27486v1","ftp://ftp.ncbi.nlm.nih.gov/genomes/all/GCA/000/274/865/GCA_000274865.1_ASM27486v1","SAMN00778879","PRJNA64195","GCA_000274865.1","1.66746","39.2","-","AKPS01","3","1652","1344/163715","6/28/2012","10/8/2019","Contig","2012-06-28T00:00:00Z","Institute for Genome Sciences","Illumina;454","24.73x","Celera Assembler v. 6.1","","","3","1667461","United States","Human, Homo sapiens"
"Helicobacter pylori Hp P-25c","163695","992111","992111.3","","GCF_000274465","N/A","","ftp://ftp.ncbi.nlm.nih.gov/genomes/all/GCF/000/274/465/GCF_000274465.1_ASM27446v1","ftp://ftp.ncbi.nlm.nih.gov/genomes/all/GCA/000/274/465/GCA_000274465.1_ASM27446v1","SAMN00778886","PRJNA64249","GCA_000274465.1","1.66911","39.2","-","AKQK01","6","1654","1496/163695","6/28/2012","3/23/2017","Contig","2012-06-28T00:00:00Z","Institute for Genome Sciences","Illumina;454","61.85x","Celera Assembler v. 6.1","","","6","1669110","United States","Human, Homo sapiens"
"Helicobacter pylori Hp P-26","163741","992085","992085.3","","GCF_000275385","N/A","","ftp://ftp.ncbi.nlm.nih.gov/genomes/all/GCF/000/275/385/GCF_000275385.1_ASM27538v1","ftp://ftp.ncbi.nlm.nih.gov/genomes/all/GCA/000/275/385/GCA_000275385.1_ASM27538v1","SAMN00778890","PRJNA64197","GCA_000275385.1","1.6972","39","-","AKPT01","9","1658","1493/163741","6/28/2012","3/23/2017","Contig","2012-06-28T00:00:00Z","Institute for Genome Sciences","Illumina;454","51.25x","Celera Assembler v. 6.1","","","9","1697203","United States","Human, Homo sapiens"
"Helicobacter pylori Hp P-4d","163709","992103","992103.3","","GCF_000274745","N/A","","ftp://ftp.ncbi.nlm.nih.gov/genomes/all/GCF/000/274/745/GCF_000274745.1_ASM27474v1","ftp://ftp.ncbi.nlm.nih.gov/genomes/all/GCA/000/274/745/GCA_000274745.1_ASM27474v1","SAMN00778892","PRJNA64233","GCA_000274745.1","1.6829","39.1","-","AKQE01","9","1650","1502/163709","6/28/2012","3/23/2017","Contig","2012-06-28T00:00:00Z","Institute for Genome Sciences","Illumina;454","53.86x","Celera Assembler v. 6.1","","","9","1682896","United States","Human, Homo sapiens"
"Helicobacter pylori Hp P-74","163689","992091","992091.3","","GCF_000274345","N/A","","ftp://ftp.ncbi.nlm.nih.gov/genomes/all/GCF/000/274/345/GCF_000274345.1_ASM27434v1","ftp://ftp.ncbi.nlm.nih.gov/genomes/all/GCA/000/274/345/GCA_000274345.1_ASM27434v1","SAMN00778888","PRJNA64209","GCA_000274345.1","1.62238","39","-","AKPX01","2","1600","1460/163689","6/28/2012","3/23/2017","Contig","2012-06-28T00:00:00Z","Institute for Genome Sciences","Illumina;454","45.55x","Celera Assembler v. 6.1","","","2","1622385","United States","Human, Homo sapiens"
"Helicobacter pylori Hp P-8","163684","992077","992077.3","","GCF_000274245","N/A","","ftp://ftp.ncbi.nlm.nih.gov/genomes/all/GCF/000/274/245/GCF_000274245.1_ASM27424v1","ftp://ftp.ncbi.nlm.nih.gov/genomes/all/GCA/000/274/245/GCA_000274245.1_ASM27424v1","SAMN00778889","PRJNA64181","GCA_000274245.1","1.61563","39.2","-","AKPM01","7","1592","1435/163684","6/28/2012","11/23/2017","Contig","2012-06-28T00:00:00Z","Institute for Genome Sciences","Illumina;454","63.91x","Celera Assembler v. 6.1","","","7","1615626","United States","Human, Homo sapiens"
"Helicobacter pylori HP_PWs","318717","210","210.2678","","","N/A","","ftp://ftp.ncbi.nlm.nih.gov/genomes/all/GCF/002/154/535/GCF_002154535.1_ASM215453v1","ftp://ftp.ncbi.nlm.nih.gov/genomes/all/GCA/002/154/535/GCA_002154535.1_ASM215453v1","SAMN06276721","PRJNA362473","GCA_002154535.1","1.6276","39.3","-","MUHJ01","101","1618","1458/318717","5/22/2017","7/30/2019","Contig","2017-05-22T00:00:00Z","MedBiotech laboratory, faculty of medicine and pharmacy, rabat/ Mohamed V university rabat","Illumina MiSeq","580.0x","SPAdes v. 3.9.1","","","101","1627601","Morocco","Human, Homo sapiens"
"Helicobacter pylori HP00152","410915","210","210.5129","","","N/A","","ftp://ftp.ncbi.nlm.nih.gov/genomes/all/GCF/003/638/625/GCF_003638625.1_ASM363862v1","ftp://ftp.ncbi.nlm.nih.gov/genomes/all/GCA/003/638/625/GCA_003638625.1_ASM363862v1","SAMN06329445","PRJNA374603","GCA_003638625.1","1.66943","38.9","-","MVYS01","78","1698","1502/410915","10/12/2018","10/18/2018","Contig","2018-10-12T00:00:00Z","University of Western Australia","Illumina MiSeq","113x","SPAdes v. 3.8.2","","","78","1669430","Australia","Human, Homo sapiens"
"Helicobacter pylori HP00192","410882","210","210.5096","","","N/A","","ftp://ftp.ncbi.nlm.nih.gov/genomes/all/GCF/003/637/965/GCF_003637965.1_ASM363796v1","ftp://ftp.ncbi.nlm.nih.gov/genomes/all/GCA/003/637/965/GCA_003637965.1_ASM363796v1","SAMN06329446","PRJNA374603","GCA_003637965.1","1.62546","39","-","MVYR01","49","1627","1459/410882","10/12/2018","10/18/2018","Contig","2018-10-12T00:00:00Z","University of Western Australia","Illumina MiSeq","82x","SPAdes v. 3.8.2","","","49","1625458","Australia","Human, Homo sapiens"
"Helicobacter pylori HP00248","410898","210","210.5113","","","N/A","","ftp://ftp.ncbi.nlm.nih.gov/genomes/all/GCF/003/638/285/GCF_003638285.1_ASM363828v1","ftp://ftp.ncbi.nlm.nih.gov/genomes/all/GCA/003/638/285/GCA_003638285.1_ASM363828v1","SAMN06329447","PRJNA374603","GCA_003638285.1","1.68346","38.7","-","MVYQ01","36","1673","1521/410898","10/12/2018","10/18/2018","Contig","2018-10-12T00:00:00Z","University of Western Australia","Illumina MiSeq","103x","SPAdes v. 3.8.2","","","36","1683463","Australia","Human, Homo sapiens"
"Helicobacter pylori HP00260","410900","210","210.5114","","","N/A","","ftp://ftp.ncbi.nlm.nih.gov/genomes/all/GCF/003/638/305/GCF_003638305.1_ASM363830v1","ftp://ftp.ncbi.nlm.nih.gov/genomes/all/GCA/003/638/305/GCA_003638305.1_ASM363830v1","SAMN06329448","PRJNA374603","GCA_003638305.1","1.5972","39","-","MVYP01","37","1565","1419/410900","10/12/2018","10/18/2018","Contig","2018-10-12T00:00:00Z","University of Western Australia","Illumina MiSeq","96x","SPAdes v. 3.8.2","","","37","1597197","Australia","Human, Homo sapiens"
"Helicobacter pylori HP01102","410899","210","210.5111","","","N/A","","ftp://ftp.ncbi.nlm.nih.gov/genomes/all/GCF/003/638/295/GCF_003638295.1_ASM363829v1","ftp://ftp.ncbi.nlm.nih.gov/genomes/all/GCA/003/638/295/GCA_003638295.1_ASM363829v1","SAMN06329449","PRJNA374603","GCA_003638295.1","1.63407","39.2","-","MVYO01","33","1598","1445/410899","10/12/2018","10/18/2018","Contig","2018-10-12T00:00:00Z","University of Western Australia","Illumina MiSeq","89x","SPAdes v. 3.8.2","","","33","1634075","Australia","Human, Homo sapiens"
"Helicobacter pylori HP01234","410914","210","210.5128","","","N/A","","ftp://ftp.ncbi.nlm.nih.gov/genomes/all/GCF/003/638/595/GCF_003638595.1_ASM363859v1","ftp://ftp.ncbi.nlm.nih.gov/genomes/all/GCA/003/638/595/GCA_003638595.1_ASM363859v1","SAMN06329452","PRJNA374603","GCA_003638595.1","1.65887","38.7","-","MVYL01","45","1632","1488/410914","10/12/2018","10/18/2018","Contig","2018-10-12T00:00:00Z","University of Western Australia","Illumina MiSeq","128x","SPAdes v. 3.8.2","","","45","1658871","Australia","Human, Homo sapiens"
"Helicobacter pylori HP01306","410913","210","210.5127","","","N/A","","ftp://ftp.ncbi.nlm.nih.gov/genomes/all/GCF/003/638/585/GCF_003638585.1_ASM363858v1","ftp://ftp.ncbi.nlm.nih.gov/genomes/all/GCA/003/638/585/GCA_003638585.1_ASM363858v1","SAMN06329453","PRJNA374603","GCA_003638585.1","1.63895","38.9","-","MVYK01","48","1642","1477/410913","10/12/2018","10/18/2018","Contig","2018-10-12T00:00:00Z","University of Western Australia","Illumina MiSeq","132x","SPAdes v. 3.8.2","","","48","1638947","Australia","Human, Homo sapiens"
"Helicobacter pylori HP01330","410881","210","210.5095","","","N/A","","ftp://ftp.ncbi.nlm.nih.gov/genomes/all/GCF/003/637/935/GCF_003637935.1_ASM363793v1","ftp://ftp.ncbi.nlm.nih.gov/genomes/all/GCA/003/637/935/GCA_003637935.1_ASM363793v1","SAMN06329456","PRJNA374603","GCA_003637935.1","1.68577","38.8","-","MVYH01","44","1690","1518/410881","10/12/2018","10/18/2018","Contig","2018-10-12T00:00:00Z","University of Western Australia","Illumina MiSeq","70x","SPAdes v. 3.8.2","","","44","1685767","Australia","Human, Homo sapiens"
"Helicobacter pylori HP02140","410912","210","210.5126","","","N/A","","ftp://ftp.ncbi.nlm.nih.gov/genomes/all/GCF/003/638/565/GCF_003638565.1_ASM363856v1","ftp://ftp.ncbi.nlm.nih.gov/genomes/all/GCA/003/638/565/GCA_003638565.1_ASM363856v1","SAMN06329457","PRJNA374603","GCA_003638565.1","1.63407","38.9","-","MVYG01","58","1627","1471/410912","10/12/2018","10/18/2018","Contig","2018-10-12T00:00:00Z","University of Western Australia","Illumina MiSeq","91x","SPAdes v. 3.8.2","","","58","1634066","Australia","Human, Homo sapiens"
"Helicobacter pylori HP03054","410897","210","210.5112","","","N/A","","ftp://ftp.ncbi.nlm.nih.gov/genomes/all/GCF/003/638/245/GCF_003638245.1_ASM363824v1","ftp://ftp.ncbi.nlm.nih.gov/genomes/all/GCA/003/638/245/GCA_003638245.1_ASM363824v1","SAMN06329458","PRJNA374603","GCA_003638245.1","1.64955","38.8","-","MVYF01","44","1636","1479/410897","10/12/2018","10/18/2018","Contig","2018-10-12T00:00:00Z","University of Western Australia","Illumina MiSeq","79x","SPAdes v. 3.8.2","","","44","1649552","Australia","Human, Homo sapiens"
"Helicobacter pylori HP03218","410880","210","210.5094","","","N/A","","ftp://ftp.ncbi.nlm.nih.gov/genomes/all/GCF/003/637/925/GCF_003637925.1_ASM363792v1","ftp://ftp.ncbi.nlm.nih.gov/genomes/all/GCA/003/637/925/GCA_003637925.1_ASM363792v1","SAMN06329460","PRJNA374603","GCA_003637925.1","1.64399","38.8","-","MVYD01","34","1623","1469/410880","10/12/2018","10/18/2018","Contig","2018-10-12T00:00:00Z","University of Western Australia","Illumina MiSeq","484x","SPAdes v. 3.8.2","","","34","1643985","Australia","Human, Homo sapiens"
"Helicobacter pylori HP04041","410910","210","210.5124","","","N/A","","ftp://ftp.ncbi.nlm.nih.gov/genomes/all/GCF/003/638/525/GCF_003638525.1_ASM363852v1","ftp://ftp.ncbi.nlm.nih.gov/genomes/all/GCA/003/638/525/GCA_003638525.1_ASM363852v1","SAMN06329461","PRJNA374603","GCA_003638525.1","1.67473","38.7","-","MVYC01","39","1666","1506/410910","10/12/2018","10/18/2018","Contig","2018-10-12T00:00:00Z","University of Western Australia","Illumina MiSeq","101x","SPAdes v. 3.8.2","","","39","1674734","Australia","Human, Homo sapiens"
"Helicobacter pylori HP04042","410896","210","210.5110","","","N/A","","ftp://ftp.ncbi.nlm.nih.gov/genomes/all/GCF/003/638/235/GCF_003638235.1_ASM363823v1","ftp://ftp.ncbi.nlm.nih.gov/genomes/all/GCA/003/638/235/GCA_003638235.1_ASM363823v1","SAMN06329462","PRJNA374603","GCA_003638235.1","1.60101","39.1","-","MVYB01","27","1577","1436/410896","10/12/2018","10/18/2018","Contig","2018-10-12T00:00:00Z","University of Western Australia","Illumina MiSeq","116x","SPAdes v. 3.8.2","","","27","1601009","Australia","Human, Homo sapiens"
"Helicobacter pylori HP04057","410895","210","210.5109","","","N/A","","ftp://ftp.ncbi.nlm.nih.gov/genomes/all/GCF/003/638/225/GCF_003638225.1_ASM363822v1","ftp://ftp.ncbi.nlm.nih.gov/genomes/all/GCA/003/638/225/GCA_003638225.1_ASM363822v1","SAMN06329463","PRJNA374603","GCA_003638225.1","1.58214","39","-","MVYA01","34","1563","1423/410895","10/12/2018","10/18/2018","Contig","2018-10-12T00:00:00Z","University of Western Australia","Illumina MiSeq","485x","SPAdes v. 3.8.2","","","34","1582137","Australia","Human, Homo sapiens"
"Helicobacter pylori HP04086","410911","210","210.5125","","","N/A","","ftp://ftp.ncbi.nlm.nih.gov/genomes/all/GCF/003/638/535/GCF_003638535.1_ASM363853v1","ftp://ftp.ncbi.nlm.nih.gov/genomes/all/GCA/003/638/535/GCA_003638535.1_ASM363853v1","SAMN06329464","PRJNA374603","GCA_003638535.1","1.62295","38.9","-","MVXZ01","24","1618","1456/410911","10/12/2018","10/18/2018","Contig","2018-10-12T00:00:00Z","University of Western Australia","Illumina MiSeq","91x","SPAdes v. 3.8.2","","","24","1622949","Australia","Human, Homo sapiens"
"Helicobacter pylori HP04087","410894","210","210.5108","","","N/A","","ftp://ftp.ncbi.nlm.nih.gov/genomes/all/GCF/003/638/195/GCF_003638195.1_ASM363819v1","ftp://ftp.ncbi.nlm.nih.gov/genomes/all/GCA/003/638/195/GCA_003638195.1_ASM363819v1","SAMN06329465","PRJNA374603","GCA_003638195.1","1.62595","38.9","-","MVXY01","39","1608","1456/410894","10/12/2018","10/18/2018","Contig","2018-10-12T00:00:00Z","University of Western Australia","Illumina MiSeq","44x","SPAdes v. 3.8.2","","","39","1625952","Australia","Human, Homo sapiens"
"Helicobacter pylori HP05044","410909","210","210.5122","","","N/A","","ftp://ftp.ncbi.nlm.nih.gov/genomes/all/GCF/003/638/485/GCF_003638485.1_ASM363848v1","ftp://ftp.ncbi.nlm.nih.gov/genomes/all/GCA/003/638/485/GCA_003638485.1_ASM363848v1","SAMN06329466","PRJNA374603","GCA_003638485.1","1.63265","38.8","-","MVXX01","43","1617","1472/410909","10/12/2018","10/18/2018","Contig","2018-10-12T00:00:00Z","University of Western Australia","Illumina MiSeq","514x","SPAdes v. 3.8.2","","","43","1632655","Australia","Human, Homo sapiens"
"Helicobacter pylori HP06038","410907","210","210.5121","","","N/A","","ftp://ftp.ncbi.nlm.nih.gov/genomes/all/GCF/003/638/465/GCF_003638465.1_ASM363846v1","ftp://ftp.ncbi.nlm.nih.gov/genomes/all/GCA/003/638/465/GCA_003638465.1_ASM363846v1","SAMN06329467","PRJNA374603","GCA_003638465.1","1.63877","38.8","-","MVXW01","36","1646","1466/410907","10/12/2018","10/18/2018","Contig","2018-10-12T00:00:00Z","University of Western Australia","Illumina MiSeq","276x","SPAdes v. 3.8.2","","","36","1638771","Australia","Human, Homo sapiens"
"Helicobacter pylori HP06045","410893","210","210.5107","","","N/A","","ftp://ftp.ncbi.nlm.nih.gov/genomes/all/GCF/003/638/175/GCF_003638175.1_ASM363817v1","ftp://ftp.ncbi.nlm.nih.gov/genomes/all/GCA/003/638/175/GCA_003638175.1_ASM363817v1","SAMN06329468","PRJNA374603","GCA_003638175.1","1.64592","39.1","-","MVXV01","29","1626","1476/410893","10/12/2018","10/18/2018","Contig","2018-10-12T00:00:00Z","University of Western Australia","Illumina MiSeq","388x","SPAdes v. 3.8.2","","","29","1645923","Australia","Human, Homo sapiens"
"Helicobacter pylori HP06058","410892","210","210.5105","","","N/A","","ftp://ftp.ncbi.nlm.nih.gov/genomes/all/GCF/003/638/165/GCF_003638165.1_ASM363816v1","ftp://ftp.ncbi.nlm.nih.gov/genomes/all/GCA/003/638/165/GCA_003638165.1_ASM363816v1","SAMN06329469","PRJNA374603","GCA_003638165.1","1.64704","38.8","-","MVXU01","46","1636","1482/410892","10/12/2018","10/18/2018","Contig","2018-10-12T00:00:00Z","University of Western Australia","Illumina MiSeq","208x","SPAdes v. 3.8.2","","","46","1647037","Australia","Human, Homo sapiens"
"Helicobacter pylori HP06059","410879","210","210.5093","","","N/A","","ftp://ftp.ncbi.nlm.nih.gov/genomes/all/GCF/003/637/885/GCF_003637885.1_ASM363788v1","ftp://ftp.ncbi.nlm.nih.gov/genomes/all/GCA/003/637/885/GCA_003637885.1_ASM363788v1","SAMN06329470","PRJNA374603","GCA_003637885.1","1.66662","39","-","MVXT01","35","1639","1492/410879","10/12/2018","10/18/2018","Contig","2018-10-12T00:00:00Z","University of Western Australia","Illumina MiSeq","229x","SPAdes v. 3.8.2","","","35","1666618","Australia","Human, Homo sapiens"
"Helicobacter pylori HP07019","410908","210","210.5123","","","N/A","","ftp://ftp.ncbi.nlm.nih.gov/genomes/all/GCF/003/638/475/GCF_003638475.1_ASM363847v1","ftp://ftp.ncbi.nlm.nih.gov/genomes/all/GCA/003/638/475/GCA_003638475.1_ASM363847v1","SAMN06329471","PRJNA374603","GCA_003638475.1","1.58498","38.9","-","MVXS01","27","1561","1421/410908","10/12/2018","10/18/2018","Contig","2018-10-12T00:00:00Z","University of Western Australia","Illumina MiSeq","170x","SPAdes v. 3.8.2","","","27","1584978","Australia","Human, Homo sapiens"
"Helicobacter pylori HP07036","410878","210","210.5092","","","N/A","","ftp://ftp.ncbi.nlm.nih.gov/genomes/all/GCF/003/637/875/GCF_003637875.1_ASM363787v1","ftp://ftp.ncbi.nlm.nih.gov/genomes/all/GCA/003/637/875/GCA_003637875.1_ASM363787v1","SAMN06329472","PRJNA374603","GCA_003637875.1","1.6397","38.8","-","MVXR01","34","1637","1466/410878","10/12/2018","10/18/2018","Contig","2018-10-12T00:00:00Z","University of Western Australia","Illumina MiSeq","192x","SPAdes v. 3.8.2","","","34","1639698","Australia","Human, Homo sapiens"
"Helicobacter pylori HP08031","410877","210","210.5091","","","N/A","","ftp://ftp.ncbi.nlm.nih.gov/genomes/all/GCF/003/637/865/GCF_003637865.1_ASM363786v1","ftp://ftp.ncbi.nlm.nih.gov/genomes/all/GCA/003/637/865/GCA_003637865.1_ASM363786v1","SAMN06329473","PRJNA374603","GCA_003637865.1","1.63036","39.1","-","MVXQ01","44","1616","1459/410877","10/12/2018","10/18/2018","Contig","2018-10-12T00:00:00Z","University of Western Australia","Illumina MiSeq","491x","SPAdes v. 3.8.2","","","44","1630358","Australia","Human, Homo sapiens"
"Helicobacter pylori HP08058","410876","210","210.5090","","","N/A","","ftp://ftp.ncbi.nlm.nih.gov/genomes/all/GCF/003/637/835/GCF_003637835.1_ASM363783v1","ftp://ftp.ncbi.nlm.nih.gov/genomes/all/GCA/003/637/835/GCA_003637835.1_ASM363783v1","SAMN06329474","PRJNA374603","GCA_003637835.1","1.54723","39.1","-","MVXP01","28","1530","1402/410876","10/12/2018","10/18/2018","Contig","2018-10-12T00:00:00Z","University of Western Australia","Illumina MiSeq","239x","SPAdes v. 3.8.2","","","28","1547231","Australia","Human, Homo sapiens"
"Helicobacter pylori HP08061","410891","210","210.5106","","","N/A","","ftp://ftp.ncbi.nlm.nih.gov/genomes/all/GCF/003/638/135/GCF_003638135.1_ASM363813v1","ftp://ftp.ncbi.nlm.nih.gov/genomes/all/GCA/003/638/135/GCA_003638135.1_ASM363813v1","SAMN06329475","PRJNA374603","GCA_003638135.1","1.64684","38.7","-","MVXO01","43","1634","1473/410891","10/12/2018","10/18/2018","Contig","2018-10-12T00:00:00Z","University of Western Australia","Illumina MiSeq","273x","SPAdes v. 3.8.2","","","43","1646844","Australia","Human, Homo sapiens"
"Helicobacter pylori HP08072","410875","210","210.5089","","","N/A","","ftp://ftp.ncbi.nlm.nih.gov/genomes/all/GCF/003/637/825/GCF_003637825.1_ASM363782v1","ftp://ftp.ncbi.nlm.nih.gov/genomes/all/GCA/003/637/825/GCA_003637825.1_ASM363782v1","SAMN06329476","PRJNA374603","GCA_003637825.1","1.62999","39.2","-","MVXN01","30","1609","1456/410875","10/12/2018","10/18/2018","Contig","2018-10-12T00:00:00Z","University of Western Australia","Illumina MiSeq","491x","SPAdes v. 3.8.2","","","30","1629992","Australia","Human, Homo sapiens"
"Helicobacter pylori HP08073","410874","210","210.5088","","","N/A","","ftp://ftp.ncbi.nlm.nih.gov/genomes/all/GCF/003/637/805/GCF_003637805.1_ASM363780v1","ftp://ftp.ncbi.nlm.nih.gov/genomes/all/GCA/003/637/805/GCA_003637805.1_ASM363780v1","SAMN06329477","PRJNA374603","GCA_003637805.1","1.61431","39","-","MVXM01","35","1599","1457/410874","10/12/2018","10/18/2018","Contig","2018-10-12T00:00:00Z","University of Western Australia","Illumina MiSeq","360x","SPAdes v. 3.8.2","","","35","1614312","Australia","Human, Homo sapiens"
"Helicobacter pylori HP08074","410873","210","210.5087","","","N/A","","ftp://ftp.ncbi.nlm.nih.gov/genomes/all/GCF/003/637/775/GCF_003637775.1_ASM363777v1","ftp://ftp.ncbi.nlm.nih.gov/genomes/all/GCA/003/637/775/GCA_003637775.1_ASM363777v1","SAMN06329478","PRJNA374603","GCA_003637775.1","1.56911","39.1","-","MVXL01","29","1553","1403/410873","10/12/2018","10/18/2018","Contig","2018-10-12T00:00:00Z","University of Western Australia","Illumina MiSeq","247x","SPAdes v. 3.8.2","","","29","1569108","Australia","Human, Homo sapiens"
"Helicobacter pylori HP09046","410872","210","210.5085","","","N/A","","ftp://ftp.ncbi.nlm.nih.gov/genomes/all/GCF/003/637/755/GCF_003637755.1_ASM363775v1","ftp://ftp.ncbi.nlm.nih.gov/genomes/all/GCA/003/637/755/GCA_003637755.1_ASM363775v1","SAMN06329479","PRJNA374603","GCA_003637755.1","1.62674","39.1","-","MVXK01","47","1612","1451/410872","10/12/2018","10/22/2018","Contig","2018-10-12T00:00:00Z","University of Western Australia","Illumina MiSeq","159x","SPAdes v. 3.8.2","","","47","1626738","Australia","Human, Homo sapiens"
"Helicobacter pylori HP11004","410906","210","210.5120","","","N/A","","ftp://ftp.ncbi.nlm.nih.gov/genomes/all/GCF/003/638/425/GCF_003638425.1_ASM363842v1","ftp://ftp.ncbi.nlm.nih.gov/genomes/all/GCA/003/638/425/GCA_003638425.1_ASM363842v1","SAMN06329480","PRJNA374603","GCA_003638425.1","1.5759","39","-","MVXJ01","32","1555","1412/410906","10/12/2018","10/18/2018","Contig","2018-10-12T00:00:00Z","University of Western Australia","Illumina MiSeq","118x","SPAdes v. 3.8.2","","","32","1575902","Australia","Human, Homo sapiens"
"Helicobacter pylori HP11005","410871","210","210.5086","","","N/A","","ftp://ftp.ncbi.nlm.nih.gov/genomes/all/GCF/003/637/745/GCF_003637745.1_ASM363774v1","ftp://ftp.ncbi.nlm.nih.gov/genomes/all/GCA/003/637/745/GCA_003637745.1_ASM363774v1","SAMN06329481","PRJNA374603","GCA_003637745.1","1.57538","39","-","MVXI01","34","1579","1425/410871","10/12/2018","10/18/2018","Contig","2018-10-12T00:00:00Z","University of Western Australia","Illumina MiSeq","114x","SPAdes v. 3.8.2","","","34","1575376","Australia","Human, Homo sapiens"
"Helicobacter pylori HP11011","410870","210","210.5084","","","N/A","","ftp://ftp.ncbi.nlm.nih.gov/genomes/all/GCF/003/637/715/GCF_003637715.1_ASM363771v1","ftp://ftp.ncbi.nlm.nih.gov/genomes/all/GCA/003/637/715/GCA_003637715.1_ASM363771v1","SAMN06329482","PRJNA374603","GCA_003637715.1","1.65091","38.8","-","MVXH01","42","1627","1467/410870","10/12/2018","10/18/2018","Contig","2018-10-12T00:00:00Z","University of Western Australia","Illumina MiSeq","82x","SPAdes v. 3.8.2","","","42","1650911","Australia","Human, Homo sapiens"
"Helicobacter pylori HP11013","410905","210","210.5119","","","N/A","","ftp://ftp.ncbi.nlm.nih.gov/genomes/all/GCF/003/638/415/GCF_003638415.1_ASM363841v1","ftp://ftp.ncbi.nlm.nih.gov/genomes/all/GCA/003/638/415/GCA_003638415.1_ASM363841v1","SAMN06329483","PRJNA374603","GCA_003638415.1","1.619","38.9","-","MVXG01","35","1608","1454/410905","10/12/2018","10/18/2018","Contig","2018-10-12T00:00:00Z","University of Western Australia","Illumina MiSeq","111x","SPAdes v. 3.8.2","","","35","1619004","Australia","Human, Homo sapiens"
"Helicobacter pylori HP11020","410890","210","210.5104","","","N/A","","ftp://ftp.ncbi.nlm.nih.gov/genomes/all/GCF/003/638/115/GCF_003638115.1_ASM363811v1","ftp://ftp.ncbi.nlm.nih.gov/genomes/all/GCA/003/638/115/GCA_003638115.1_ASM363811v1","SAMN06329484","PRJNA374603","GCA_003638115.1","1.61552","38.9","-","MVXF01","44","1613","1454/410890","10/12/2018","10/18/2018","Contig","2018-10-12T00:00:00Z","University of Western Australia","Illumina MiSeq","145x","SPAdes v. 3.8.2","","","44","1615516","Australia","Human, Homo sapiens"
"Helicobacter pylori HP11032","410889","210","210.5103","","","N/A","","ftp://ftp.ncbi.nlm.nih.gov/genomes/all/GCF/003/638/105/GCF_003638105.1_ASM363810v1","ftp://ftp.ncbi.nlm.nih.gov/genomes/all/GCA/003/638/105/GCA_003638105.1_ASM363810v1","SAMN06329485","PRJNA374603","GCA_003638105.1","1.6235","38.9","-","MVXE01","36","1635","1484/410889","10/12/2018","10/18/2018","Contig","2018-10-12T00:00:00Z","University of Western Australia","Illumina MiSeq","97x","SPAdes v. 3.8.2","","","36","1623497","Australia","Human, Homo sapiens"
"Helicobacter pylori HP11037","410869","210","210.5083","","","N/A","","ftp://ftp.ncbi.nlm.nih.gov/genomes/all/GCF/003/637/695/GCF_003637695.1_ASM363769v1","ftp://ftp.ncbi.nlm.nih.gov/genomes/all/GCA/003/637/695/GCA_003637695.1_ASM363769v1","SAMN06329486","PRJNA374603","GCA_003637695.1","1.65324","38.7","-","MVXD01","31","1621","1470/410869","10/12/2018","10/18/2018","Contig","2018-10-12T00:00:00Z","University of Western Australia","Illumina MiSeq","76x","SPAdes v. 3.8.2","","","31","1653242","Australia","Human, Homo sapiens"
"Helicobacter pylori HP11042","410888","210","210.5102","","","N/A","","ftp://ftp.ncbi.nlm.nih.gov/genomes/all/GCF/003/638/085/GCF_003638085.1_ASM363808v1","ftp://ftp.ncbi.nlm.nih.gov/genomes/all/GCA/003/638/085/GCA_003638085.1_ASM363808v1","SAMN06329487","PRJNA374603","GCA_003638085.1","1.64347","38.8","-","MVXC01","29","1629","1457/410888","10/12/2018","10/18/2018","Contig","2018-10-12T00:00:00Z","University of Western Australia","Illumina MiSeq","185x","SPAdes v. 3.8.2","","","29","1643471","Australia","Human, Homo sapiens"
"Helicobacter pylori HP11043","410887","210","210.5101","","","N/A","","ftp://ftp.ncbi.nlm.nih.gov/genomes/all/GCF/003/638/055/GCF_003638055.1_ASM363805v1","ftp://ftp.ncbi.nlm.nih.gov/genomes/all/GCA/003/638/055/GCA_003638055.1_ASM363805v1","SAMN06329488","PRJNA374603","GCA_003638055.1","1.63325","38.9","-","MVXB01","38","1625","1476/410887","10/12/2018","10/18/2018","Contig","2018-10-12T00:00:00Z","University of Western Australia","Illumina MiSeq","129x","SPAdes v. 3.8.2","","","38","1633250","Australia","Human, Homo sapiens"
"Helicobacter pylori HP11049","410886","210","210.5100","","","N/A","","ftp://ftp.ncbi.nlm.nih.gov/genomes/all/GCF/003/638/045/GCF_003638045.1_ASM363804v1","ftp://ftp.ncbi.nlm.nih.gov/genomes/all/GCA/003/638/045/GCA_003638045.1_ASM363804v1","SAMN06329489","PRJNA374603","GCA_003638045.1","1.55256","39.1","-","MVXA01","50","1531","1399/410886","10/12/2018","10/18/2018","Contig","2018-10-12T00:00:00Z","University of Western Australia","Illumina MiSeq","103x","SPAdes v. 3.8.2","","","50","1552557","Australia","Human, Homo sapiens"
"Helicobacter pylori HP11054","410904","210","210.5117","","","N/A","","ftp://ftp.ncbi.nlm.nih.gov/genomes/all/GCF/003/638/405/GCF_003638405.1_ASM363840v1","ftp://ftp.ncbi.nlm.nih.gov/genomes/all/GCA/003/638/405/GCA_003638405.1_ASM363840v1","SAMN06329490","PRJNA374603","GCA_003638405.1","1.58466","39","-","MVWZ01","30","1572","1428/410904","10/12/2018","10/18/2018","Contig","2018-10-12T00:00:00Z","University of Western Australia","Illumina MiSeq","116x","SPAdes v. 3.8.2","","","30","1584658","Australia","Human, Homo sapiens"
"Helicobacter pylori HP11055","410885","210","210.5099","","","N/A","","ftp://ftp.ncbi.nlm.nih.gov/genomes/all/GCF/003/638/025/GCF_003638025.1_ASM363802v1","ftp://ftp.ncbi.nlm.nih.gov/genomes/all/GCA/003/638/025/GCA_003638025.1_ASM363802v1","SAMN06329491","PRJNA374603","GCA_003638025.1","1.58724","38.9","-","MVWY01","29","1577","1438/410885","10/12/2018","10/18/2018","Contig","2018-10-12T00:00:00Z","University of Western Australia","Illumina MiSeq","659x","SPAdes v. 3.8.2","","","29","1587241","Australia","Human, Homo sapiens"
"Helicobacter pylori HP11059","410884","210","210.5098","","","N/A","","ftp://ftp.ncbi.nlm.nih.gov/genomes/all/GCF/003/637/995/GCF_003637995.1_ASM363799v1","ftp://ftp.ncbi.nlm.nih.gov/genomes/all/GCA/003/637/995/GCA_003637995.1_ASM363799v1","SAMN06329492","PRJNA374603","GCA_003637995.1","1.63892","38.7","-","MVWX01","38","1623","1485/410884","10/12/2018","10/18/2018","Contig","2018-10-12T00:00:00Z","University of Western Australia","Illumina MiSeq","70x","SPAdes v. 3.8.2","","","38","1638916","Australia","Human, Homo sapiens"
"Helicobacter pylori HP12002","410868","210","210.5082","","","N/A","","ftp://ftp.ncbi.nlm.nih.gov/genomes/all/GCF/003/637/685/GCF_003637685.1_ASM363768v1","ftp://ftp.ncbi.nlm.nih.gov/genomes/all/GCA/003/637/685/GCA_003637685.1_ASM363768v1","SAMN06329493","PRJNA374603","GCA_003637685.1","1.58045","39","-","MVWW01","21","1557","1426/410868","10/12/2018","10/18/2018","Contig","2018-10-12T00:00:00Z","University of Western Australia","Illumina MiSeq","214x","SPAdes v. 3.8.2","","","21","1580451","Australia","Human, Homo sapiens"
"Helicobacter pylori HP12014","410903","210","210.5118","","","N/A","","ftp://ftp.ncbi.nlm.nih.gov/genomes/all/GCF/003/638/375/GCF_003638375.1_ASM363837v1","ftp://ftp.ncbi.nlm.nih.gov/genomes/all/GCA/003/638/375/GCA_003638375.1_ASM363837v1","SAMN06329494","PRJNA374603","GCA_003638375.1","1.5648","39.1","-","MVWV01","31","1562","1426/410903","10/12/2018","10/18/2018","Contig","2018-10-12T00:00:00Z","University of Western Australia","Illumina MiSeq","96x","SPAdes v. 3.8.2","","","31","1564796","Australia","Human, Homo sapiens"
"Helicobacter pylori HP12019","410902","210","210.5116","","","N/A","","ftp://ftp.ncbi.nlm.nih.gov/genomes/all/GCF/003/638/355/GCF_003638355.1_ASM363835v1","ftp://ftp.ncbi.nlm.nih.gov/genomes/all/GCA/003/638/355/GCA_003638355.1_ASM363835v1","SAMN06329495","PRJNA374603","GCA_003638355.1","1.61873","39","-","MVWU01","34","1614","1446/410902","10/12/2018","10/18/2018","Contig","2018-10-12T00:00:00Z","University of Western Australia","Illumina MiSeq","116x","SPAdes v. 3.8.2","","","34","1618733","Australia","Human, Homo sapiens"
"Helicobacter pylori HP12020","410901","210","210.5115","","","N/A","","ftp://ftp.ncbi.nlm.nih.gov/genomes/all/GCF/003/638/345/GCF_003638345.1_ASM363834v1","ftp://ftp.ncbi.nlm.nih.gov/genomes/all/GCA/003/638/345/GCA_003638345.1_ASM363834v1","SAMN06329496","PRJNA374603","GCA_003638345.1","1.59867","39.3","-","MVWT01","33","1583","1434/410901","10/12/2018","10/18/2018","Contig","2018-10-12T00:00:00Z","University of Western Australia","Illumina MiSeq","172x","SPAdes v. 3.8.2","","","33","1598666","Australia","Human, Homo sapiens"
"Helicobacter pylori HP12036","410883","210","210.5097","","","N/A","","ftp://ftp.ncbi.nlm.nih.gov/genomes/all/GCF/003/637/985/GCF_003637985.1_ASM363798v1","ftp://ftp.ncbi.nlm.nih.gov/genomes/all/GCA/003/637/985/GCA_003637985.1_ASM363798v1","SAMN06329497","PRJNA374603","GCA_003637985.1","1.60378","38.7","-","MVWS01","32","1601","1448/410883","10/12/2018","10/18/2018","Contig","2018-10-12T00:00:00Z","University of Western Australia","Illumina MiSeq","98x","SPAdes v. 3.8.2","","","32","1603777","Australia","Human, Homo sapiens"
"Helicobacter pylori HP12038","410867","210","210.5081","","","N/A","","ftp://ftp.ncbi.nlm.nih.gov/genomes/all/GCF/003/637/665/GCF_003637665.1_ASM363766v1","ftp://ftp.ncbi.nlm.nih.gov/genomes/all/GCA/003/637/665/GCA_003637665.1_ASM363766v1","SAMN06329498","PRJNA374603","GCA_003637665.1","1.65483","38.8","-","MVWR01","32","1631","1476/410867","10/12/2018","10/18/2018","Contig","2018-10-12T00:00:00Z","University of Western Australia","Illumina MiSeq","168x","SPAdes v. 3.8.2","","","32","1654828","Australia","Human, Homo sapiens"
"Helicobacter pylori HP12053","410866","210","210.5080","","","N/A","","ftp://ftp.ncbi.nlm.nih.gov/genomes/all/GCF/003/637/635/GCF_003637635.1_ASM363763v1","ftp://ftp.ncbi.nlm.nih.gov/genomes/all/GCA/003/637/635/GCA_003637635.1_ASM363763v1","SAMN06329499","PRJNA374603","GCA_003637635.1","1.61554","38.9","-","MVWQ01","32","1613","1455/410866","10/12/2018","10/18/2018","Contig","2018-10-12T00:00:00Z","University of Western Australia","Illumina MiSeq","102x","SPAdes v. 3.8.2","","","32","1615541","Australia","Human, Homo sapiens"
"Helicobacter pylori HP12054","410865","210","210.5079","","","N/A","","ftp://ftp.ncbi.nlm.nih.gov/genomes/all/GCF/003/637/625/GCF_003637625.1_ASM363762v1","ftp://ftp.ncbi.nlm.nih.gov/genomes/all/GCA/003/637/625/GCA_003637625.1_ASM363762v1","SAMN06329500","PRJNA374603","GCA_003637625.1","1.58045","38.7","-","MVWP01","32","1545","1401/410865","10/12/2018","10/18/2018","Contig","2018-10-12T00:00:00Z","University of Western Australia","Illumina MiSeq","89x","SPAdes v. 3.8.2","","","32","1580448","Australia","Human, Homo sapiens"
"Helicobacter pylori HP12059","410864","210","210.5078","","","N/A","","ftp://ftp.ncbi.nlm.nih.gov/genomes/all/GCF/003/637/605/GCF_003637605.1_ASM363760v1","ftp://ftp.ncbi.nlm.nih.gov/genomes/all/GCA/003/637/605/GCA_003637605.1_ASM363760v1","SAMN06329501","PRJNA374603","GCA_003637605.1","1.63058","38.9","-","MVWO01","35","1605","1447/410864","10/12/2018","10/18/2018","Contig","2018-10-12T00:00:00Z","University of Western Australia","Illumina MiSeq","111x","SPAdes v. 3.8.2","","","35","1630575","Australia","Human, Homo sapiens"
"Helicobacter pylori HP12060","410862","210","210.5076","","","N/A","","ftp://ftp.ncbi.nlm.nih.gov/genomes/all/GCF/003/637/565/GCF_003637565.1_ASM363756v1","ftp://ftp.ncbi.nlm.nih.gov/genomes/all/GCA/003/637/565/GCA_003637565.1_ASM363756v1","SAMN06329502","PRJNA374603","GCA_003637565.1","1.58052","39.1","-","MVWN01","38","1577","1436/410862","10/12/2018","10/18/2018","Contig","2018-10-12T00:00:00Z","University of Western Australia","Illumina MiSeq","91x","SPAdes v. 3.8.2","","","38","1580522","Australia","Human, Homo sapiens"
"Helicobacter pylori HP12064","410863","210","210.5077","","","N/A","","ftp://ftp.ncbi.nlm.nih.gov/genomes/all/GCF/003/637/575/GCF_003637575.1_ASM363757v1","ftp://ftp.ncbi.nlm.nih.gov/genomes/all/GCA/003/637/575/GCA_003637575.1_ASM363757v1","SAMN06329503","PRJNA374603","GCA_003637575.1","1.57566","38.9","-","MVWM01","26","1580","1429/410863","10/12/2018","10/18/2018","Contig","2018-10-12T00:00:00Z","University of Western Australia","Illumina MiSeq","89x","SPAdes v. 3.8.2","","","26","1575661","Australia","Human, Homo sapiens"
"Helicobacter pylori HP12068","410861","210","210.5075","","","N/A","","ftp://ftp.ncbi.nlm.nih.gov/genomes/all/GCF/003/637/545/GCF_003637545.1_ASM363754v1","ftp://ftp.ncbi.nlm.nih.gov/genomes/all/GCA/003/637/545/GCA_003637545.1_ASM363754v1","SAMN06329504","PRJNA374603","GCA_003637545.1","1.60967","38.9","-","MVWL01","31","1599","1458/410861","10/12/2018","10/18/2018","Contig","2018-10-12T00:00:00Z","University of Western Australia","Illumina MiSeq","157x","SPAdes v. 3.8.2","","","31","1609673","Australia","Human, Homo sapiens"
"Helicobacter pylori HP12069","410860","210","210.5074","","","N/A","","ftp://ftp.ncbi.nlm.nih.gov/genomes/all/GCF/003/637/515/GCF_003637515.1_ASM363751v1","ftp://ftp.ncbi.nlm.nih.gov/genomes/all/GCA/003/637/515/GCA_003637515.1_ASM363751v1","SAMN06329505","PRJNA374603","GCA_003637515.1","1.59564","38.7","-","MVWK01","36","1573","1442/410860","10/12/2018","10/18/2018","Contig","2018-10-12T00:00:00Z","University of Western Australia","Illumina MiSeq","73x","SPAdes v. 3.8.2","","","36","1595644","Australia","Human, Homo sapiens"
"Helicobacter pylori HP12070","410859","210","210.5073","","","N/A","","ftp://ftp.ncbi.nlm.nih.gov/genomes/all/GCF/003/637/505/GCF_003637505.1_ASM363750v1","ftp://ftp.ncbi.nlm.nih.gov/genomes/all/GCA/003/637/505/GCA_003637505.1_ASM363750v1","SAMN06329506","PRJNA374603","GCA_003637505.1","1.55124","39.2","-","MVWJ01","38","1538","1403/410859","10/12/2018","10/18/2018","Contig","2018-10-12T00:00:00Z","University of Western Australia","Illumina MiSeq","32x","SPAdes v. 3.8.2","","","38","1551236","Australia","Human, Homo sapiens"
"Helicobacter pylori HP12073","410858","210","210.5072","","","N/A","","ftp://ftp.ncbi.nlm.nih.gov/genomes/all/GCF/003/637/485/GCF_003637485.1_ASM363748v1","ftp://ftp.ncbi.nlm.nih.gov/genomes/all/GCA/003/637/485/GCA_003637485.1_ASM363748v1","SAMN06329507","PRJNA374603","GCA_003637485.1","1.60642","38.5","-","MVWI01","36","1569","1431/410858","10/12/2018","10/18/2018","Contig","2018-10-12T00:00:00Z","University of Western Australia","Illumina MiSeq","196x","SPAdes v. 3.8.2","","","36","1606420","Australia","Human, Homo sapiens"
"Helicobacter pylori HP12077","410857","210","210.5070","","","N/A","","ftp://ftp.ncbi.nlm.nih.gov/genomes/all/GCF/003/637/465/GCF_003637465.1_ASM363746v1","ftp://ftp.ncbi.nlm.nih.gov/genomes/all/GCA/003/637/465/GCA_003637465.1_ASM363746v1","SAMN06329508","PRJNA374603","GCA_003637465.1","1.5989","39","-","MVWH01","27","1583","1443/410857","10/12/2018","10/18/2018","Contig","2018-10-12T00:00:00Z","University of Western Australia","Illumina MiSeq","144x","SPAdes v. 3.8.2","","","27","1598900","Australia","Human, Homo sapiens"
"Helicobacter pylori HP12078","410856","210","210.5071","","","N/A","","ftp://ftp.ncbi.nlm.nih.gov/genomes/all/GCF/003/637/435/GCF_003637435.1_ASM363743v1","ftp://ftp.ncbi.nlm.nih.gov/genomes/all/GCA/003/637/435/GCA_003637435.1_ASM363743v1","SAMN06329509","PRJNA374603","GCA_003637435.1","1.61889","38.6","-","MVWG01","34","1609","1441/410856","10/12/2018","10/18/2018","Contig","2018-10-12T00:00:00Z","University of Western Australia","Illumina MiSeq","78x","SPAdes v. 3.8.2","","","34","1618888","Australia","Human, Homo sapiens"
"Helicobacter pylori HP13005","410855","210","210.5069","","","N/A","","ftp://ftp.ncbi.nlm.nih.gov/genomes/all/GCF/003/637/415/GCF_003637415.1_ASM363741v1","ftp://ftp.ncbi.nlm.nih.gov/genomes/all/GCA/003/637/415/GCA_003637415.1_ASM363741v1","SAMN06329510","PRJNA374603","GCA_003637415.1","1.58002","39","-","MVWF01","38","1581","1443/410855","10/12/2018","10/18/2018","Contig","2018-10-12T00:00:00Z","University of Western Australia","Illumina MiSeq","93x","SPAdes v. 3.8.2","","","38","1580020","Australia","Human, Homo sapiens"
"Helicobacter pylori HP13007","410854","210","210.5068","","","N/A","","ftp://ftp.ncbi.nlm.nih.gov/genomes/all/GCF/003/637/405/GCF_003637405.1_ASM363740v1","ftp://ftp.ncbi.nlm.nih.gov/genomes/all/GCA/003/637/405/GCA_003637405.1_ASM363740v1","SAMN06329511","PRJNA374603","GCA_003637405.1","1.60682","38.9","-","MVWE01","36","1592","1443/410854","10/12/2018","10/18/2018","Contig","2018-10-12T00:00:00Z","University of Western Australia","Illumina MiSeq","123x","SPAdes v. 3.8.2","","","36","1606819","Australia","Human, Homo sapiens"
"Helicobacter pylori HP13009","410852","210","210.5066","","","N/A","","ftp://ftp.ncbi.nlm.nih.gov/genomes/all/GCF/003/637/365/GCF_003637365.1_ASM363736v1","ftp://ftp.ncbi.nlm.nih.gov/genomes/all/GCA/003/637/365/GCA_003637365.1_ASM363736v1","SAMN06329512","PRJNA374603","GCA_003637365.1","1.65419","38.8","-","MVWD01","46","1642","1498/410852","10/12/2018","10/18/2018","Contig","2018-10-12T00:00:00Z","University of Western Australia","Illumina MiSeq","79x","SPAdes v. 3.8.2","","","46","1654194","Australia","Human, Homo sapiens"
"Helicobacter pylori HP13011","410853","210","210.5067","","","N/A","","ftp://ftp.ncbi.nlm.nih.gov/genomes/all/GCF/003/637/375/GCF_003637375.1_ASM363737v1","ftp://ftp.ncbi.nlm.nih.gov/genomes/all/GCA/003/637/375/GCA_003637375.1_ASM363737v1","SAMN06329513","PRJNA374603","GCA_003637375.1","1.5978","39.1","-","MVWC01","44","1574","1425/410853","10/12/2018","10/18/2018","Contig","2018-10-12T00:00:00Z","University of Western Australia","Illumina MiSeq","126x","SPAdes v. 3.8.2","","","44","1597798","Australia","Human, Homo sapiens"
"Helicobacter pylori HP13012","410851","210","210.5064","","","N/A","","ftp://ftp.ncbi.nlm.nih.gov/genomes/all/GCF/003/637/345/GCF_003637345.1_ASM363734v1","ftp://ftp.ncbi.nlm.nih.gov/genomes/all/GCA/003/637/345/GCA_003637345.1_ASM363734v1","SAMN06329514","PRJNA374603","GCA_003637345.1","1.63301","38.7","-","MVWB01","28","1623","1458/410851","10/12/2018","10/18/2018","Contig","2018-10-12T00:00:00Z","University of Western Australia","Illumina MiSeq","134x","SPAdes v. 3.8.2","","","28","1633006","Australia","Human, Homo sapiens"
"Helicobacter pylori HP13013","410850","210","210.5062","","","N/A","","ftp://ftp.ncbi.nlm.nih.gov/genomes/all/GCF/003/637/305/GCF_003637305.1_ASM363730v1","ftp://ftp.ncbi.nlm.nih.gov/genomes/all/GCA/003/637/305/GCA_003637305.1_ASM363730v1","SAMN06329515","PRJNA374603","GCA_003637305.1","1.66101","38.5","-","MVWA01","38","1653","1511/410850","10/12/2018","10/18/2018","Contig","2018-10-12T00:00:00Z","University of Western Australia","Illumina MiSeq","79x","SPAdes v. 3.8.2","","","38","1661012","Australia","Human, Homo sapiens"
"Helicobacter pylori HP13021","410849","210","210.5061","","","N/A","","ftp://ftp.ncbi.nlm.nih.gov/genomes/all/GCF/003/637/295/GCF_003637295.1_ASM363729v1","ftp://ftp.ncbi.nlm.nih.gov/genomes/all/GCA/003/637/295/GCA_003637295.1_ASM363729v1","SAMN06329516","PRJNA374603","GCA_003637295.1","1.57799","39","-","MVVZ01","34","1576","1419/410849","10/12/2018","10/18/2018","Contig","2018-10-12T00:00:00Z","University of Western Australia","Illumina MiSeq","153x","SPAdes v. 3.8.2","","","34","1577986","Australia","Human, Homo sapiens"
"Helicobacter pylori HP13022","410848","210","210.5065","","","N/A","","ftp://ftp.ncbi.nlm.nih.gov/genomes/all/GCF/003/637/285/GCF_003637285.1_ASM363728v1","ftp://ftp.ncbi.nlm.nih.gov/genomes/all/GCA/003/637/285/GCA_003637285.1_ASM363728v1","SAMN06329517","PRJNA374603","GCA_003637285.1","1.5949","39","-","MVVY01","45","1595","1443/410848","10/12/2018","10/18/2018","Contig","2018-10-12T00:00:00Z","University of Western Australia","Illumina MiSeq","105x","SPAdes v. 3.8.2","","","45","1594896","Australia","Human, Homo sapiens"
"Helicobacter pylori HP13024","410847","210","210.5063","","","N/A","","ftp://ftp.ncbi.nlm.nih.gov/genomes/all/GCF/003/637/265/GCF_003637265.1_ASM363726v1","ftp://ftp.ncbi.nlm.nih.gov/genomes/all/GCA/003/637/265/GCA_003637265.1_ASM363726v1","SAMN06329518","PRJNA374603","GCA_003637265.1","1.64118","38.8","-","MVVX01","46","1629","1481/410847","10/12/2018","10/18/2018","Contig","2018-10-12T00:00:00Z","University of Western Australia","Illumina MiSeq","146x","SPAdes v. 3.8.2","","","46","1641180","Australia","Human, Homo sapiens"
"Helicobacter pylori HP13025","410846","210","210.5060","","","N/A","","ftp://ftp.ncbi.nlm.nih.gov/genomes/all/GCF/003/637/235/GCF_003637235.1_ASM363723v1","ftp://ftp.ncbi.nlm.nih.gov/genomes/all/GCA/003/637/235/GCA_003637235.1_ASM363723v1","SAMN06329519","PRJNA374603","GCA_003637235.1","1.62763","38.9","-","MVVW01","26","1602","1457/410846","10/12/2018","10/18/2018","Contig","2018-10-12T00:00:00Z","University of Western Australia","Illumina MiSeq","145x","SPAdes v. 3.8.2","","","26","1627628","Australia","Human, Homo sapiens"
"Helicobacter pylori HP13026","410845","210","210.5059","","","N/A","","ftp://ftp.ncbi.nlm.nih.gov/genomes/all/GCF/003/637/225/GCF_003637225.1_ASM363722v1","ftp://ftp.ncbi.nlm.nih.gov/genomes/all/GCA/003/637/225/GCA_003637225.1_ASM363722v1","SAMN06329520","PRJNA374603","GCA_003637225.1","1.67619","39","-","MVVV01","50","1660","1503/410845","10/12/2018","10/18/2018","Contig","2018-10-12T00:00:00Z","University of Western Australia","Illumina MiSeq","176x","SPAdes v. 3.8.2","","","50","1676191","Australia","Human, Homo sapiens"
"Helicobacter pylori HP13027","410844","210","210.5058","","","N/A","","ftp://ftp.ncbi.nlm.nih.gov/genomes/all/GCF/003/637/205/GCF_003637205.1_ASM363720v1","ftp://ftp.ncbi.nlm.nih.gov/genomes/all/GCA/003/637/205/GCA_003637205.1_ASM363720v1","SAMN06329521","PRJNA374603","GCA_003637205.1","1.58557","39.1","-","MVVU01","59","1575","1419/410844","10/12/2018","10/18/2018","Contig","2018-10-12T00:00:00Z","University of Western Australia","Illumina MiSeq","92x","SPAdes v. 3.8.2","","","59","1585567","Australia","Human, Homo sapiens"
"Helicobacter pylori HP13028","410843","210","210.5057","","","N/A","","ftp://ftp.ncbi.nlm.nih.gov/genomes/all/GCF/003/637/175/GCF_003637175.1_ASM363717v1","ftp://ftp.ncbi.nlm.nih.gov/genomes/all/GCA/003/637/175/GCA_003637175.1_ASM363717v1","SAMN06329522","PRJNA374603","GCA_003637175.1","1.6499","38.8","-","MVVT01","38","1640","1462/410843","10/12/2018","10/18/2018","Contig","2018-10-12T00:00:00Z","University of Western Australia","Illumina MiSeq","146x","SPAdes v. 3.8.2","","","38","1649898","Australia","Human, Homo sapiens"
"Helicobacter pylori HP13029","410842","210","210.5056","","","N/A","","ftp://ftp.ncbi.nlm.nih.gov/genomes/all/GCF/003/637/165/GCF_003637165.1_ASM363716v1","ftp://ftp.ncbi.nlm.nih.gov/genomes/all/GCA/003/637/165/GCA_003637165.1_ASM363716v1","SAMN06329523","PRJNA374603","GCA_003637165.1","1.56469","39.1","-","MVVS01","30","1542","1398/410842","10/12/2018","10/18/2018","Contig","2018-10-12T00:00:00Z","University of Western Australia","Illumina MiSeq","141x","SPAdes v. 3.8.2","","","30","1564695","Australia","Human, Homo sapiens"
"Helicobacter pylori HP13031","410841","210","210.5055","","","N/A","","ftp://ftp.ncbi.nlm.nih.gov/genomes/all/GCF/003/637/135/GCF_003637135.1_ASM363713v1","ftp://ftp.ncbi.nlm.nih.gov/genomes/all/GCA/003/637/135/GCA_003637135.1_ASM363713v1","SAMN06329524","PRJNA374603","GCA_003637135.1","1.58808","39","-","MVVR01","47","1588","1441/410841","10/12/2018","10/18/2018","Contig","2018-10-12T00:00:00Z","University of Western Australia","Illumina MiSeq","69x","SPAdes v. 3.8.2","","","47","1588083","Australia","Human, Homo sapiens"
"Helicobacter pylori HP13033","410839","210","210.5054","","","N/A","","ftp://ftp.ncbi.nlm.nih.gov/genomes/all/GCF/003/637/105/GCF_003637105.1_ASM363710v1","ftp://ftp.ncbi.nlm.nih.gov/genomes/all/GCA/003/637/105/GCA_003637105.1_ASM363710v1","SAMN06329525","PRJNA374603","GCA_003637105.1","1.64852","38.8","-","MVVQ01","46","1643","1477/410839","10/12/2018","10/18/2018","Contig","2018-10-12T00:00:00Z","University of Western Australia","Illumina MiSeq","153x","SPAdes v. 3.8.2","","","46","1648519","Australia","Human, Homo sapiens"
"Helicobacter pylori HP13050","410840","210","210.5053","","","N/A","","ftp://ftp.ncbi.nlm.nih.gov/genomes/all/GCF/003/637/115/GCF_003637115.1_ASM363711v1","ftp://ftp.ncbi.nlm.nih.gov/genomes/all/GCA/003/637/115/GCA_003637115.1_ASM363711v1","SAMN06329526","PRJNA374603","GCA_003637115.1","1.58059","39.1","-","MVVP01","31","1566","1449/410840","10/12/2018","10/18/2018","Contig","2018-10-12T00:00:00Z","University of Western Australia","Illumina MiSeq","106x","SPAdes v. 3.8.2","","","31","1580589","Australia","Human, Homo sapiens"
"Helicobacter pylori HP13054","410838","210","210.5052","","","N/A","","ftp://ftp.ncbi.nlm.nih.gov/genomes/all/GCF/003/637/065/GCF_003637065.1_ASM363706v1","ftp://ftp.ncbi.nlm.nih.gov/genomes/all/GCA/003/637/065/GCA_003637065.1_ASM363706v1","SAMN06329527","PRJNA374603","GCA_003637065.1","1.57826","39","-","MVVO01","29","1569","1426/410838","10/12/2018","10/18/2018","Contig","2018-10-12T00:00:00Z","University of Western Australia","Illumina MiSeq","157x","SPAdes v. 3.8.2","","","29","1578262","Australia","Human, Homo sapiens"
"Helicobacter pylori HP13056","410837","210","210.5051","","","N/A","","ftp://ftp.ncbi.nlm.nih.gov/genomes/all/GCF/003/637/055/GCF_003637055.1_ASM363705v1","ftp://ftp.ncbi.nlm.nih.gov/genomes/all/GCA/003/637/055/GCA_003637055.1_ASM363705v1","SAMN06329528","PRJNA374603","GCA_003637055.1","1.58886","38.9","-","MVVN01","37","1582","1427/410837","10/12/2018","10/18/2018","Contig","2018-10-12T00:00:00Z","University of Western Australia","Illumina MiSeq","103x","SPAdes v. 3.8.2","","","37","1588857","Australia","Human, Homo sapiens"
"Helicobacter pylori HP13061","410836","210","210.5050","","","N/A","","ftp://ftp.ncbi.nlm.nih.gov/genomes/all/GCF/003/637/045/GCF_003637045.1_ASM363704v1","ftp://ftp.ncbi.nlm.nih.gov/genomes/all/GCA/003/637/045/GCA_003637045.1_ASM363704v1","SAMN06329529","PRJNA374603","GCA_003637045.1","1.70607","38.5","-","MVVM01","51","1695","1512/410836","10/12/2018","10/18/2018","Contig","2018-10-12T00:00:00Z","University of Western Australia","Illumina MiSeq","102x","SPAdes v. 3.8.2","","","51","1706070","Australia","Human, Homo sapiens"
"Helicobacter pylori HP13063","410835","210","210.5049","","","N/A","","ftp://ftp.ncbi.nlm.nih.gov/genomes/all/GCF/003/637/025/GCF_003637025.1_ASM363702v1","ftp://ftp.ncbi.nlm.nih.gov/genomes/all/GCA/003/637/025/GCA_003637025.1_ASM363702v1","SAMN06329530","PRJNA374603","GCA_003637025.1","1.6166","38.7","-","MVVL01","24","1601","1439/410835","10/12/2018","10/18/2018","Contig","2018-10-12T00:00:00Z","University of Western Australia","Illumina MiSeq","99x","SPAdes v. 3.8.2","","","24","1616602","Australia","Human, Homo sapiens"
"Helicobacter pylori HP13064","410834","210","210.5048","","","N/A","","ftp://ftp.ncbi.nlm.nih.gov/genomes/all/GCF/003/636/995/GCF_003636995.1_ASM363699v1","ftp://ftp.ncbi.nlm.nih.gov/genomes/all/GCA/003/636/995/GCA_003636995.1_ASM363699v1","SAMN06329531","PRJNA374603","GCA_003636995.1","1.6648","38.8","-","MVVK01","46","1651","1487/410834","10/12/2018","10/18/2018","Contig","2018-10-12T00:00:00Z","University of Western Australia","Illumina MiSeq","74x","SPAdes v. 3.8.2","","","46","1664798","Australia","Human, Homo sapiens"
"Helicobacter pylori HP13068","410833","210","210.5045","","","N/A","","ftp://ftp.ncbi.nlm.nih.gov/genomes/all/GCF/003/636/985/GCF_003636985.1_ASM363698v1","ftp://ftp.ncbi.nlm.nih.gov/genomes/all/GCA/003/636/985/GCA_003636985.1_ASM363698v1","SAMN06329532","PRJNA374603","GCA_003636985.1","1.63915","38.8","-","MVVJ01","24","1612","1466/410833","10/12/2018","10/18/2018","Contig","2018-10-12T00:00:00Z","University of Western Australia","Illumina MiSeq","181x","SPAdes v. 3.8.2","","","24","1639150","Australia","Human, Homo sapiens"
"Helicobacter pylori HP13072","410832","210","210.5047","","","N/A","","ftp://ftp.ncbi.nlm.nih.gov/genomes/all/GCF/003/636/965/GCF_003636965.1_ASM363696v1","ftp://ftp.ncbi.nlm.nih.gov/genomes/all/GCA/003/636/965/GCA_003636965.1_ASM363696v1","SAMN06329533","PRJNA374603","GCA_003636965.1","1.67452","38.9","-","MVVI01","39","1643","1494/410832","10/12/2018","10/18/2018","Contig","2018-10-12T00:00:00Z","University of Western Australia","Illumina MiSeq","167x","SPAdes v. 3.8.2","","","39","1674524","Australia","Human, Homo sapiens"
"Helicobacter pylori HP14012","455534","210","210.5651","","","N/A","","ftp://ftp.ncbi.nlm.nih.gov/genomes/all/GCF/004/323/545/GCF_004323545.1_ASM432354v1","ftp://ftp.ncbi.nlm.nih.gov/genomes/all/GCA/004/323/545/GCA_004323545.1_ASM432354v1","SAMN07540328","PRJNA374603","GCA_004323545.1","1.54634","39","-","NYJQ01","30","1518","1396/455534","3/4/2019","3/6/2019","Contig","2019-03-04T00:00:00Z","University of Western Australia","Illumina MiSeq","282x","SPAdes v. 3.10.1","","","30","1546337","Australia","Human, Homo sapiens"
"Helicobacter pylori HP14016","455529","210","210.5645","","","N/A","","ftp://ftp.ncbi.nlm.nih.gov/genomes/all/GCF/004/323/445/GCF_004323445.1_ASM432344v1","ftp://ftp.ncbi.nlm.nih.gov/genomes/all/GCA/004/323/445/GCA_004323445.1_ASM432344v1","SAMN07540329","PRJNA374603","GCA_004323445.1","1.57751","38.9","-","NYJP01","38","1573","1424/455529","3/4/2019","3/6/2019","Contig","2019-03-04T00:00:00Z","University of Western Australia","Illumina MiSeq","213x","SPAdes v. 3.10.1","","","38","1577510","Australia","Human, Homo sapiens"
"Helicobacter pylori HP14021","410831","210","210.5044","","","N/A","","ftp://ftp.ncbi.nlm.nih.gov/genomes/all/GCF/003/636/935/GCF_003636935.1_ASM363693v1","ftp://ftp.ncbi.nlm.nih.gov/genomes/all/GCA/003/636/935/GCA_003636935.1_ASM363693v1","SAMN06329534","PRJNA374603","GCA_003636935.1","1.62528","38.8","-","MVVH01","34","1595","1449/410831","10/12/2018","10/18/2018","Contig","2018-10-12T00:00:00Z","University of Western Australia","Illumina MiSeq","153x","SPAdes v. 3.8.2","","","34","1625282","Australia","Human, Homo sapiens"
"Helicobacter pylori HP14023","410830","210","210.5043","","","N/A","","ftp://ftp.ncbi.nlm.nih.gov/genomes/all/GCF/003/636/925/GCF_003636925.1_ASM363692v1","ftp://ftp.ncbi.nlm.nih.gov/genomes/all/GCA/003/636/925/GCA_003636925.1_ASM363692v1","SAMN06329535","PRJNA374603","GCA_003636925.1","1.6499","39","-","MVVG01","29","1614","1458/410830","10/12/2018","10/18/2018","Contig","2018-10-12T00:00:00Z","University of Western Australia","Illumina MiSeq","196x","SPAdes v. 3.8.2","","","29","1649904","Australia","Human, Homo sapiens"
"Helicobacter pylori HP14031","410829","210","210.5046","","","N/A","","ftp://ftp.ncbi.nlm.nih.gov/genomes/all/GCF/003/636/905/GCF_003636905.1_ASM363690v1","ftp://ftp.ncbi.nlm.nih.gov/genomes/all/GCA/003/636/905/GCA_003636905.1_ASM363690v1","SAMN06329536","PRJNA374603","GCA_003636905.1","1.56509","38.9","-","MVVF01","24","1558","1399/410829","10/12/2018","10/18/2018","Contig","2018-10-12T00:00:00Z","University of Western Australia","Illumina MiSeq","158x","SPAdes v. 3.8.2","","","24","1565090","Australia","Human, Homo sapiens"
"Helicobacter pylori HP14036","410828","210","210.5042","","","N/A","","ftp://ftp.ncbi.nlm.nih.gov/genomes/all/GCF/003/636/885/GCF_003636885.1_ASM363688v1","ftp://ftp.ncbi.nlm.nih.gov/genomes/all/GCA/003/636/885/GCA_003636885.1_ASM363688v1","SAMN06329537","PRJNA374603","GCA_003636885.1","1.6277","38.9","-","MVVE01","46","1632","1465/410828","10/12/2018","10/18/2018","Contig","2018-10-12T00:00:00Z","University of Western Australia","Illumina MiSeq","196x","SPAdes v. 3.8.2","","","46","1627696","Australia","Human, Homo sapiens"
"Helicobacter pylori HP14048","410826","210","210.5040","","","N/A","","ftp://ftp.ncbi.nlm.nih.gov/genomes/all/GCF/003/636/845/GCF_003636845.1_ASM363684v1","ftp://ftp.ncbi.nlm.nih.gov/genomes/all/GCA/003/636/845/GCA_003636845.1_ASM363684v1","SAMN06329539","PRJNA374603","GCA_003636845.1","1.60242","38.9","-","MVVC01","42","1596","1448/410826","10/12/2018","10/18/2018","Contig","2018-10-12T00:00:00Z","University of Western Australia","Illumina MiSeq","149x","SPAdes v. 3.8.2","","","42","1602417","Australia","Human, Homo sapiens"
"Helicobacter pylori HP14050","410825","210","210.5039","","","N/A","","ftp://ftp.ncbi.nlm.nih.gov/genomes/all/GCF/003/636/825/GCF_003636825.1_ASM363682v1","ftp://ftp.ncbi.nlm.nih.gov/genomes/all/GCA/003/636/825/GCA_003636825.1_ASM363682v1","SAMN06329540","PRJNA374603","GCA_003636825.1","1.58334","39.1","-","MVVB01","32","1576","1430/410825","10/12/2018","10/18/2018","Contig","2018-10-12T00:00:00Z","University of Western Australia","Illumina MiSeq","121x","SPAdes v. 3.8.2","","","32","1583336","Australia","Human, Homo sapiens"
"Helicobacter pylori HP14051","410824","210","210.5038","","","N/A","","ftp://ftp.ncbi.nlm.nih.gov/genomes/all/GCF/003/636/805/GCF_003636805.1_ASM363680v1","ftp://ftp.ncbi.nlm.nih.gov/genomes/all/GCA/003/636/805/GCA_003636805.1_ASM363680v1","SAMN06329541","PRJNA374603","GCA_003636805.1","1.55516","38.8","-","MVVA01","24","1560","1414/410824","10/12/2018","10/18/2018","Contig","2018-10-12T00:00:00Z","University of Western Australia","Illumina MiSeq","171x","SPAdes v. 3.8.2","","","24","1555159","Australia","Human, Homo sapiens"
"Helicobacter pylori HP14052","410823","210","210.5037","","","N/A","","ftp://ftp.ncbi.nlm.nih.gov/genomes/all/GCF/003/636/785/GCF_003636785.1_ASM363678v1","ftp://ftp.ncbi.nlm.nih.gov/genomes/all/GCA/003/636/785/GCA_003636785.1_ASM363678v1","SAMN06329542","PRJNA374603","GCA_003636785.1","1.55175","38.8","-","MVUZ01","32","1545","1399/410823","10/12/2018","10/18/2018","Contig","2018-10-12T00:00:00Z","University of Western Australia","Illumina MiSeq","78x","SPAdes v. 3.8.2","","","32","1551755","Australia","Human, Homo sapiens"
"Helicobacter pylori HP14054","410822","210","210.5036","","","N/A","","ftp://ftp.ncbi.nlm.nih.gov/genomes/all/GCF/003/636/765/GCF_003636765.1_ASM363676v1","ftp://ftp.ncbi.nlm.nih.gov/genomes/all/GCA/003/636/765/GCA_003636765.1_ASM363676v1","SAMN06329543","PRJNA374603","GCA_003636765.1","1.58108","38.9","-","MVUY01","28","1561","1410/410822","10/12/2018","10/18/2018","Contig","2018-10-12T00:00:00Z","University of Western Australia","Illumina MiSeq","138x","SPAdes v. 3.8.2","","","28","1581075","Australia","Human, Homo sapiens"
"Helicobacter pylori HP14056","410821","210","210.5035","","","N/A","","ftp://ftp.ncbi.nlm.nih.gov/genomes/all/GCF/003/636/745/GCF_003636745.1_ASM363674v1","ftp://ftp.ncbi.nlm.nih.gov/genomes/all/GCA/003/636/745/GCA_003636745.1_ASM363674v1","SAMN06329544","PRJNA374603","GCA_003636745.1","1.61573","38.7","-","MVUX01","28","1600","1446/410821","10/12/2018","10/18/2018","Contig","2018-10-12T00:00:00Z","University of Western Australia","Illumina MiSeq","158x","SPAdes v. 3.8.2","","","28","1615732","Australia","Human, Homo sapiens"
"Helicobacter pylori HP14065","410820","210","210.5034","","","N/A","","ftp://ftp.ncbi.nlm.nih.gov/genomes/all/GCF/003/636/725/GCF_003636725.1_ASM363672v1","ftp://ftp.ncbi.nlm.nih.gov/genomes/all/GCA/003/636/725/GCA_003636725.1_ASM363672v1","SAMN06329545","PRJNA374603","GCA_003636725.1","1.63263","38.8","-","MVUW01","34","1621","1469/410820","10/12/2018","10/18/2018","Contig","2018-10-12T00:00:00Z","University of Western Australia","Illumina MiSeq","172x","SPAdes v. 3.8.2","","","34","1632634","Australia","Human, Homo sapiens"
"Helicobacter pylori HP14069","410819","210","210.5033","","","N/A","","ftp://ftp.ncbi.nlm.nih.gov/genomes/all/GCF/003/636/705/GCF_003636705.1_ASM363670v1","ftp://ftp.ncbi.nlm.nih.gov/genomes/all/GCA/003/636/705/GCA_003636705.1_ASM363670v1","SAMN06329546","PRJNA374603","GCA_003636705.1","1.61995","38.6","-","MVUV01","39","1609","1456/410819","10/12/2018","10/18/2018","Contig","2018-10-12T00:00:00Z","University of Western Australia","Illumina MiSeq","227x","SPAdes v. 3.8.2","","","39","1619950","Australia","Human, Homo sapiens"
"Helicobacter pylori HP15001","455523","210","210.5640","","","N/A","","ftp://ftp.ncbi.nlm.nih.gov/genomes/all/GCF/004/323/315/GCF_004323315.1_ASM432331v1","ftp://ftp.ncbi.nlm.nih.gov/genomes/all/GCA/004/323/315/GCA_004323315.1_ASM432331v1","SAMN07540330","PRJNA374603","GCA_004323315.1","1.58743","39.1","-","NYJO01","46","1599","1444/455523","3/4/2019","3/6/2019","Contig","2019-03-04T00:00:00Z","University of Western Australia","Illumina MiSeq","199x","SPAdes v. 3.10.1","","","46","1587427","Australia","Human, Homo sapiens"
"Helicobacter pylori HP15002","410818","210","210.5032","","","N/A","","ftp://ftp.ncbi.nlm.nih.gov/genomes/all/GCF/003/636/675/GCF_003636675.1_ASM363667v1","ftp://ftp.ncbi.nlm.nih.gov/genomes/all/GCA/003/636/675/GCA_003636675.1_ASM363667v1","SAMN06329547","PRJNA374603","GCA_003636675.1","1.58283","38.8","-","MVUU01","27","1569","1414/410818","10/12/2018","10/18/2018","Contig","2018-10-12T00:00:00Z","University of Western Australia","Illumina MiSeq","123x","SPAdes v. 3.8.2","","","27","1582835","Australia","Human, Homo sapiens"
"Helicobacter pylori HP15003","410817","210","210.5031","","","N/A","","ftp://ftp.ncbi.nlm.nih.gov/genomes/all/GCF/003/636/665/GCF_003636665.1_ASM363666v1","ftp://ftp.ncbi.nlm.nih.gov/genomes/all/GCA/003/636/665/GCA_003636665.1_ASM363666v1","SAMN06329548","PRJNA374603","GCA_003636665.1","1.59807","38.8","-","MVUT01","31","1594","1449/410817","10/12/2018","10/18/2018","Contig","2018-10-12T00:00:00Z","University of Western Australia","Illumina MiSeq","76x","SPAdes v. 3.8.2","","","31","1598068","Australia","Human, Homo sapiens"
"Helicobacter pylori HP15004","410816","210","210.5030","","","N/A","","ftp://ftp.ncbi.nlm.nih.gov/genomes/all/GCF/003/636/645/GCF_003636645.1_ASM363664v1","ftp://ftp.ncbi.nlm.nih.gov/genomes/all/GCA/003/636/645/GCA_003636645.1_ASM363664v1","SAMN06329549","PRJNA374603","GCA_003636645.1","1.65137","38.6","-","MVUS01","24","1640","1492/410816","10/12/2018","10/18/2018","Contig","2018-10-12T00:00:00Z","University of Western Australia","Illumina MiSeq","151x","SPAdes v. 3.8.2","","","24","1651366","Australia","Human, Homo sapiens"
"Helicobacter pylori HP15005","410793","210","210.5007","","","N/A","","ftp://ftp.ncbi.nlm.nih.gov/genomes/all/GCF/003/636/165/GCF_003636165.1_ASM363616v1","ftp://ftp.ncbi.nlm.nih.gov/genomes/all/GCA/003/636/165/GCA_003636165.1_ASM363616v1","SAMN06329550","PRJNA374603","GCA_003636165.1","1.55882","39.1","-","MVUR01","44","1549","1402/410793","10/12/2018","10/18/2018","Contig","2018-10-12T00:00:00Z","University of Western Australia","Illumina MiSeq","92x","SPAdes v. 3.8.2","","","44","1558820","Australia","Human, Homo sapiens"
"Helicobacter pylori HP15006","410792","210","210.5005","","","N/A","","ftp://ftp.ncbi.nlm.nih.gov/genomes/all/GCF/003/636/155/GCF_003636155.1_ASM363615v1","ftp://ftp.ncbi.nlm.nih.gov/genomes/all/GCA/003/636/155/GCA_003636155.1_ASM363615v1","SAMN06329551","PRJNA374603","GCA_003636155.1","1.65231","38.7","-","MVUQ01","36","1633","1473/410792","10/12/2018","10/18/2018","Contig","2018-10-12T00:00:00Z","University of Western Australia","Illumina MiSeq","176x","SPAdes v. 3.8.2","","","36","1652308","Australia","Human, Homo sapiens"
"Helicobacter pylori HP15011","410791","210","210.5006","","","N/A","","ftp://ftp.ncbi.nlm.nih.gov/genomes/all/GCF/003/636/145/GCF_003636145.1_ASM363614v1","ftp://ftp.ncbi.nlm.nih.gov/genomes/all/GCA/003/636/145/GCA_003636145.1_ASM363614v1","SAMN06329552","PRJNA374603","GCA_003636145.1","1.65213","38.5","-","MVUP01","31","1634","1484/410791","10/12/2018","10/18/2018","Contig","2018-10-12T00:00:00Z","University of Western Australia","Illumina MiSeq","176x","SPAdes v. 3.8.2","","","31","1652125","Australia","Human, Homo sapiens"
"Helicobacter pylori HP15012","410790","210","210.5004","","","N/A","","ftp://ftp.ncbi.nlm.nih.gov/genomes/all/GCF/003/636/105/GCF_003636105.1_ASM363610v1","ftp://ftp.ncbi.nlm.nih.gov/genomes/all/GCA/003/636/105/GCA_003636105.1_ASM363610v1","SAMN06329553","PRJNA374603","GCA_003636105.1","1.60025","39","-","MVUO01","40","1591","1454/410790","10/12/2018","10/18/2018","Contig","2018-10-12T00:00:00Z","University of Western Australia","Illumina MiSeq","204x","SPAdes v. 3.8.2","","","40","1600252","Australia","Human, Homo sapiens"
"Helicobacter pylori HP15013","410789","210","210.5003","","","N/A","","ftp://ftp.ncbi.nlm.nih.gov/genomes/all/GCF/003/636/095/GCF_003636095.1_ASM363609v1","ftp://ftp.ncbi.nlm.nih.gov/genomes/all/GCA/003/636/095/GCA_003636095.1_ASM363609v1","SAMN06329554","PRJNA374603","GCA_003636095.1","1.56447","39.1","-","MVUN01","47","1571","1402/410789","10/12/2018","10/18/2018","Contig","2018-10-12T00:00:00Z","University of Western Australia","Illumina MiSeq","252x","SPAdes v. 3.8.2","","","47","1564467","Australia","Human, Homo sapiens"
"Helicobacter pylori HP15015","410788","210","210.5002","","","N/A","","ftp://ftp.ncbi.nlm.nih.gov/genomes/all/GCF/003/636/085/GCF_003636085.1_ASM363608v1","ftp://ftp.ncbi.nlm.nih.gov/genomes/all/GCA/003/636/085/GCA_003636085.1_ASM363608v1","SAMN06329555","PRJNA374603","GCA_003636085.1","1.54526","38.9","-","MVUM01","37","1553","1396/410788","10/12/2018","10/18/2018","Contig","2018-10-12T00:00:00Z","University of Western Australia","Illumina MiSeq","191x","SPAdes v. 3.8.2","","","37","1545257","Australia","Human, Homo sapiens"
"Helicobacter pylori HP15018","410787","210","210.4999","","","N/A","","ftp://ftp.ncbi.nlm.nih.gov/genomes/all/GCF/003/636/065/GCF_003636065.1_ASM363606v1","ftp://ftp.ncbi.nlm.nih.gov/genomes/all/GCA/003/636/065/GCA_003636065.1_ASM363606v1","SAMN06329556","PRJNA374603","GCA_003636065.1","1.54485","38.9","-","MVUL01","21","1540","1394/410787","10/12/2018","10/18/2018","Contig","2018-10-12T00:00:00Z","University of Western Australia","Illumina MiSeq","137x","SPAdes v. 3.8.2","","","21","1544845","Australia","Human, Homo sapiens"
"Helicobacter pylori HP15020","410814","210","210.5028","","","N/A","","ftp://ftp.ncbi.nlm.nih.gov/genomes/all/GCF/003/636/605/GCF_003636605.1_ASM363660v1","ftp://ftp.ncbi.nlm.nih.gov/genomes/all/GCA/003/636/605/GCA_003636605.1_ASM363660v1","SAMN06329557","PRJNA374603","GCA_003636605.1","1.57336","38.9","-","MVUK01","27","1559","1419/410814","10/12/2018","10/18/2018","Contig","2018-10-12T00:00:00Z","University of Western Australia","Illumina MiSeq","80x","SPAdes v. 3.8.2","","","27","1573363","Australia","Human, Homo sapiens"
"Helicobacter pylori HP15022","410785","210","210.5000","","","N/A","","ftp://ftp.ncbi.nlm.nih.gov/genomes/all/GCF/003/636/025/GCF_003636025.1_ASM363602v1","ftp://ftp.ncbi.nlm.nih.gov/genomes/all/GCA/003/636/025/GCA_003636025.1_ASM363602v1","SAMN06329558","PRJNA374603","GCA_003636025.1","1.65805","38.7","-","MVUJ01","53","1635","1480/410785","10/12/2018","10/18/2018","Contig","2018-10-12T00:00:00Z","University of Western Australia","Illumina MiSeq","75x","SPAdes v. 3.8.2","","","53","1658050","Australia","Human, Homo sapiens"
"Helicobacter pylori HP15025","410815","210","210.5029","","","N/A","","ftp://ftp.ncbi.nlm.nih.gov/genomes/all/GCF/003/636/615/GCF_003636615.1_ASM363661v1","ftp://ftp.ncbi.nlm.nih.gov/genomes/all/GCA/003/636/615/GCA_003636615.1_ASM363661v1","SAMN06329559","PRJNA374603","GCA_003636615.1","1.68423","38.7","-","MVUI01","38","1663","1525/410815","10/12/2018","10/18/2018","Contig","2018-10-12T00:00:00Z","University of Western Australia","Illumina MiSeq","192x","SPAdes v. 3.8.2","","","38","1684227","Australia","Human, Homo sapiens"
"Helicobacter pylori HP15026","410786","210","210.5001","","","N/A","","ftp://ftp.ncbi.nlm.nih.gov/genomes/all/GCF/003/636/035/GCF_003636035.1_ASM363603v1","ftp://ftp.ncbi.nlm.nih.gov/genomes/all/GCA/003/636/035/GCA_003636035.1_ASM363603v1","SAMN06329560","PRJNA374603","GCA_003636035.1","1.69313","38.6","-","MVUH01","43","1662","1489/410786","10/12/2018","10/18/2018","Contig","2018-10-12T00:00:00Z","University of Western Australia","Illumina MiSeq","139x","SPAdes v. 3.8.2","","","43","1693128","Australia","Human, Homo sapiens"
"Helicobacter pylori HP15027","410784","210","210.4998","","","N/A","","ftp://ftp.ncbi.nlm.nih.gov/genomes/all/GCF/003/636/005/GCF_003636005.1_ASM363600v1","ftp://ftp.ncbi.nlm.nih.gov/genomes/all/GCA/003/636/005/GCA_003636005.1_ASM363600v1","SAMN06329561","PRJNA374603","GCA_003636005.1","1.58261","38.8","-","MVUG01","26","1576","1422/410784","10/12/2018","10/18/2018","Contig","2018-10-12T00:00:00Z","University of Western Australia","Illumina MiSeq","140x","SPAdes v. 3.8.2","","","26","1582609","Australia","Human, Homo sapiens"
"Helicobacter pylori HP15028","410782","210","210.4996","","","N/A","","ftp://ftp.ncbi.nlm.nih.gov/genomes/all/GCF/003/635/965/GCF_003635965.1_ASM363596v1","ftp://ftp.ncbi.nlm.nih.gov/genomes/all/GCA/003/635/965/GCA_003635965.1_ASM363596v1","SAMN06329562","PRJNA374603","GCA_003635965.1","1.63117","38.9","-","MVUF01","42","1612","1445/410782","10/12/2018","10/18/2018","Contig","2018-10-12T00:00:00Z","University of Western Australia","Illumina MiSeq","224x","SPAdes v. 3.8.2","","","42","1631173","Australia","Human, Homo sapiens"
"Helicobacter pylori HP15031","410783","210","210.4997","","","N/A","","ftp://ftp.ncbi.nlm.nih.gov/genomes/all/GCF/003/635/975/GCF_003635975.1_ASM363597v1","ftp://ftp.ncbi.nlm.nih.gov/genomes/all/GCA/003/635/975/GCA_003635975.1_ASM363597v1","SAMN06329563","PRJNA374603","GCA_003635975.1","1.60549","38.7","-","MVUE01","38","1585","1448/410783","10/12/2018","10/18/2018","Contig","2018-10-12T00:00:00Z","University of Western Australia","Illumina MiSeq","113x","SPAdes v. 3.8.2","","","38","1605490","Australia","Human, Homo sapiens"
"Helicobacter pylori HP15032","410781","210","210.4995","","","N/A","","ftp://ftp.ncbi.nlm.nih.gov/genomes/all/GCF/003/635/945/GCF_003635945.1_ASM363594v1","ftp://ftp.ncbi.nlm.nih.gov/genomes/all/GCA/003/635/945/GCA_003635945.1_ASM363594v1","SAMN06329564","PRJNA374603","GCA_003635945.1","1.55525","38.9","-","MVUD01","29","1547","1399/410781","10/12/2018","10/18/2018","Contig","2018-10-12T00:00:00Z","University of Western Australia","Illumina MiSeq","98x","SPAdes v. 3.8.2","","","29","1555248","Australia","Human, Homo sapiens"
"Helicobacter pylori HP15033","410813","210","210.5027","","","N/A","","ftp://ftp.ncbi.nlm.nih.gov/genomes/all/GCF/003/636/585/GCF_003636585.1_ASM363658v1","ftp://ftp.ncbi.nlm.nih.gov/genomes/all/GCA/003/636/585/GCA_003636585.1_ASM363658v1","SAMN06329565","PRJNA374603","GCA_003636585.1","1.57108","39","-","MVUC01","54","1592","1432/410813","10/12/2018","10/18/2018","Contig","2018-10-12T00:00:00Z","University of Western Australia","Illumina MiSeq","111x","SPAdes v. 3.8.2","","","54","1571081","Australia","Human, Homo sapiens"
"Helicobacter pylori HP15034","410780","210","210.4994","","","N/A","","ftp://ftp.ncbi.nlm.nih.gov/genomes/all/GCF/003/635/915/GCF_003635915.1_ASM363591v1","ftp://ftp.ncbi.nlm.nih.gov/genomes/all/GCA/003/635/915/GCA_003635915.1_ASM363591v1","SAMN06329566","PRJNA374603","GCA_003635915.1","1.6289","39.2","-","MVUB01","45","1595","1449/410780","10/12/2018","10/18/2018","Contig","2018-10-12T00:00:00Z","University of Western Australia","Illumina MiSeq","141x","SPAdes v. 3.8.2","","","45","1628897","Australia","Human, Homo sapiens"
"Helicobacter pylori HP15035","410779","210","210.4993","","","N/A","","ftp://ftp.ncbi.nlm.nih.gov/genomes/all/GCF/003/635/905/GCF_003635905.1_ASM363590v1","ftp://ftp.ncbi.nlm.nih.gov/genomes/all/GCA/003/635/905/GCA_003635905.1_ASM363590v1","SAMN06329567","PRJNA374603","GCA_003635905.1","1.60508","38.9","-","MVUA01","60","1613","1444/410779","10/12/2018","10/18/2018","Contig","2018-10-12T00:00:00Z","University of Western Australia","Illumina MiSeq","67x","SPAdes v. 3.8.2","","","60","1605083","Australia","Human, Homo sapiens"
"Helicobacter pylori HP15036","410778","210","210.4992","","","N/A","","ftp://ftp.ncbi.nlm.nih.gov/genomes/all/GCF/003/635/885/GCF_003635885.1_ASM363588v1","ftp://ftp.ncbi.nlm.nih.gov/genomes/all/GCA/003/635/885/GCA_003635885.1_ASM363588v1","SAMN06329568","PRJNA374603","GCA_003635885.1","1.53671","38.8","-","MVTZ01","43","1547","1372/410778","10/12/2018","10/18/2018","Contig","2018-10-12T00:00:00Z","University of Western Australia","Illumina MiSeq","95x","SPAdes v. 3.8.2","","","43","1536706","Australia","Human, Homo sapiens"
"Helicobacter pylori HP15039","410777","210","210.4991","","","N/A","","ftp://ftp.ncbi.nlm.nih.gov/genomes/all/GCF/003/635/855/GCF_003635855.1_ASM363585v1","ftp://ftp.ncbi.nlm.nih.gov/genomes/all/GCA/003/635/855/GCA_003635855.1_ASM363585v1","SAMN06329569","PRJNA374603","GCA_003635855.1","1.58846","39.2","-","MVTY01","86","1596","1421/410777","10/12/2018","10/18/2018","Contig","2018-10-12T00:00:00Z","University of Western Australia","Illumina MiSeq","93x","SPAdes v. 3.8.2","","","86","1588463","Australia","Human, Homo sapiens"
"Helicobacter pylori HP15040","410812","210","210.5026","","","N/A","","ftp://ftp.ncbi.nlm.nih.gov/genomes/all/GCF/003/636/555/GCF_003636555.1_ASM363655v1","ftp://ftp.ncbi.nlm.nih.gov/genomes/all/GCA/003/636/555/GCA_003636555.1_ASM363655v1","SAMN06329570","PRJNA374603","GCA_003636555.1","1.59736","38.9","-","MVTX01","19","1589","1437/410812","10/12/2018","10/18/2018","Contig","2018-10-12T00:00:00Z","University of Western Australia","Illumina MiSeq","164x","SPAdes v. 3.8.2","","","19","1597365","Australia","Human, Homo sapiens"
"Helicobacter pylori HP15044","410810","210","210.5024","","","N/A","","ftp://ftp.ncbi.nlm.nih.gov/genomes/all/GCF/003/636/525/GCF_003636525.1_ASM363652v1","ftp://ftp.ncbi.nlm.nih.gov/genomes/all/GCA/003/636/525/GCA_003636525.1_ASM363652v1","SAMN06329571","PRJNA374603","GCA_003636525.1","1.64136","38.7","-","MVTW01","46","1624","1477/410810","10/12/2018","10/18/2018","Contig","2018-10-12T00:00:00Z","University of Western Australia","Illumina MiSeq","199x","SPAdes v. 3.8.2","","","46","1641358","Australia","Human, Homo sapiens"
"Helicobacter pylori HP15050","410776","210","210.4990","","","N/A","","ftp://ftp.ncbi.nlm.nih.gov/genomes/all/GCF/003/635/845/GCF_003635845.1_ASM363584v1","ftp://ftp.ncbi.nlm.nih.gov/genomes/all/GCA/003/635/845/GCA_003635845.1_ASM363584v1","SAMN06329572","PRJNA374603","GCA_003635845.1","1.65728","38.8","-","MVTV01","42","1626","1476/410776","10/12/2018","10/18/2018","Contig","2018-10-12T00:00:00Z","University of Western Australia","Illumina MiSeq","264x","SPAdes v. 3.8.2","","","42","1657276","Australia","Human, Homo sapiens"
"Helicobacter pylori HP15051","410809","210","210.5023","","","N/A","","ftp://ftp.ncbi.nlm.nih.gov/genomes/all/GCF/003/636/505/GCF_003636505.1_ASM363650v1","ftp://ftp.ncbi.nlm.nih.gov/genomes/all/GCA/003/636/505/GCA_003636505.1_ASM363650v1","SAMN06329573","PRJNA374603","GCA_003636505.1","1.61021","38.7","-","MVTU01","26","1608","1443/410809","10/12/2018","10/18/2018","Contig","2018-10-12T00:00:00Z","University of Western Australia","Illumina MiSeq","264x","SPAdes v. 3.8.2","","","26","1610206","Australia","Human, Homo sapiens"
"Helicobacter pylori HP15054","410811","210","210.5025","","","N/A","","ftp://ftp.ncbi.nlm.nih.gov/genomes/all/GCF/003/636/545/GCF_003636545.1_ASM363654v1","ftp://ftp.ncbi.nlm.nih.gov/genomes/all/GCA/003/636/545/GCA_003636545.1_ASM363654v1","SAMN06329574","PRJNA374603","GCA_003636545.1","1.61088","38.9","-","MVTT01","34","1578","1452/410811","10/12/2018","10/18/2018","Contig","2018-10-12T00:00:00Z","University of Western Australia","Illumina MiSeq","317x","SPAdes v. 3.8.2","","","34","1610877","Australia","Human, Homo sapiens"
"Helicobacter pylori HP15058","410775","210","210.4988","","","N/A","","ftp://ftp.ncbi.nlm.nih.gov/genomes/all/GCF/003/635/825/GCF_003635825.1_ASM363582v1","ftp://ftp.ncbi.nlm.nih.gov/genomes/all/GCA/003/635/825/GCA_003635825.1_ASM363582v1","SAMN06329575","PRJNA374603","GCA_003635825.1","1.54915","39.1","-","MVTS01","28","1535","1381/410775","10/12/2018","10/18/2018","Contig","2018-10-12T00:00:00Z","University of Western Australia","Illumina MiSeq","201x","SPAdes v. 3.8.2","","","28","1549150","Australia","Human, Homo sapiens"
"Helicobacter pylori HP15059","410773","210","210.4987","","","N/A","","ftp://ftp.ncbi.nlm.nih.gov/genomes/all/GCF/003/635/785/GCF_003635785.1_ASM363578v1","ftp://ftp.ncbi.nlm.nih.gov/genomes/all/GCA/003/635/785/GCA_003635785.1_ASM363578v1","SAMN06329576","PRJNA374603","GCA_003635785.1","1.66059","39","-","MVTR01","57","1625","1469/410773","10/12/2018","10/18/2018","Contig","2018-10-12T00:00:00Z","University of Western Australia","Illumina MiSeq","45x","SPAdes v. 3.8.2","","","57","1660590","Australia","Human, Homo sapiens"
"Helicobacter pylori HP15060","410774","210","210.4989","","","N/A","","ftp://ftp.ncbi.nlm.nih.gov/genomes/all/GCF/003/635/795/GCF_003635795.1_ASM363579v1","ftp://ftp.ncbi.nlm.nih.gov/genomes/all/GCA/003/635/795/GCA_003635795.1_ASM363579v1","SAMN06329577","PRJNA374603","GCA_003635795.1","1.62069","38.9","-","MVTQ01","36","1608","1470/410774","10/12/2018","10/18/2018","Contig","2018-10-12T00:00:00Z","University of Western Australia","Illumina MiSeq","177x","SPAdes v. 3.8.2","","","36","1620688","Australia","Human, Homo sapiens"
"Helicobacter pylori HP15067","410772","210","210.4986","","","N/A","","ftp://ftp.ncbi.nlm.nih.gov/genomes/all/GCF/003/635/765/GCF_003635765.1_ASM363576v1","ftp://ftp.ncbi.nlm.nih.gov/genomes/all/GCA/003/635/765/GCA_003635765.1_ASM363576v1","SAMN06329578","PRJNA374603","GCA_003635765.1","1.58108","38.8","-","MVTP01","25","1569","1420/410772","10/12/2018","10/18/2018","Contig","2018-10-12T00:00:00Z","University of Western Australia","Illumina MiSeq","663x","SPAdes v. 3.8.2","","","25","1581081","Australia","Human, Homo sapiens"
"Helicobacter pylori HP16001","410808","210","210.5022","","","N/A","","ftp://ftp.ncbi.nlm.nih.gov/genomes/all/GCF/003/636/485/GCF_003636485.1_ASM363648v1","ftp://ftp.ncbi.nlm.nih.gov/genomes/all/GCA/003/636/485/GCA_003636485.1_ASM363648v1","SAMN06329579","PRJNA374603","GCA_003636485.1","1.70146","38.6","-","MVTO01","43","1690","1548/410808","10/12/2018","10/18/2018","Contig","2018-10-12T00:00:00Z","University of Western Australia","Illumina MiSeq","654x","SPAdes v. 3.8.2","","","43","1701459","Australia","Human, Homo sapiens"
"Helicobacter pylori HP16004","410807","210","210.5021","","","N/A","","ftp://ftp.ncbi.nlm.nih.gov/genomes/all/GCF/003/636/455/GCF_003636455.1_ASM363645v1","ftp://ftp.ncbi.nlm.nih.gov/genomes/all/GCA/003/636/455/GCA_003636455.1_ASM363645v1","SAMN06329580","PRJNA374603","GCA_003636455.1","1.52129","39","-","MVTN01","21","1533","1385/410807","10/12/2018","10/18/2018","Contig","2018-10-12T00:00:00Z","University of Western Australia","Illumina MiSeq","618x","SPAdes v. 3.8.2","","","21","1521290","Australia","Human, Homo sapiens"
"Helicobacter pylori HP16008","410806","210","210.5020","","","N/A","","ftp://ftp.ncbi.nlm.nih.gov/genomes/all/GCF/003/636/445/GCF_003636445.1_ASM363644v1","ftp://ftp.ncbi.nlm.nih.gov/genomes/all/GCA/003/636/445/GCA_003636445.1_ASM363644v1","SAMN06329581","PRJNA374603","GCA_003636445.1","1.64854","38.9","-","MVTM01","32","1652","1476/410806","10/12/2018","10/18/2018","Contig","2018-10-12T00:00:00Z","University of Western Australia","Illumina MiSeq","592x","SPAdes v. 3.8.2","","","32","1648542","Australia","Human, Homo sapiens"
"Helicobacter pylori HP16042","455530","210","210.5647","","","N/A","","ftp://ftp.ncbi.nlm.nih.gov/genomes/all/GCF/004/323/455/GCF_004323455.1_ASM432345v1","ftp://ftp.ncbi.nlm.nih.gov/genomes/all/GCA/004/323/455/GCA_004323455.1_ASM432345v1","SAMN07540331","PRJNA374603","GCA_004323455.1","1.62907","39.1","-","NYJN01","39","1612","1457/455530","3/4/2019","3/6/2019","Contig","2019-03-04T00:00:00Z","University of Western Australia","Illumina MiSeq","82x","SPAdes v. 3.10.1","","","39","1629068","Australia","Human, Homo sapiens"
"Helicobacter pylori HP16051","455528","210","210.5646","","","N/A","","ftp://ftp.ncbi.nlm.nih.gov/genomes/all/GCF/004/323/415/GCF_004323415.1_ASM432341v1","ftp://ftp.ncbi.nlm.nih.gov/genomes/all/GCA/004/323/415/GCA_004323415.1_ASM432341v1","SAMN07540332","PRJNA374603","GCA_004323415.1","1.60235","38.8","-","NYJM01","64","1608","1445/455528","3/4/2019","3/6/2019","Contig","2019-03-04T00:00:00Z","University of Western Australia","Illumina MiSeq","95x","SPAdes v. 3.10.1","","","64","1602346","Australia","Human, Homo sapiens"
"Helicobacter pylori HP16052","455522","210","210.5639","","","N/A","","ftp://ftp.ncbi.nlm.nih.gov/genomes/all/GCF/004/323/305/GCF_004323305.1_ASM432330v1","ftp://ftp.ncbi.nlm.nih.gov/genomes/all/GCA/004/323/305/GCA_004323305.1_ASM432330v1","SAMN07540333","PRJNA374603","GCA_004323305.1","1.62799","38.8","-","NYJL01","59","1624","1477/455522","3/4/2019","3/6/2019","Contig","2019-03-04T00:00:00Z","University of Western Australia","Illumina MiSeq","116x","SPAdes v. 3.10.1","","","59","1627989","Australia","Human, Homo sapiens"
"Helicobacter pylori HP16055","455533","210","210.5650","","","N/A","","ftp://ftp.ncbi.nlm.nih.gov/genomes/all/GCF/004/323/525/GCF_004323525.1_ASM432352v1","ftp://ftp.ncbi.nlm.nih.gov/genomes/all/GCA/004/323/525/GCA_004323525.1_ASM432352v1","SAMN07540334","PRJNA374603","GCA_004323525.1","1.61346","38.9","-","NYJK01","78","1614","1462/455533","3/4/2019","3/6/2019","Contig","2019-03-04T00:00:00Z","University of Western Australia","Illumina MiSeq","61x","SPAdes v. 3.10.1","","","78","1613462","Australia","Human, Homo sapiens"
"Helicobacter pylori HP16056","455532","210","210.5649","","","N/A","","ftp://ftp.ncbi.nlm.nih.gov/genomes/all/GCF/004/323/515/GCF_004323515.1_ASM432351v1","ftp://ftp.ncbi.nlm.nih.gov/genomes/all/GCA/004/323/515/GCA_004323515.1_ASM432351v1","SAMN07540335","PRJNA374603","GCA_004323515.1","1.61666","38.9","-","NYJJ01","41","1616","1483/455532","3/4/2019","3/6/2019","Contig","2019-03-04T00:00:00Z","University of Western Australia","Illumina MiSeq","121x","SPAdes v. 3.10.1","","","41","1616663","Australia","Human, Homo sapiens"
"Helicobacter pylori HP16062","455527","210","210.5644","","","N/A","","ftp://ftp.ncbi.nlm.nih.gov/genomes/all/GCF/004/323/385/GCF_004323385.1_ASM432338v1","ftp://ftp.ncbi.nlm.nih.gov/genomes/all/GCA/004/323/385/GCA_004323385.1_ASM432338v1","SAMN07540336","PRJNA374603","GCA_004323385.1","1.64543","38.9","-","NYJI01","39","1653","1470/455527","3/4/2019","3/6/2019","Contig","2019-03-04T00:00:00Z","University of Western Australia","Illumina MiSeq","143x","SPAdes v. 3.10.1","","","39","1645426","Australia","Human, Homo sapiens"
"Helicobacter pylori HP2RS","163660","1111674","1111674.3","","GCF_000258825","N/A","","ftp://ftp.ncbi.nlm.nih.gov/genomes/all/GCF/000/258/825/GCF_000258825.1_ASM25882v1","ftp://ftp.ncbi.nlm.nih.gov/genomes/all/GCA/000/258/825/GCA_000258825.1_ASM25882v1","SAMN02471468","PRJNA76567","GCA_000258825.1","1.61765","38.9","-","AIHW01","215","1709","1433/163660","4/16/2012","3/22/2017","Contig","2012-04-16T00:00:00Z","Microbiology Dept, University College Cork","","","","","","215","1617653","Germany","Human, Homo sapiens"
"Helicobacter pylori HP45","517732","210","210.5652","","","N/A","","ftp://ftp.ncbi.nlm.nih.gov/genomes/all/GCF/005/250/645/GCF_005250645.1_ASM525064v1","ftp://ftp.ncbi.nlm.nih.gov/genomes/all/GCA/005/250/645/GCA_005250645.1_ASM525064v1","SAMN11557456","PRJNA540766","GCA_005250645.1","1.63255","38.8","-","SZUB01","118","1618","1447/517732","5/10/2019","5/12/2019","Contig","2019-05-10T00:00:00Z","Medical Institution in Homel","IonTorrent","30.0x","SPAdes v. 3.13","","","118","1632546","","Human, Homo sapiens"
"Helicobacter pylori HP725g","313371","210","210.2675","","","N/A","","ftp://ftp.ncbi.nlm.nih.gov/genomes/all/GCF/002/081/955/GCF_002081955.1_ASM208195v1","ftp://ftp.ncbi.nlm.nih.gov/genomes/all/GCA/002/081/955/GCA_002081955.1_ASM208195v1","SAMN06240245","PRJNA362473","GCA_002081955.1","1.71262","39.3","-","MTLF01","282","1689","1523/313371","4/7/2017","7/30/2019","Contig","2017-04-07T00:00:00Z","","","","","","","282","1712620","Morocco","Human, Homo sapiens"
"Helicobacter pylori HP87hu","163813","1354718","1354718.3","","","N/A","","ftp://ftp.ncbi.nlm.nih.gov/genomes/all/GCF/000/470/135/GCF_000470135.1_HP87hu","ftp://ftp.ncbi.nlm.nih.gov/genomes/all/GCA/000/470/135/GCA_000470135.1_HP87hu","SAMEA2272409","PRJEB4248","GCA_000470135.1","1.63776","38.9","-","CBRI01","72","1641","1437/163813","9/2/2013","3/24/2017","Contig","2013-09-02T00:00:00Z","MHH","","","","","","72","1637756","Germany","Mongolian gerbil, Meriones unguiculatus"
"Helicobacter pylori HP87P7","163814","1354719","1354719.3","","","N/A","","ftp://ftp.ncbi.nlm.nih.gov/genomes/all/GCF/000/470/355/GCF_000470355.1_HP87P7","ftp://ftp.ncbi.nlm.nih.gov/genomes/all/GCA/000/470/355/GCA_000470355.1_HP87P7","SAMEA2272152","PRJEB4249","GCA_000470355.1","1.66457","38.7","-","CBRJ01","46","1647","1443/163814","9/2/2013","1/31/2019","Contig","2013-09-02T00:00:00Z","MHH","","","","","","46","1664575","Germany","Mongolian gerbil, Meriones unguiculatus"
"Helicobacter pylori HP87P7tlpDRI","163812","1354721","1354721.3","","","N/A","","ftp://ftp.ncbi.nlm.nih.gov/genomes/all/GCF/000/470/075/GCF_000470075.1_HP87tlpDRI","ftp://ftp.ncbi.nlm.nih.gov/genomes/all/GCA/000/470/075/GCA_000470075.1_HP87tlpDRI","SAMEA2272529","PRJEB4251","GCA_000470075.1","1.66499","38.7","-","CBRL01","46","1656","1450/163812","9/2/2013","3/24/2017","Contig","2013-09-02T00:00:00Z","MHH","","","","","","46","1664988","Germany","Mongolian gerbil, Meriones unguiculatus"
"Helicobacter pylori HP87tlpD","163811","1354720","1354720.3","","","N/A","","ftp://ftp.ncbi.nlm.nih.gov/genomes/all/GCF/000/469/985/GCF_000469985.1_HP87P7tlpD","ftp://ftp.ncbi.nlm.nih.gov/genomes/all/GCA/000/469/985/GCA_000469985.1_HP87P7tlpD","SAMEA2272729","PRJEB4250","GCA_000469985.1","1.66447","38.7","-","CBRK01","49","1659","1448/163811","9/2/2013","3/24/2017","Contig","2013-09-02T00:00:00Z","MHH","","","","","","49","1664475","Germany","Mongolian gerbil, Meriones unguiculatus"
"Helicobacter pylori HP97011","410805","210","210.5019","","","N/A","","ftp://ftp.ncbi.nlm.nih.gov/genomes/all/GCF/003/636/415/GCF_003636415.1_ASM363641v1","ftp://ftp.ncbi.nlm.nih.gov/genomes/all/GCA/003/636/415/GCA_003636415.1_ASM363641v1","SAMN06329582","PRJNA374603","GCA_003636415.1","1.55206","39.1","-","MVTL01","23","1549","1396/410805","10/12/2018","10/18/2018","Contig","2018-10-12T00:00:00Z","University of Western Australia","Illumina MiSeq","160x","SPAdes v. 3.8.2","","","23","1552062","Australia","Human, Homo sapiens"
"Helicobacter pylori HP98123","410804","210","210.5018","","","N/A","","ftp://ftp.ncbi.nlm.nih.gov/genomes/all/GCF/003/636/395/GCF_003636395.1_ASM363639v1","ftp://ftp.ncbi.nlm.nih.gov/genomes/all/GCA/003/636/395/GCA_003636395.1_ASM363639v1","SAMN06329583","PRJNA374603","GCA_003636395.1","1.63433","38.8","-","MVTK01","42","1621","1465/410804","10/12/2018","10/18/2018","Contig","2018-10-12T00:00:00Z","University of Western Australia","Illumina MiSeq","109x","SPAdes v. 3.8.2","","","42","1634330","Australia","Human, Homo sapiens"
"Helicobacter pylori HP98317","410771","210","210.4985","","","N/A","","ftp://ftp.ncbi.nlm.nih.gov/genomes/all/GCF/003/635/735/GCF_003635735.1_ASM363573v1","ftp://ftp.ncbi.nlm.nih.gov/genomes/all/GCA/003/635/735/GCA_003635735.1_ASM363573v1","SAMN06329585","PRJNA374603","GCA_003635735.1","1.60238","38.9","-","MVTI01","36","1594","1445/410771","10/12/2018","10/18/2018","Contig","2018-10-12T00:00:00Z","University of Western Australia","Illumina MiSeq","131x","SPAdes v. 3.8.2","","","36","1602375","Australia","Human, Homo sapiens"
"Helicobacter pylori HP98490","410803","210","210.5017","","","N/A","","ftp://ftp.ncbi.nlm.nih.gov/genomes/all/GCF/003/636/385/GCF_003636385.1_ASM363638v1","ftp://ftp.ncbi.nlm.nih.gov/genomes/all/GCA/003/636/385/GCA_003636385.1_ASM363638v1","SAMN06329586","PRJNA374603","GCA_003636385.1","1.68768","38.7","-","MVTH01","38","1687","1536/410803","10/12/2018","10/18/2018","Contig","2018-10-12T00:00:00Z","University of Western Australia","Illumina MiSeq","79x","SPAdes v. 3.8.2","","","38","1687678","Australia","Human, Homo sapiens"
"Helicobacter pylori HP99216","410770","210","210.4984","","","N/A","","ftp://ftp.ncbi.nlm.nih.gov/genomes/all/GCF/003/635/715/GCF_003635715.1_ASM363571v1","ftp://ftp.ncbi.nlm.nih.gov/genomes/all/GCA/003/635/715/GCA_003635715.1_ASM363571v1","SAMN06329587","PRJNA374603","GCA_003635715.1","1.6282","39.1","-","MVTG01","46","1616","1457/410770","10/12/2018","10/18/2018","Contig","2018-10-12T00:00:00Z","University of Western Australia","Illumina MiSeq","150x","SPAdes v. 3.8.2","","","46","1628204","Australia","Human, Homo sapiens"
"Helicobacter pylori HP99244","410802","210","210.5016","","","N/A","","ftp://ftp.ncbi.nlm.nih.gov/genomes/all/GCF/003/636/355/GCF_003636355.1_ASM363635v1","ftp://ftp.ncbi.nlm.nih.gov/genomes/all/GCA/003/636/355/GCA_003636355.1_ASM363635v1","SAMN06329588","PRJNA374603","GCA_003636355.1","1.61291","39","-","MVTF01","31","1596","1450/410802","10/12/2018","10/18/2018","Contig","2018-10-12T00:00:00Z","University of Western Australia","Illumina MiSeq","136x","SPAdes v. 3.8.2","","","31","1612906","Australia","Human, Homo sapiens"
"Helicobacter pylori HP99255","410769","210","210.4983","","","N/A","","ftp://ftp.ncbi.nlm.nih.gov/genomes/all/GCF/003/635/705/GCF_003635705.1_ASM363570v1","ftp://ftp.ncbi.nlm.nih.gov/genomes/all/GCA/003/635/705/GCA_003635705.1_ASM363570v1","SAMN06329589","PRJNA374603","GCA_003635705.1","1.56473","39.1","-","MVTE01","28","1550","1412/410769","10/12/2018","10/18/2018","Contig","2018-10-12T00:00:00Z","University of Western Australia","Illumina MiSeq","156x","SPAdes v. 3.8.2","","","28","1564730","Australia","Human, Homo sapiens"
"Helicobacter pylori HP99316","410801","210","210.5015","","","N/A","","ftp://ftp.ncbi.nlm.nih.gov/genomes/all/GCF/003/636/335/GCF_003636335.1_ASM363633v1","ftp://ftp.ncbi.nlm.nih.gov/genomes/all/GCA/003/636/335/GCA_003636335.1_ASM363633v1","SAMN06329590","PRJNA374603","GCA_003636335.1","1.66079","38.8","-","MVTD01","46","1669","1506/410801","10/12/2018","10/18/2018","Contig","2018-10-12T00:00:00Z","University of Western Australia","Illumina MiSeq","88x","SPAdes v. 3.8.2","","","46","1660794","Australia","Human, Homo sapiens"
"Helicobacter pylori HP99330","410768","210","210.4982","","","N/A","","ftp://ftp.ncbi.nlm.nih.gov/genomes/all/GCF/003/635/665/GCF_003635665.1_ASM363566v1","ftp://ftp.ncbi.nlm.nih.gov/genomes/all/GCA/003/635/665/GCA_003635665.1_ASM363566v1","SAMN06329591","PRJNA374603","GCA_003635665.1","1.59625","39.2","-","MVTC01","38","1575","1428/410768","10/12/2018","10/18/2018","Contig","2018-10-12T00:00:00Z","University of Western Australia","Illumina MiSeq","114x","SPAdes v. 3.8.2","","","38","1596254","Australia","Human, Homo sapiens"
"Helicobacter pylori HP99392","410767","210","210.4981","","","N/A","","ftp://ftp.ncbi.nlm.nih.gov/genomes/all/GCF/003/635/655/GCF_003635655.1_ASM363565v1","ftp://ftp.ncbi.nlm.nih.gov/genomes/all/GCA/003/635/655/GCA_003635655.1_ASM363565v1","SAMN06329592","PRJNA374603","GCA_003635655.1","1.63121","38.8","-","MVTB01","31","1623","1471/410767","10/12/2018","10/18/2018","Contig","2018-10-12T00:00:00Z","University of Western Australia","Illumina MiSeq","109x","SPAdes v. 3.8.2","","","31","1631211","Australia","Human, Homo sapiens"
"Helicobacter pylori HP99521","410766","210","210.4980","","","N/A","","ftp://ftp.ncbi.nlm.nih.gov/genomes/all/GCF/003/635/645/GCF_003635645.1_ASM363564v1","ftp://ftp.ncbi.nlm.nih.gov/genomes/all/GCA/003/635/645/GCA_003635645.1_ASM363564v1","SAMN06329595","PRJNA374603","GCA_003635645.1","1.62421","39","-","MVSY01","43","1606","1441/410766","10/12/2018","10/19/2018","Contig","2018-10-12T00:00:00Z","University of Western Australia","Illumina MiSeq","104x","SPAdes v. 3.8.2","","","43","1624208","Australia","Human, Homo sapiens"
"Helicobacter pylori HP99647","410765","210","210.4979","","","N/A","","ftp://ftp.ncbi.nlm.nih.gov/genomes/all/GCF/003/635/615/GCF_003635615.1_ASM363561v1","ftp://ftp.ncbi.nlm.nih.gov/genomes/all/GCA/003/635/615/GCA_003635615.1_ASM363561v1","SAMN06329596","PRJNA374603","GCA_003635615.1","1.60097","39","-","MVSX01","30","1569","1447/410765","10/12/2018","10/18/2018","Contig","2018-10-12T00:00:00Z","University of Western Australia","Illumina MiSeq","100x","SPAdes v. 3.8.2","","","30","1600967","Australia","Human, Homo sapiens"
"Helicobacter pylori HP99648","410800","210","210.5014","","","N/A","","ftp://ftp.ncbi.nlm.nih.gov/genomes/all/GCF/003/636/325/GCF_003636325.1_ASM363632v1","ftp://ftp.ncbi.nlm.nih.gov/genomes/all/GCA/003/636/325/GCA_003636325.1_ASM363632v1","SAMN06329597","PRJNA374603","GCA_003636325.1","1.6228","39.1","-","MVSW01","29","1599","1451/410800","10/12/2018","10/18/2018","Contig","2018-10-12T00:00:00Z","University of Western Australia","Illumina MiSeq","105x","SPAdes v. 3.8.2","","","29","1622797","Australia","Human, Homo sapiens"
"Helicobacter pylori HP99689","410798","210","210.5012","","","N/A","","ftp://ftp.ncbi.nlm.nih.gov/genomes/all/GCF/003/636/275/GCF_003636275.1_ASM363627v1","ftp://ftp.ncbi.nlm.nih.gov/genomes/all/GCA/003/636/275/GCA_003636275.1_ASM363627v1","SAMN06329598","PRJNA374603","GCA_003636275.1","1.61521","38.8","-","MVSV01","47","1604","1457/410798","10/12/2018","10/18/2018","Contig","2018-10-12T00:00:00Z","University of Western Australia","Illumina MiSeq","112x","SPAdes v. 3.8.2","","","47","1615212","Australia","Human, Homo sapiens"
"Helicobacter pylori HPARG63","299790","1338534","1338534.3","","","N/A","","ftp://ftp.ncbi.nlm.nih.gov/genomes/all/GCF/000/438/495/GCF_000438495.1_HP63C","ftp://ftp.ncbi.nlm.nih.gov/genomes/all/GCA/000/438/495/GCA_000438495.1_HP63C","SAMEA2272629","PRJEB1889","GCA_000438495.1","1.66868","38.8","-","CBKY01","34","1638","1486/299790","6/30/2013","3/24/2017","Contig","2013-06-30T00:00:00Z","IMPAM","","","","","","34","1668677","",""
"Helicobacter pylori HPARG8G","299789","1333704","1333704.3","","","N/A","","ftp://ftp.ncbi.nlm.nih.gov/genomes/all/GCF/000/438/475/GCF_000438475.1_HP8GU","ftp://ftp.ncbi.nlm.nih.gov/genomes/all/GCA/000/438/475/GCA_000438475.1_HP8GU","SAMEA2272011","PRJEB1920","GCA_000438475.1","1.60223","39","-","CBKZ01","47","1577","1421/299789","7/2/2013","3/24/2017","Contig","2013-07-02T00:00:00Z","IMPAM","","","","","","47","1602229","",""
"Helicobacter pylori HPAS14","410763","210","210.4977","","","N/A","","ftp://ftp.ncbi.nlm.nih.gov/genomes/all/GCF/003/635/585/GCF_003635585.1_ASM363558v1","ftp://ftp.ncbi.nlm.nih.gov/genomes/all/GCA/003/635/585/GCA_003635585.1_ASM363558v1","SAMN06329599","PRJNA374603","GCA_003635585.1","1.57792","39","-","MVSU01","36","1564","1418/410763","10/12/2018","10/18/2018","Contig","2018-10-12T00:00:00Z","University of Western Australia","Illumina MiSeq","54x","SPAdes v. 3.8.2","","","36","1577919","Australia","Human, Homo sapiens"
"Helicobacter pylori HPJ013","410764","210","210.4978","","","N/A","","ftp://ftp.ncbi.nlm.nih.gov/genomes/all/GCF/003/635/595/GCF_003635595.1_ASM363559v1","ftp://ftp.ncbi.nlm.nih.gov/genomes/all/GCA/003/635/595/GCA_003635595.1_ASM363559v1","SAMN06329602","PRJNA374603","GCA_003635595.1","1.66223","38.7","-","MVSR01","51","1662","1493/410764","10/12/2018","10/18/2018","Contig","2018-10-12T00:00:00Z","University of Western Australia","Illumina MiSeq","99x","SPAdes v. 3.8.2","","","51","1662228","Australia","Human, Homo sapiens"
"Helicobacter pylori HPJ024","410799","210","210.5013","","","N/A","","ftp://ftp.ncbi.nlm.nih.gov/genomes/all/GCF/003/636/285/GCF_003636285.1_ASM363628v1","ftp://ftp.ncbi.nlm.nih.gov/genomes/all/GCA/003/636/285/GCA_003636285.1_ASM363628v1","SAMN06329605","PRJNA374603","GCA_003636285.1","1.68408","38.7","-","MVSO01","47","1679","1521/410799","10/12/2018","10/18/2018","Contig","2018-10-12T00:00:00Z","University of Western Australia","Illumina MiSeq","65x","SPAdes v. 3.8.2","","","47","1684079","Australia","Human, Homo sapiens"
"Helicobacter pylori HPJ025","410797","210","210.5011","","","N/A","","ftp://ftp.ncbi.nlm.nih.gov/genomes/all/GCF/003/636/265/GCF_003636265.1_ASM363626v1","ftp://ftp.ncbi.nlm.nih.gov/genomes/all/GCA/003/636/265/GCA_003636265.1_ASM363626v1","SAMN06329606","PRJNA374603","GCA_003636265.1","1.6821","38.7","-","MVSN01","53","1680","1515/410797","10/12/2018","10/18/2018","Contig","2018-10-12T00:00:00Z","University of Western Australia","Illumina MiSeq","59x","SPAdes v. 3.8.2","","","53","1682100","Australia","Human, Homo sapiens"
"Helicobacter pylori HPJ040","410762","210","210.4975","","","N/A","","ftp://ftp.ncbi.nlm.nih.gov/genomes/all/GCF/003/635/555/GCF_003635555.1_ASM363555v1","ftp://ftp.ncbi.nlm.nih.gov/genomes/all/GCA/003/635/555/GCA_003635555.1_ASM363555v1","SAMN06329607","PRJNA374603","GCA_003635555.1","1.64712","38.8","-","MVSM01","47","1629","1474/410762","10/12/2018","10/18/2018","Contig","2018-10-12T00:00:00Z","University of Western Australia","Illumina MiSeq","90x","SPAdes v. 3.8.2","","","47","1647118","Australia","Human, Homo sapiens"
"Helicobacter pylori HPJ050","410796","210","210.5010","","","N/A","","ftp://ftp.ncbi.nlm.nih.gov/genomes/all/GCF/003/636/225/GCF_003636225.1_ASM363622v1","ftp://ftp.ncbi.nlm.nih.gov/genomes/all/GCA/003/636/225/GCA_003636225.1_ASM363622v1","SAMN06329608","PRJNA374603","GCA_003636225.1","1.68259","38.7","-","MVSL01","68","1684","1509/410796","10/12/2018","10/18/2018","Contig","2018-10-12T00:00:00Z","University of Western Australia","Illumina MiSeq","100x","SPAdes v. 3.8.2","","","68","1682586","Australia","Human, Homo sapiens"
"Helicobacter pylori HPJ099","410794","210","210.5008","","","N/A","","ftp://ftp.ncbi.nlm.nih.gov/genomes/all/GCF/003/636/205/GCF_003636205.1_ASM363620v1","ftp://ftp.ncbi.nlm.nih.gov/genomes/all/GCA/003/636/205/GCA_003636205.1_ASM363620v1","SAMN06329614","PRJNA374603","GCA_003636205.1","1.5808","39","-","MVSF01","28","1572","1439/410794","10/12/2018","10/18/2018","Contig","2018-10-12T00:00:00Z","University of Western Australia","Illumina MiSeq","110x","SPAdes v. 3.8.2","","","28","1580798","Australia","Human, Homo sapiens"
"Helicobacter pylori HPJ118","410795","210","210.5009","","","N/A","","ftp://ftp.ncbi.nlm.nih.gov/genomes/all/GCF/003/636/215/GCF_003636215.1_ASM363621v1","ftp://ftp.ncbi.nlm.nih.gov/genomes/all/GCA/003/636/215/GCA_003636215.1_ASM363621v1","SAMN06329616","PRJNA374603","GCA_003636215.1","1.6469","38.8","-","MVSD01","42","1629","1468/410795","10/12/2018","10/18/2018","Contig","2018-10-12T00:00:00Z","University of Western Australia","Illumina MiSeq","108x","SPAdes v. 3.8.2","","","42","1646903","Australia","Human, Homo sapiens"
"Helicobacter pylori HPJ165","410761","210","210.4976","","","N/A","","ftp://ftp.ncbi.nlm.nih.gov/genomes/all/GCF/003/635/545/GCF_003635545.1_ASM363554v1","ftp://ftp.ncbi.nlm.nih.gov/genomes/all/GCA/003/635/545/GCA_003635545.1_ASM363554v1","SAMN06329620","PRJNA374603","GCA_003635545.1","1.69431","38.8","-","MVRZ01","55","1683","1529/410761","10/12/2018","10/18/2018","Contig","2018-10-12T00:00:00Z","University of Western Australia","Illumina MiSeq","93x","SPAdes v. 3.8.2","","","55","1694310","Australia","Human, Homo sapiens"
"Helicobacter pylori HPKX_438_AG0C1","201851","499171","499171.4","","HPYL499171","N/A","","ftp://ftp.ncbi.nlm.nih.gov/genomes/all/GCF/000/172/195/GCF_000172195.1_ASM17219v1","ftp://ftp.ncbi.nlm.nih.gov/genomes/all/GCA/000/172/195/GCA_000172195.1_ASM17219v1","SAMN00000754","PRJNA28543","GCA_000172195.1","1.81966","39.5","-","ABJO01","2602","-","-/201851","3/27/2008","11/19/2013","Contig","2008-03-27T00:00:00Z","Washington University Medical School","","","","","","2602","1819663","","Human, Homo sapiens"
"Helicobacter pylori HPKX_438_CA4C1","201852","499172","499172.4","","HPYL499172","N/A","","ftp://ftp.ncbi.nlm.nih.gov/genomes/all/GCF/000/172/215/GCF_000172215.1_ASM17221v1","ftp://ftp.ncbi.nlm.nih.gov/genomes/all/GCA/000/172/215/GCA_000172215.1_ASM17221v1","SAMN00000755","PRJNA28545","GCA_000172215.1","1.56639","39.2","-","ABJP01","3766","-","-/201852","3/27/2008","11/19/2013","Contig","2008-03-27T00:00:00Z","Washington University Medical School","","","","","","3766","1566388","","Human, Homo sapiens"
"Helicobacter pylori Iso6","361267","1431451","1431451.3","","","N/A","","ftp://ftp.ncbi.nlm.nih.gov/genomes/all/GCF/002/900/195/GCF_002900195.1_ASM290019v1","ftp://ftp.ncbi.nlm.nih.gov/genomes/all/GCA/002/900/195/GCA_002900195.1_ASM290019v1","SAMN04350627","PRJNA230062","GCA_002900195.1","1.58072","39","-","AZBQ01","53","1592","1425/361267","1/25/2018","8/9/2019","Contig","2018-01-25T00:00:00Z","Aarhus University","Illumina GAIIx","50.0x","SOAPdenovo v. 2015","","","53","1580715","Germany","Human, Homo sapiens"
"Helicobacter pylori Iso8","361266","1431452","1431452.3","","","N/A","","ftp://ftp.ncbi.nlm.nih.gov/genomes/all/GCF/002/900/175/GCF_002900175.1_ASM290017v1","ftp://ftp.ncbi.nlm.nih.gov/genomes/all/GCA/002/900/175/GCA_002900175.1_ASM290017v1","SAMN04350644","PRJNA230063","GCA_002900175.1","1.57839","39","-","AZBS01","55","1591","1425/361266","1/25/2018","3/19/2019","Contig","2018-01-25T00:00:00Z","Aarhus University","Illumina GAIIx","50.0x","SOAPdenovo v. 2015","","","55","1578391","Germany","Human, Homo sapiens"
"Helicobacter pylori JGF25","410932","210","210.5155","","","N/A","","ftp://ftp.ncbi.nlm.nih.gov/genomes/all/GCF/003/639/675/GCF_003639675.1_ASM363967v1","ftp://ftp.ncbi.nlm.nih.gov/genomes/all/GCA/003/639/675/GCA_003639675.1_ASM363967v1","SAMN08999424","PRJNA449871","GCA_003639675.1","1.62344","39","-","QEGJ01","43","1618","1454/410932","10/12/2018","8/20/2019","Contig","2018-10-12T00:00:00Z","Facultat de Farmacia i Ciencies de l'Alimentacio; Universitat de Barcelona","Illumina HiSeq","406x","A5-miseq v. 20160825","","","43","1623437","Spain","Human, Homo sapiens"
"Helicobacter pylori KH0022","592607","210","210.6019","","","N/A","","ftp://ftp.ncbi.nlm.nih.gov/genomes/all/GCF/006/439/955/GCF_006439955.1_ASM643995v1","ftp://ftp.ncbi.nlm.nih.gov/genomes/all/GCA/006/439/955/GCA_006439955.1_ASM643995v1","SAMN12011802","PRJNA547954","GCA_006439955.1","1.62224","38.7","-","VEZO01","43","1611","1445/592607","6/24/2019","6/28/2019","Contig","2019-06-24T00:00:00Z","Oita university","Illumina MiSeq","9x","SPAdes v. 3.12.0","","","43","1622236","Cambodia","Homo sapiens"
"Helicobacter pylori KH0025","592619","210","210.6040","","","N/A","","ftp://ftp.ncbi.nlm.nih.gov/genomes/all/GCF/006/440/345/GCF_006440345.1_ASM644034v1","ftp://ftp.ncbi.nlm.nih.gov/genomes/all/GCA/006/440/345/GCA_006440345.1_ASM644034v1","SAMN12011803","PRJNA547954","GCA_006440345.1","1.63222","38.9","-","VEZN01","39","1607","1447/592619","6/24/2019","6/28/2019","Contig","2019-06-24T00:00:00Z","Oita university","Illumina MiSeq","16x","SPAdes v. 3.12.0","","","39","1632223","Cambodia","Homo sapiens"
"Helicobacter pylori KH0031","592612","210","210.6028","","","N/A","","ftp://ftp.ncbi.nlm.nih.gov/genomes/all/GCF/006/440/125/GCF_006440125.1_ASM644012v1","ftp://ftp.ncbi.nlm.nih.gov/genomes/all/GCA/006/440/125/GCA_006440125.1_ASM644012v1","SAMN12011804","PRJNA547954","GCA_006440125.1","1.56123","38.9","-","VEZM01","31","1555","1414/592612","6/24/2019","6/28/2019","Contig","2019-06-24T00:00:00Z","Oita university","Illumina MiSeq","17x","SPAdes v. 3.12.0","","","31","1561234","Cambodia","Homo sapiens"
"Helicobacter pylori KH0032","592596","210","210.6006","","","N/A","","ftp://ftp.ncbi.nlm.nih.gov/genomes/all/GCF/006/439/685/GCF_006439685.1_ASM643968v1","ftp://ftp.ncbi.nlm.nih.gov/genomes/all/GCA/006/439/685/GCA_006439685.1_ASM643968v1","SAMN12011805","PRJNA547954","GCA_006439685.1","1.59399","38.8","-","VEZL01","47","1578","1443/592596","6/24/2019","6/28/2019","Contig","2019-06-24T00:00:00Z","Oita university","Illumina MiSeq","16x","SPAdes v. 3.12.0","","","47","1593989","Cambodia","Homo sapiens"
"Helicobacter pylori KH0040","592603","210","210.6015","","","N/A","","ftp://ftp.ncbi.nlm.nih.gov/genomes/all/GCF/006/439/875/GCF_006439875.1_ASM643987v1","ftp://ftp.ncbi.nlm.nih.gov/genomes/all/GCA/006/439/875/GCA_006439875.1_ASM643987v1","SAMN12011807","PRJNA547954","GCA_006439875.1","1.62034","38.9","-","VEZJ01","52","1612","1484/592603","6/24/2019","6/28/2019","Contig","2019-06-24T00:00:00Z","Oita university","Illumina MiSeq","8x","SPAdes v. 3.12.0","","","52","1620336","Cambodia","Homo sapiens"
"Helicobacter pylori KH0042","592617","210","210.6036","","","N/A","","ftp://ftp.ncbi.nlm.nih.gov/genomes/all/GCF/006/440/285/GCF_006440285.1_ASM644028v1","ftp://ftp.ncbi.nlm.nih.gov/genomes/all/GCA/006/440/285/GCA_006440285.1_ASM644028v1","SAMN12011808","PRJNA547954","GCA_006440285.1","1.6152","38.7","-","VEZI01","48","1593","1436/592617","6/24/2019","6/28/2019","Contig","2019-06-24T00:00:00Z","Oita university","Illumina MiSeq","18x","SPAdes v. 3.12.0","","","48","1615198","Cambodia","Homo sapiens"
"Helicobacter pylori KH0045","592615","210","210.6032","","","N/A","","ftp://ftp.ncbi.nlm.nih.gov/genomes/all/GCF/006/440/215/GCF_006440215.1_ASM644021v1","ftp://ftp.ncbi.nlm.nih.gov/genomes/all/GCA/006/440/215/GCA_006440215.1_ASM644021v1","SAMN12011809","PRJNA547954","GCA_006440215.1","1.70746","38.7","-","VEZH01","47","1684","1513/592615","6/24/2019","6/28/2019","Contig","2019-06-24T00:00:00Z","Oita university","Illumina MiSeq","19x","SPAdes v. 3.12.0","","","47","1707464","Cambodia","Homo sapiens"
"Helicobacter pylori KH0054","592602","210","210.6014","","","N/A","","ftp://ftp.ncbi.nlm.nih.gov/genomes/all/GCF/006/439/845/GCF_006439845.1_ASM643984v1","ftp://ftp.ncbi.nlm.nih.gov/genomes/all/GCA/006/439/845/GCA_006439845.1_ASM643984v1","SAMN12011810","PRJNA547954","GCA_006439845.1","1.64649","38.8","-","VEZG01","66","1651","1502/592602","6/24/2019","6/28/2019","Contig","2019-06-24T00:00:00Z","Oita university","Illumina MiSeq","17x","SPAdes v. 3.12.0","","","66","1646489","Cambodia","Homo sapiens"
"Helicobacter pylori KH0065","592609","210","210.6023","","","N/A","","ftp://ftp.ncbi.nlm.nih.gov/genomes/all/GCF/006/440/025/GCF_006440025.1_ASM644002v1","ftp://ftp.ncbi.nlm.nih.gov/genomes/all/GCA/006/440/025/GCA_006440025.1_ASM644002v1","SAMN12011811","PRJNA547954","GCA_006440025.1","1.6494","38.8","-","VEZF01","51","1638","1474/592609","6/24/2019","6/28/2019","Contig","2019-06-24T00:00:00Z","Oita university","Illumina MiSeq","14x","SPAdes v. 3.12.0","","","51","1649404","Cambodia","Homo sapiens"
"Helicobacter pylori KH0066","592595","210","210.6005","","","N/A","","ftp://ftp.ncbi.nlm.nih.gov/genomes/all/GCF/006/439/655/GCF_006439655.1_ASM643965v1","ftp://ftp.ncbi.nlm.nih.gov/genomes/all/GCA/006/439/655/GCA_006439655.1_ASM643965v1","SAMN12011812","PRJNA547954","GCA_006439655.1","1.56428","38.9","-","VEZE01","46","1564","1413/592595","6/24/2019","6/28/2019","Contig","2019-06-24T00:00:00Z","Oita university","Illumina MiSeq","17x","SPAdes v. 3.12.0","","","46","1564277","Cambodia","Homo sapiens"
"Helicobacter pylori KH0070","592605","210","210.6017","","","N/A","","ftp://ftp.ncbi.nlm.nih.gov/genomes/all/GCF/006/439/905/GCF_006439905.1_ASM643990v1","ftp://ftp.ncbi.nlm.nih.gov/genomes/all/GCA/006/439/905/GCA_006439905.1_ASM643990v1","SAMN12011813","PRJNA547954","GCA_006439905.1","1.65004","38.8","-","VEZD01","32","1617","1450/592605","6/24/2019","6/28/2019","Contig","2019-06-24T00:00:00Z","Oita university","Illumina MiSeq","15x","SPAdes v. 3.12.0","","","32","1650045","Cambodia","Homo sapiens"
"Helicobacter pylori KH0071","592608","210","210.6020","","","N/A","","ftp://ftp.ncbi.nlm.nih.gov/genomes/all/GCF/006/439/965/GCF_006439965.1_ASM643996v1","ftp://ftp.ncbi.nlm.nih.gov/genomes/all/GCA/006/439/965/GCA_006439965.1_ASM643996v1","SAMN12011814","PRJNA547954","GCA_006439965.1","1.64391","38.8","-","VEZC01","40","1618","1469/592608","6/24/2019","6/28/2019","Contig","2019-06-24T00:00:00Z","Oita university","Illumina MiSeq","16x","SPAdes v. 3.12.0","","","40","1643911","Cambodia","Homo sapiens"
"Helicobacter pylori KH0075","592616","210","210.6035","","","N/A","","ftp://ftp.ncbi.nlm.nih.gov/genomes/all/GCF/006/440/265/GCF_006440265.1_ASM644026v1","ftp://ftp.ncbi.nlm.nih.gov/genomes/all/GCA/006/440/265/GCA_006440265.1_ASM644026v1","SAMN12011816","PRJNA547954","GCA_006440265.1","1.60984","38.7","-","VEZA01","53","1587","1441/592616","6/24/2019","6/28/2019","Contig","2019-06-24T00:00:00Z","Oita university","Illumina MiSeq","18x","SPAdes v. 3.12.0","","","53","1609845","Cambodia","Homo sapiens"
"Helicobacter pylori KH0086","592599","210","210.6009","","","N/A","","ftp://ftp.ncbi.nlm.nih.gov/genomes/all/GCF/006/439/745/GCF_006439745.1_ASM643974v1","ftp://ftp.ncbi.nlm.nih.gov/genomes/all/GCA/006/439/745/GCA_006439745.1_ASM643974v1","SAMN12011817","PRJNA547954","GCA_006439745.1","1.58859","38.8","-","VEYZ01","41","1569","1420/592599","6/24/2019","6/28/2019","Contig","2019-06-24T00:00:00Z","Oita university","Illumina MiSeq","20x","SPAdes v. 3.12.0","","","41","1588593","Cambodia","Homo sapiens"
"Helicobacter pylori KH0095","592613","210","210.6030","","","N/A","","ftp://ftp.ncbi.nlm.nih.gov/genomes/all/GCF/006/440/155/GCF_006440155.1_ASM644015v1","ftp://ftp.ncbi.nlm.nih.gov/genomes/all/GCA/006/440/155/GCA_006440155.1_ASM644015v1","SAMN12011819","PRJNA547954","GCA_006440155.1","1.64697","38.6","-","VEYX01","42","1631","1473/592613","6/24/2019","6/28/2019","Contig","2019-06-24T00:00:00Z","Oita university","Illumina MiSeq","11x","SPAdes v. 3.12.0","","","42","1646965","Cambodia","Homo sapiens"
"Helicobacter pylori KH0097","592598","210","210.6008","","","N/A","","ftp://ftp.ncbi.nlm.nih.gov/genomes/all/GCF/006/439/735/GCF_006439735.1_ASM643973v1","ftp://ftp.ncbi.nlm.nih.gov/genomes/all/GCA/006/439/735/GCA_006439735.1_ASM643973v1","SAMN12011820","PRJNA547954","GCA_006439735.1","1.59889","39","-","VEYW01","49","1596","1442/592598","6/24/2019","6/28/2019","Contig","2019-06-24T00:00:00Z","Oita university","Illumina MiSeq","3x","SPAdes v. 3.12.0","","","49","1598890","Cambodia","Homo sapiens"
"Helicobacter pylori KH0110","592621","210","210.6043","","","N/A","","ftp://ftp.ncbi.nlm.nih.gov/genomes/all/GCF/006/440/425/GCF_006440425.1_ASM644042v1","ftp://ftp.ncbi.nlm.nih.gov/genomes/all/GCA/006/440/425/GCA_006440425.1_ASM644042v1","SAMN12011822","PRJNA547954","GCA_006440425.1","1.60168","38.7","-","VEYU01","33","1611","1466/592621","6/24/2019","6/28/2019","Contig","2019-06-24T00:00:00Z","Oita university","Illumina MiSeq","23x","SPAdes v. 3.12.0","","","33","1601682","Cambodia","Homo sapiens"
"Helicobacter pylori KH0113","592614","210","210.6031","","","N/A","","ftp://ftp.ncbi.nlm.nih.gov/genomes/all/GCF/006/440/195/GCF_006440195.1_ASM644019v1","ftp://ftp.ncbi.nlm.nih.gov/genomes/all/GCA/006/440/195/GCA_006440195.1_ASM644019v1","SAMN12011823","PRJNA547954","GCA_006440195.1","1.60587","38.7","-","VEYT01","32","1593","1447/592614","6/24/2019","6/28/2019","Contig","2019-06-24T00:00:00Z","Oita university","Illumina MiSeq","25x","SPAdes v. 3.12.0","","","32","1605875","Cambodia","Homo sapiens"
"Helicobacter pylori KH0120","592622","210","210.6044","","","N/A","","ftp://ftp.ncbi.nlm.nih.gov/genomes/all/GCF/006/440/435/GCF_006440435.1_ASM644043v1","ftp://ftp.ncbi.nlm.nih.gov/genomes/all/GCA/006/440/435/GCA_006440435.1_ASM644043v1","SAMN12011825","PRJNA547954","GCA_006440435.1","1.59565","38.8","-","VEYR01","51","1587","1440/592622","6/24/2019","6/28/2019","Contig","2019-06-24T00:00:00Z","Oita university","Illumina MiSeq","15x","SPAdes v. 3.12.0","","","51","1595648","Cambodia","Homo sapiens"
"Helicobacter pylori KH0122","592620","210","210.6041","","","N/A","","ftp://ftp.ncbi.nlm.nih.gov/genomes/all/GCF/006/440/395/GCF_006440395.1_ASM644039v1","ftp://ftp.ncbi.nlm.nih.gov/genomes/all/GCA/006/440/395/GCA_006440395.1_ASM644039v1","SAMN12011826","PRJNA547954","GCA_006440395.1","1.59894","39","-","VEYQ01","55","1586","1427/592620","6/24/2019","6/28/2019","Contig","2019-06-24T00:00:00Z","Oita university","Illumina MiSeq","17x","SPAdes v. 3.12.0","","","55","1598940","Cambodia","Homo sapiens"
"Helicobacter pylori KH0125","592610","210","210.6024","","","N/A","","ftp://ftp.ncbi.nlm.nih.gov/genomes/all/GCF/006/440/045/GCF_006440045.1_ASM644004v1","ftp://ftp.ncbi.nlm.nih.gov/genomes/all/GCA/006/440/045/GCA_006440045.1_ASM644004v1","SAMN12011827","PRJNA547954","GCA_006440045.1","1.59814","38.9","-","VEYP01","51","1579","1425/592610","6/24/2019","6/28/2019","Contig","2019-06-24T00:00:00Z","Oita university","Illumina MiSeq","21x","SPAdes v. 3.12.0","","","51","1598142","Cambodia","Homo sapiens"
"Helicobacter pylori KH0126","592606","210","210.6018","","","N/A","","ftp://ftp.ncbi.nlm.nih.gov/genomes/all/GCF/006/439/915/GCF_006439915.1_ASM643991v1","ftp://ftp.ncbi.nlm.nih.gov/genomes/all/GCA/006/439/915/GCA_006439915.1_ASM643991v1","SAMN12011828","PRJNA547954","GCA_006439915.1","1.64616","38.7","-","VEYO01","49","1645","1466/592606","6/24/2019","6/28/2019","Contig","2019-06-24T00:00:00Z","Oita university","Illumina MiSeq","21x","SPAdes v. 3.12.0","","","49","1646157","Cambodia","Homo sapiens"
"Helicobacter pylori KH0127","592611","210","210.6027","","","N/A","","ftp://ftp.ncbi.nlm.nih.gov/genomes/all/GCF/006/440/105/GCF_006440105.1_ASM644010v1","ftp://ftp.ncbi.nlm.nih.gov/genomes/all/GCA/006/440/105/GCA_006440105.1_ASM644010v1","SAMN12011829","PRJNA547954","GCA_006440105.1","1.57286","39","-","VEYN01","25","1563","1425/592611","6/24/2019","6/28/2019","Contig","2019-06-24T00:00:00Z","Oita university","Illumina MiSeq","11x","SPAdes v. 3.12.0","","","25","1572859","Cambodia","Homo sapiens"
"Helicobacter pylori KH0129","592600","210","210.6010","","","N/A","","ftp://ftp.ncbi.nlm.nih.gov/genomes/all/GCF/006/439/775/GCF_006439775.1_ASM643977v1","ftp://ftp.ncbi.nlm.nih.gov/genomes/all/GCA/006/439/775/GCA_006439775.1_ASM643977v1","SAMN12011830","PRJNA547954","GCA_006439775.1","1.59025","39","-","VEYM01","48","1581","1442/592600","6/24/2019","6/28/2019","Contig","2019-06-24T00:00:00Z","Oita university","Illumina MiSeq","19x","SPAdes v. 3.12.0","","","48","1590246","Cambodia","Homo sapiens"
"Helicobacter pylori KH0143","592604","210","210.6016","","","N/A","","ftp://ftp.ncbi.nlm.nih.gov/genomes/all/GCF/006/439/895/GCF_006439895.1_ASM643989v1","ftp://ftp.ncbi.nlm.nih.gov/genomes/all/GCA/006/439/895/GCA_006439895.1_ASM643989v1","SAMN12011832","PRJNA547954","GCA_006439895.1","1.58121","38.9","-","VEYK01","59","1578","1429/592604","6/24/2019","6/28/2019","Contig","2019-06-24T00:00:00Z","Oita university","Illumina MiSeq","19x","SPAdes v. 3.12.0","","","59","1581211","Cambodia","Homo sapiens"
"Helicobacter pylori KH0148","592597","210","210.6007","","","N/A","","ftp://ftp.ncbi.nlm.nih.gov/genomes/all/GCF/006/439/715/GCF_006439715.1_ASM643971v1","ftp://ftp.ncbi.nlm.nih.gov/genomes/all/GCA/006/439/715/GCA_006439715.1_ASM643971v1","SAMN12011833","PRJNA547954","GCA_006439715.1","1.5867","38.9","-","VEYJ01","42","1577","1421/592597","6/24/2019","6/28/2019","Contig","2019-06-24T00:00:00Z","Oita university","Illumina MiSeq","24x","SPAdes v. 3.12.0","","","42","1586701","Cambodia","Homo sapiens"
"Helicobacter pylori KH0158","592618","210","210.6039","","","N/A","","ftp://ftp.ncbi.nlm.nih.gov/genomes/all/GCF/006/440/335/GCF_006440335.1_ASM644033v1","ftp://ftp.ncbi.nlm.nih.gov/genomes/all/GCA/006/440/335/GCA_006440335.1_ASM644033v1","SAMN12011837","PRJNA547954","GCA_006440335.1","1.62548","38.7","-","VEYF01","30","1615","1463/592618","6/24/2019","6/28/2019","Contig","2019-06-24T00:00:00Z","Oita university","Illumina MiSeq","36x","SPAdes v. 3.12.0","","","30","1625475","Cambodia","Homo sapiens"
"Helicobacter pylori KH0161","592601","210","210.6011","","","N/A","","ftp://ftp.ncbi.nlm.nih.gov/genomes/all/GCF/006/439/785/GCF_006439785.1_ASM643978v1","ftp://ftp.ncbi.nlm.nih.gov/genomes/all/GCA/006/439/785/GCA_006439785.1_ASM643978v1","SAMN12011839","PRJNA547954","GCA_006439785.1","1.64495","38.7","-","VEYD01","74","1656","1484/592601","6/24/2019","6/28/2019","Contig","2019-06-24T00:00:00Z","Oita university","Illumina MiSeq","29x","SPAdes v. 3.12.0","","","74","1644954","Cambodia","Homo sapiens"
"Helicobacter pylori KH0173","592592","210","210.5995","","","N/A","","ftp://ftp.ncbi.nlm.nih.gov/genomes/all/GCF/006/438/465/GCF_006438465.1_ASM643846v1","ftp://ftp.ncbi.nlm.nih.gov/genomes/all/GCA/006/438/465/GCA_006438465.1_ASM643846v1","SAMN12011843","PRJNA547954","GCA_006438465.1","1.53761","38.9","-","VEXZ01","28","1544","1393/592592","6/24/2019","6/28/2019","Contig","2019-06-24T00:00:00Z","Oita university","Illumina MiSeq","14x","SPAdes v. 3.12.0","","","28","1537605","Cambodia","Homo sapiens"
"Helicobacter pylori KH0182","592591","210","210.5993","","","N/A","","ftp://ftp.ncbi.nlm.nih.gov/genomes/all/GCF/006/438/425/GCF_006438425.1_ASM643842v1","ftp://ftp.ncbi.nlm.nih.gov/genomes/all/GCA/006/438/425/GCA_006438425.1_ASM643842v1","SAMN12011847","PRJNA547954","GCA_006438425.1","1.57642","38.8","-","VEXV01","44","1567","1421/592591","6/24/2019","6/28/2019","Contig","2019-06-24T00:00:00Z","Oita university","Illumina MiSeq","33x","SPAdes v. 3.12.0","","","44","1576421","Cambodia","Homo sapiens"
"Helicobacter pylori KH0191","592593","210","210.5996","","","N/A","","ftp://ftp.ncbi.nlm.nih.gov/genomes/all/GCF/006/438/475/GCF_006438475.1_ASM643847v1","ftp://ftp.ncbi.nlm.nih.gov/genomes/all/GCA/006/438/475/GCA_006438475.1_ASM643847v1","SAMN12011848","PRJNA547954","GCA_006438475.1","1.60635","38.7","-","VEXU01","30","1588","1461/592593","6/24/2019","6/28/2019","Contig","2019-06-24T00:00:00Z","Oita university","Illumina MiSeq","17x","SPAdes v. 3.12.0","","","30","1606355","Cambodia","Homo sapiens"
"Helicobacter pylori KH0198","592594","210","210.5997","","","N/A","","ftp://ftp.ncbi.nlm.nih.gov/genomes/all/GCF/006/438/515/GCF_006438515.1_ASM643851v1","ftp://ftp.ncbi.nlm.nih.gov/genomes/all/GCA/006/438/515/GCA_006438515.1_ASM643851v1","SAMN12011849","PRJNA547954","GCA_006438515.1","1.60761","39","-","VEXT01","99","1626","1460/592594","6/24/2019","6/28/2019","Contig","2019-06-24T00:00:00Z","Oita university","Illumina MiSeq","27x","SPAdes v. 3.12.0","","","99","1607611","Cambodia","Homo sapiens"
"Helicobacter pylori KH0207","592590","210","210.5992","","","N/A","","ftp://ftp.ncbi.nlm.nih.gov/genomes/all/GCF/006/438/415/GCF_006438415.1_ASM643841v1","ftp://ftp.ncbi.nlm.nih.gov/genomes/all/GCA/006/438/415/GCA_006438415.1_ASM643841v1","SAMN12011850","PRJNA547954","GCA_006438415.1","1.64688","38.8","-","VEXS01","54","1619","1481/592590","6/24/2019","6/28/2019","Contig","2019-06-24T00:00:00Z","Oita university","Illumina MiSeq","10x","SPAdes v. 3.12.0","","","54","1646883","Cambodia","Homo sapiens"
"Helicobacter pylori KH1","356648","210","210.3143","","","N/A","","ftp://ftp.ncbi.nlm.nih.gov/genomes/all/GCF/002/832/645/GCF_002832645.1_ASM283264v1","ftp://ftp.ncbi.nlm.nih.gov/genomes/all/GCA/002/832/645/GCA_002832645.1_ASM283264v1","SAMN08093243","PRJNA419585","GCA_002832645.1","1.65491","38.8","-","PHMW01","38","1623","1477/356648","12/11/2017","12/13/2017","Contig","2017-12-11T00:00:00Z","University of Western Australia","Illumina MiSeq","214x","SPAdes v. 3.10.1","","","38","1654914","India","Human, Homo sapiens"
"Helicobacter pylori KH10","356620","210","210.3115","","","N/A","","ftp://ftp.ncbi.nlm.nih.gov/genomes/all/GCF/002/832/075/GCF_002832075.1_ASM283207v1","ftp://ftp.ncbi.nlm.nih.gov/genomes/all/GCA/002/832/075/GCA_002832075.1_ASM283207v1","SAMN08093251","PRJNA419585","GCA_002832075.1","1.6324","39","-","PHMO01","39","1618","1457/356620","12/11/2017","12/13/2017","Contig","2017-12-11T00:00:00Z","University of Western Australia","Illumina MiSeq","100x","SPAdes v. 3.10.1","","","39","1632401","India","Human, Homo sapiens"
"Helicobacter pylori KH11","356619","210","210.3114","","","N/A","","ftp://ftp.ncbi.nlm.nih.gov/genomes/all/GCF/002/832/055/GCF_002832055.1_ASM283205v1","ftp://ftp.ncbi.nlm.nih.gov/genomes/all/GCA/002/832/055/GCA_002832055.1_ASM283205v1","SAMN08093252","PRJNA419585","GCA_002832055.1","1.61218","39.1","-","PHMN01","30","1591","1440/356619","12/11/2017","12/13/2017","Contig","2017-12-11T00:00:00Z","University of Western Australia","Illumina MiSeq","156x","SPAdes v. 3.10.1","","","30","1612177","India","Human, Homo sapiens"
"Helicobacter pylori KH12","356642","210","210.3137","","","N/A","","ftp://ftp.ncbi.nlm.nih.gov/genomes/all/GCF/002/832/525/GCF_002832525.1_ASM283252v1","ftp://ftp.ncbi.nlm.nih.gov/genomes/all/GCA/002/832/525/GCA_002832525.1_ASM283252v1","SAMN08093253","PRJNA419585","GCA_002832525.1","1.53175","39.1","-","PHMM01","26","1511","1390/356642","12/11/2017","12/13/2017","Contig","2017-12-11T00:00:00Z","University of Western Australia","Illumina MiSeq","155x","SPAdes v. 3.10.1","","","26","1531748","India","Human, Homo sapiens"
"Helicobacter pylori KH13","356641","210","210.3136","","","N/A","","ftp://ftp.ncbi.nlm.nih.gov/genomes/all/GCF/002/832/505/GCF_002832505.1_ASM283250v1","ftp://ftp.ncbi.nlm.nih.gov/genomes/all/GCA/002/832/505/GCA_002832505.1_ASM283250v1","SAMN08093254","PRJNA419585","GCA_002832505.1","1.62812","38.8","-","PHML01","53","1621","1450/356641","12/11/2017","12/13/2017","Contig","2017-12-11T00:00:00Z","University of Western Australia","Illumina MiSeq","101x","SPAdes v. 3.10.1","","","53","1628116","India","Human, Homo sapiens"
"Helicobacter pylori KH14","356640","210","210.3135","","","N/A","","ftp://ftp.ncbi.nlm.nih.gov/genomes/all/GCF/002/832/485/GCF_002832485.1_ASM283248v1","ftp://ftp.ncbi.nlm.nih.gov/genomes/all/GCA/002/832/485/GCA_002832485.1_ASM283248v1","SAMN08093255","PRJNA419585","GCA_002832485.1","1.59409","39.1","-","PHMK01","40","1567","1414/356640","12/11/2017","12/13/2017","Contig","2017-12-11T00:00:00Z","University of Western Australia","Illumina MiSeq","107x","SPAdes v. 3.10.1","","","40","1594086","India","Human, Homo sapiens"
"Helicobacter pylori KH15","356639","210","210.3134","","","N/A","","ftp://ftp.ncbi.nlm.nih.gov/genomes/all/GCF/002/832/475/GCF_002832475.1_ASM283247v1","ftp://ftp.ncbi.nlm.nih.gov/genomes/all/GCA/002/832/475/GCA_002832475.1_ASM283247v1","SAMN08093256","PRJNA419585","GCA_002832475.1","1.60899","39.1","-","PHMJ01","49","1603","1449/356639","12/11/2017","12/13/2017","Contig","2017-12-11T00:00:00Z","University of Western Australia","Illumina MiSeq","101x","SPAdes v. 3.10.1","","","49","1608987","India","Human, Homo sapiens"
"Helicobacter pylori KH16","356618","210","210.3113","","","N/A","","ftp://ftp.ncbi.nlm.nih.gov/genomes/all/GCF/002/832/045/GCF_002832045.1_ASM283204v1","ftp://ftp.ncbi.nlm.nih.gov/genomes/all/GCA/002/832/045/GCA_002832045.1_ASM283204v1","SAMN08093257","PRJNA419585","GCA_002832045.1","1.59874","39","-","PHMI01","48","1596","1423/356618","12/11/2017","12/13/2017","Contig","2017-12-11T00:00:00Z","University of Western Australia","Illumina MiSeq","115x","SPAdes v. 3.10.1","","","48","1598738","India","Human, Homo sapiens"
"Helicobacter pylori KH17","356638","210","210.3133","","","N/A","","ftp://ftp.ncbi.nlm.nih.gov/genomes/all/GCF/002/832/435/GCF_002832435.1_ASM283243v1","ftp://ftp.ncbi.nlm.nih.gov/genomes/all/GCA/002/832/435/GCA_002832435.1_ASM283243v1","SAMN08093258","PRJNA419585","GCA_002832435.1","1.62517","39","-","PHMH01","40","1601","1433/356638","12/11/2017","12/13/2017","Contig","2017-12-11T00:00:00Z","University of Western Australia","Illumina MiSeq","118x","SPAdes v. 3.10.1","","","40","1625170","India","Human, Homo sapiens"
"Helicobacter pylori KH18","356637","210","210.3132","","","N/A","","ftp://ftp.ncbi.nlm.nih.gov/genomes/all/GCF/002/832/415/GCF_002832415.1_ASM283241v1","ftp://ftp.ncbi.nlm.nih.gov/genomes/all/GCA/002/832/415/GCA_002832415.1_ASM283241v1","SAMN08093259","PRJNA419585","GCA_002832415.1","1.64847","38.8","-","PHMG01","55","1638","1467/356637","12/11/2017","12/13/2017","Contig","2017-12-11T00:00:00Z","University of Western Australia","Illumina MiSeq","190x","SPAdes v. 3.10.1","","","55","1648469","India","Human, Homo sapiens"
"Helicobacter pylori KH19","356636","210","210.3131","","","N/A","","ftp://ftp.ncbi.nlm.nih.gov/genomes/all/GCF/002/832/405/GCF_002832405.1_ASM283240v1","ftp://ftp.ncbi.nlm.nih.gov/genomes/all/GCA/002/832/405/GCA_002832405.1_ASM283240v1","SAMN08093260","PRJNA419585","GCA_002832405.1","1.65647","38.8","-","PHMF01","39","1639","1472/356636","12/11/2017","12/13/2017","Contig","2017-12-11T00:00:00Z","University of Western Australia","Illumina MiSeq","356x","SPAdes v. 3.10.1","","","39","1656470","India","Human, Homo sapiens"
"Helicobacter pylori KH2","356647","210","210.3142","","","N/A","","ftp://ftp.ncbi.nlm.nih.gov/genomes/all/GCF/002/832/615/GCF_002832615.1_ASM283261v1","ftp://ftp.ncbi.nlm.nih.gov/genomes/all/GCA/002/832/615/GCA_002832615.1_ASM283261v1","SAMN08093244","PRJNA419585","GCA_002832615.1","1.60332","39","-","PHMV01","47","1573","1421/356647","12/11/2017","12/13/2017","Contig","2017-12-11T00:00:00Z","University of Western Australia","Illumina MiSeq","343x","SPAdes v. 3.10.1","","","47","1603318","India","Human, Homo sapiens"
"Helicobacter pylori KH20","356616","210","210.3111","","","N/A","","ftp://ftp.ncbi.nlm.nih.gov/genomes/all/GCF/002/831/995/GCF_002831995.1_ASM283199v1","ftp://ftp.ncbi.nlm.nih.gov/genomes/all/GCA/002/831/995/GCA_002831995.1_ASM283199v1","SAMN08093261","PRJNA419585","GCA_002831995.1","1.64766","38.8","-","PHME01","42","1628","1476/356616","12/11/2017","12/13/2017","Contig","2017-12-11T00:00:00Z","University of Western Australia","Illumina MiSeq","75x","SPAdes v. 3.10.1","","","42","1647657","India","Human, Homo sapiens"
"Helicobacter pylori KH21","356617","210","210.3112","","","N/A","","ftp://ftp.ncbi.nlm.nih.gov/genomes/all/GCF/002/832/025/GCF_002832025.1_ASM283202v1","ftp://ftp.ncbi.nlm.nih.gov/genomes/all/GCA/002/832/025/GCA_002832025.1_ASM283202v1","SAMN08093262","PRJNA419585","GCA_002832025.1","1.64777","38.9","-","PHMD01","46","1655","1484/356617","12/11/2017","12/13/2017","Contig","2017-12-11T00:00:00Z","University of Western Australia","Illumina MiSeq","106x","SPAdes v. 3.10.1","","","46","1647771","India","Human, Homo sapiens"
"Helicobacter pylori KH22","356635","210","210.3130","","","N/A","","ftp://ftp.ncbi.nlm.nih.gov/genomes/all/GCF/002/832/395/GCF_002832395.1_ASM283239v1","ftp://ftp.ncbi.nlm.nih.gov/genomes/all/GCA/002/832/395/GCA_002832395.1_ASM283239v1","SAMN08093263","PRJNA419585","GCA_002832395.1","1.59293","39.1","-","PHMC01","40","1585","1409/356635","12/11/2017","12/13/2017","Contig","2017-12-11T00:00:00Z","University of Western Australia","Illumina MiSeq","196x","SPAdes v. 3.10.1","","","40","1592933","India","Human, Homo sapiens"
"Helicobacter pylori KH23","356634","210","210.3128","","","N/A","","ftp://ftp.ncbi.nlm.nih.gov/genomes/all/GCF/002/832/355/GCF_002832355.1_ASM283235v1","ftp://ftp.ncbi.nlm.nih.gov/genomes/all/GCA/002/832/355/GCA_002832355.1_ASM283235v1","SAMN08093264","PRJNA419585","GCA_002832355.1","1.65182","38.8","-","PHMB01","69","1640","1467/356634","12/11/2017","12/13/2017","Contig","2017-12-11T00:00:00Z","University of Western Australia","Illumina MiSeq","198x","SPAdes v. 3.10.1","","","69","1651818","India","Human, Homo sapiens"
"Helicobacter pylori KH25","356613","210","210.3108","","","N/A","","ftp://ftp.ncbi.nlm.nih.gov/genomes/all/GCF/002/831/955/GCF_002831955.1_ASM283195v1","ftp://ftp.ncbi.nlm.nih.gov/genomes/all/GCA/002/831/955/GCA_002831955.1_ASM283195v1","SAMN08093265","PRJNA419585","GCA_002831955.1","1.6258","38.9","-","PHMA01","37","1626","1447/356613","12/11/2017","12/13/2017","Contig","2017-12-11T00:00:00Z","University of Western Australia","Illumina MiSeq","280x","SPAdes v. 3.10.1","","","37","1625804","India","Human, Homo sapiens"
"Helicobacter pylori KH26","356633","210","210.3129","","","N/A","","ftp://ftp.ncbi.nlm.nih.gov/genomes/all/GCF/002/832/345/GCF_002832345.1_ASM283234v1","ftp://ftp.ncbi.nlm.nih.gov/genomes/all/GCA/002/832/345/GCA_002832345.1_ASM283234v1","SAMN08093266","PRJNA419585","GCA_002832345.1","1.70911","38.7","-","PHLZ01","62","1707","1533/356633","12/11/2017","12/13/2017","Contig","2017-12-11T00:00:00Z","University of Western Australia","Illumina MiSeq","96x","SPAdes v. 3.10.1","","","62","1709107","India","Human, Homo sapiens"
"Helicobacter pylori KH27","356615","210","210.3110","","","N/A","","ftp://ftp.ncbi.nlm.nih.gov/genomes/all/GCF/002/831/985/GCF_002831985.1_ASM283198v1","ftp://ftp.ncbi.nlm.nih.gov/genomes/all/GCA/002/831/985/GCA_002831985.1_ASM283198v1","SAMN08093267","PRJNA419585","GCA_002831985.1","1.63554","38.9","-","PHLY01","36","1634","1468/356615","12/11/2017","12/13/2017","Contig","2017-12-11T00:00:00Z","University of Western Australia","Illumina MiSeq","66x","SPAdes v. 3.10.1","","","36","1635544","India","Human, Homo sapiens"
"Helicobacter pylori KH28","356612","210","210.3107","","","N/A","","ftp://ftp.ncbi.nlm.nih.gov/genomes/all/GCF/002/831/925/GCF_002831925.1_ASM283192v1","ftp://ftp.ncbi.nlm.nih.gov/genomes/all/GCA/002/831/925/GCA_002831925.1_ASM283192v1","SAMN08093268","PRJNA419585","GCA_002831925.1","1.67999","38.7","-","PHLX01","30","1664","1501/356612","12/11/2017","12/13/2017","Contig","2017-12-11T00:00:00Z","University of Western Australia","Illumina MiSeq","112x","SPAdes v. 3.10.1","","","30","1679991","India","Human, Homo sapiens"
"Helicobacter pylori KH29","356632","210","210.3127","","","N/A","","ftp://ftp.ncbi.nlm.nih.gov/genomes/all/GCF/002/832/325/GCF_002832325.1_ASM283232v1","ftp://ftp.ncbi.nlm.nih.gov/genomes/all/GCA/002/832/325/GCA_002832325.1_ASM283232v1","SAMN08093269","PRJNA419585","GCA_002832325.1","1.60501","39","-","PHLW01","38","1591","1426/356632","12/11/2017","12/13/2017","Contig","2017-12-11T00:00:00Z","University of Western Australia","Illumina MiSeq","80x","SPAdes v. 3.10.1","","","38","1605007","India","Human, Homo sapiens"
"Helicobacter pylori KH3","356622","210","210.3117","","","N/A","","ftp://ftp.ncbi.nlm.nih.gov/genomes/all/GCF/002/832/135/GCF_002832135.1_ASM283213v1","ftp://ftp.ncbi.nlm.nih.gov/genomes/all/GCA/002/832/135/GCA_002832135.1_ASM283213v1","SAMN08093245","PRJNA419585","GCA_002832135.1","1.61484","39","-","PHMU01","45","1599","1446/356622","12/11/2017","12/13/2017","Contig","2017-12-11T00:00:00Z","University of Western Australia","Illumina MiSeq","241x","SPAdes v. 3.10.1","","","45","1614842","India","Human, Homo sapiens"
"Helicobacter pylori KH30","356631","210","210.3126","","","N/A","","ftp://ftp.ncbi.nlm.nih.gov/genomes/all/GCF/002/832/295/GCF_002832295.1_ASM283229v1","ftp://ftp.ncbi.nlm.nih.gov/genomes/all/GCA/002/832/295/GCA_002832295.1_ASM283229v1","SAMN08093270","PRJNA419585","GCA_002832295.1","1.58046","39.1","-","PHLV01","33","1581","1432/356631","12/11/2017","12/13/2017","Contig","2017-12-11T00:00:00Z","University of Western Australia","Illumina MiSeq","86x","SPAdes v. 3.10.1","","","33","1580459","India","Human, Homo sapiens"
"Helicobacter pylori KH31","356629","210","210.3124","","","N/A","","ftp://ftp.ncbi.nlm.nih.gov/genomes/all/GCF/002/832/275/GCF_002832275.1_ASM283227v1","ftp://ftp.ncbi.nlm.nih.gov/genomes/all/GCA/002/832/275/GCA_002832275.1_ASM283227v1","SAMN08093271","PRJNA419585","GCA_002832275.1","1.60797","39.1","-","PHLU01","34","1593","1429/356629","12/11/2017","12/13/2017","Contig","2017-12-11T00:00:00Z","University of Western Australia","Illumina MiSeq","85x","SPAdes v. 3.10.1","","","34","1607973","India","Human, Homo sapiens"
"Helicobacter pylori KH32","356630","210","210.3125","","","N/A","","ftp://ftp.ncbi.nlm.nih.gov/genomes/all/GCF/002/832/285/GCF_002832285.1_ASM283228v1","ftp://ftp.ncbi.nlm.nih.gov/genomes/all/GCA/002/832/285/GCA_002832285.1_ASM283228v1","SAMN08093272","PRJNA419585","GCA_002832285.1","1.61173","39.1","-","PHLT01","34","1583","1428/356630","12/11/2017","12/13/2017","Contig","2017-12-11T00:00:00Z","University of Western Australia","Illumina MiSeq","214x","SPAdes v. 3.10.1","","","34","1611728","India","Human, Homo sapiens"
"Helicobacter pylori KH33","356628","210","210.3123","","","N/A","","ftp://ftp.ncbi.nlm.nih.gov/genomes/all/GCF/002/832/255/GCF_002832255.1_ASM283225v1","ftp://ftp.ncbi.nlm.nih.gov/genomes/all/GCA/002/832/255/GCA_002832255.1_ASM283225v1","SAMN08093273","PRJNA419585","GCA_002832255.1","1.61412","38.9","-","PHLS01","34","1585","1432/356628","12/11/2017","12/13/2017","Contig","2017-12-11T00:00:00Z","University of Western Australia","Illumina MiSeq","97x","SPAdes v. 3.10.1","","","34","1614122","India","Human, Homo sapiens"
"Helicobacter pylori KH34","356627","210","210.3122","","","N/A","","ftp://ftp.ncbi.nlm.nih.gov/genomes/all/GCF/002/832/215/GCF_002832215.1_ASM283221v1","ftp://ftp.ncbi.nlm.nih.gov/genomes/all/GCA/002/832/215/GCA_002832215.1_ASM283221v1","SAMN08093274","PRJNA419585","GCA_002832215.1","1.58343","39.1","-","PHLR01","32","1581","1424/356627","12/11/2017","12/13/2017","Contig","2017-12-11T00:00:00Z","University of Western Australia","Illumina MiSeq","279x","SPAdes v. 3.10.1","","","32","1583431","India","Human, Homo sapiens"
"Helicobacter pylori KH35","356626","210","210.3121","","","N/A","","ftp://ftp.ncbi.nlm.nih.gov/genomes/all/GCF/002/832/195/GCF_002832195.1_ASM283219v1","ftp://ftp.ncbi.nlm.nih.gov/genomes/all/GCA/002/832/195/GCA_002832195.1_ASM283219v1","SAMN08093275","PRJNA419585","GCA_002832195.1","1.65731","38.8","-","PHLQ01","45","1675","1504/356626","12/11/2017","12/13/2017","Contig","2017-12-11T00:00:00Z","University of Western Australia","Illumina MiSeq","136x","SPAdes v. 3.10.1","","","45","1657309","India","Human, Homo sapiens"
"Helicobacter pylori KH36","356614","210","210.3109","","","N/A","","ftp://ftp.ncbi.nlm.nih.gov/genomes/all/GCF/002/831/975/GCF_002831975.1_ASM283197v1","ftp://ftp.ncbi.nlm.nih.gov/genomes/all/GCA/002/831/975/GCA_002831975.1_ASM283197v1","SAMN08093276","PRJNA419585","GCA_002831975.1","1.64459","38.8","-","PHLP01","41","1630","1471/356614","12/11/2017","12/13/2017","Contig","2017-12-11T00:00:00Z","University of Western Australia","Illumina MiSeq","95x","SPAdes v. 3.10.1","","","41","1644588","India","Human, Homo sapiens"
"Helicobacter pylori KH37","356625","210","210.3120","","","N/A","","ftp://ftp.ncbi.nlm.nih.gov/genomes/all/GCF/002/832/175/GCF_002832175.1_ASM283217v1","ftp://ftp.ncbi.nlm.nih.gov/genomes/all/GCA/002/832/175/GCA_002832175.1_ASM283217v1","SAMN08093277","PRJNA419585","GCA_002832175.1","1.6238","38.9","-","PHLO01","42","1622","1433/356625","12/11/2017","12/13/2017","Contig","2017-12-11T00:00:00Z","University of Western Australia","Illumina MiSeq","79x","SPAdes v. 3.10.1","","","42","1623802","India","Human, Homo sapiens"
"Helicobacter pylori KH38","356624","210","210.3119","","","N/A","","ftp://ftp.ncbi.nlm.nih.gov/genomes/all/GCF/002/832/155/GCF_002832155.1_ASM283215v1","ftp://ftp.ncbi.nlm.nih.gov/genomes/all/GCA/002/832/155/GCA_002832155.1_ASM283215v1","SAMN08093278","PRJNA419585","GCA_002832155.1","1.62308","38.9","-","PHLN01","61","1614","1448/356624","12/11/2017","12/13/2017","Contig","2017-12-11T00:00:00Z","University of Western Australia","Illumina MiSeq","96x","SPAdes v. 3.10.1","","","61","1623079","India","Human, Homo sapiens"
"Helicobacter pylori KH39","356611","210","210.3106","","","N/A","","ftp://ftp.ncbi.nlm.nih.gov/genomes/all/GCF/002/831/915/GCF_002831915.1_ASM283191v1","ftp://ftp.ncbi.nlm.nih.gov/genomes/all/GCA/002/831/915/GCA_002831915.1_ASM283191v1","SAMN08093279","PRJNA419585","GCA_002831915.1","1.62211","39","-","PHLM01","33","1625","1440/356611","12/11/2017","12/13/2017","Contig","2017-12-11T00:00:00Z","University of Western Australia","Illumina MiSeq","255x","SPAdes v. 3.10.1","","","33","1622113","India","Human, Homo sapiens"
"Helicobacter pylori KH4","356621","210","210.3116","","","N/A","","ftp://ftp.ncbi.nlm.nih.gov/genomes/all/GCF/002/832/115/GCF_002832115.1_ASM283211v1","ftp://ftp.ncbi.nlm.nih.gov/genomes/all/GCA/002/832/115/GCA_002832115.1_ASM283211v1","SAMN08093246","PRJNA419585","GCA_002832115.1","1.60028","39.1","-","PHMT01","32","1602","1431/356621","12/11/2017","12/13/2017","Contig","2017-12-11T00:00:00Z","University of Western Australia","Illumina MiSeq","206x","SPAdes v. 3.10.1","","","32","1600283","India","Human, Homo sapiens"
"Helicobacter pylori KH40","356623","210","210.3118","","","N/A","","ftp://ftp.ncbi.nlm.nih.gov/genomes/all/GCF/002/832/145/GCF_002832145.1_ASM283214v1","ftp://ftp.ncbi.nlm.nih.gov/genomes/all/GCA/002/832/145/GCA_002832145.1_ASM283214v1","SAMN08093280","PRJNA419585","GCA_002832145.1","1.59135","39","-","PHLL01","32","1583","1418/356623","12/11/2017","12/13/2017","Contig","2017-12-11T00:00:00Z","University of Western Australia","Illumina MiSeq","281x","SPAdes v. 3.10.1","","","32","1591353","India","Human, Homo sapiens"
"Helicobacter pylori KH41","356610","210","210.3105","","","N/A","","ftp://ftp.ncbi.nlm.nih.gov/genomes/all/GCF/002/831/875/GCF_002831875.1_ASM283187v1","ftp://ftp.ncbi.nlm.nih.gov/genomes/all/GCA/002/831/875/GCA_002831875.1_ASM283187v1","SAMN08093281","PRJNA419585","GCA_002831875.1","1.65431","38.9","-","PHLK01","46","1637","1481/356610","12/11/2017","12/13/2017","Contig","2017-12-11T00:00:00Z","University of Western Australia","Illumina MiSeq","65x","SPAdes v. 3.10.1","","","46","1654315","India","Human, Homo sapiens"
"Helicobacter pylori KH43","356607","210","210.3102","","","N/A","","ftp://ftp.ncbi.nlm.nih.gov/genomes/all/GCF/002/831/835/GCF_002831835.1_ASM283183v1","ftp://ftp.ncbi.nlm.nih.gov/genomes/all/GCA/002/831/835/GCA_002831835.1_ASM283183v1","SAMN08093282","PRJNA419585","GCA_002831835.1","1.6271","39","-","PHLJ01","34","1615","1453/356607","12/11/2017","12/13/2017","Contig","2017-12-11T00:00:00Z","University of Western Australia","Illumina MiSeq","261x","SPAdes v. 3.10.1","","","34","1627102","India","Human, Homo sapiens"
"Helicobacter pylori KH44","356608","210","210.3103","","","N/A","","ftp://ftp.ncbi.nlm.nih.gov/genomes/all/GCF/002/831/845/GCF_002831845.1_ASM283184v1","ftp://ftp.ncbi.nlm.nih.gov/genomes/all/GCA/002/831/845/GCA_002831845.1_ASM283184v1","SAMN08093283","PRJNA419585","GCA_002831845.1","1.61564","39","-","PHLI01","38","1592","1445/356608","12/11/2017","12/13/2017","Contig","2017-12-11T00:00:00Z","University of Western Australia","Illumina MiSeq","196x","SPAdes v. 3.10.1","","","38","1615640","India","Human, Homo sapiens"
"Helicobacter pylori KH45","356609","210","210.3104","","","N/A","","ftp://ftp.ncbi.nlm.nih.gov/genomes/all/GCF/002/831/855/GCF_002831855.1_ASM283185v1","ftp://ftp.ncbi.nlm.nih.gov/genomes/all/GCA/002/831/855/GCA_002831855.1_ASM283185v1","SAMN08093284","PRJNA419585","GCA_002831855.1","1.61957","39","-","PHLH01","36","1605","1428/356609","12/11/2017","12/13/2017","Contig","2017-12-11T00:00:00Z","University of Western Australia","Illumina MiSeq","234x","SPAdes v. 3.10.1","","","36","1619572","India","Human, Homo sapiens"
"Helicobacter pylori KH6","356646","210","210.3141","","","N/A","","ftp://ftp.ncbi.nlm.nih.gov/genomes/all/GCF/002/832/605/GCF_002832605.1_ASM283260v1","ftp://ftp.ncbi.nlm.nih.gov/genomes/all/GCA/002/832/605/GCA_002832605.1_ASM283260v1","SAMN08093247","PRJNA419585","GCA_002832605.1","1.53993","39.1","-","PHMS01","38","1519","1390/356646","12/11/2017","12/13/2017","Contig","2017-12-11T00:00:00Z","University of Western Australia","Illumina MiSeq","129x","SPAdes v. 3.10.1","","","38","1539929","India","Human, Homo sapiens"
"Helicobacter pylori KH7","356645","210","210.3140","","","N/A","","ftp://ftp.ncbi.nlm.nih.gov/genomes/all/GCF/002/832/595/GCF_002832595.1_ASM283259v1","ftp://ftp.ncbi.nlm.nih.gov/genomes/all/GCA/002/832/595/GCA_002832595.1_ASM283259v1","SAMN08093248","PRJNA419585","GCA_002832595.1","1.61292","39","-","PHMR01","37","1583","1423/356645","12/11/2017","12/13/2017","Contig","2017-12-11T00:00:00Z","University of Western Australia","Illumina MiSeq","237x","SPAdes v. 3.10.1","","","37","1612917","India","Human, Homo sapiens"
"Helicobacter pylori KH8","356644","210","210.3139","","","N/A","","ftp://ftp.ncbi.nlm.nih.gov/genomes/all/GCF/002/832/575/GCF_002832575.1_ASM283257v1","ftp://ftp.ncbi.nlm.nih.gov/genomes/all/GCA/002/832/575/GCA_002832575.1_ASM283257v1","SAMN08093249","PRJNA419585","GCA_002832575.1","1.64399","38.8","-","PHMQ01","36","1627","1453/356644","12/11/2017","12/13/2017","Contig","2017-12-11T00:00:00Z","University of Western Australia","Illumina MiSeq","135x","SPAdes v. 3.10.1","","","36","1643985","India","Human, Homo sapiens"
"Helicobacter pylori KH9","356643","210","210.3138","","","N/A","","ftp://ftp.ncbi.nlm.nih.gov/genomes/all/GCF/002/832/545/GCF_002832545.1_ASM283254v1","ftp://ftp.ncbi.nlm.nih.gov/genomes/all/GCA/002/832/545/GCA_002832545.1_ASM283254v1","SAMN08093250","PRJNA419585","GCA_002832545.1","1.60424","39","-","PHMP01","46","1588","1447/356643","12/11/2017","12/13/2017","Contig","2017-12-11T00:00:00Z","University of Western Australia","Illumina MiSeq","329x","SPAdes v. 3.10.1","","","46","1604237","India","Human, Homo sapiens"
"Helicobacter pylori Manado-1","211387","210","210.1343","","","N/A","","ftp://ftp.ncbi.nlm.nih.gov/genomes/all/GCF/000/766/035/GCF_000766035.1_ASM76603v1","ftp://ftp.ncbi.nlm.nih.gov/genomes/all/GCA/000/766/035/GCA_000766035.1_ASM76603v1","SAMN03009497","PRJNA259567","GCA_000766035.1","1.53981","38.9","-","JRAC01","38","1535","1365/211387","10/10/2014","3/24/2017","Contig","2014-10-10T00:00:00Z","Oita University","Illumina HiSeq","2455.0x","CLC NGS Cell v. 6.0.3","","","38","1539815","Indonesia","Human, Homo sapiens"
"Helicobacter pylori MC2006-52","309449","210","210.2661","","","N/A","","ftp://ftp.ncbi.nlm.nih.gov/genomes/all/GCF/002/026/835/GCF_002026835.1_MC2006-52_v1.0","ftp://ftp.ncbi.nlm.nih.gov/genomes/all/GCA/002/026/835/GCA_002026835.1_MC2006-52_v1.0","SAMN05569560","PRJNA338771","GCA_002026835.1","1.69821","38.9","-","MIKS01","89","1709","1540/309449","3/14/2017","7/30/2019","Contig","2017-03-14T00:00:00Z","Escuela Nacional de Ciencias Biologicas, Instituto Politecnico Nacional","Illumina HiSeq","31.56x","ABySS v. 1.9.0","","","89","1698210","Mexico","Human, Homo sapiens"
"Helicobacter pylori MC2011-145","309433","210","210.2645","","","N/A","","ftp://ftp.ncbi.nlm.nih.gov/genomes/all/GCF/002/026/515/GCF_002026515.1_MC2011-145_v1.0","ftp://ftp.ncbi.nlm.nih.gov/genomes/all/GCA/002/026/515/GCA_002026515.1_MC2011-145_v1.0","SAMN05569561","PRJNA338771","GCA_002026515.1","1.65082","39","-","MIKT01","180","1648","1476/309433","3/14/2017","7/30/2019","Contig","2017-03-14T00:00:00Z","Escuela Nacional de Ciencias Biologicas, Instituto Politecnico Nacional","Illumina HiSeq","25.27x","ABySS v. 1.9.0","","","180","1650819","Mexico","Human, Homo sapiens"
"Helicobacter pylori MCms1054","309432","210","210.2644","","","N/A","","ftp://ftp.ncbi.nlm.nih.gov/genomes/all/GCF/002/026/505/GCF_002026505.1_MCms1054_v1.0","ftp://ftp.ncbi.nlm.nih.gov/genomes/all/GCA/002/026/505/GCA_002026505.1_MCms1054_v1.0","SAMN05569562","PRJNA338771","GCA_002026505.1","1.65658","39.1","-","MIKU01","117","1639","1477/309432","3/14/2017","7/30/2019","Contig","2017-03-14T00:00:00Z","Escuela Nacional de Ciencias Biologicas, Instituto Politecnico Nacional","Illumina HiSeq","44.99x","ABySS v. 1.9.0","","","117","1656578","Mexico","Human, Homo sapiens"
"Helicobacter pylori MCms1055","309451","210","210.2663","","","N/A","","ftp://ftp.ncbi.nlm.nih.gov/genomes/all/GCF/002/026/885/GCF_002026885.1_MCms1055_v1.0","ftp://ftp.ncbi.nlm.nih.gov/genomes/all/GCA/002/026/885/GCA_002026885.1_MCms1055_v1.0","SAMN05569563","PRJNA338771","GCA_002026885.1","1.67687","38.9","-","MIKV01","63","1671","1509/309451","3/14/2017","7/30/2019","Contig","2017-03-14T00:00:00Z","Escuela Nacional de Ciencias Biologicas, Instituto Politecnico Nacional","Illumina HiSeq","101.43x","ABySS v. 1.9.0","","","63","1676870","Mexico","Human, Homo sapiens"
"Helicobacter pylori MCms1063","309452","210","210.2664","","","N/A","","ftp://ftp.ncbi.nlm.nih.gov/genomes/all/GCF/002/026/895/GCF_002026895.1_MCms1063_v1.0","ftp://ftp.ncbi.nlm.nih.gov/genomes/all/GCA/002/026/895/GCA_002026895.1_MCms1063_v1.0","SAMN05569564","PRJNA338771","GCA_002026895.1","1.69206","39","-","MIKW01","72","1657","1474/309452","3/14/2017","7/30/2019","Contig","2017-03-14T00:00:00Z","Escuela Nacional de Ciencias Biologicas, Instituto Politecnico Nacional","Illumina HiSeq","60.77x","ABySS v. 1.9.0","","","72","1692058","Mexico","Human, Homo sapiens"
"Helicobacter pylori MCms1078","309458","210","210.2670","","","N/A","","ftp://ftp.ncbi.nlm.nih.gov/genomes/all/GCF/002/027/025/GCF_002027025.1_MCms1078_v1.0","ftp://ftp.ncbi.nlm.nih.gov/genomes/all/GCA/002/027/025/GCA_002027025.1_MCms1078_v1.0","SAMN05569565","PRJNA338771","GCA_002027025.1","1.64922","38.9","-","MIKX01","81","1648","1481/309458","3/14/2017","7/30/2019","Contig","2017-03-14T00:00:00Z","Escuela Nacional de Ciencias Biologicas, Instituto Politecnico Nacional","Illumina HiSeq","35.02x","ABySS v. 1.9.0","","","81","1649218","Mexico","Human, Homo sapiens"
"Helicobacter pylori MCms1080","309453","210","210.2665","","","N/A","","ftp://ftp.ncbi.nlm.nih.gov/genomes/all/GCF/002/026/925/GCF_002026925.1_MCms1080_v1.0","ftp://ftp.ncbi.nlm.nih.gov/genomes/all/GCA/002/026/925/GCA_002026925.1_MCms1080_v1.0","SAMN05569566","PRJNA338771","GCA_002026925.1","1.66194","39","-","MIKY01","92","1636","1480/309453","3/14/2017","7/30/2019","Contig","2017-03-14T00:00:00Z","Escuela Nacional de Ciencias Biologicas, Instituto Politecnico Nacional","Illumina HiSeq","69.31x","ABySS v. 1.9.0","","","92","1661940","Mexico","Human, Homo sapiens"
"Helicobacter pylori MCms931","309430","210","210.2642","","","N/A","","ftp://ftp.ncbi.nlm.nih.gov/genomes/all/GCF/002/026/455/GCF_002026455.1_MCms931_v1.0","ftp://ftp.ncbi.nlm.nih.gov/genomes/all/GCA/002/026/455/GCA_002026455.1_MCms931_v1.0","SAMN05569567","PRJNA338771","GCA_002026455.1","1.66868","39","-","MIKZ01","96","1657","1505/309430","3/14/2017","7/30/2019","Contig","2017-03-14T00:00:00Z","Escuela Nacional de Ciencias Biologicas, Instituto Politecnico Nacional","Illumina HiSeq","44.56x","ABySS v. 1.9.0","","","96","1668681","Mexico","Human, Homo sapiens"
"Helicobacter pylori MG2003-107","309454","210","210.2666","","","N/A","","ftp://ftp.ncbi.nlm.nih.gov/genomes/all/GCF/002/026/935/GCF_002026935.1_MG2003-107_v1.0","ftp://ftp.ncbi.nlm.nih.gov/genomes/all/GCA/002/026/935/GCA_002026935.1_MG2003-107_v1.0","SAMN05569568","PRJNA338771","GCA_002026935.1","1.7577","38.9","-","MILA01","146","1743","1556/309454","3/14/2017","7/30/2019","Contig","2017-03-14T00:00:00Z","Escuela Nacional de Ciencias Biologicas, Instituto Politecnico Nacional","Illumina HiSeq","36.03x","ABySS v. 1.9.0","","","146","1757702","Mexico","Human, Homo sapiens"
"Helicobacter pylori MG2003-98","309434","210","210.2646","","","N/A","","ftp://ftp.ncbi.nlm.nih.gov/genomes/all/GCF/002/026/545/GCF_002026545.1_MG2003-98_v1.0","ftp://ftp.ncbi.nlm.nih.gov/genomes/all/GCA/002/026/545/GCA_002026545.1_MG2003-98_v1.0","SAMN05569569","PRJNA338771","GCA_002026545.1","1.71566","38.8","-","MILB01","85","1698","1544/309434","3/14/2017","7/30/2019","Contig","2017-03-14T00:00:00Z","Escuela Nacional de Ciencias Biologicas, Instituto Politecnico Nacional","Illumina HiSeq","31.91x","ABySS v. 1.9.0","","","85","1715656","Mexico","Human, Homo sapiens"
"Helicobacter pylori MG2005-100","309431","210","210.2643","","","N/A","","ftp://ftp.ncbi.nlm.nih.gov/genomes/all/GCF/002/026/485/GCF_002026485.1_MG2005-100_v1.0","ftp://ftp.ncbi.nlm.nih.gov/genomes/all/GCA/002/026/485/GCA_002026485.1_MG2005-100_v1.0","SAMN05569570","PRJNA338771","GCA_002026485.1","1.68589","38.9","-","MILC01","107","1665","1497/309431","3/14/2017","7/30/2019","Contig","2017-03-14T00:00:00Z","Escuela Nacional de Ciencias Biologicas, Instituto Politecnico Nacional","Illumina HiSeq","50.74x","ABySS v. 1.9.0","","","107","1685887","Mexico","Human, Homo sapiens"
"Helicobacter pylori MG2005-98","309437","210","210.2649","","","N/A","","ftp://ftp.ncbi.nlm.nih.gov/genomes/all/GCF/002/026/595/GCF_002026595.1_MG2005-98_v1.0","ftp://ftp.ncbi.nlm.nih.gov/genomes/all/GCA/002/026/595/GCA_002026595.1_MG2005-98_v1.0","SAMN05569571","PRJNA338771","GCA_002026595.1","1.65062","39","-","MILD01","88","1634","1486/309437","3/14/2017","7/30/2019","Contig","2017-03-14T00:00:00Z","Escuela Nacional de Ciencias Biologicas, Instituto Politecnico Nacional","Illumina HiSeq","37.38x","ABySS v. 1.9.0","","","88","1650616","Mexico","Human, Homo sapiens"
"Helicobacter pylori MG2006-4","309438","210","210.2650","","","N/A","","ftp://ftp.ncbi.nlm.nih.gov/genomes/all/GCF/002/026/625/GCF_002026625.1_MG2006-4_v1.0","ftp://ftp.ncbi.nlm.nih.gov/genomes/all/GCA/002/026/625/GCA_002026625.1_MG2006-4_v1.0","SAMN05569572","PRJNA338771","GCA_002026625.1","1.69192","39.1","-","MILE01","159","1716","1504/309438","3/14/2017","7/30/2019","Contig","2017-03-14T00:00:00Z","Escuela Nacional de Ciencias Biologicas, Instituto Politecnico Nacional","Illumina HiSeq","28.12x","ABySS v. 1.9.0","","","159","1691923","Mexico","Human, Homo sapiens"
"Helicobacter pylori MG2006-407","309435","210","210.2647","","","N/A","","ftp://ftp.ncbi.nlm.nih.gov/genomes/all/GCF/002/026/555/GCF_002026555.1_MG2006-407_v1.0","ftp://ftp.ncbi.nlm.nih.gov/genomes/all/GCA/002/026/555/GCA_002026555.1_MG2006-407_v1.0","SAMN05569573","PRJNA338771","GCA_002026555.1","1.74421","38.9","-","MILF01","94","1750","1573/309435","3/14/2017","7/30/2019","Contig","2017-03-14T00:00:00Z","Escuela Nacional de Ciencias Biologicas, Instituto Politecnico Nacional","Illumina HiSeq","30.44x","ABySS v. 1.9.0","","","94","1744207","Mexico","Human, Homo sapiens"
"Helicobacter pylori MG2006-479","309439","210","210.2651","","","N/A","","ftp://ftp.ncbi.nlm.nih.gov/genomes/all/GCF/002/026/645/GCF_002026645.1_MG2006-479_v1.0","ftp://ftp.ncbi.nlm.nih.gov/genomes/all/GCA/002/026/645/GCA_002026645.1_MG2006-479_v1.0","SAMN05569574","PRJNA338771","GCA_002026645.1","1.65098","39","-","MILG01","114","1656","1501/309439","3/14/2017","7/30/2019","Contig","2017-03-14T00:00:00Z","Escuela Nacional de Ciencias Biologicas, Instituto Politecnico Nacional","Illumina HiSeq","34.94x","ABySS v. 1.9.0","","","114","1650985","Mexico","Human, Homo sapiens"
"Helicobacter pylori MG2011-41","309436","210","210.2648","","","N/A","","ftp://ftp.ncbi.nlm.nih.gov/genomes/all/GCF/002/026/585/GCF_002026585.1_MC2011-41_v1.0","ftp://ftp.ncbi.nlm.nih.gov/genomes/all/GCA/002/026/585/GCA_002026585.1_MC2011-41_v1.0","SAMN05569575","PRJNA338771","GCA_002026585.1","1.71751","39.4","-","MILH01","319","1734","1558/309436","3/14/2017","7/30/2019","Contig","2017-03-14T00:00:00Z","Escuela Nacional de Ciencias Biologicas, Instituto Politecnico Nacional","Illumina HiSeq","25.49x","ABySS v. 1.9.0","","","319","1717511","Mexico","Human, Homo sapiens"
"Helicobacter pylori MGms13","309440","210","210.2652","","","N/A","","ftp://ftp.ncbi.nlm.nih.gov/genomes/all/GCF/002/026/665/GCF_002026665.1_MGms13_v1.0","ftp://ftp.ncbi.nlm.nih.gov/genomes/all/GCA/002/026/665/GCA_002026665.1_MGms13_v1.0","SAMN05569576","PRJNA338771","GCA_002026665.1","1.65393","38.9","-","MILI01","111","1659","1484/309440","3/14/2017","7/30/2019","Contig","2017-03-14T00:00:00Z","Escuela Nacional de Ciencias Biologicas, Instituto Politecnico Nacional","Illumina HiSeq","31.27x","ABySS v. 1.9.0","","","111","1653926","Mexico","Human, Homo sapiens"
"Helicobacter pylori MGms15","309441","210","210.2653","","","N/A","","ftp://ftp.ncbi.nlm.nih.gov/genomes/all/GCF/002/026/675/GCF_002026675.1_MGms15_v1.0","ftp://ftp.ncbi.nlm.nih.gov/genomes/all/GCA/002/026/675/GCA_002026675.1_MGms15_v1.0","SAMN05569577","PRJNA338771","GCA_002026675.1","1.69279","38.8","-","MILJ01","88","1699","1516/309441","3/14/2017","7/30/2019","Contig","2017-03-14T00:00:00Z","Escuela Nacional de Ciencias Biologicas, Instituto Politecnico Nacional","Illumina HiSeq","58.12x","ABySS v. 1.9.0","","","88","1692789","Mexico","Human, Homo sapiens"
"Helicobacter pylori MGms167","309442","210","210.2654","","","N/A","","ftp://ftp.ncbi.nlm.nih.gov/genomes/all/GCF/002/026/705/GCF_002026705.1_MGms167_v1.0","ftp://ftp.ncbi.nlm.nih.gov/genomes/all/GCA/002/026/705/GCA_002026705.1_MGms167_v1.0","SAMN05569578","PRJNA338771","GCA_002026705.1","1.68068","39","-","MILK01","73","1634","1482/309442","3/14/2017","7/30/2019","Contig","2017-03-14T00:00:00Z","Escuela Nacional de Ciencias Biologicas, Instituto Politecnico Nacional","Illumina HiSeq","43.22x","ABySS v. 1.9.0","","","73","1680682","Mexico","Human, Homo sapiens"
"Helicobacter pylori MGms176","309443","210","210.2655","","","N/A","","ftp://ftp.ncbi.nlm.nih.gov/genomes/all/GCF/002/026/725/GCF_002026725.1_MGms176_v1.0","ftp://ftp.ncbi.nlm.nih.gov/genomes/all/GCA/002/026/725/GCA_002026725.1_MGms176_v1.0","SAMN05569579","PRJNA338771","GCA_002026725.1","1.67243","39","-","MILL01","226","1699","1522/309443","3/14/2017","7/30/2019","Contig","2017-03-14T00:00:00Z","Escuela Nacional de Ciencias Biologicas, Instituto Politecnico Nacional","Illumina HiSeq","38.26x","ABySS v. 1.9.0","","","226","1672433","Mexico","Human, Homo sapiens"
"Helicobacter pylori MGms2","309444","210","210.2656","","","N/A","","ftp://ftp.ncbi.nlm.nih.gov/genomes/all/GCF/002/026/745/GCF_002026745.1_MGms2_v1.0","ftp://ftp.ncbi.nlm.nih.gov/genomes/all/GCA/002/026/745/GCA_002026745.1_MGms2_v1.0","SAMN05569580","PRJNA338771","GCA_002026745.1","1.71246","38.9","-","MILM01","102","1698","1509/309444","3/14/2017","7/30/2019","Contig","2017-03-14T00:00:00Z","Escuela Nacional de Ciencias Biologicas, Instituto Politecnico Nacional","Illumina HiSeq","51.08x","ABySS v. 1.9.0","","","102","1712465","Mexico","Human, Homo sapiens"
"Helicobacter pylori MGms203","309455","210","210.2667","","","N/A","","ftp://ftp.ncbi.nlm.nih.gov/genomes/all/GCF/002/026/955/GCF_002026955.1_MGms203_v1.0","ftp://ftp.ncbi.nlm.nih.gov/genomes/all/GCA/002/026/955/GCA_002026955.1_MGms203_v1.0","SAMN05569581","PRJNA338771","GCA_002026955.1","1.73293","38.8","-","MILN01","84","1705","1533/309455","3/14/2017","7/30/2019","Contig","2017-03-14T00:00:00Z","Escuela Nacional de Ciencias Biologicas, Instituto Politecnico Nacional","Illumina HiSeq","48.06x","ABySS v. 1.9.0","","","84","1732925","Mexico","Human, Homo sapiens"
"Helicobacter pylori MGms23","309445","210","210.2657","","","N/A","","ftp://ftp.ncbi.nlm.nih.gov/genomes/all/GCF/002/026/755/GCF_002026755.1_MGms23_v1.0","ftp://ftp.ncbi.nlm.nih.gov/genomes/all/GCA/002/026/755/GCA_002026755.1_MGms23_v1.0","SAMN05569582","PRJNA338771","GCA_002026755.1","1.66493","38.9","-","MILO01","89","1650","1494/309445","3/14/2017","7/30/2019","Contig","2017-03-14T00:00:00Z","Escuela Nacional de Ciencias Biologicas, Instituto Politecnico Nacional","Illumina HiSeq","31.23x","ABySS v. 1.9.0","","","89","1664931","Mexico","Human, Homo sapiens"
"Helicobacter pylori MGms44","309456","210","210.2668","","","N/A","","ftp://ftp.ncbi.nlm.nih.gov/genomes/all/GCF/002/026/985/GCF_002026985.1_MGms44_v1.0","ftp://ftp.ncbi.nlm.nih.gov/genomes/all/GCA/002/026/985/GCA_002026985.1_MGms44_v1.0","SAMN05569583","PRJNA338771","GCA_002026985.1","1.63545","39.1","-","MILP01","113","1614","1469/309456","3/14/2017","7/30/2019","Contig","2017-03-14T00:00:00Z","Escuela Nacional de Ciencias Biologicas, Instituto Politecnico Nacional","Illumina HiSeq","26.57x","ABySS v. 1.9.0","","","113","1635449","Mexico","Human, Homo sapiens"
"Helicobacter pylori MM2003-103","309429","210","210.2641","","","N/A","","ftp://ftp.ncbi.nlm.nih.gov/genomes/all/GCF/002/026/445/GCF_002026445.1_MM2003-103_v1.0","ftp://ftp.ncbi.nlm.nih.gov/genomes/all/GCA/002/026/445/GCA_002026445.1_MM2003-103_v1.0","SAMN05569559","PRJNA338771","GCA_002026445.1","1.71051","38.9","-","MIKR01","145","1721","1522/309429","3/14/2017","7/30/2019","Contig","2017-03-14T00:00:00Z","Escuela Nacional de Ciencias Biologicas, Instituto Politecnico Nacional","Illumina HiSeq","35.50x","ABySS v. 1.9.0","","","145","1710512","Mexico","Human, Homo sapiens"
"Helicobacter pylori MM2004-20","309446","210","210.2658","","","N/A","","ftp://ftp.ncbi.nlm.nih.gov/genomes/all/GCF/002/026/785/GCF_002026785.1_MM2004-20_v1.0","ftp://ftp.ncbi.nlm.nih.gov/genomes/all/GCA/002/026/785/GCA_002026785.1_MM2004-20_v1.0","SAMN05569584","PRJNA338771","GCA_002026785.1","1.63886","38.9","-","MILQ01","77","1619","1477/309446","3/14/2017","7/30/2019","Contig","2017-03-14T00:00:00Z","Escuela Nacional de Ciencias Biologicas, Instituto Politecnico Nacional","Illumina HiSeq","35.71x","ABySS v. 1.9.0","","","77","1638858","Mexico","Human, Homo sapiens"
"Helicobacter pylori MM2005-126","309457","210","210.2669","","","N/A","","ftp://ftp.ncbi.nlm.nih.gov/genomes/all/GCF/002/027/005/GCF_002027005.1_MM2005-126_v1.0","ftp://ftp.ncbi.nlm.nih.gov/genomes/all/GCA/002/027/005/GCA_002027005.1_MM2005-126_v1.0","SAMN05569587","PRJNA338771","GCA_002027005.1","1.64029","39","-","MILT01","140","1625","1484/309457","3/14/2017","7/30/2019","Contig","2017-03-14T00:00:00Z","Escuela Nacional de Ciencias Biologicas, Instituto Politecnico Nacional","Illumina HiSeq","30.43x","ABySS v. 1.9.0","","","140","1640290","Mexico","Human, Homo sapiens"
"Helicobacter pylori MM2005-72","309460","210","210.2672","","","N/A","","ftp://ftp.ncbi.nlm.nih.gov/genomes/all/GCF/002/027/065/GCF_002027065.1_MM2005-72_v1.0","ftp://ftp.ncbi.nlm.nih.gov/genomes/all/GCA/002/027/065/GCA_002027065.1_MM2005-72_v1.0","SAMN05569585","PRJNA338771","GCA_002027065.1","1.69392","38.9","-","MILR01","86","1701","1543/309460","3/14/2017","7/30/2019","Contig","2017-03-14T00:00:00Z","Escuela Nacional de Ciencias Biologicas, Instituto Politecnico Nacional","Illumina HiSeq","42.75x","ABySS v. 1.9.0","","","86","1693924","Mexico","Human, Homo sapiens"
"Helicobacter pylori MM2006-103","309447","210","210.2659","","","N/A","","ftp://ftp.ncbi.nlm.nih.gov/genomes/all/GCF/002/026/805/GCF_002026805.1_MM2006-103_v1.0","ftp://ftp.ncbi.nlm.nih.gov/genomes/all/GCA/002/026/805/GCA_002026805.1_MM2006-103_v1.0","SAMN05569586","PRJNA338771","GCA_002026805.1","1.74549","38.8","-","MILS01","85","1700","1532/309447","3/14/2017","7/30/2019","Contig","2017-03-14T00:00:00Z","Escuela Nacional de Ciencias Biologicas, Instituto Politecnico Nacional","Illumina HiSeq","43.69x","ABySS v. 1.9.0","","","85","1745486","Mexico","Human, Homo sapiens"
"Helicobacter pylori MM2006-480","309461","210","210.2673","","","N/A","","ftp://ftp.ncbi.nlm.nih.gov/genomes/all/GCF/002/027/085/GCF_002027085.1_MM2006-480_v1.0","ftp://ftp.ncbi.nlm.nih.gov/genomes/all/GCA/002/027/085/GCA_002027085.1_MM2006-480_v1.0","SAMN05569588","PRJNA338771","GCA_002027085.1","1.6475","39","-","MILU01","141","1654","1502/309461","3/14/2017","7/30/2019","Contig","2017-03-14T00:00:00Z","Escuela Nacional de Ciencias Biologicas, Instituto Politecnico Nacional","Illumina HiSeq","31.12x","ABySS v. 1.9.0","","","141","1647498","Mexico","Human, Homo sapiens"
"Helicobacter pylori MM2006-56","309462","210","210.2674","","","N/A","","ftp://ftp.ncbi.nlm.nih.gov/genomes/all/GCF/002/027/125/GCF_002027125.1_MM2006-56_v1.0","ftp://ftp.ncbi.nlm.nih.gov/genomes/all/GCA/002/027/125/GCA_002027125.1_MM2006-56_v1.0","SAMN05569589","PRJNA338771","GCA_002027125.1","1.68226","38.9","-","MILV01","107","1692","1517/309462","3/14/2017","7/30/2019","Contig","2017-03-14T00:00:00Z","Escuela Nacional de Ciencias Biologicas, Instituto Politecnico Nacional","Illumina HiSeq","30.65x","ABySS v. 1.9.0","","","107","1682264","Mexico","Human, Homo sapiens"
"Helicobacter pylori MM2012-26","309450","210","210.2662","","","N/A","","ftp://ftp.ncbi.nlm.nih.gov/genomes/all/GCF/002/026/865/GCF_002026865.1_MM2012-26_v1.0","ftp://ftp.ncbi.nlm.nih.gov/genomes/all/GCA/002/026/865/GCA_002026865.1_MM2012-26_v1.0","SAMN05569590","PRJNA338771","GCA_002026865.1","1.66654","38.9","-","MILW01","60","1644","1480/309450","3/14/2017","7/30/2019","Contig","2017-03-14T00:00:00Z","Escuela Nacional de Ciencias Biologicas, Instituto Politecnico Nacional","Illumina HiSeq","72.84x","ABySS v. 1.9.0","","","60","1666537","Mexico","Human, Homo sapiens"
"Helicobacter pylori MMV242","410930","210","210.5150","","","N/A","","ftp://ftp.ncbi.nlm.nih.gov/genomes/all/GCF/003/639/575/GCF_003639575.1_ASM363957v1","ftp://ftp.ncbi.nlm.nih.gov/genomes/all/GCA/003/639/575/GCA_003639575.1_ASM363957v1","SAMN08999427","PRJNA449871","GCA_003639575.1","1.63593","38.9","-","QEGG01","54","1630","1464/410930","10/12/2018","8/20/2019","Contig","2018-10-12T00:00:00Z","Facultat de Farmacia i Ciencies de l'Alimentacio; Universitat de Barcelona","Illumina HiSeq","426x","A5-miseq v. 20160825","","","54","1635927","Spain","Human, Homo sapiens"
"Helicobacter pylori MSL190","410929","210","210.5149","","","N/A","","ftp://ftp.ncbi.nlm.nih.gov/genomes/all/GCF/003/639/565/GCF_003639565.1_ASM363956v1","ftp://ftp.ncbi.nlm.nih.gov/genomes/all/GCA/003/639/565/GCA_003639565.1_ASM363956v1","SAMN08999428","PRJNA449871","GCA_003639565.1","1.61284","38.9","-","QEGF01","33","1580","1442/410929","10/12/2018","8/20/2019","Contig","2018-10-12T00:00:00Z","Facultat de Farmacia i Ciencies de l'Alimentacio; Universitat de Barcelona","Illumina HiSeq","543x","A5-miseq v. 20160825","","","33","1612843","Spain","Human, Homo sapiens"
"Helicobacter pylori MU2003-84","309459","210","210.2671","","","N/A","","ftp://ftp.ncbi.nlm.nih.gov/genomes/all/GCF/002/027/045/GCF_002027045.1_MU2003-84_v1.0","ftp://ftp.ncbi.nlm.nih.gov/genomes/all/GCA/002/027/045/GCA_002027045.1_MU2003-84_v1.0","SAMN05569591","PRJNA338771","GCA_002027045.1","1.6768","38.9","-","MILX01","118","1639","1480/309459","3/14/2017","7/30/2019","Contig","2017-03-14T00:00:00Z","Escuela Nacional de Ciencias Biologicas, Instituto Politecnico Nacional","Illumina HiSeq","36.67x","ABySS v. 1.9.0","","","118","1676803","Mexico","Human, Homo sapiens"
"Helicobacter pylori MU2004-2","309448","210","210.2660","","","N/A","","ftp://ftp.ncbi.nlm.nih.gov/genomes/all/GCF/002/026/825/GCF_002026825.1_MU2004-2_v1.0","ftp://ftp.ncbi.nlm.nih.gov/genomes/all/GCA/002/026/825/GCA_002026825.1_MU2004-2_v1.0","SAMN05569592","PRJNA338771","GCA_002026825.1","1.74047","38.9","-","MILY01","169","1770","1572/309448","3/14/2017","7/30/2019","Contig","2017-03-14T00:00:00Z","Escuela Nacional de Ciencias Biologicas, Instituto Politecnico Nacional","Illumina HiSeq","31.59x","ABySS v. 1.9.0","","","169","1740468","Mexico","Human, Homo sapiens"
"Helicobacter pylori N6","163764","102616","102616.3","","GCF_000285895","N/A","","ftp://ftp.ncbi.nlm.nih.gov/genomes/all/GCF/000/285/895/GCF_000285895.1_ASM28589v1","ftp://ftp.ncbi.nlm.nih.gov/genomes/all/GCA/000/285/895/GCA_000285895.1_ASM28589v1","SAMEA2272535","PRJEA89447","GCA_000285895.1","1.65768","38.7","-","CAHX01","54","1643","1393/163764","4/10/2012","7/2/2019","Contig","2012-04-10T00:00:00Z","Hannover Medical School","","","","","","54","1657684","France","Human, Homo sapiens"
"Helicobacter pylori N6","553414","210","210.5655","","","N/A","","ftp://ftp.ncbi.nlm.nih.gov/genomes/all/GCF/005/796/135/GCF_005796135.1_ASM579613v1","ftp://ftp.ncbi.nlm.nih.gov/genomes/all/GCA/005/796/135/GCA_005796135.1_ASM579613v1","SAMN10411099","PRJNA505142","GCA_005796135.1","1.66416","38.7","-","VAPN01","16","1641","1484/553414","5/23/2019","5/27/2019","Contig","2019-05-23T00:00:00Z","Faculty of Biology and Environmental Protection, University of Lodz","Illumina NextSeq","231.0x","SPAdes v. 3.11","","","16","1664156","","Human, Homo sapiens"
"Helicobacter pylori N6_del_htrA","553412","210","210.5653","","","N/A","","ftp://ftp.ncbi.nlm.nih.gov/genomes/all/GCF/005/796/115/GCF_005796115.1_ASM579611v1","ftp://ftp.ncbi.nlm.nih.gov/genomes/all/GCA/005/796/115/GCA_005796115.1_ASM579611v1","SAMN10411397","PRJNA505142","GCA_005796115.1","1.66397","38.7","-","VAPO01","44","1649","1488/553412","5/23/2019","5/27/2019","Contig","2019-05-23T00:00:00Z","Faculty of Biology and Environmental Protection, University of Lodz","Illumina NextSeq","32.0x","SPAdes v. 3.11","","","44","1663968","",""
"Helicobacter pylori N6_mut_htrA661","553413","210","210.5654","","","N/A","","ftp://ftp.ncbi.nlm.nih.gov/genomes/all/GCF/005/796/125/GCF_005796125.1_ASM579612v1","ftp://ftp.ncbi.nlm.nih.gov/genomes/all/GCA/005/796/125/GCA_005796125.1_ASM579612v1","SAMN10411398","PRJNA505142","GCA_005796125.1","1.66396","38.7","-","VAPP01","41","1647","1489/553413","5/23/2019","5/27/2019","Contig","2019-05-23T00:00:00Z","Faculty of Biology and Environmental Protection, University of Lodz","Illumina NextSeq","314.0x","SPAdes v. 3.11","","","41","1663962","",""
"Helicobacter pylori NAB47","163659","1156914","1156914.3","","GCF_000256075","N/A","","ftp://ftp.ncbi.nlm.nih.gov/genomes/all/GCF/000/256/075/GCF_000256075.1_ASM25607v2","ftp://ftp.ncbi.nlm.nih.gov/genomes/all/GCA/000/256/075/GCA_000256075.2_ASM25607v2","SAMN02471794","PRJNA85617","GCA_000256075.2","1.58592","39.1","-","AJFA02","107","1583","1409/163659","3/26/2012","11/23/2017","Contig","2012-03-26T00:00:00Z","University of Hyderabad","","","","","","385","1581359","India","Human, Homo sapiens"
"Helicobacter pylori NAD1","163658","1156915","1156915.3","","GCF_000256035","N/A","","ftp://ftp.ncbi.nlm.nih.gov/genomes/all/GCF/000/256/035/GCF_000256035.1_ASM25603v2","ftp://ftp.ncbi.nlm.nih.gov/genomes/all/GCA/000/256/035/GCA_000256035.2_ASM25603v2","SAMN02471796","PRJNA85619","GCA_000256035.2","1.60356","38.9","-","AJGJ02","103","1589","1438/163658","3/26/2012","11/23/2017","Contig","2012-03-26T00:00:00Z","University of Hyderabad","","","","","","400","1593185","India","Human, Homo sapiens"
"Helicobacter pylori NAK7","201853","1282880","1282880.3","","","N/A","","ftp://ftp.ncbi.nlm.nih.gov/genomes/all/GCF/000/401/295/GCF_000401295.1_HelPylNAK7_1.0","ftp://ftp.ncbi.nlm.nih.gov/genomes/all/GCA/000/401/295/GCA_000401295.1_HelPylNAK7_1.0","SAMN02471799","PRJNA186589","GCA_000401295.1","1.58671","39","-","AONJ01","68","1566","1419/201853","5/24/2013","3/24/2017","Contig","2013-05-24T00:00:00Z","University of Hyderabad","Illumina GAIIx","300.0x","Velvet v. 1.2.03","","","68","1586710","India","Human, Homo sapiens"
"Helicobacter pylori NCTC 11637 = CCUG 17874 = ATCC 43504","163661","102618","102618.3","","","N/A","","ftp://ftp.ncbi.nlm.nih.gov/genomes/all/GCF/000/258/845/GCF_000258845.1_ASM25884v1","ftp://ftp.ncbi.nlm.nih.gov/genomes/all/GCA/000/258/845/GCA_000258845.1_ASM25884v1","SAMN02472263","PRJNA76569","GCA_000258845.1","1.60051","39","-","AIHX01","163","1664","1422/163661","4/16/2012","3/23/2017","Contig","2012-04-16T00:00:00Z","Microbiology Dept, University College Cork","","","","","","163","1600513","Australia","Human, Homo sapiens"
"Helicobacter pylori NCTC13094","391937","210","210.4857","","","N/A","","ftp://ftp.ncbi.nlm.nih.gov/genomes/all/GCF/900/451/055/GCF_900451055.1_57728_C01","ftp://ftp.ncbi.nlm.nih.gov/genomes/all/GCA/900/451/055/GCA_900451055.1_57728_C01","SAMEA104224781","PRJEB6403","GCA_900451055.1","1.61005","38.9","-","UGJP01","6","1584","1418/391937","7/30/2018","8/17/2019","Contig","2018-07-30T00:00:00Z","SC","","","","","","6","1610054","",""
"Helicobacter pylori NCTC13207","391936","210","210.4856","","","N/A","","ftp://ftp.ncbi.nlm.nih.gov/genomes/all/GCF/900/450/825/GCF_900450825.1_57387_G01","ftp://ftp.ncbi.nlm.nih.gov/genomes/all/GCA/900/450/825/GCA_900450825.1_57387_G01","SAMEA104210750","PRJEB6403","GCA_900450825.1","1.59434","39","-","UGHN01","2","1570","1436/391936","7/30/2018","8/17/2019","Contig","2018-07-30T00:00:00Z","SC","","","","","","2","1594341","",""
"Helicobacter pylori NCTC13338","391938","210","210.4858","","","N/A","","ftp://ftp.ncbi.nlm.nih.gov/genomes/all/GCF/900/451/295/GCF_900451295.1_57752_B01","ftp://ftp.ncbi.nlm.nih.gov/genomes/all/GCA/900/451/295/GCA_900451295.1_57752_B01","SAMEA104224782","PRJEB6403","GCA_900451295.1","1.65137","39","-","UGHQ01","2","1611","1457/391938","7/30/2018","8/17/2019","Contig","2018-07-30T00:00:00Z","SC","","","","","","2","1651372","",""
"Helicobacter pylori NQ1671","163762","981220","981220.3","","GCF_000285235","N/A","","ftp://ftp.ncbi.nlm.nih.gov/genomes/all/GCF/000/285/235/GCF_000285235.1_ASM28523v1","ftp://ftp.ncbi.nlm.nih.gov/genomes/all/GCA/000/285/235/GCA_000285235.1_ASM28523v1","SAMEA2272392","PRJEA62453","GCA_000285235.1","1.62695","39.1","-","CADM01","38","1605","1461/163762","3/9/2011","3/23/2017","Contig","2011-03-09T00:00:00Z","MHH Hannover Medical School","","","","","","38","1626950","Colombia","Human, Homo sapiens"
"Helicobacter pylori NQ1701","163757","981215","981215.3","","GCF_000285135","N/A","","ftp://ftp.ncbi.nlm.nih.gov/genomes/all/GCF/000/285/135/GCF_000285135.1_ASM28513v1","ftp://ftp.ncbi.nlm.nih.gov/genomes/all/GCA/000/285/135/GCA_000285135.1_ASM28513v1","SAMEA2272619","PRJEA62443","GCA_000285135.1","1.63962","38.9","-","CADH01","78","1640","1159/163757","3/9/2011","10/8/2019","Contig","2011-03-09T00:00:00Z","MHH Hannover Medical School","","","","","","78","1639623","Colombia","Human, Homo sapiens"
"Helicobacter pylori NQ1707","163759","981217","981217.3","","GCF_000285175","N/A","","ftp://ftp.ncbi.nlm.nih.gov/genomes/all/GCF/000/285/175/GCF_000285175.1_ASM28517v1","ftp://ftp.ncbi.nlm.nih.gov/genomes/all/GCA/000/285/175/GCA_000285175.1_ASM28517v1","SAMEA2272498","PRJEA62447","GCA_000285175.1","1.65474","38.9","-","CADJ01","91","1629","1490/163759","3/9/2011","3/23/2017","Contig","2011-03-09T00:00:00Z","MHH Hannover Medical School","","","","","","91","1654738","Colombia","Human, Homo sapiens"
"Helicobacter pylori NQ1712","163755","981213","981213.3","","GCF_000285095","N/A","","ftp://ftp.ncbi.nlm.nih.gov/genomes/all/GCF/000/285/095/GCF_000285095.1_ASM28509v1","ftp://ftp.ncbi.nlm.nih.gov/genomes/all/GCA/000/285/095/GCA_000285095.1_ASM28509v1","SAMEA2272517","PRJEA62439","GCA_000285095.1","1.57258","39.1","-","CADF01","62","1566","1389/163755","3/9/2011","3/23/2017","Contig","2011-03-09T00:00:00Z","MHH Hannover Medical School","","","","","","62","1572582","Colombia","Human, Homo sapiens"
"Helicobacter pylori NQ315","163754","981212","981212.3","","GCF_000285075","N/A","","ftp://ftp.ncbi.nlm.nih.gov/genomes/all/GCF/000/285/075/GCF_000285075.1_ASM28507v1","ftp://ftp.ncbi.nlm.nih.gov/genomes/all/GCA/000/285/075/GCA_000285075.1_ASM28507v1","SAMEA2272015","PRJEA62437","GCA_000285075.1","1.60194","39","-","CADE01","57","1594","1429/163754","3/9/2011","3/23/2017","Contig","2011-03-09T00:00:00Z","MHH Hannover Medical School","","","","","","57","1601938","Colombia","Human, Homo sapiens"
"Helicobacter pylori NQ352","163756","981214","981214.3","","GCF_000285115","N/A","","ftp://ftp.ncbi.nlm.nih.gov/genomes/all/GCF/000/285/115/GCF_000285115.1_ASM28511v1","ftp://ftp.ncbi.nlm.nih.gov/genomes/all/GCA/000/285/115/GCA_000285115.1_ASM28511v1","SAMEA2272230","PRJEA62441","GCA_000285115.1","1.63915","39","-","CADG01","61","1616","1375/163756","3/9/2011","4/2/2019","Contig","2011-03-09T00:00:00Z","MHH Hannover Medical School","","","","","","61","1639151","Colombia","Human, Homo sapiens"
"Helicobacter pylori NQ367","163761","981219","981219.3","","GCF_000285215","N/A","","ftp://ftp.ncbi.nlm.nih.gov/genomes/all/GCF/000/285/215/GCF_000285215.1_ASM28521v1","ftp://ftp.ncbi.nlm.nih.gov/genomes/all/GCA/000/285/215/GCA_000285215.1_ASM28521v1","SAMEA2271994","PRJEA62451","GCA_000285215.1","1.62241","39.1","-","CADL01","90","1624","1342/163761","3/9/2011","10/8/2019","Contig","2011-03-09T00:00:00Z","MHH Hannover Medical School","","","","","","90","1622411","Colombia","Human, Homo sapiens"
"Helicobacter pylori NQ392","163758","981216","981216.3","","GCF_000285155","N/A","","ftp://ftp.ncbi.nlm.nih.gov/genomes/all/GCF/000/285/155/GCF_000285155.1_ASM28515v1","ftp://ftp.ncbi.nlm.nih.gov/genomes/all/GCA/000/285/155/GCA_000285155.1_ASM28515v1","SAMEA2272151","PRJEA62445","GCA_000285155.1","1.65499","38.9","-","CADI01","80","1623","1469/163758","3/9/2011","3/23/2017","Contig","2011-03-09T00:00:00Z","MHH Hannover Medical School","","","","","","80","1654988","Colombia","Human, Homo sapiens"
"Helicobacter pylori NQ4044","163703","992028","992028.3","","GCF_000274625","N/A","","ftp://ftp.ncbi.nlm.nih.gov/genomes/all/GCF/000/274/625/GCF_000274625.1_ASM27462v1","ftp://ftp.ncbi.nlm.nih.gov/genomes/all/GCA/000/274/625/GCA_000274625.1_ASM27462v1","SAMN00777283","PRJNA64083","GCA_000274625.1","1.72852","38.7","-","AKNW01","17","1714","1521/163703","6/28/2012","3/23/2017","Contig","2012-06-28T00:00:00Z","Institute for Genome Sciences","Illumina;454","63.30x","Celera Assembler v. 6.1","","","17","1728524","Colombia","Human, Homo sapiens"
"Helicobacter pylori NQ4053","163702","992027","992027.3","","GCF_000274605","N/A","","ftp://ftp.ncbi.nlm.nih.gov/genomes/all/GCF/000/274/605/GCF_000274605.1_ASM27460v1","ftp://ftp.ncbi.nlm.nih.gov/genomes/all/GCA/000/274/605/GCA_000274605.1_ASM27460v1","SAMN00777284","PRJNA64081","GCA_000274605.1","1.65203","38.9","-","AKNV01","6","1638","1454/163702","6/28/2012","3/23/2017","Contig","2012-06-28T00:00:00Z","Institute for Genome Sciences","Illumina;454","64.97x","Celera Assembler v. 6.1","","","6","1652030","Colombia","Human, Homo sapiens"
"Helicobacter pylori NQ4060","163760","981218","981218.3","","GCF_000285195","N/A","","ftp://ftp.ncbi.nlm.nih.gov/genomes/all/GCF/000/285/195/GCF_000285195.1_ASM28519v1","ftp://ftp.ncbi.nlm.nih.gov/genomes/all/GCA/000/285/195/GCA_000285195.1_ASM28519v1","SAMEA2271996","PRJEA62449","GCA_000285195.1","1.64974","38.9","-","CADK01","59","1622","1446/163760","3/9/2011","3/23/2017","Contig","2011-03-09T00:00:00Z","MHH Hannover Medical School","","","","","","59","1649736","Colombia","Human, Homo sapiens"
"Helicobacter pylori NQ4076","163701","992029","992029.3","","GCF_000274585","N/A","","ftp://ftp.ncbi.nlm.nih.gov/genomes/all/GCF/000/274/585/GCF_000274585.1_ASM27458v1","ftp://ftp.ncbi.nlm.nih.gov/genomes/all/GCA/000/274/585/GCA_000274585.1_ASM27458v1","SAMN00777285","PRJNA64085","GCA_000274585.1","1.63271","39","-","AKNX01","4","1590","1447/163701","6/28/2012","3/23/2017","Contig","2012-06-28T00:00:00Z","Institute for Genome Sciences","Illumina;454","66.58x","Celera Assembler v. 6.1","","","4","1632709","Colombia","Human, Homo sapiens"
"Helicobacter pylori NQ4099","163700","992026","992026.3","","GCF_000274565","N/A","","ftp://ftp.ncbi.nlm.nih.gov/genomes/all/GCF/000/274/565/GCF_000274565.1_ASM27456v1","ftp://ftp.ncbi.nlm.nih.gov/genomes/all/GCA/000/274/565/GCA_000274565.1_ASM27456v1","SAMN00777286","PRJNA64079","GCA_000274565.1","1.65064","39","-","AKNU01","6","1609","1454/163700","6/28/2012","3/23/2017","Contig","2012-06-28T00:00:00Z","Institute for Genome Sciences","Illumina;454","70.23x","Celera Assembler v. 6.1","","","6","1650644","Colombia","Human, Homo sapiens"
"Helicobacter pylori NQ4191","163763","981221","981221.3","","GCF_000285255","N/A","","ftp://ftp.ncbi.nlm.nih.gov/genomes/all/GCF/000/285/255/GCF_000285255.1_ASM28525v1","ftp://ftp.ncbi.nlm.nih.gov/genomes/all/GCA/000/285/255/GCA_000285255.1_ASM28525v1","SAMEA2272109","PRJEA62455","GCA_000285255.1","1.62906","39.1","-","CADN01","43","1613","1464/163763","3/9/2011","3/23/2017","Contig","2011-03-09T00:00:00Z","MHH Hannover Medical School","","","","","","43","1629065","Colombia","Human, Homo sapiens"
"Helicobacter pylori NQ4200","163717","992024","992024.3","","GCF_000274905","N/A","","ftp://ftp.ncbi.nlm.nih.gov/genomes/all/GCF/000/274/905/GCF_000274905.1_ASM27490v1","ftp://ftp.ncbi.nlm.nih.gov/genomes/all/GCA/000/274/905/GCA_000274905.1_ASM27490v1","SAMN00777289","PRJNA64075","GCA_000274905.1","1.64674","39","-","AKNS01","14","1599","1439/163717","6/28/2012","3/23/2017","Contig","2012-06-28T00:00:00Z","Institute for Genome Sciences","Illumina;454","29.62x","Celera Assembler v. 6.1","","","14","1646737","Colombia","Human, Homo sapiens"
"Helicobacter pylori NQ4228","163718","992025","992025.3","","GCF_000274925","N/A","","ftp://ftp.ncbi.nlm.nih.gov/genomes/all/GCF/000/274/925/GCF_000274925.1_ASM27492v1","ftp://ftp.ncbi.nlm.nih.gov/genomes/all/GCA/000/274/925/GCA_000274925.1_ASM27492v1","SAMN00777291","PRJNA64077","GCA_000274925.1","1.65328","39","-","AKNT01","6","1618","1475/163718","6/28/2012","3/23/2017","Contig","2012-06-28T00:00:00Z","Institute for Genome Sciences","Illumina;454","64.81x","Celera Assembler v. 6.1","","","6","1653281","Colombia","Human, Homo sapiens"
